番号,受付日,住所,申告方法,車名,通称名,初度登録年月,総走行距離,型式,原動機型式,不具合装置,発生時期,申告内容の要約
90,2020年08月25日,千葉,ＨＰ,フォルクスワーゲン,ゴルフヴァリアント２．０ＴＳＩ,2010年08月,"40,000 Km",ABA-1KCCZ,CCZ,動力伝達,２０１９年１０月,ＤＳＧ（自動変速機）の不良によりシフトインジケータが点滅し、ギヤが抜けバックできない。
91,2020年08月25日,千葉,ＨＰ,ホンダ,Ｎ－ＢＯＸ,2019年04月,"6,100 Km",DBA-JF3,S07B,その他,２０２０年５月・８月,ＡＣＣシステム運転中にＡＣＣシステム・路外逸脱制御システム・ＣＭＢＳ点検警告が点灯し、システムが利用できなくなった。
92,2020年08月25日,埼玉,ＨＰ,ＢＭＷ,３２０ｄ,2015年10月,"20,055 Km",LDA-3D20,N47D20C,電気装置,２０２０年７月上旬,スピードセンサーの異常により、走行中に突然、メーターパネルにＡＢＳ異常・衝突警告装置異常・パンク警告装置異常・走行安定性注意など警告が点灯した。ナビの位置情報も正しく表示されなくなった。
93,2020年08月25日,埼玉,ﾌﾘｰﾀﾞｲｱﾙ,トヨタ,ハイエース,2015年02月,"185,300 Km",LDF-KDH206V,1KD,走行装置,不明,ディーラーで販売されていたダンロップ製アルミホイールを装着したところ、ハブ座面が錆びてハブとホイールの接地不良が発生し、ホイールナットが頻繁に緩むようになった。
94,2020年08月25日,茨城,ﾌﾘｰﾀﾞｲｱﾙ,ダイハツ,ハイゼット,2009年07月,"30,000 Km",EBD-S321V,KF,制動装置,不明,ＡＢＳユニットの不良により、ブレーキをかけた際にペダルが踏み抜けたような状態になり、ペダルを全力で奥まで踏み込まないとブレーキが効かない状態になった。
95,2020年08月25日,静岡,ＨＰ,ニッサン,デイズ,2014年05月,"42,100 Km",DBA-B21W,3B20,保安灯火,新車購入５年後,ドアロックの開閉時に助手席のドアミラーが開閉しなくなった。
96,2020年08月25日,静岡,ﾌﾘｰﾀﾞｲｱﾙ,三菱,ミニキャブ,2020年01月,"27,850 Km",HBD-DS17V,R06A,走行装置,不明,左前輪だけが著しく摩耗する。
97,2020年08月25日,三重,ＨＰ,マツダ,アテンザワゴン,2016年08月,"22,000 Km",LDA-GJ2FW,SH,その他,２０２０年８月１４日,カメラの不具合により、ＳＣＢＳ、ＡＬＨ／ＬＡＳシステム異常が表示され、オートハイビーム、自動ブレーキ等が作動しなくなった。
98,2020年08月25日,京都,ﾌﾘｰﾀﾞｲｱﾙ,スズキ,パレット,2012年08月,"54,800 Km",DBA-MK21S,K6A,かじ取り,不明,電動ステアリングロックの不良により、エンジンがかからなくなった。
99,2020年08月25日,滋賀,ﾌﾘｰﾀﾞｲｱﾙ,トヨタ,ランドクルーザープラド,2007年06月,"105,100 Km",CBA-TRJ120W,2TR,車枠・車体,去年の７月くらいから,パールホワイト塗装の車で、ボンネットやドア、バンパー等の塗装がパリパリと剥がれた。
100,2020年08月25日,島根,ＨＰ,ニッサン,エルグランド,2010年10月,"85,000 Km",DBA-TE52,QR25,かじ取り,走行中,パワーステアリングポンプからオイルが漏れたため、パワーステアリングが効かなくなった。
101,2020年08月25日,福岡,ＨＰ,トヨタ,アクア,2014年07月,"113,000 Km",DAA-NHP10,1NZ-1LM,保安灯火,不明,ドアミラーが開閉しない時がある。
102,2020年08月25日,鹿児島,電話,いすゞ,エルガ,2018年03月,"107,783 Km",2DG-LV290N2,4HK1,制動装置,通常走行時,デュアルリレーバルブの破損により車両の運行が出来なくなった。
103,2020年08月24日,宮城,ＨＰ,ホンダ,ＳＨＵＴＴＬＥハイブリッド,2017年07月,"26,000 Km",DAA-GP7,LEB-H1,車枠・車体,購入１年半後くらいから,運転席付近からビビリ音が出る。走行中、特に段差のあるような場所で連続的に発生する。
104,2020年08月24日,福島,ﾌﾘｰﾀﾞｲｱﾙ,三菱,アイ,2007年01月,"73,400 Km",CBA-HA1W,3B20,動力伝達,不明,変速機のリコール措置を受けている車で、シフトをＰレンジに入れても坂道で車が動いてしまう症状と、Ｒレンジに入れても動かない症状が出た。
105,2020年08月24日,山形,ＨＰ,ホンダ,アクティトラック,2011年02月,"34,000 Km",HA9,不明,かじ取り,２０２０年８月,パワーステアリングの異常により、速度上昇とともにステアリングが重く固まり、復元力が無くなる。
106,2020年08月24日,東京,ＨＰ,メルセデス・ベンツ,Ｅ２００ワゴン,2019年09月,810 Km,4AA-213277C,264-EM0018,電動機(モーター),２０２０年８月９日,４８Ｖバッテリーの不具合により、走行中にエラーメッセージが表示された。
107,2020年08月24日,東京,ﾌﾘｰﾀﾞｲｱﾙ,ニッサン,ノート,2013年08月,"50,000 Km",DBA-E12,HR12,エンジン,不明,ＶＴＣの不具合ににより、走行中にアイドリングランプとエンジンランプが点灯した。
108,2020年08月24日,神奈川,ＨＰ,ニッサン,スカイライン,2019年01月,"30,000 Km",DBA-YV37,274A,制動装置,２０２０年７月,バイパス走行時、何もないところで自動ブレーキが作動した。
109,2020年08月24日,神奈川,ﾌﾘｰﾀﾞｲｱﾙ,ホンダ,フィットハイブリッド,2016年01月,"8,800 Km",DAA-GP5,LEB-H1,電気装置,２０２０年８月１４日,バッテリーが過熱し、走行不能になった。
110,2020年08月24日,埼玉,電話,ニッサン,ＮＶ１００クリッパー,2016年11月,不明,HBD-DR17V,R06A,動力伝達,２０２０年８月１０日,交差点で停止後、発進しなくなった。
111,2020年08月24日,埼玉,ＨＰ,フォルクスワーゲン,ポロ,2019年08月,"4,000 Km",ABA-AWCHZ,CHZ,車枠・車体,購入当初から,運転席の左足・助手席の右足辺りのセンターコンソールが熱くなる。
112,2020年08月24日,茨城,ﾌﾘｰﾀﾞｲｱﾙ,トヨタ,プリウス,2010年05月,"170,000 Km",DAA-ZVW30,2ZR-3JM,エンジン,２０１９年１１月，２０２０年５月,ＥＧＲバルブの不具合により、エンジンから異音が出た。
113,2020年08月24日,静岡,ＨＰ,カワサキ,Ｗ８００,2016年09月,"10,000 Km",EBL-EJ800A,EJ800AE,エンジン,２０１９年１０月,２０００～３０００回転で走行中に回転が落ちて失速し、その後に急加速する。しばらくしてＦＩアラームが出るようになった。
114,2020年08月24日,静岡,ＨＰ,ホンダ,Ｎ－ＷＧＮ,2016年10月,"34,400 Km",DBA-JH1,S07A,保安灯火,２０２０年８月２１日,仕事が終わり、帰宅しようとしたところ、助手席側の後部座席のドアガラスが割れていた。
115,2020年08月24日,広島,電話,アウディ,Ａ４,2007年04月,"108,757 Km",GH-8EBWEF,BWE,エンジン,８月中旬～下旬,冷却水がすぐになくなる。
116,2020年08月24日,岡山,電話,ダイハツ,トール,2019年10月,"4,239 Km",DBA-M900S,1KR,かじ取り,７月中旬,ハンドルが異常に重い。
117,2020年08月24日,愛媛,ＨＰ,アウディ,Ａ１スポーツバック,2013年07月,"38,342 Km",DBA-8XCAX,CAX,エンジン,２０２０年８月２４日高速走行後,ターボチャージャーの軸の摩耗からガタツキが発生したため、アクセルペダルを踏んで、３．４速に切り替わる頃にエンジンより異音が発生するようになった。
118,2020年08月24日,福岡,ＨＰ,アウディ,Ａ６アバント,2015年03月,"13,000 Km",DBA-4GCDN,CDN,かじ取り,２０２０年８月９日１０：３０,高速走行後、コンビニに駐車。エンジン再起動の際ハンドルが異常な振動を起こし、ＥＣＵ故障と警告灯が点灯。ハンドルが効かなくなり走行不能になった。ディーラーで確認を受けたところ、ステアリングギアボックスのコンピューター故障と診断された。
119,2020年08月24日,福岡,ﾌﾘｰﾀﾞｲｱﾙ,スズキ,スペーシア,2019年06月,不明,DAA-MK53S,不明,エンジン,不明,実走行燃費が悪く、カタログ表示で２７ｋｍ／Ｌのところ、１０ｋｍ／Ｌしか走らない。
120,2020年08月24日,熊本,ﾌﾘｰﾀﾞｲｱﾙ,ニッサン,セレナ,不明,"60,000 Km",DBA-C26,不明,車枠・車体,不明,パールホワイト色塗装の車で、塗装が剥がれた。
121,2020年08月23日,北海道,ＨＰ,ニッサン,エクストレイル,不明,"60,000 Km",NT32,不明,動力伝達,２０２０年８月１８日,運転中に突然警告灯が点灯し、その後からＣＶＴの切り替わりに衝撃が出る。
122,2020年08月23日,山形,ＨＰ,フォルクスワーゲン,ゴルフヴァリアント,2016年06月,"40,000 Km",DBA-AUCHP,CHP,保安灯火,２０２０年７月,走行中、右側ドアミラーの鏡部が剥離した。
123,2020年08月23日,埼玉,ＨＰ,ニッサン,セレナ,2014年09月,"94,500 Km",DAA-HFC26,MR20-SM23,動力伝達,２０２０年８月,高速道路を走行中、突然マフラーから白煙が上がり、アクセルペダルを踏んでもスピードが時速８０ｋｍ程度しか出なくなった。高速を降りたあと、信号で停車すると自走できなくなった。
124,2020年08月23日,茨城,ＨＰ,ダイハツ,ブーン,2016年11月,"37,000 Km",DBA-M700S,1KR,エンジン,２０１８年７月１日頃から,０ｋｍ／ｈからのスタートで、アクセルペダルを踏んでも１～２秒はほとんど加速しなくなる。
125,2020年08月23日,愛知,ＨＰ,ホンダ,ＳＨＵＴＴＬＥハイブリッド,2016年12月,"38,000 Km",DAA-GP7,LEB-H1,電動機(モーター),２０１９年７月頃から頻発,ハイブリッド走行用バッテリの残量表示が１目盛になり、動力低下なのか加速が著しく悪くなり、ガクガクとギクシャクした走行になる。
126,2020年08月23日,兵庫,ＨＰ,ＫＴＭ,３９０ＤＵＫＥ,2018年12月,"1,600 Km",2BL-390DUKE,938,エンジン,２０２０年８月２０日,信号待ちで停止後、再発進しようとしたところアクセルを開けてもエンジン回転が上がらない。一度エンジンを切り再始動させると回復するが警告灯が点灯する。
127,2020年08月23日,兵庫,ＨＰ,ジープ,ラングラーＪＫアンリミテッド,2015年11月,"64,571 Km",ABA-JK36LR,G,エンジン,２０２０年１月頃から（走行５７００ｋｍ）,ディーゼルエンジンのようなタペットの異音が発生した。
128,2020年08月23日,兵庫,ＨＰ,トヨタ,プリウス,2018年09月,"15,632 Km",DAA-ZVW50,2ZR-1NM,その他,納車時より,ナビ不具合により、エンジン停止後、車輛に乗り込みスタートボタンを押すと不定期にラジオの音声が無音となる。位置ずれが多い。
129,2020年08月22日,福島,ＨＰ,マツダ,デミオ,不明,不明,DJ5AS,不明,エンジン,２０２０年８月２２日,信号停車でアイドリングストップが作動後、ブレーキペダルから足を離しても再始動せず、ギアをパーキングに入れてスタートボタンを押すとエンジンが動いて走行出来た。
130,2020年08月22日,群馬,ＨＰ,スバル,ＷＲＸ　ＳＴＩ,2012年05月,"48,000 Km",CBA-GRF,EJ25,制動装置,２０２０年０３月,ブレーキマスターバックの気密不良により、ブレーキペダルが固く踏めなくなり、エンジンが始動出来なくなった。
131,2020年08月22日,福井,ＨＰ,ジープ,レネゲード,不明,不明,BU14,不明,電気装置,２０２０年８月,電気系統の不具合により、走行中にハンドルが動かなくなった。
132,2020年08月22日,兵庫,24時間電話,スズキ,キャリイ,2017年07月,"22,200 Km",EBD-DA16T,R06A,保安灯火,不明,左右の窓ガラスが下がったまま上がらなくなった。
133,2020年08月22日,兵庫,ＨＰ,トヨタ,プリウス,2018年09月,不明,DAA-ZVW50,2ZR-1NM,保安灯火,納車時より,オートワイパー（雨滴感知式ワイパー）が機能しないまたは誤動作するときがある。
134,2020年08月22日,兵庫,ＨＰ,トヨタ,プリウス,2018年09月,不明,DAA-ZVW50,2ZR-1NM,その他,納車時より,一般道及び高速道走行中、警告音有無に関係なくＬＤＡ（レーンディパーチャーアラート）及びステアリング制御が機能していない時がある。走行支援システム連携画面でも、車線を認識しない時がある。警告音、鳴らない時もある。ハンドルを軽く添えてもＬＤＡが機能せず対向車線または追い越し車線に逸脱する。道路（車線）中央走行中も警告音が鳴る時がある。ディスプレイにＬＤＡ操舵支援表示灯が表示されない時がある。
135,2020年08月22日,兵庫,ＨＰ,トヨタ,プリウス,2018年09月,不明,DAA-ZVW50,2ZR-1NM,保安灯火,納車時より,オートマチックハイビームが機能しないときがある。
136,2020年08月22日,奈良,ＨＰ,ニッサン,ＲＯＯＸ,2020年07月,350 Km,5AA-B44A,BR06-SM21,制動装置,２０２０年８月１６日午前１０時頃,一般道路走行中、信号で停止しようしたところ、ブレーキペダルが重くなり、通常の力で踏み込めなくなった。
137,2020年08月22日,広島,ＨＰ,マツダ,ＣＸ－５,2012年04月,"160,016 Km",LDA-KE2AW,SH,電気装置,２０２０年８月２２日,走行中にオルタネータープーリーが脱落した。
138,2020年08月22日,高知,ＨＰ,スバル,レヴォーグ,2015年05月,"83,900 Km",DBA-VMG,FA20,電気装置,２０２０年８月２２日,エンジンルーム内のハーネスに水が入り、Ｏ２センサーよりの情報がエラーとなったため、エンジンチェックランプが点灯し、「販売店に連絡」の表示が出て、セーフモードとなった。
139,2020年08月22日,佐賀,ＨＰ,ニッサン,ノート,2014年01月,"33,000 Km",DBA-E12,HR12,エンジン,２０２０年８月１５日,インタークーラー吸気側配管の破損により、高速道路を走行中に突然の異音がし、走行不能になった。
140,2020年08月21日,東京,ﾌﾘｰﾀﾞｲｱﾙ,ニッサン,エルグランド,2011年03月,"54,500 Km",DBA-TE52,QR25,かじ取り,不明,パワーステアリングポンプからオイルが漏れ、パワーステアリングが効かなくなったため、左カーブを走行中に突然ハンドルが操作できなくなり、対向車線にはみ出してしまった。
141,2020年08月21日,埼玉,ＨＰ,スバル,フォレスター,2012年12月,"78,900 Km",DBA-SJ5,FB20,保安灯火,２０１７年,外気温が３０℃を超えると左右のミラーが開閉できなくなる症状が頻発する。
142,2020年08月21日,山口,ＨＰ,マツダ,ＣＸ－５,2017年03月,"49,900 Km",LDA-KF2P,SH,保安灯火,２０２０年１月,ドアミラーの開閉ができなくなった。
143,2020年08月21日,福岡,ＨＰ,フォルクスワーゲン,ポロ,2012年09月,"68,000 Km",DBA-6RCBZ,CBZ,エンジン,２０１９年１月,タイミングチェーンの伸びにより、エンジン始動時にガラガラと大きな異音がする。
144,2020年08月21日,大分,ＨＰ,ニッサン,デイズ,2013年09月,"33,300 Km",DBA-B21W,3B20,かじ取り,１回目の車検前頃,走行中にブレーキペダルを踏むと、ブレーキペダル、ハンドルがぶれる。振動する。
145,2020年08月21日,宮崎,ＨＰ,フォルクスワーゲン,ゴルフヴァリアント,2011年03月,"65,600 Km",DBA-1KCAV,CAV,制動装置,２０２０年８月２１日,「ＡＢＳ」「ＥＳＰ」の警告灯が点灯し、警告音が鳴った。
146,2020年08月20日,千葉,ＨＰ,メルセデス・ベンツ,ＣＬＳ２２０ブルーテック　ＳＢ,2015年06月,"50,000 Km",LDA-218901,651,排ｶﾞｽ･騒音,２０２０年８月８日,ＮＯｘセンサーの不良により、走行中にエンジン警告灯が点灯した。
147,2020年08月20日,千葉,ﾌﾘｰﾀﾞｲｱﾙ,ホンダ,フィット,2019年12月,不明,DBA-GK3,L13B,動力伝達,２０２０年８月１０日,車を止めようと後退している途中で車止めを乗り越えて、車止めの後ろの植木鉢に当たり反動で前に出た瞬間に運転席のエアバッグが開いた。この事故時、ギアをバックに入れていたはずなのに前進した。慌てていたのでよくわからないうちに前進して道路に出て６ｍほど進んで、公園の壁ににぶつかって助手席のエアバッグが開いて、車が止まった。
148,2020年08月20日,愛知,ﾌﾘｰﾀﾞｲｱﾙ,ホンダ,Ｎ－ＢＯＸ,2018年01月,不明,DBA-JF3,S07B,動力伝達,２０２０年７月末,国４６７７（自動無段変速機（ＣＶＴ）のトルクコンバータ）のリコール対象車で、作業ミスにより警告灯が点灯し、Ｄで走行中に「Ｎ」の点滅表示になった。
149,2020年08月20日,静岡,ＨＰ,ジープ,ラングラーアンリミテッド,2016年07月,"20,200 Km",ABA-JK36L,G,動力伝達,２０２０年８月２０日,変速機の制御コンピュータの不具合により、突然ＨＯＴ　ＯＩＬ（ＡＴオイル高温警報）の警告が出て、車内の運転席から警告音が止まらなくなった。
150,2020年08月20日,静岡,ＨＰ,フォルクスワーゲン,ゴルフトゥーラン,2017年08月,不明,DBA-1TCZD,CZD,保安灯火,２０２０年７月と２０２０年８月,外２５８５のリコールにて、バルブホルダを対策品に交換した車両で、テール＆ストップランプが正常に点灯しなくなった。
151,2020年08月20日,静岡,ＨＰ,フォルクスワーゲン,ゴルフトゥーラン,2017年08月,不明,DBA-1TCZD,CZD,保安灯火,２０２０年７月と２０２０年８月,外２５８５のリコールにて、バルブホルダを対策品に交換した車両で、テール＆ストップランプが正常に点灯しなくなった。
152,2020年08月20日,三重,ＨＰ,トヨタ,ランドクルーザープラド,2014年10月,"38,000 Km",LDA-GDJ150W,1GD,排ｶﾞｽ･騒音,２０２０年８月１３日,ユリアポンプの不良により、一般道を６０ｋｍ／ｈで走行中にエンジン警告灯が点灯した。
153,2020年08月20日,大阪,ﾌﾘｰﾀﾞｲｱﾙ,三菱,アウトランダーＰＨＥＶ,2013年12月,"90,000 Km",DLA-GG2W,4B11-S61-Y61,電動機(モーター),不明,バッテリーの性能低下により、高速道路で１００ｋｍ／ｈ走行中、突然加速しなくなって３０ｋｍ／ｈになった。一度路側帯に止めて確認し、再度走り出したら、加速は出来たが、この間に警告灯は点灯しなかった。
154,2020年08月20日,京都,ＨＰ,スズキ,ソリオ,2013年03月,"43,273 Km",DBA-MA15S,K12B,かじ取り,２０２０年８月１６日,ステアリングロックの不良により、突然エンジンがかからなくなった。
155,2020年08月20日,滋賀,ＨＰ,アウディ,Ａ３,2010年01月,"44,800 Km",ABA-8PCAX,CAX,動力伝達,２０２０年７月２１日,トランスミッションの不良のにより、走行中にエンジン警告灯が点灯し、走行に不具合が生じたため、通り道の駐車場へ緊急停止した。
156,2020年08月20日,香川,ＨＰ,マツダ,タイタンダッシュ,2006年03月,"92,000 Km",KR-SYF4T,RF,動力伝達,２０２０年８月１１日,走行中にプロペラシャフトが破損したため、走行不能になった。
157,2020年08月19日,宮城,ﾌﾘｰﾀﾞｲｱﾙ,ホンダ,ＧＲＡＣＥハイブリッド,2016年10月,"16,300 Km",DAA-GM4,LEB-H1,電動機(モーター),２０１８年,エアコンを使用した際に、ハイブリッドバッテリーの電圧が急激に低下し、路上で止まってしまった。
158,2020年08月19日,新潟,ＨＰ,メルセデス・ベンツ,Ｅ３５０　Ｂｌｕｅｔｅｃ,2015年03月,"73,000 Km",LDA-212026C,642,排ｶﾞｽ･騒音,２０２０年８月１４日,ＮＯｘセンサーの故障により、走行中に警告灯が点灯した。
159,2020年08月19日,長野,ＨＰ,ニッサン,デイズ,2015年03月,"39,686 Km",DBA-B21W,3B20,保安灯火,２０２０年８月１５日,左の電動ドアミラーが開閉しなくなった。
160,2020年08月19日,東京,ＨＰ,クライスラー,ジープラングラーアンリミテッドサハラ,2020年07月,不明,ABA-JL20L,N,かじ取り,納車時から,ハンドルの遊びが大きく、かつ走行中ハンドルが左に取られる。平地でハンドルから手を離すと左に曲がる。常に右にハンドルを切り続けないと直進できない。
161,2020年08月19日,東京,ＨＰ,クライスラー,ジープラングラーアンリミテッドサハラ,2020年07月,不明,ABA-JL20L,N,かじ取り,納車時から,ハンドルの遊びが大きく、かつ走行中ハンドルが左に取られる。平地でハンドルから手を離すと左に曲がる。常に右にハンドルを切り続けないと直進できない。
162,2020年08月19日,東京,ＨＰ,テスラ,モデルＳ,2014年09月,"67,900 Km",ZAA-SL1SA,L1S,その他,２０１９年５月,センターパネルがブラックアウトし、何をしても再起動しなくなり、エアコン等が操作できなくなった。
163,2020年08月19日,東京,ﾌﾘｰﾀﾞｲｱﾙ,ホンダ,オデッセイ,2004年09月,"111,700 Km",DBA-RB1,K24A,かじ取り,不明,パワーステアリングが故障したため、走行中に突然ハンドルがロック状態になり、カーブを曲がれなくなった。
164,2020年08月19日,神奈川,ﾌﾘｰﾀﾞｲｱﾙ,三菱,デリカＤ２,2012年09月,"30,200 Km",DBA-MB15S,K12B,車枠・車体,不明,フロントグリルと、リヤゲートガーニッシュに水が溜まる。
165,2020年08月19日,千葉,ﾌﾘｰﾀﾞｲｱﾙ,ニッサン,クリッパー,2004年08月,不明,LE-U72T,3G83,エンジン,不明,エンジンのリングギアが削れたため、エンジンが始動できなくなった。
166,2020年08月19日,山梨,ﾌﾘｰﾀﾞｲｱﾙ,マツダ,アテンザ,2013年07月,"65,000 Km",LDA-GJ2FW,SH,保安灯火,２０２０年７月の車検時に発見,左前照灯のリフレクタが焼け溶け、火災寸前のような状態になっていた。
167,2020年08月19日,愛知,ＨＰ,ダイハツ,タント,2019年10月,"83,600 Km",CBA-L350S,EF,電気装置,不明,オルタネーターアジャストステーが折損し、異音、ベルト鳴きが発生した。バッテリーの警告が点灯した。
168,2020年08月19日,三重,電話,スズキ,ワゴンＲ,2009年09月,"20,000 Km",DBA-MH23S,K6A,エンジン,不明,エアコンをつけた状態で乗るとエンストする。
169,2020年08月19日,大阪,ＨＰ,ＢＭＷ,２１８ｄ,2015年11月,"30,000 Km",LDA-2C20,B47C20A,動力伝達,２０１９年１２月,トランスミッションの内部故障により、市街を通常走行中にドライブトレーン異常の警告が出て、走りが重たくなった。
170,2020年08月19日,大阪,ﾌﾘｰﾀﾞｲｱﾙ,三菱,ふそうキャンター,2015年08月,"83,000 Km",TKG-FEB50,4P10,車枠・車体,不明,サイドバンパーをフレームに取り付けるためのボルト穴部分に亀裂が発生した。
171,2020年08月19日,福岡,ﾌﾘｰﾀﾞｲｱﾙ,ニッサン,セレナ,2011年11月,"90,000 Km",DBA-C26,MR20,動力伝達,不明,ＣＶＴの不具合により、交差点で発進時に突然アクセルペダルを踏んでもガラガラと異音がして、動力が切れたような状態で進まなくなり、惰性で路肩に停車した。
172,2020年08月19日,福岡,ﾌﾘｰﾀﾞｲｱﾙ,スズキ,ワゴンＲ,2011年02月,"85,600 Km",DBA-MH23S,K6A,その他,不明,エアコンのエバポレーターからガス漏れし、エアコンが効かなくなった。
173,2020年08月19日,福岡,ﾌﾘｰﾀﾞｲｱﾙ,マツダ,ＣＸ－５,2013年03月,"108,200 Km",LDA-KE2FW,SH,保安灯火,不明,左右のドアミラーが内部の歯車が破損し、格納できなくなった。
174,2020年08月19日,熊本,ＨＰ,ニッサン,ルークス,2011年10月,"88,658 Km",DBA-ML21S,K6A,エンジン,２０２０年５月,プッシュスタートでエンジンがかからなくなった。
175,2020年08月19日,大分,ＨＰ,マツダ,ＣＸ－５,2017年02月,"89,000 Km",LDA-KF2P,642,その他,２０２０年８月１５,エアコンのサーモスタット（フロスト・スイッチ）の不良により、走行中にエアコンの風量調整をしても風が出なくなった。
176,2020年08月18日,東京,ＨＰ,テスラ,モデル３,2020年04月,"5,202 Km",ZAA-3L13,3D1,電動機(モーター),２０２０年８月１７日,走行中にいきなり警告音が鳴り、ディスプレイに「走行できません。安全に停止して下さい」と出てアクセルが反応しなくなった。
177,2020年08月18日,東京,ﾌﾘｰﾀﾞｲｱﾙ,ニッサン,デイズルークス,2015年03月,"50,400 Km",DBA-B21A,3B20,保安灯火,不明,ドアミラーが格納しなくなった。
