番号,受付日,住所,申告方法,車名,通称名,初度登録年月,総走行距離,型式,原動機型式,不具合装置,発生時期,申告内容の要約
166,2020年03月10日,岡山,ﾌﾘｰﾀﾞｲｱﾙ,三菱,ｉ－ＭｉＥＶ,不明,不明,ZAA-HA3W,Y4F1,電動機(モーター),不明,駆動用バッテリーの不具合により、残走行可能距離が４０ｋｍ残っている状態で、電欠を知らせる亀マークの点灯もないまま突然電源が落ちて、走行不能になる。
167,2020年03月10日,鹿児島,ＨＰ,ホンダ,ライフ,不明,"90,000 Km",CBA-JB5,不明,かじ取り,購入時から,ステアリングが重い。ハンドルが戻らず、ぶつかりそうになった。
168,2020年03月09日,北海道,ＨＰ,三菱,アウトランダーＰＨＥＶ,2013年10月,"67,000 Km",DLA-GG2W,4B11-S61-Y61,電気装置,２０２０年３月９日,駆動用バッテリーに水が浸入して漏電したため、走行中に突然ＥＶエラーが発生し、速度が５０ｋｍ／ｈ以下に低下した。
169,2020年03月09日,埼玉,ﾌﾘｰﾀﾞｲｱﾙ,三菱,ふそうスーパーグレート,2015年07月,不明,QPG-FS64VZ,6R10,エンジン,２０２０年,オイルパンの２か所に亀裂が発生し、オイルが漏れてくる状態になった。
170,2020年03月09日,愛知,ＨＰ,アウディ,Ａ３　スポーツバック,2012年06月,"60,600 Km",DBA-8PCAX,CAX,動力伝達,２０２０年２月,７速Ｓトロニック自動変速ユニットのメカトロニクスで、シフト部の油漏れにより油圧が低下し、メーターパネルのシフト表示灯が点滅した。
171,2020年03月09日,静岡,ＨＰ,スバル,フォレスター,2018年10月,不明,5AA-SKE,FB20-MA1,動力伝達,２０２０年２月,登坂信号待ち右折時、発進しようとアクセルペダルを踏んだが車が発進せず後退した。（体感的に１～２秒）
172,2020年03月09日,岐阜,ﾌﾘｰﾀﾞｲｱﾙ,三菱,デリカＤ２,2016年03月,"85,000 Km",DAA-MD36S,K12C-WA05A,緩衝装置,不明,左右のサスペンションのダストブーツが破けた。
173,2020年03月09日,福岡,ﾌﾘｰﾀﾞｲｱﾙ,ホンダ,Ｎ－ＢＯＸカスタム,2015年08月,"43,000 Km",DBA-JF1,S07A,エンジン,不明,エンジン始動後発進する際にエンジンがストールする。ディーラーに相談をしているが、入庫中に症状が確認できないために原因が特定されない。
174,2020年03月09日,沖縄,ＨＰ,スズキ,クロスビー,2019年03月,"2,700 Km",DAA-MN71S,K10C-WA05A,制動装置,２０１９年６月,前方に何も無く走行中に予期せぬ緊急ブレーキが作動し、シートベルトで鎖骨が痛くなった。バックカメラが突然にピンボケし、白黒になり見え辛くなる。
175,2020年03月08日,東京,ＨＰ,ＢＭＷ,３３０ｅ　ＭＳＰｏｒｔ,2020年01月,560 Km,3LA-5X20,B48B20B-P251,走行装置,２０２０年２月６日,走行中タイヤ空気圧異常のアラームが鳴り、緊急停止の指示が出た。
176,2020年03月08日,岡山,24時間電話,ニッサン,デイズルークス,2015年05月,"34,600 Km",DBA-B21A,3B20,保安灯火,２０１９年１２月,左ドアミラーが格納しなくなり、モーターが空回りする状態になった。
177,2020年03月08日,岡山,24時間電話,ニッサン,デイズルークス,2015年05月,"34,600 Km",DBA-B21A,3B20,エンジン,２０２０年２月１８日,エンジンが不調になり、ガガガッと異音が出たり、アクセルペダルを踏むとドッドッドッと振動するようになり、その後エンジンが止まるようになった。
178,2020年03月08日,岡山,24時間電話,ニッサン,デイズルークス,2015年05月,"34,600 Km",DBA-B21A,3B20,走行装置,２０１９年１０月,高速道路を走行中にパンッという音がしたため、ディーラーで確認を行ったところ、左タイヤハブベアリングが破損していた。
179,2020年03月08日,香川,ＨＰ,スバル,レガシィ,2010年12月,"33,700 Km",DBA-BR9,EJ25,制動装置,２０１９年１０月頃,ＶＤＣハイドロリックユニットの不良により、メーターパネルにＶＤＣ警告灯、ＡＢＳ警告灯が表示される。
180,2020年03月07日,北海道,ＨＰ,トヨタ,マークＸジオ,2011年03月,"96,800 Km",DBA-ANA15,2AZ,かじ取り,２０２０年１月,走行中、路面の段差によりステアリング部からコトコト音が発生する。
181,2020年03月07日,埼玉,ＨＰ,ボルボ,Ｖ６０　Ｔ４,2013年09月,"62,000 Km",DBA-FB4164T,B4164T,動力伝達,２０２０年１月より,低速走行中にギア抜けのように、エンジン回転数のみが急に上がることがしばしば発生するようになった。
182,2020年03月07日,三重,ＨＰ,ニッサンＭＴ,マーチ　ニスモＳ,2014年06月,"102,700 Km",DBA-K13改,HR15,車枠・車体,２０１９年１２月５日,テールレンズの裏のボディーパネルの繋ぎ目が歪んでいたか何かでメーカーにて補修した跡があったが、その補修材が割れてテールランプの辺りから浸水した。
183,2020年03月07日,大阪,ＨＰ,シトロエン,Ｃ４ピカソ,2016年09月,"18,236 Km",ABA-B7875G01,5G01,エンジン,２０２０年２月２３日　３月１日,エンジンが不安定になり、出力が半減した。
184,2020年03月07日,福岡,ＨＰ,ニッサン,セレナ,2019年09月,"4,749 Km",DAA-GFC27,MR20-SM24,エンジン,２０２０年２月１４日,バイパスの追越車線を走行中、いきなりエンストした。
185,2020年03月07日,熊本,24時間電話,ニッサン,デイズ,2019年05月,不明,5BA-B43W,BR06,電気装置,２０２０年１月１８日,バッテリーが上がる。一度整備を受けたが、その後に再度バッテリーが上がってしまった。
186,2020年03月06日,北海道,ﾌﾘｰﾀﾞｲｱﾙ,ホンダ,Ｎ－ＢＯＸ,2017年10月,"16,000 Km",DBA-JF4,S07B,その他,不明,燃料計と、走行可能距離表示がフリーズすることがある。
187,2020年03月06日,北海道,ﾌﾘｰﾀﾞｲｱﾙ,ホンダ,Ｎ－ＢＯＸ,2017年10月,"3,000 Km",DBA-JF4,S07B,排ｶﾞｽ･騒音,２０１８年４月５日,暖機運転中、マフラーからポコポコと異常音がする。
188,2020年03月06日,福島,ＨＰ,ニッサン,エルグランド,2015年02月,"43,211 Km",DBA-TNE52,QR25,車枠・車体,２０１９年２月,低回転で走行中、３０ｋｍ／ｈ辺りから６０ｋｍ／ｈぐらいまでの間で毎回振動が起きる。
189,2020年03月06日,東京,ＨＰ,ニッサン,セレナ,2019年06月,"9,793 Km",DAA-GFNC27,MR20-SM24,エンジン,２０２０年２月２９日,サービスエリアで２時間ほど仮眠後、エンジンのスタートボタンを押したら「キーＩＤが認識できません」となり動かせなくなった。
190,2020年03月06日,東京,ＨＰ,ＢＭＷ,３３０ｅ　ＭＳｐｏｒｔ,2020年01月,450 Km,3LA-5X20,B48B20B-P251,乗車装置,２／４新車受け取り、２／５友人を助手席に,助手席乗員が降車しようとしたところ、ドアが開かない。何度か力づくで脱出した。その後も外からも開かないことを確認した。
191,2020年03月06日,神奈川,ﾌﾘｰﾀﾞｲｱﾙ,三菱,デリカＤ５,2019年11月,不明,不明,不明,制動装置,不明,被害軽減ブレーキが不要作動したり、突然オフになることがあり、信頼して使えない。
192,2020年03月06日,千葉,電話,ダイハツ,タント,2017年03月,"12,000 Km",DBA-LA600S,KF,制動装置,中古で購入した２０１９年ごろから,スマートアシストの警告が表示され、機能が停止する。
193,2020年03月06日,大阪,ＨＰ,アウディ,ＲＳ５,2011年05月,"40,000 Km",ABA-8TCFSF,CFS,エンジン,２０２０年１月２５日,フューエルポンプコネクタの不良により、エンジン始動させても、スターターが回るだけでエンジンが全くかからない。
194,2020年03月06日,滋賀,ﾌﾘｰﾀﾞｲｱﾙ,フォルクスワーゲン,ゴルフ,2012年02月,"60,000 Km",DBA-1KCAX,CAX,動力伝達,２０２０年３月５日,運転中に突然加速しなくなり、停車をして再始動をしたところ、エンジンはかかるものの、動力が伝わらずに空回り状態となり、走行不能になった。
195,2020年03月06日,沖縄,ＨＰ,トヨタ,ランドクルーザープラド,2006年05月,"75,000 Km",CBA-TRJ120W,2TR,車枠・車体,２０１９年にネットで話題になったことから,ホワイトパール色塗装の車で、ドア、天井部の塗装が剥がれた。
196,2020年03月05日,宮城,ＨＰ,日野,レンジャー,2011年07月,"61,300 Km",BKG-FC7JCYA,J07E,保安灯火,２０２０年３月５日,ブレーキペダルのブレーキスイッチの不具合により、ストップランプが左右両方点灯しなくなった。
197,2020年03月05日,宮城,ＨＰ,日野,レンジャー,2011年07月,"66,900 Km",BKG-FC7JCYA,J07E,車枠・車体,２０１９年６月,クラッチペダルに付いているＰＴＯセンサースイッチの不具合で、ＰＴＯが入らない。
198,2020年03月05日,宮城,ＨＰ,日野,レンジャー,2011年07月,"61,300 Km",BKG-FC7JCYA,J07E,車枠・車体,２０２０年３月５日,クラッチペダルに付いているＰＴＯセンサースイッチの不具合で、ＰＴＯが入らない。
199,2020年03月05日,宮城,ＨＰ,日野,レンジャー,2011年07月,"61,300 Km",BKG-FC7JCYA,J07E,乗車装置,２０２０年３月５日,運転席ドアのカギを閉めた状態で、ドアノブに触らないで閉めてもインロックされる。
200,2020年03月05日,宮城,ＨＰ,日野,レンジャー,2013年02月,"41,000 Km",TKG-FC9JCAA,J05E,車枠・車体,２０１９年８月,クラッチペダルに付いているＰＴＯセンサースイッチの不具合で、ＰＴＯが入らない。
201,2020年03月05日,宮城,ＨＰ,日野,レンジャー,2013年02月,"25,000 Km",TKG-FC9JCAA,J05E,車枠・車体,２０１９年５月,クラッチペダルに付いているＰＴＯセンサースイッチの不具合で、ＰＴＯが入らない。
202,2020年03月05日,宮城,ＨＰ,日野,レンジャー,2013年02月,"21,200 Km",TKG-FC9JCAA,J05E,車枠・車体,２０１９年３月,クラッチペダルに付いているＰＴＯセンサースイッチの不具合で、ＰＴＯが入らない。
203,2020年03月05日,宮城,ＨＰ,日野,レンジャー,2013年02月,"33,200 Km",TKG-FC9JCAA,J05E,車枠・車体,２０１９年２月,クラッチペダルに付いているＰＴＯセンサースイッチの不具合で、ＰＴＯが入らない。
204,2020年03月05日,長野,ＨＰ,ニッサン,ノート,2014年09月,"136,595 Km",DBA-E12,HR12,エンジン,２０２０年１月１５日,ラジエーターファンモーターのガタにより異音が発生し、ファンシュラウドと接触・損傷した。
205,2020年03月05日,富山,ＨＰ,ダイハツ,タントカスタム,2016年03月,"35,000 Km",DBA-LA600S,KF,エンジン,新車購入時からたびたび,エンジン始動時、セルはまわるがエンジンがかからない時があり、しばらくエンジンがかからない。
206,2020年03月05日,東京,ＨＰ,ＢＭＷ,Ｘ１,2016年09月,"50,000 Km",LDA-HT20,B47C20A,制動装置,２０１９年９月,ブレーキパッドが片減りし、残量センサーのないアウター側のみ減っていた。
207,2020年03月05日,東京,ﾌﾘｰﾀﾞｲｱﾙ,アウディ,Ａ１スポーツバック,不明,不明,DBA-8XCAX,CAX,動力伝達,不明,ＤＳＧのアッパーハウジングのリコール対象になり、措置を済ませた車両で、クラッチがすべるようになり、車が動かなくなった。
208,2020年03月05日,群馬,ＨＰ,スバル,レヴォーグ　２．０ＧＴ－Ｓ,2014年10月,"70,000 Km",DBA-VMG,FA20,動力伝達,２０１９年１０月頃,ＣＶＴのオイルポンプのシール不良により、ＣＶＴフルードが漏れ、フロントデフのドレンボルトにフルードの滴が溜まっていた。
209,2020年03月05日,愛知,ＨＰ,ホンダ,Ｎ－ＢＯＸ,2014年01月,"82,637 Km",DBA-JF2,S07A,動力伝達,２０２０年２月,シフトレバーのプッシュノブが破損し、プッシュボタンが機能しないのでＰレンジに入らない。
210,2020年03月05日,大阪,ＨＰ,ニッサン,エルグランド,2010年01月,"48,000 Km",CBA-ME51,VQ25,エンジン,２０１９年１０月,Ｎｏ．４シリンダーの圧縮不良により、エンジン警告灯が点灯した。
211,2020年03月05日,奈良,ﾌﾘｰﾀﾞｲｱﾙ,ダイハツ,ムーヴ,2005年06月,"60,000 Km",DBA-L150S,EF,緩衝装置,不明,後輪のサスペンションの耐久性が低く、車高が下がってくるため、駐車場で車止めや、悪路でバンパーが擦れてしまうようになる。
212,2020年03月05日,山口,ＨＰ,プジョー,２０７ｃｃ,2009年10月,"40,600 Km",ABA-A7C5FX,5FX,保安灯火,２０１９年１１月,フロントガラスの一部が外れ、走行中に風が吹き込むようになった。
213,2020年03月05日,鹿児島,ＨＰ,メルセデス・ベンツ,Ｃ２００アバンギャルド,2015年09月,"22,000 Km",RBA-205042C,274,車枠・車体,２０２０年２月,燃料ポンプあたりからガソリン漏れたらしく、室内にガソリン臭がし出した。
214,2020年03月04日,岩手,ＨＰ,ボルボ,Ｖ６０,2011年11月,"47,700 Km",DBA-FB4164T,B4164T,動力伝達,不明,走行中ミッションエラーが表示され、アクセルペダルを踏んでも動かなくなったり、エンジンの回転数が上がったりする。
215,2020年03月04日,神奈川,ﾌﾘｰﾀﾞｲｱﾙ,ホンダ,フィットハイブリッド,2014年04月,"125,467 Km",DAA-GP5,LEB-H1,動力伝達,２０２０年,ＤＣＴ（自動変速機）内部のベアリング不良により、朝一番のエンジン始動時にキリキリと異音が出る。
216,2020年03月04日,千葉,ＨＰ,ニッサン,ＮＶ２００バネット,2019年10月,"3,100 Km",DBA-M20,HR16,乗車装置,２０１９年１１月１０日,座席が高いのにステップがないため、人が乗り降りする際に転倒して落ちる事が多々ある。
217,2020年03月04日,埼玉,ＨＰ,ホンダ,オデッセイ,2013年11月,"58,100 Km",DBA-RC1,K24W,電気装置,２０２０年３月２日,エンジンをかけるとインパネの警告灯が全点灯しそのまま点灯し続ける。いったんエンジンを切りもう一度かけると一旦消え、再び点灯する。
218,2020年03月04日,埼玉,ＨＰ,ＢＭＷ,１１６ｉ,2012年09月,"24,400 Km",DBA-1A16,N13B16A,エンジン,２月１５日・２６日,走行中にドライブトレーンの表示と警告音が鳴った。
219,2020年03月04日,埼玉,ﾌﾘｰﾀﾞｲｱﾙ,三菱,デリカスペースギア,2003年02月,"95,000 Km",GH-PD6W,6G72,車枠・車体,不明,左フロントサイドメンバの４か所に亀裂が出来たため、ハンドルを右に切って、戻していくときにカキンと異音がするようになった。
220,2020年03月04日,愛知,ＨＰ,ニッサン,エクストレイル,2009年07月,"111,134 Km",LDA-DNT31,M9R,制動装置,２０２０年３月１日,高速道走行中、ブレーキペダルが踏めなくなり、ブレーキが効かなくなった。レッカー入庫でディーラーに診てもらうとバキュームポンプの故障と診断された。
221,2020年03月04日,京都,ＨＰ,トヨタ,アルファード,2018年06月,"6,700 Km",DBA-GGH35W,2GR,動力伝達,２０１８年６月,せまい道路で対向車とすれ違うために１０ｋｍ／ｈ程度に減速し、再加速するためにアクセルペダルを踏むと、エンジン回転数は上がるが、反応が悪く加速しない。
222,2020年03月04日,兵庫,ＨＰ,ジープ,ラングラー　ＪＬ,不明,不明,ABA-JL36L,不明,制動装置,不明,立体駐車場のような場所や、低い何かがあるような所で突然自動ブレーキが作動して急ブレーキがかかる。
223,2020年03月04日,兵庫,ＨＰ,ニッサン,ノートｅ－ＰＯＷＥＲ,2017年07月,"10,100 Km",DAA-HE12,HR12-EM57,動力伝達,２０１７年９月,狭い道路でＵターンをしようとして車を前後に動かし、何回目かにブレーキペタルを離したところ突然車が急加速し、ガードレールにぶつかった。
224,2020年03月04日,広島,ＨＰ,ホンダ,ＶＥＺＥＬハイブリッド,2014年11月,"97,436 Km",DAA-RU4,LEB-H1,エンジン,２０２０年２月２６日,Ｈｏｎｄａスマートキーシステム点検ランプが作動、点検してもらうとエンジンスタートストップスイッチ故障とのこと。
225,2020年03月03日,宮城,ﾌﾘｰﾀﾞｲｱﾙ,ニッサン,セレナ,2015年06月,"30,000 Km",DAA-HFC26,MR20-SM23,乗車装置,不明,電動スライドドアのワイヤー不良により、自動で開閉しなくなった。
226,2020年03月03日,鳥取,ＨＰ,メルセデス・ベンツ,Ｅ３５０ブルーテック,2015年08月,"27,000 Km",LDA-212226C,642,排ｶﾞｽ･騒音,不明,ＮＯＸセンサーの不良により、走行中にメーターパネルにエンジンチェックランプが点灯した。
227,2020年03月03日,愛媛,来訪,その他,コーナーポール,2020年02月,280 Km,6AA-NHP170G,不明,装置その他,２０２０年２月,コーナーポール（フェンダーポール）の上下機能が手動であるのが納得がいかない。またコーナーポールランプについても暗すぎる。
228,2020年03月03日,鹿児島,ﾌﾘｰﾀﾞｲｱﾙ,カワサキ,ＺＸ１４００　ＡＢＳ,2017年05月,"10,000 Km",ZXT40H,ZXT40EE,制動装置,不明,ＡＢＳのハイドロリックユニットが固着し、リヤブレーキが効かなくなった。
229,2020年03月02日,福島,ﾌﾘｰﾀﾞｲｱﾙ,トヨタ,カローラフィールダー,2002年10月,"175,300 Km",UA-NZE121G,1NZ,車枠・車体,冬季,気温が低いときにバックドアを開けると、全開状態で維持が出来ずにバックドアが落ちてくる。
230,2020年03月02日,福島,ﾌﾘｰﾀﾞｲｱﾙ,トヨタ,カローラフィールダー,2002年10月,"175,300 Km",UA-NZE121G,1NZ,車枠・車体,不明,後軸をジャッキアップするためのジャッキポイントが腐食し、ジャッキをかけるとへこんでしまう。
231,2020年03月02日,東京,ﾌﾘｰﾀﾞｲｱﾙ,スバル,インプレッサ,2017年12月,"4,000 Km",DBA-GK2,FB16,エンジン,２０１９年１月７日,エンジンから異音がし、ハードノッキングする。
232,2020年03月02日,東京,ﾌﾘｰﾀﾞｲｱﾙ,アウディ,Ａ４,2011年03月,"63,500 Km",ABA-8KCDN,CDH,その他,不明,メーター中央のインフォメーション画面が点いたり消えたりする。
233,2020年03月02日,東京,ﾌﾘｰﾀﾞｲｱﾙ,アウディ,Ａ４,2011年03月,"63,500 Km",ABA-8KCDN,CDH,エンジン,中古車購入直後から,エンジンオイルの消費が激しく、オイルを補充しても直ぐにエンジンオイルの黄色い警告灯が点灯する。
234,2020年03月02日,東京,ﾌﾘｰﾀﾞｲｱﾙ,レクサス,ＣＴ２００ｈ,2014年06月,不明,DAA-ZWA10,2ZR-3JM,かじ取り,不明,車庫入れた際にハンドルが左に回りだした。
235,2020年03月02日,神奈川,ＨＰ,スバル,レガシィアウトバック,2012年04月,"137,800 Km",DBA-BRF,EZ36,緩衝装置,２０２０年３月,左前ロアアームとハブの接続ボルトが破断し、右前輪が外れたため走行不能になった。
236,2020年03月02日,千葉,ﾌﾘｰﾀﾞｲｱﾙ,スバル,フォレスター,2012年06月,"39,500 Km",DBA-SHJ,FB20,車枠・車体,２０２０年,運転席サンバイザーの軸部が破損したため、サンバイザーが脱落した。
237,2020年03月02日,埼玉,ＨＰ,ジャガー,ＸＥ,2018年06月,"7,000 Km",LDA-JA2NA,204DT,かじ取り,２０２０年２月２３日,駐車しようとした際にタイロッドのネジが切れたため、ハンドルを切っても車が動かなくなり、アクセルペダルを踏み込んだところ、意図しない方向に車が進み、木の柱に左前面のバンパーがぶつかった。
238,2020年03月02日,大阪,ＨＰ,スズキ,スイフト,2013年10月,"63,000 Km",DBAｰZC72S,K12B,エンジン,２０２０年２月１７日,クランクボルトが折れたため、走行中にエンジンからバタバタ音がして金属と金属が当たる音がし、メーター内にチャージランプが点灯した。
239,2020年03月02日,京都,ﾌﾘｰﾀﾞｲｱﾙ,ダイハツ,タント,2013年03月,"116,400 Km",DBA-L375S,KF,制動装置,中古車購入直後から,ブレーキの効きが悪く、ペダルの踏み代が深い。
240,2020年03月02日,兵庫,ＨＰ,ホンダ,ステップワゴン,2016年10月,"30,000 Km",DBA-RP3,L15B,乗車装置,２０１９年１０月以降～現在,テールゲートスイッチの反応が悪く、テールゲートを即座に開くことが困難。数回の押下で開くこともあれば、十数回の押下が必要な場合もある。
241,2020年03月02日,兵庫,ﾌﾘｰﾀﾞｲｱﾙ,ニッサン,ジューク,2010年11月,"56,102 Km",DBA-YF15,HR15,動力伝達,２０１９年,ＣＶＴの不具合により、前進、後進共にエンストしてしまうようになった。
242,2020年03月02日,岡山,ﾌﾘｰﾀﾞｲｱﾙ,ホンダ,Ｎ－ＢＯＸカスタム,2012年04月,"79,000 Km",DBA-JF1,S07A,動力伝達,２０１９年１２月２８日,ＣＶＴの不具合により、走行中にガタガタと振動し始め、その後、空ぶかし状態で走行不能になった。
243,2020年03月02日,山口,ＨＰ,マツダ,アテンザワゴン,2013年11月,"120,000 Km",LDA-GJ2FW,SH,エンジン,２０２０年,一般道を走行中突然警告灯が点灯し、エンジンが停止したため、惰性で空き地にたどり着いた。
244,2020年03月01日,北海道,ＨＰ,三菱,デリカＤ５,2013年09月,"145,000 Km",LDA-CV1W,4N14,排ｶﾞｽ･騒音,２０１９年５月,駐車中にエンジンを掛けた状態で、空調を外気導入にすると排気ガスが車内に入り異臭がする。内気循環にすると異臭がしなくなる。
245,2020年03月01日,富山,ＨＰ,ニッサン,フェアレディＺ,2009年01月,"62,400 Km",CBA-Z34,VQ37,エンジン,２０２０年２月２８日,ステアリングロックの故障により、勤務を終え会社から帰宅する際、ハンドルロックが解除されず、エンジンがかからなかった。
246,2020年03月01日,富山,ＨＰ,ニッサン,フェアレディＺ,2009年01月,"62,400 Km",CBA-Z34,VQ37,制動装置,２０２０年２月,圧雪になった交差点にて左折する際歩行者がいたため、ブレーキをかけたところ、全てのタイヤがロックし、歩行者をはねそうになった。ＡＢＳが作動しなかった。
247,2020年03月01日,千葉,ＨＰ,トヨタ,ヴィッツ,2012年05月,"120,000 Km",DBA-NCP131,1NZ,車枠・車体,２０２０年１月,バックドアのホワイトパール塗装がパリパリ剥がれた。
