番号,受付日,住所,申告方法,車名,通称名,初度登録年月,総走行距離,型式,原動機型式,不具合装置,発生時期,申告内容の要約
86,2020年03月18日,神奈川,ﾌﾘｰﾀﾞｲｱﾙ,ニッサン,シーマ,2012年09月,"80,000 Km",DAA-HGY51,VQ35-HM34,制動装置,２０２０年３月,ブレーキマスターシリンダーの不具合により、ブレーキ系統にエアが入ったようにペダルが深く踏み抜ける様になったり、少し踏むだけでもタイヤがロックするほどの制動力が出たりと、毎回バラバラのブレーキ作動をするようになった。
87,2020年03月18日,千葉,ＨＰ,ニッサン,エクストレイル,2009年12月,"146,269 Km",LDA-DNT31,M9R,エンジン,２０２０年３月,クランクシャフトプーリーのガタつきにより、エンジンから異音がする。
88,2020年03月18日,千葉,ﾌﾘｰﾀﾞｲｱﾙ,ＢＭＷ,３３０ｉＭスポーツ,不明,"3,000 Km",3BA-5F20,不明,電気装置,購入当初から,ラジオの音が出ない。ナビがついたり消えたりする。ウインカーの音が出ない。
89,2020年03月18日,愛知,ﾌﾘｰﾀﾞｲｱﾙ,ニッサン,ＮＶ３５０キャラバン,2013年06月,"120,000 Km",LDF-VW2E26,YD25,動力伝達,２０２０年２月末,走行中に自動変速機が故障し、アクセルペダルを踏み込んでもエンジン回転が上がるだけで、走行できなくなった。
90,2020年03月18日,大阪,ＨＰ,ニッサン,セレナ,2010年09月,"124,500 Km",DBA-CC25,MR20,動力伝達,２０１９年１２月,ＣＶＴ不良ショックが大きく変速しなくなり、最後には動かなくなった。
91,2020年03月18日,山口,ＨＰ,ニッサン,デイズルークス,2014年11月,"55,400 Km",DBA-B21A,3B20,保安灯火,２０１９年１０月２９日,左電動ドアミラーが格納できなくなった。
92,2020年03月18日,熊本,ﾌﾘｰﾀﾞｲｱﾙ,トヨタ,マークＸ,2005年09月,"65,800 Km",DBA-GRX120,4GR,エンジン,１年前から３回発生。,特に操作をしていないのにも関わらず、突然エンジン回転が上昇した。一度エンジンを切って再始動をしたところ、症状が消えたが、その後にも同じことが再発した。
93,2020年03月17日,東京,ﾌﾘｰﾀﾞｲｱﾙ,トヨタ,クラウンハイブリッド,2016年06月,"153,400 Km",DAA-AWS210,2AR-1KM,乗車装置,２０１９年１１月,トーシンテック製の自動ドア搭載車で、自動ドアの開閉装置の耐久性が低く、直ぐに故障して自動で開かなくなる。
94,2020年03月17日,神奈川,ＨＰ,ホンダ,ＣＢＲ１０００ＲＲ,2005年07月,"52,445 Km",BC-SC57,SC57E,動力伝達,２０２０年３月１３日１５時頃,走行中の変速操作にて、シフトペダルの操作感覚が突然無くなり、変速操作が不可能になった。停車し車体を確認するとシフトリンクが破断していた。
95,2020年03月17日,神奈川,ﾌﾘｰﾀﾞｲｱﾙ,メルセデス・ベンツ,Ｃ２００,2013年03月,"47,000 Km",DBA-204048,271,エンジン,不明,外２８７２（カムシャフトアジャスタ）のリコールについて対象範囲より後の年式の車で、同じカムシャフトアジャスタの故障が疑われる異音と警告灯の点灯が発生した。
96,2020年03月17日,神奈川,ﾌﾘｰﾀﾞｲｱﾙ,ボルボ,Ｖ６０　Ｔ５,2019年06月,不明,DBA-ZB420,B420,緩衝装置,購入２日目,レーンキープアシストを使用して高速道路を走行していたところ、ほぼ直線路であるのにも関わらず、車体が左右に大きく振られた。後日にディーラーで車両を確認させたところ、左後輪のラテラルリンクの固定ナットが無くなってリンクが外れていた。
97,2020年03月17日,茨城,ＨＰ,フォルクスワーゲン,アルテオン,2018年06月,"4,580 Km",ABA-3HDJHF,DJH,その他,２０２０年３月１７日１６時２０分,残燃料の警告灯が点灯し、残り４５ｋｍ走行可能という表示が出ていたにも関わらず、１～２ｋｍの走行で燃料切れを起こしてエンジンが停止したため、ステアリングが重く操作不能になり、民家の塀に激突寸前になった。
98,2020年03月17日,愛知,ＨＰ,ＵＤトラックス,クオン,2018年08月,"66,122 Km",QPG-GK5XAB,GH11,非装置,２０１９年９月１３日,高速道路走行中、１５㎞走行したところで、エアコン吹き出し口より煙が出たため、降車したところ、車両左前方、エンジンルーム内より出火し、車両が全焼した。
99,2020年03月17日,愛知,ﾌﾘｰﾀﾞｲｱﾙ,トヨタ,ランドクルーザープラド,2010年06月,"66,700 Km",CBA-TRJ150W,2TR,車枠・車体,不明,後輪のジャッキポイントについて、説明書でリヤアクスルホーシングにかけることとされているが、円筒形のアクスルで、明確に固定できる接点がないため、ジャッキアップをした後、作業で車体が揺れた場合に、容易にジャッキが外れる可能性がある。
100,2020年03月17日,静岡,ＨＰ,ボルボ,Ｖ６０クロスカントリー,2016年06月,"10,500 Km",LDA-FD4204T,D4204T,かじ取り,２０２０年３月２８日,高速走行中にパワーステアリングが故障し、操舵困難になった。
101,2020年03月17日,兵庫,ﾌﾘｰﾀﾞｲｱﾙ,スバル,レガシィ,2011年11月,"160,000 Km",DBA-BR9,EJ25,動力伝達,半年くらい前から,発進後、１速から２速に変速する際に、一度ギアがニュートラル状態になり、エンジンがふけ上がってからドーンと大きな衝撃を伴って変速する。
102,2020年03月17日,滋賀,ＨＰ,カワサキ,Ｚ１２５Ｐｒｏ,2016年08月,不明,2BJ-BR125H,不明,電気装置,２０２０年３月,車体左側に配線された電源ハーネスが車両フレームの溶接アングル部と干渉、ハーネス被服の破損により断線した箇所から漏電、煙が発生した。
103,2020年03月17日,奈良,ＨＰ,ニッサン,ノートｅ－ＰＯＷＥＲ,2017年06月,"25,000 Km",DAA-HE12,HR12-EM57,保安灯火,２０１９年１２月,ヘッドライトユニット内側に水滴痕が見受けられる。
104,2020年03月17日,宮崎,ﾌﾘｰﾀﾞｲｱﾙ,ジープ,レネゲード,2018年12月,不明,ABA-BU14,55263624,動力伝達,購入直後から,走行中に突然変速しなくなり、警告灯が点灯して、ギヤがニュートラルに切替わり走行不能になる。
105,2020年03月16日,北海道,ﾌﾘｰﾀﾞｲｱﾙ,ホンダ,Ｎ－ＢＯＸ,2020年01月,不明,6BA-JF4,S07B,車枠・車体,不明,６０ｋｍ／ｈくらいで走行中に左右に揺れが発生する。車両後方からギシギシと異音が出る。
106,2020年03月16日,北海道,ﾌﾘｰﾀﾞｲｱﾙ,キャタピラー,９１０Ｈ,2013年12月,不明,KDP-SAT,CPS4,エンジン,２０２０年３月６日,オイル管理等を適切に行っていたのにも関わらず、ターボチャージャーが破損し、羽の破片がエンジンに混入したことからエンジン本体も破損した。
107,2020年03月16日,北海道,ﾌﾘｰﾀﾞｲｱﾙ,極東,粉粒体運搬セミトレーラ,2019年03月,不明,KA2469K-1,不明,緩衝装置,不明,ＢＰＷ製の足回りを装着している車両で、トルクロッドにガタが発生しているのを発見した。
108,2020年03月16日,宮城,ＨＰ,三菱,アウトランダーＰＨＥＶ,2014年02月,"57,000 Km",DLA-GG2W,4B11-S61-Y61,電気装置,不明,走行中、ナビ画面が瞬断後、ハンドル、ブレーキ以外操作不能となり、２０種類くらいのエラーが表示されて、パワースイッチも切れず、ドアロックもできない状態になった。
109,2020年03月16日,長野,ＨＰ,フォルクスワーゲン,ゴルフトゥーラン,2008年06月,"100,000 Km",ABA-1TBLG,BLG,動力伝達,走行開始後数分,ＤＳＧトランスミッション不良により、シフトインジケータが全点滅し、１速固定になり、バック不能になった。
110,2020年03月16日,長野,ＨＰ,コマツ,１．５ｔ　バッテリーフォーク,2018年03月,不明,FB15-12,不明,エンジン,２０２０年３月,アクセルリターンスプリング破損のためアクセルが踏み込まれたまま戻らなくなった。速度リミッターを掛けていてさほどスピードが出ていなかったたあめ、ブレーキをかけキーオフで安全に停止することが出来た。
111,2020年03月16日,東京,ＨＰ,レクサス,ＧＳ４５０Ｈ,2016年01月,"71,900 Km",DAA-GWL10,2GR-1KM,エンジン,２０２０年１月及び２０１８年１２月,ブレーキペダルを踏んだ瞬間、車が大きく振動した。
112,2020年03月16日,神奈川,ＨＰ,ジープ,ジープラングラー,2019年12月,不明,ABA-JL36L,G,制動装置,２０２０年２月,自動ブレーキが誤作動し、何もないところで急ブレーキがかかる。
113,2020年03月16日,茨城,ＨＰ,フォルクスワーゲン,ポロ,2012年05月,"71,396 Km",DBA-6RCBZ,CBZ,動力伝達,２０２０年１月２４日,ＤＳＧメカトロユニットの不具合により、メーターパネルに警告表示がされた。
114,2020年03月16日,栃木,ﾌﾘｰﾀﾞｲｱﾙ,ホンダ,Ｎ－ＢＯＸ,不明,不明,DBA-JF1,S07A,エンジン,不明,エンジンのチェーンカバーと、カムカバーに使用されているパッキン、および液体ガスケット部分からオイルがにじみだした。
115,2020年03月16日,岐阜,ＨＰ,フォルクスワーゲン,シャラン,2012年10月,"134,520 Km",DBA-7NCAV,CAV,動力伝達,２０２０年２月,一般道走行中にいきなりエンジンルームから突き上げるような振動があり、しばらく走っているとギアチェンジ時に異音がしエンストしそうになる。
116,2020年03月16日,京都,ﾌﾘｰﾀﾞｲｱﾙ,ＢＭＷ,Ｘ３,2019年06月,不明,LDA-TX20,B47D20A,エンジン,購入当初から,低速走行時、エンジンがしゃくる。車体が前に出るような感覚がある。
117,2020年03月16日,兵庫,ﾌﾘｰﾀﾞｲｱﾙ,ＢＭＷ,２２５ｘｅ,2017年03月,"11,300 Km",DLA-2L15,B38A15A-P160,車枠・車体,不明,電動リアゲートが意図していないところで勝手に開くことがあり、駐車しておいた車の後方にいた際に勝手に開き、車両後方のフェンスと車体に挟まれたことがある。
118,2020年03月15日,東京,ＨＰ,トヨタ,クラウン　アスリートＳ,2017年03月,"59,800 Km",DAA-AWS210,2AR-1KM,乗車装置,２０２０年３月５日,タクシー仕様の車で、出庫前点検の際に、自動ドアの開閉点検を行ったところ、ガラと音がしてその後動作が出来なくなった。ディーラーにて確認したところ、モーターから駆動を伝える鉄ステー（３、４ｍｍ厚）、ドアの開閉を伝えるロッドが、ちぎれ取れていた。
119,2020年03月15日,茨城,ＨＰ,マツダ,プレマシー,不明,不明,DBA-CREW,不明,乗車装置,２０２０年３月,ドアを開けドアを閉めるもドアノブが戻らず、ドアがロックされない。
120,2020年03月15日,京都,ＨＰ,スズキ,エブリイ,2017年12月,"17,000 Km",EBD-DA17V,R06A,エンジン,購入当初,冷却水が著しく減る。
121,2020年03月15日,福岡,ＨＰ,ニッサン,デイズ,2015年04月,"13,800 Km",DBA-B21W,3B20,保安灯火,冬の気温が低い日,冬の気温が低い日に運転席の窓を下げた後、上げようとしてパワーウインドウのスイッチを入れると、少し上に上がるが、ストンと下がりスイッチに指をかけたままでないと上がらないときがよくある。
122,2020年03月15日,熊本,ＨＰ,スバル,レヴォーグ,2016年04月,"50,000 Km",DBA-VM4,FB16,エンジン,２０２０年３月９日,突然何らかのセキュリティが作動し、エンジンが始動不能になった。
123,2020年03月15日,沖縄,ＨＰ,ダイハツ,ソニカ,2007年10月,"92,000 Km",CBA-L405S,KF,エンジン,不明,前回オイル交換後、３０００ｋｍ付近でカタカタ音が発生し、オイル漏れもないのにオイルレベルゲージにオイルがつかない。
124,2020年03月14日,北海道,ＨＰ,トヨタ,エスクァイア,2018年01月,"23,311 Km",DBA-ZRR85G,3ZR,制動装置,２０１９年７月,長く駐車した後に車を動かすと、ブレーキをひきづってる様なキーキーと異音がする。
125,2020年03月14日,神奈川,ＨＰ,ホンダ,ステップワゴン,2016年07月,"33,400 Km",DBA-RP3,L15B,乗車装置,２０１９年５月,リアゲートが開かなくなる。
126,2020年03月14日,茨城,ＨＰ,ホンダ,フィット,2012年06月,"77,778 Km",DBA-GE6,L13A,エンジン,２０２０年１月,エンジン起動時に異音がし、エンジンが起動しなくなった。
127,2020年03月14日,静岡,ＨＰ,ホンダ,シビック　ハッチバック,2018年11月,不明,DBA-FK7,L15C,エンジン,２０１９年１２月７日,下り坂での走行中、突然エンジンが止まり、各種操作が不能になった。
128,2020年03月14日,静岡,ＨＰ,ニッサン,ノート,2016年09月,"16,950 Km",DBA-E12,HR12,エンジン,２０１８年１１月、２０１９年１０月、２０,信号で停止しアイドリングストップして、ブレーキペダルから足を離すとエンジンがかかるが、アクセルペダルを踏むと警告灯などランプが全てつき、エンストする。
129,2020年03月14日,兵庫,ＨＰ,ニッサン,デイズルークス,2015年01月,"28,600 Km",DBA-B21A,3B20,保安灯火,２０２０年３月１４日,左の電動開閉ドアミラーが開閉しなくなり、モーターが空回りする。
130,2020年03月14日,徳島,ＨＰ,ニッサン,デイズ,2016年03月,"74,400 Km",DBA-B21W,3B20,保安灯火,２０２０年２月２３日,ドアの解錠施錠でドアミラーが開閉していたが、ドアミラーが動かなくなった。
131,2020年03月13日,北海道,ﾌﾘｰﾀﾞｲｱﾙ,ホンダ,インサイト,2019年09月,不明,6AA-ZE4,LEB-H4,その他,不明,前後のソナーに汚れがないのにも関わらず、「汚れています」というエラーが出て被害軽減ブレーキ等が使えなくなる。
132,2020年03月13日,北海道,ﾌﾘｰﾀﾞｲｱﾙ,ホンダ,インサイト,2019年09月,不明,6AA-ZE4,LEB-H4,保安灯火,２０１９年１１月,オートハイビーム搭載車で、前方にライトをつけている車両がいたり、明らかに周囲が明るい状態であるのにハイビームになり、周囲にパッシングをしているかのような状態になる。
133,2020年03月13日,京都,ﾌﾘｰﾀﾞｲｱﾙ,ＢＭＷアルピナ,Ｂ３　３．３,2000年07月,不明,GF-3E44,E44,電気装置,２０２０年２月２０日,ブレーキ倍力装置の負圧ポンプがショートし、過電流が流れたため、配線が過熱して、焼損するとともに原動機ＥＣＵ用ヒューズが飛び、エンジンが始動できなくなった。
134,2020年03月13日,兵庫,ＨＰ,シトロエン,Ｃ４ピカソ,2015年12月,"35,500 Km",ABA-B785G01,5G01,電気装置,２０１９年４月,走行中（主に右左折時）にメイン電源が瞬間停電を起こす。また、聞きなれないアラームが一時的に鳴る。
135,2020年03月13日,兵庫,ＨＰ,トヨタ,ハリアーハイブリッド,2005年10月,"257,618 Km",DAA-MHU38W,3MZ-1JM-2FM,制動装置,２００６年４月,ブレーキが効くときと効かない時がある。寒い日や車が暖まる前に多く発生するように感じる。完全に利かなくなるわけではないが、大きく低下する。
136,2020年03月13日,広島,ﾌﾘｰﾀﾞｲｱﾙ,スズキ,キャリイ,2018年06月,不明,EBD-DA16T,R06A,その他,購入半年くらいから,燃料を満タンに給油した後、燃料計の表示が増えない。ある程度使った後、燃料の残量表示が増えたり減ったりする。
137,2020年03月13日,山口,ﾌﾘｰﾀﾞｲｱﾙ,ホンダ,Ｎ－ＷＧＮ,2014年02月,"57,000 Km",DBA-JH1,S07A,エンジン,２０２０年,高速道路を１００ｋｍ／ｈくらいで走行中、突然４０ｋｍ／ｈくらいまで失速した。焦げ臭い異臭も発生していたが、ディーラーに相談しても、原因が特定されない。
138,2020年03月13日,不明,電話,スズキ,スウィッシュ,2019年04月,不明,2BJ-DV12B,不明,エンジン,２０１９年７月以降,信号待ち時、エンジン回転数が勝手に５０００ｒｐｍ以上まで上がり、急発進しそうになる（通常アイドル時１０００～１５００ｒｐｍ）。使用者が自らエンジン停止し、再始動すると一旦通常回転に戻るが、別日にまた発生する。
139,2020年03月13日,不明,電話,スズキ,スウィッシュ,2019年04月,不明,2BJ-DV12B,不明,走行装置,購入直後から,前輪のベアリングから異音が発生する。当初は運転手だけが気づくくらいの小さな音だったが、だんだん大きくなり、他車の運転手にも聞こえるレベルになった。
140,2020年03月12日,長野,ﾌﾘｰﾀﾞｲｱﾙ,マツダ,アクセラ,2017年04月,不明,LDA-BM2AS,SH,その他,不明,マツダコネクト搭載車で、カーナビのＧＰＳの精度が悪い。ルート案内時に表示が付いてこない。オーディオにＵＳＢを接続して利用する際、ＵＳＢ内の音楽データをフォルダ分けしていても、それが正しく表示されない。突然ブラックアウトする。
141,2020年03月12日,神奈川,ＨＰ,ニッサン,フェアレディＺ,2013年02月,"26,600 Km",CBA-Z34,VQ37,かじ取り,２０２０年３月,ステアリングロックの作動不良により、エンジン再始動時、キー警告が表示され、突然エンジンがかからなくなった。
142,2020年03月12日,埼玉,24時間電話,スズキ,アルト,2007年08月,"46,800 Km",DBA-HA24S,K6A,エンジン,不明,駐車場でエンジンが停止した。
143,2020年03月12日,埼玉,ＨＰ,ホンダ,ステップワゴン,2017年01月,"58,300 Km",DBA-RP4,L15B,車枠・車体,２０１９年夏頃,一定速度走行中、ロードノイズとは別にコツコツ・ゴツゴツとした小さな振動が発生する。
144,2020年03月12日,埼玉,ﾌﾘｰﾀﾞｲｱﾙ,ニッサン,セレナ,2013年05月,"78,000 Km",DAA-HFC26,MR20-SM23,車枠・車体,２０２０年１月～２月ごろから,天井と、Ａピラーの塗装が剥がれた。
145,2020年03月12日,鳥取,来訪,ダイハツ,ミライース,2013年06月,"62,000 Km",DBA-LA310S,KF,動力伝達,不明,リヤアクスルケースのデファレンシャルドレン部付近にある溶接箇所に巣ができており、そこからオイル漏れが発生している。ディーラーに話をするも保証対応等は出来ないと言われた。溶接不良による製品不良なのではないか。
146,2020年03月11日,宮城,ﾌﾘｰﾀﾞｲｱﾙ,いすゞ,エルフ,2009年10月,"85,000 Km",BDG-NPS85AN,4JJ1,排ｶﾞｽ･騒音,２年前,国２７５９のリコール対象外の形状であるキャブオーバ（車載車）仕様の車で、リコール届出内容と同じ排気ガス再循環装置（ＥＧＲクーラ）の蛇腹管に亀裂が入って排気ガス漏れした。
147,2020年03月11日,青森,ＨＰ,三菱,ｅＫスペースカスタム,2014年06月,"35,591 Km",DBA-B11A,3B20,動力伝達,２０２０年３月,フロントトランスファからガタつきが発生し、４ＷＤなのでリアデフまで振動が発生し、速度をあげて走ることが困難になる。
148,2020年03月11日,神奈川,ＨＰ,フォルクスワーゲン,アルテオン,2019年01月,不明,ABA-3HDJHF,DJH,その他,２０２０年２月２９日,ガソリンタンク内の燃料センサー取り付け不良により、燃料計が誤作動し、警告灯が点灯せずにガス欠したため、走行中いきなりエンジンストールした。
149,2020年03月11日,神奈川,ﾌﾘｰﾀﾞｲｱﾙ,トヨタ,ハイエース,2012年04月,"118,100 Km",LDF-KDH201V,1KD,車枠・車体,不明,ホワイトパール塗装の車で、ドアの縁部分の塗装が剥がれた。
150,2020年03月11日,栃木,ＨＰ,マツダ,ＣＸ－５,2016年06月,"15,000 Km",DBA-KE5FW,PY,保安灯火,２０１９年９月１４日,夜間走行時、アダプティブＬＥＤヘッドライトを作動させて走行すると、オレンジの警告灯が点灯して対向車が来てもハイビームのままで前車に追い付いても下向きにならずに前方を照らしている。
151,2020年03月11日,岐阜,ＨＰ,マツダ,デミオ,2015年08月,"39,300 Km",LDA-DJ5FS,S5,車枠・車体,購入時より,付属のトノカバーの末端処理が不適切なため、荷物の出し入れ時に手を切創する。
152,2020年03月11日,京都,来訪,ボルボ,Ｖ５０,2011年07月,"36,500 Km",CBA-MB4204S,B4204S,エンジン,２０２０年１月,ピストンリングの３層構造のうち１層が無い状態のため、エンジンオイルが異常消費し、エキゾーストバルブが破損した。
153,2020年03月11日,佐賀,ＨＰ,スバル,レガシィツーリングワゴン,2009年11月,"124,867 Km",DBA-BR9,EJ25,エンジン,２０２０年３月１０日,停車する際、強くブレーキペダルを踏むとエンジンが止まる。
154,2020年03月11日,不明,ﾌﾘｰﾀﾞｲｱﾙ,スバル,ＷＲＸ　Ｓ４,2016年04月,"20,000 Km",DBA-VAG,FA20,かじ取り,不明,ハンドルを左に切ると、異音（ギーギー）がする。
155,2020年03月10日,青森,ﾌﾘｰﾀﾞｲｱﾙ,ニッサン,リーフ,2014年03月,"48,500 Km",ZAA-AZE0,EM57,制動装置,２０２０年３月１０日,交差点で停車のため、前車に追従して減速をすべく、ブレーキペダルを踏んだところ、まったく減速感がなく、２度ほどグッと前に引っ張られるような感触がして車が止まらず、前車に追突した。
156,2020年03月10日,新潟,ＨＰ,ホンダ,Ｎ－ＢＯＸ,2012年03月,"168,800 Km",DBA-JF1,S07A,動力伝達,２０２０年２月,低速からアクセルペダルを踏むとエンジンが止まったり、アクセルが抜けた感じが起こる。またゴロゴロと音がする場合がある。
157,2020年03月10日,東京,ＨＰ,スバル,レヴォーグ,2014年06月,"34,800 Km",DBA-VMG,FA20,乗車装置,２０２０年３月、２０１８年１０月,駐車しておいた車で、車上荒らしなどの様子が無いのにも関わらず、突然警報音が鳴った。
158,2020年03月10日,東京,ﾌﾘｰﾀﾞｲｱﾙ,トヨタ,ハイエース,2013年05月,"88,200 Km",CBF-TRH200V,1TR,乗車装置,不明,助手席側ドアロックが、内側ノブを開ける操作をすると、ロックをしていても強制的にロックが解除され、ドアを開けることが出来てしまうため、助手席の乗員が子供であった場合等に、不意にドアを開けてしまうことが出来、危ない。
159,2020年03月10日,神奈川,ＨＰ,スバル,レガシィアウトバック,2014年10月,"33,000 Km",BDA-BRM,FB25,保安灯火,不明,自己の運転ミスによりブロック塀に衝突し横転した際、電動ウインドウが誤作動して開閉した。この時右腕が挟まれたが、挟み込み防止装置が作動せずに挟まれ、右ひじの骨折等の傷害を負った。
160,2020年03月10日,神奈川,ﾌﾘｰﾀﾞｲｱﾙ,ニッサン,セレナ,2011年07月,不明,DBA-FC26,MR20,エンジン,不明,燃料系統圧力系統の不良により、エンジンチェックランプが点灯する。
161,2020年03月10日,千葉,ﾌﾘｰﾀﾞｲｱﾙ,ホンダ,ステップワゴン,2016年03月,"8,200 Km",DBA-RP1,L15B,乗車装置,不明,コンピューターの不良により、リヤゲートのロックが開いたり開かなかったりする。
162,2020年03月10日,埼玉,ﾌﾘｰﾀﾞｲｱﾙ,マツダ,ＣＸ－８,2019年12月,不明,5BA-KG5P,PY,電気装置,不明,フロントボディコントロールモジュールの基盤が漏電したため、バッテリーがダウンした。
163,2020年03月10日,茨城,ＨＰ,三菱,ふそうキャンター,2014年03月,"319,000 Km",TKG-FEB50,4P10,エンジン,２０１９年５月,コモンレール・サプライポンプの不良により、高速道路走行中にエンジンストールし、警告灯やブザーは鳴らない。
164,2020年03月10日,静岡,ＨＰ,ホンダ,Ｎ－ＢＯＸ,2018年06月,不明,DBA-JF3,S07B,制動装置,２０２０年３月８日,駐車場で発進しようとしてエンジンをかけたら、ブレーキ・ＣＭＢＳ・ＡＣＣ・ＬＫＡＳの警告灯が点灯した。インフォメーションディスプレーにも同点検を促す表示が繰り返し表示され、エンジンをかけ直しても警告が消えない。
165,2020年03月10日,大阪,ﾌﾘｰﾀﾞｲｱﾙ,スズキ,エスクード,2009年02月,"61,000 Km",CBA-TDA4W,J24B,制動装置,７年目の車検後から,ＡＢＳアクチュエーターの不良により、横滑りの警告が点灯するようになった。
