番号,受付日,住所,申告方法,車名,通称名,初度登録年月,総走行距離,型式,原動機型式,不具合装置,発生時期,申告内容の要約
178,2020年08月18日,愛知,ＨＰ,ニッサン,ルークス,2012年02月,"40,244 Km",DBA-ML21S,K6A,かじ取り,２０２０年８月１８日,ステアリングロックの不良により、出先で突然エンジンが始動しなくなった。
179,2020年08月18日,大阪,ＨＰ,トヨタ,ヴォクシー,2014年05月,"57,099 Km",DBA-ZRR80G,3ZR,電気装置,２０２０年７月１６日,ネットワークゲートウェイコンピュータの不良により、早期にバッテリーがあがる。
180,2020年08月18日,京都,ＨＰ,スバル,ステラ,2007年12月,"58,313 Km",DBA-RN1,EN07,動力伝達,不明,リコール対策後に走行８０００ｋｍ使用したところで、ＣＶＴオイルポンプの不良によりエンジンチェックランプが点灯した。
181,2020年08月18日,兵庫,ＨＰ,スバル,レガシィツーリングワゴン,2012年08月,"84,231 Km",DBA-BRM,FB25,保安灯火,２０１８年,右後部及び右前部のパワーウインドウが全く動かなくなった。
182,2020年08月18日,兵庫,ＨＰ,ニッサン,エルグランド,2012年05月,"78,610 Km",DBA-TNE52,QR25,動力伝達,２０２０年８月７日　１７：４０頃,ＣＶＴの不具合により、走行中にアクセルペダルを踏んでも前進しなくなった。
183,2020年08月18日,福岡,ＨＰ,マツダ,ＣＸ－３,2015年04月,"82,000 Km",LDA-DK5FW,S5,電気装置,２０２０年８月１６日,一般道走行中に、右前付近にてパタパタ音がなり、直ぐに停車して確認すると、オルタネーターのプーリーが落ちかけ、ベルトが破断していた。
184,2020年08月18日,福岡,ＨＰ,ホンダ,フィット,2020年05月,944 Km,6BA-GR1,L13B,制動装置,２０２０年６月２５日,ブレーキペダルを踏むとギー・ギーと連続した異音が発生した。
185,2020年08月18日,福岡,ＨＰ,ホンダ,フィット,2020年05月,944 Km,6BA-GR1,L13B,車枠・車体,２０２０年６月２４日,下り坂で突然ゴーという音が発生した。
186,2020年08月18日,長崎,ﾌﾘｰﾀﾞｲｱﾙ,ニッサン,エルグランド,2011年05月,"60,000 Km",DBA-TE52,QR25,かじ取り,２０２０年８月１３日,パワーステアリングの不具合により、車に乗ろうとした際にハンドルが重たくなっていた。確認したところ、オイルが漏れていた。
187,2020年08月18日,宮崎,ＨＰ,ニッサン,セレナ,2016年03月,"33,300 Km",DAA-HFC26,MR20-SM23,乗車装置,２０２０年８月１７日、１９：４０,エンジンを始動したまま、集中ロックをかけた後、運転席以外のドアよりロックして車外へ出た際、車外からキーレスの電波、およびメカニカルキー共に施錠・解錠が不可になる。
188,2020年08月17日,岩手,ﾌﾘｰﾀﾞｲｱﾙ,三菱,ふそうスーパーグレート,2017年05月,"650,000 Km",QPG-FU65VZ,6R10,エンジン,不明,樹脂製のエンジンオイルパンに亀裂が生じ、エンジンオイルが漏れた。
189,2020年08月17日,岩手,ﾌﾘｰﾀﾞｲｱﾙ,三菱,ふそうスーパーグレート,2017年05月,"600,000 Km",QPG-FU65VZ,6R10,エンジン,不明,インジェクターの不良により、エンジンチェックランプ、排気ガスチェックランプが点灯して出力が低下するため、坂道で４０ｋｍ／ｈ程度しか出なくなる。
190,2020年08月17日,秋田,電話,ニッサン,デイズルークス,2015年02月,"10,000 Km",DBA-B21A,3B20,エンジン,２０２０年８月,スタートボタンを押してもエンジンがかからない。
191,2020年08月17日,東京,ＨＰ,テスラ,モデルＳ,2015年03月,"86,000 Km",ZAA-SL1S,L1S,その他,２０２０年８月６日,センターモニターが表示しなくなった。
192,2020年08月17日,東京,ＨＰ,ＢＭＷ,Ｘ５,2013年03月,"101,000 Km",DBA-ZV30S,N55B30A,エンジン,２０２０年７月,一般道路で信号待ちの際に、突然、車のモニターに「エンジン出力異常」と警告が表示されてエンジンがストップした。その後、エンジンを掛けるが全く反応しなくなった。
193,2020年08月17日,東京,ﾌﾘｰﾀﾞｲｱﾙ,ホンダ,フィット,不明,不明,DBA-GK3,L13B,エンジン,半年くらい前,走行中に異常な振動が発生する。バッテリーや、点火プラグなどを交換すると、一時的に解消するが、しばらくすると再発する。
194,2020年08月17日,東京,ﾌﾘｰﾀﾞｲｱﾙ,トヨタ,クラウンハイブリッド,2013年10月,"360,000 Km",DAA-AWS210,2AR-1KM,制動装置,不明,一般道を走行中、警告音とブレーキ異常の警告表示が出るとともに、ブレーキペダルが踏み抜けるような状態になった。
195,2020年08月17日,神奈川,ＨＰ,スズキ,スイフト,2007年06月,"81,374 Km",CBA-ZC31S,M16A,制動装置,２０２０年８月７日,エンジン始動時にＥＳＰ警告灯が点灯し、ＡＢＳ及び横滑り防止機能が停止した。
196,2020年08月17日,千葉,ﾌﾘｰﾀﾞｲｱﾙ,ダイハツ,ミライース,2015年08月,"24,400 Km",DBA-LA300S,KF,乗車装置,２０２０年８月１４日,交差点で、右折車両に追突し、自車両が大きくくの字型に損傷するほどの破損をしたが、この際にエアバッグが開かなかった。
197,2020年08月17日,埼玉,ＨＰ,スバル,レガシィツーリングワゴン,2014年06月,"51,000 Km",DBA-BRM,FB25,制動装置,２０２０年６月頃より,エンジン始動時、ブレーキペダルが重く、かなり力を入れないと踏み込めない。
198,2020年08月17日,埼玉,ＨＰ,ニッサン,セレナ,2010年08月,"52,500 Km",DBA-CC25,MR20,エンジン,２０１９年１０月頃,走行時、段差などでゴトゴト音がするようになり、少しずつ音の出る頻度が多くなってきた。また、アイドリング時のエンジン振動が大きくなってきており、Ｄレンジにおいて顕著に症状が現れる。
199,2020年08月17日,茨城,ＨＰ,三菱,ふそうキャンター,2016年10月,"279,000 Km",TPG-FEB50,4P10,動力伝達,２０２０年８月１４日,配送途中、突然Ｔ／Ｍ　ＳＹＳの警告灯が点灯してシフトできなくなり、走行出来なくなった。
200,2020年08月17日,大阪,ﾌﾘｰﾀﾞｲｱﾙ,マツダ,ＭＡＺＤＡ３,不明,不明,6BA-BP5P,P5,その他,不明,アクティブドライビングディスプレイ搭載車で、ディスプレイに西日が当たると、鏡のように反射して眩しい。
201,2020年08月17日,京都,ＨＰ,ＢＭＷ,３２０ｄ　ツーリング,2015年11月,"20,000 Km",LDA-3D20,N47D20C,エンジン,２０２０年８月１４日,下り坂でフットブレーキで停車中に突然エンジン回転数が上がり、前車に追突した。
202,2020年08月17日,山口,ﾌﾘｰﾀﾞｲｱﾙ,ダイハツ,ムーヴ,不明,"146,200 Km",GF-L900S,EF,エンジン,不明,セルモーターから発煙した。
203,2020年08月16日,東京,ＨＰ,メルセデス・ベンツ,Ｖ２２０ｄ,2016年12月,"45,000 Km",LDA-447811,651,車枠・車体,購入後３０ヶ月,外装パネル接合部の塗装が剥離した。
204,2020年08月16日,神奈川,ＨＰ,フォルクスワーゲン,ゴルフ,2009年09月,"53,658 Km",ABA-1KCAV,CAV,動力伝達,２０２０年８月１１日,一般道路走行中に、メーターパネルに（ｔｒａｎｓｍｉｓｓｉｏｎ　ｏｖｅｒｈｅａｔｅｄ）の異常表示が出た。警告音も出たため、路肩に停車したところ、走行不能となった。
205,2020年08月16日,静岡,ＨＰ,トヨタ,カローラツーリング,2020年06月,"1,140 Km",3BA-ZRE212W,2ZR,乗車装置,２０２０年８月１５日（納車１ケ月半ほど）,スマートキーを使用してドアロックを解除し、助手席側ドアを開けようとしたが、ドアが開かなくなっていた。ドアロックは、見た目では解除されているが、運転席ドアを開けて内側から開けようとドアハンドルを引いても開かない。
206,2020年08月16日,静岡,ＨＰ,ニッサン,セレナ,2012年08月,"61,814 Km",DAA-HFC26,MR20-SM23,電気装置,２０２０年８月１２日,一般道を走行中にエンジンルーム内からガラガラと異音が一瞬鳴った。その後、音が消えたため、走行を継続したところ、車両停止時にエンジンが停止し、再始動して走行を再開したところ、ブレーキ、バッテリーの警告が点灯し、アイドリングストップボタンが点滅したため、停車場所を探しつつ走行を続けたところ、エンジンがオーバーヒートし、挙動がおかしくなった。
207,2020年08月16日,兵庫,ＨＰ,ダイハツ,タント,2019年04月,不明,DBA-LA600S,KF,制動装置,２０２０年８月１６日１３時頃,何もないところでピピピピピと音がなって、いきなり自動ブレーキがかかった。
208,2020年08月16日,滋賀,ＨＰ,スバル,レガシィＢ４,2007年03月,"80,500 Km",CBA-BL5,EJ20,排ｶﾞｽ･騒音,２０２０年６月上旬,朝エンジンを始動するとエンジン警告灯が点灯し、確認のためボンネットを開けたところ、２次エアポンプ部より発煙・異臭が発生した。
209,2020年08月16日,福岡,ＨＰ,ニッサン,デイズルークス,2016年11月,"37,900 Km",DBA-B21A,3B20,保安灯火,２０２０年８月１６日１０時ごろ,キーロックを解除したら、助手席側のサイドミラーが音だけ鳴って開かない。角度調節ボタンを押しても動かない。
210,2020年08月15日,青森,ﾌﾘｰﾀﾞｲｱﾙ,アウディ,Ａ４,2019年02月,"86,155 Km",ABA-8KCDNF,CDN,保安灯火,２０２０年８月５日,走行中に右サイドミラーのガラス鏡面部分が剥がれ落ちた。
211,2020年08月15日,茨城,ＨＰ,スバル,アウトバック,2008年06月,"147,000 Km",CBA-BPH,EJ25,動力伝達,２０２０年８月１５日,発進後の１速→２速の変速時に後ろから押されるような衝撃をうける。ＡＴＦの温度警告、ＡＢＳとＶＤＣの警告灯が表示される。
212,2020年08月15日,愛知,ＨＰ,フォルクスワーゲン,ザ・ビートル,2015年06月,"57,725 Km",ABA-16CPL,CPL,保安灯火,２０２０年８月１４日,走行中にドアミラーのガラスだけが外れて落下し、割れた。
213,2020年08月15日,愛知,ＨＰ,フォルクスワーゲン,ザ・ビートル,2015年06月,"56,689 Km",ABA-16CPL,CPL,車枠・車体,２０２０年７月１８日,フューエルリッドのふたのロック／アンロックをするアクチュエーター内部のモーターのブラシが磨耗して通電不良を起こしたため、フューエルリッドが開かなくなった。
214,2020年08月15日,大阪,ＨＰ,マツダ,ＭＡＺＤＡ２,2020年01月,"3,236 Km",6BA-DJLFS,P5,エンジン,２０２０年７月２５日（土）　９：３０頃,国道を走行中に突然警告灯が点灯し、アクセルの反動が無くなり、惰性で路肩に流れ着いた。
215,2020年08月14日,北海道,ﾌﾘｰﾀﾞｲｱﾙ,スズキ,パレット,2011年10月,"41,500 Km",DBA-MK21S,K6A,エンジン,春頃、２０２０年８月１４日,降りようとしたところ、鍵マークの警告灯が点いた。その後、乗ろうとしたところ、ハンドルロックがかかっていない様子で、始動できなくなった。２回目は、買い物に車を使おうとしたが、始動出来なくなった。
216,2020年08月14日,宮城,ＨＰ,ニッサン,スカイライン,2020年02月,"12,000 Km",5BA-RV37,VR30,動力伝達,２０２０年８月,Ｄレンジで２５～３０ｋｍ／ｈの低速走行時、突然オートマのギヤが１～２秒の間に１～３速の間をシフトアップ、ダウンを繰り返したようになり、大きな音と振動で車体がガクガク揺れた。
217,2020年08月14日,東京,ＨＰ,テスラ,モデルＳ,2014年12月,"72,000 Km",ZAA-SL1S,L1S,その他,２０１９年１月、２月～,ＭＣＵ（メディアコントロールユニット）が走行中に突然ブラックアウトして、タッチパネルから操作する全ての機能が消失した。ＭＣＵブラックアウト時は車の走行自体は可能だが、タッチパネルから操作する走行用ライトのコントロール、エアコン、クルーズコントロール、音楽再生などは操作できなくなる。また時としてタッチパネルが不応答で、始動時のピンコードが入力できずに、車をスタートできない事態となったこともある。
218,2020年08月14日,東京,ﾌﾘｰﾀﾞｲｱﾙ,トヨタ,プリウスα,2014年07月,"104,400 Km",DAA-ZVW41W,2ZR-5JM,動力伝達,２０２０年７月１５日,駐車場に後退して入庫しようとした際、２／３ほど入ったところでエンジン音がブアーと大きくなって急加速をした。ブレーキペダルを踏んだが、車は後退し続け、輪留めを乗り越えて塀に当たって止まった。
219,2020年08月14日,埼玉,ＨＰ,ホンダ,ＪＡＤＥハイブリッド,2015年02月,"38,093 Km",DAA-FR4,LEB-H1,動力伝達,２０２０年８月１４日,発進直後に動力伝達が途切れ途切れになり、エンジンが空ぶかしになる。
220,2020年08月14日,埼玉,ＨＰ,テスラ,モデルＳ,2015年05月,"70,197 Km",ZAA-SL1S,L1S,その他,２０２０年８月８日,リモートからの操作ができなくなったのでソフトリセットをかけたところ、メインディスプレイが消灯し、一切操作を受け付けなくなった。速度計の表示がマイル計算になった。
221,2020年08月14日,茨城,ＨＰ,スバル,エクシーガＧＴ,2008年09月,"72,700 Km",CBA-YA5,EJ20,動力伝達,２０２０年８月１４日,自動変速機の不良により、２～３速にシフトアップするときに動力が抜け、エンジン回転数がいきなり上昇し、その後急激にクラッチが繋がるため、ガツンと衝撃とともに変速する。
222,2020年08月14日,福岡,ＨＰ,ＢＭＷ,１１６ｉ,2014年03月,"25,600 Km",DBA-1A16,N13B16A,動力伝達,２０２０年８月,走行中、突然、後輪に動力が伝わらなくなり、車が遅くなった。
223,2020年08月13日,東京,ＨＰ,メルセデス・ベンツ,ＧＬＡ２５０,2014年10月,"35,000 Km",DBA-156946,270M20,電気装置,２０１０年８月１０日,リアホイールのスピードセンサー不良により、走行中、突然警告ランプが全て点灯し、ブレーキ不調、４ＷＤ機能停止、パワーステアリング機能停止、アクセル不調になった。
224,2020年08月13日,東京,ﾌﾘｰﾀﾞｲｱﾙ,ホンダ,ＣＢＲ１０００ＲＲ,2010年03月,"13,100 Km",EBL-SC59,SC59E,燃料装置,不明,プライマリーインジェクターのフューエルレールと、４番インジェクターのつなぎ目がぶかぶかで、燃料が滲み出している。燃圧も抜けている様子があり、低速、高速を問わず加速不良を起こす。
225,2020年08月13日,茨城,ＨＰ,三菱,ふそうキャンター,2015年11月,"296,846 Km",TKG-FEB50,4P10,電気装置,２０２０年８月１２日,バッテリー警告点灯し、エアコン・冷凍機共に効かなくなった。キャビンを上げてみたところ、オルタネーターのフランジが落ちてなくなっていた。ファンベルト・冷凍機ベルトも無かった。
226,2020年08月13日,群馬,ＨＰ,プジョー,３０８,2017年01月,"56,000 Km",ABA-T9HN02,HN02,排ｶﾞｽ･騒音,２０２０年１月頃より現在,ガソリンタンクの燃料が６割以上の残量がある状態で、峠道にて０．３Ｇ程度の横Ｇをかけると、走行後の駐車中にアイドリング不調が発生する。アイドリングが低下してアクセルペダルを踏まないと振動と共に回転数が低下してエンストする。
227,2020年08月13日,栃木,ＨＰ,ニッサン,ノート,2012年07月,"53,000 Km",DBA-E11,HR15,その他,２０２０年８月１２日　ＡＭ１０：２０,エアコンのブロアファンが回らなくなった。
228,2020年08月13日,大阪,ＨＰ,ニッサン,リーフ,2020年05月,"1,626 Km",ZAA-ZE1,EM57,電動機(モーター),夏場は頻繁,駆動用バッテリーの温度が簡単に上がり急速充電を３回（８時間で」しただけでバッテリーの温度計がレッドゾーンに入り３０分の充電で３０％も充電できなくなる。
229,2020年08月13日,沖縄,ＨＰ,ホンダ,ステップワゴン,2006年09月,"191,903 Km",DBA-RG1,K20A,燃料装置,２０２０年８月,エンジンを始動すると燃料ポンプ上部のひび割れから燃料が吹き出す。
230,2020年08月13日,沖縄,ＨＰ,アウディ,Ａ５,2010年08月,"72,000 Km",ABA-8TCDNF,CDN,エンジン,２０２０年６月中古で購入後すでに症状あり,３００ｋｍの走行で１リットルのオイルを消費する。マフラーから黒い液体が噴き出す。
231,2020年08月12日,山形,ＨＰ,トヨタ,プリウス,2016年02月,"45,000 Km",DAA-ZVW55,2ZR-1NM-1MM,電気装置,２０２０年８月１１日,点火プラグの不良により、高速道路を走行中に振動が発生し、エンジン警告灯が点灯した。
232,2020年08月12日,東京,ＨＰ,ニッサン,セレナ,2015年09月,"60,000 Km",DAA-HC26,MR20-SM23,動力伝達,２０２０年８月１１日,ＣＶＴの不良により、走行中にノッキング現象が起き、低速・高速と速度調整が不可能になった。アクセルペダルを何度も踏んだり、エンジンかけなおしたりして、どうにかこうにか低速だが動くレベルであり、ニュートラルの時にアクセルペダル踏んだような音が鳴ってるだけでちっとも走れない。
233,2020年08月12日,神奈川,ﾌﾘｰﾀﾞｲｱﾙ,ニッサン,キャラバン,2013年10月,"157,156 Km",LDF-VW2E26,YD25,エンジン,不明,ターボチャージャーの不具合により、異音がし、その後加速しなくなった。
234,2020年08月12日,千葉,ﾌﾘｰﾀﾞｲｱﾙ,ニッサン,セレナ,2014年07月,"86,000 Km",DAA-HC26,MR20-SM23,動力伝達,２０２０年６月,ＣＶＴの不具合により、１速固定のような状態になり、加速できなくなり、車体が揺れた。
235,2020年08月12日,山梨,ＨＰ,スバル,レヴォーグ,2015年03月,"54,714 Km",DBA-VM4,FB16,エンジン,２０２０年５月,走行中に全ての警告灯が点灯するとともにエンジンが停止し、惰性で路肩に流れ着いた。
236,2020年08月12日,愛知,ＨＰ,ニッサン,セレナ,2013年07月,"91,100 Km",DAA-HFC26,MR20-SM23,動力伝達,２０１６年頃,ＣＶＴの不良により、信号待ちなどからの発進時でゆっくり加速する際、２０～４０ｋｍ／ｈ程度の時に、車体が揺れるほどの強い振動が発生する。
237,2020年08月12日,愛知,ＨＰ,スズキ,スイフトスポーツ,2018年06月,"55,600 Km",CBA-ZC33S,K14C,かじ取り,２０２０年８月,純正ステアリング右側の皮が縮んで破れた。
238,2020年08月12日,愛知,ＨＰ,ニッサン,セレナ,2013年07月,"91,100 Km",DAA-HFC26,MR20-SM23,かじ取り,２０２０年,ステアリングラックの不良により、駐車場などで左にハンドルを切りながらゆっくり前・後進するとハンドルに「ガクガク」と振動が発生する。
239,2020年08月12日,静岡,ﾌﾘｰﾀﾞｲｱﾙ,トヨタ,クラウン,1993年10月,"150,000 Km",E-JZS141,1JZ,エンジン,不明,エンジンの回転にむらがあり、３０ｋｍ／ｈくらいしか出なくなった。ボンネットの蓋が揺れていた。
240,2020年08月12日,岐阜,ＨＰ,ニッサンUK( 生産国： 英国),マイクラＣ＋Ｃ,2010年03月,"47,000 Km",ABA-FHZK12,HR16,燃料装置,２０１９年９月ごろ,燃料タンク側の燃料ポンプと燃料パイプの接続部分からガソリンが漏れ、車内がガソリン臭くなった。
241,2020年08月12日,三重,電話,スズキ,パレット,2012年01月,"54,200 Km",DBA-MK21S,K6A,エンジン,最近,エアコンのコンプレッサーのリコールがでており、対策を行っているのにエアコンのコンプレッサーが壊れた。
242,2020年08月11日,北海道,ＨＰ,マツダ,ＣＸ－３,2016年01月,"45,000 Km",LDA-DK5AW,S5,排ｶﾞｽ･騒音,２０１７年夏位から夏季限定,夏（暑い時期）になるとＤＰＦ再生間隔が極端に短くなる。
243,2020年08月11日,北海道,ﾌﾘｰﾀﾞｲｱﾙ,トヨタ,クラウン,2004年09月,"150,000 Km",DBA-GRS181,4GR,かじ取り,２０２０年８月,高速道路を走行中に突然電動パワーステアリングが故障したため、ハンドルがロック状態になった。
244,2020年08月11日,東京,ﾌﾘｰﾀﾞｲｱﾙ,アウディ,Ｑ３,2015年04月,"8,000 Km",ABA-8UCHP,CHP,エンジン,不明,ターボチャージャーのフラップが固着したため、エンジン警告灯が点灯した。
245,2020年08月11日,神奈川,電話,フォルクスワーゲン,ポロ,2013年06月,不明,ABA-6RCTH,CTH,動力伝達,不明,ＤＳＧの不具合により、信号からの発進時にアクセルペダルを踏んでも車が進まない。停車時にエンストをしている様子であり、エンジンを再始動して走行を再開した。
246,2020年08月11日,茨城,ＨＰ,アルファロメオ,ジュリエッタ,2015年07月,"44,478 Km",ABA-940181,940B2,乗車装置,２０２０年７月,自宅に帰宅して車庫に入れ、降りようとドアノブを引いたところ、ドアノブが根元から破損した。
247,2020年08月11日,群馬,ﾌﾘｰﾀﾞｲｱﾙ,ダイハツ,ムーヴ,2016年02月,"39,000 Km",DBA-LA150S,KF,エンジン,２０２０年,ウォーターポンプの不良により、エンジン始動時にガラガラと異音が出るようになった。
248,2020年08月11日,静岡,ﾌﾘｰﾀﾞｲｱﾙ,ニッサン,セレナ,2015年01月,"73,600 Km",DAA-HFC26,MR20-SM23,動力伝達,２０２０年７月,ＣＶＴの不良により、走行中にノッキングやエンジン回転の異常な上下動が発生するようになり、その後ベルトが切れて走行不能になった。
249,2020年08月11日,大阪,ﾌﾘｰﾀﾞｲｱﾙ,トヨタ,Ｃ－ＨＲ,不明,不明,不明,不明,電動機(モーター),２０２０年７月２３日,ハイブリッドバッテリーのコンピューターが熱で不具合を起こしたため、突然前後に動かなくなった。
250,2020年08月11日,大阪,ﾌﾘｰﾀﾞｲｱﾙ,ＢＭＷ,４２０ｉグランクーペ,2019年06月,不明,DBA-4D20,B48B20A,車枠・車体,２０１９年１１月１３日,機械式駐車場の中でリアゲート（ハッチバック）が勝手に開き、駐車場が回ったときに中でハッチバックが引っ掛かって、車も駐車場も大破した。
251,2020年08月11日,兵庫,ＨＰ,トヨタ,クラウン,2004年01月,"11,000 Km",UA-GRS180,4GR,乗車装置,２０２０年８月１０日,外出先で車内にスマートキーを置いたまま外に出て、車の横にいたところ、ピッと音がしてドアが自動でロックされた。携帯電話も財布もすべて室内にあり、為す術がなくなった。
252,2020年08月10日,埼玉,ＨＰ,その他,ウエッズ　レオニスナヴィア０２,不明,不明,33850,不明,装置その他,２０２０年１月,前輪に装着したホイール５穴のうち２穴のナットが走行中に外れて落ちた。その後も定期的に確認しているが、定期的に緩みが生じる。
253,2020年08月10日,広島,ＨＰ,ＢＭＷ,ミニ　クラブマン,2015年10月,"32,449 Km",DBA-LN15,B38A15A,保安灯火,不明,車両に乗りキーをオンしたときに、ウォッシャー液があるのにウォッシャー警告が出る。
254,2020年08月10日,広島,ＨＰ,ＢＭＷ,ミニ　クラブマン,2015年10月,"32,449 Km",DBA-LN15,B38A15A,動力伝達,２０２０年７月,シフトメカニズムのパーキング検知不良により、車両を停止し、シフトレバーをパーキングに入れたとき、「車両動き出し注意」という警告がメーターパネルに出た。
255,2020年08月10日,福岡,ＨＰ,トヨタ,アルファード,2010年11月,"130,823 Km",DBA-ANH20W,2AZ,車枠・車体,２０２０年６月,屋根の塗装の一部が自然に剥がれ落ち、鉄の部分が完全に露出してしまった。
256,2020年08月10日,佐賀,ＨＰ,スズキ,ワゴンＲ,2011年09月,"69,558 Km",DBA-MH23S,K6A,かじ取り,２０２０年８月６日,ステアリングロックの不良により、イモビライザー警告灯が点灯してエンジンがかからなくなった。
