番号,受付日,住所,申告方法,車名,通称名,初度登録年月,総走行距離,型式,原動機型式,不具合装置,発生時期,申告内容の要約
257,2020年08月09日,東京,ＨＰ,スバル,フォレスター,2015年02月,"109,507 Km",DBA-SJ5,FB20,電気装置,２０２０年０７月３１日,トランスファソレノイドコントロールバルブの不良により、ＡＴオイルランプ点滅、ＡＢＳオフ、トラコンオフ、自動ブレーキオフ、ヒルブレーキコントロールオフ、販売店で点検が必要との表示が出た。
258,2020年08月09日,栃木,ＨＰ,マツダ,ＣＸ－５,2012年07月,"139,500 Km",LDA-KE2FW,SH,エンジン,２０２０年７月２８日,エンジンのオイルポンプチェーンが切れて走行不能となった。
259,2020年08月09日,愛知,ＨＰ,ホンダ,Ｎ－ＢＯＸ,2018年08月,不明,DBA-JF3,S07B,動力伝達,走行中,走行中に突然警告灯が全点灯し、アクセルペダルを踏んでも速度が出なくなった。
260,2020年08月09日,静岡,ＨＰ,ニッサン,セレナ,2011年06月,"141,000 Km",DBA-FC26,MR20,動力伝達,中古購入後すぐ,エンジン始動直後は通常の加速するが、エンジン、ミッションが暖まるとアクセルペダルを踏んでもスタート加速しない。アクセルペダルを踏み直せばジワジワと加速を始める。
261,2020年08月09日,岐阜,ＨＰ,ニッサン,ティーダ,2009年06月,"110,000 Km",DBA-C11,HR15,エンジン,２０２０年８月７日,スロットルチャンバーの不具合により、信号停止から左折方向に発進して若干の登り坂でアクセルペダルを踏み込んだところ、エンジンがストールしてエンジン回転数が上がらず、１５ｋｍ程度でしか走行できなくなった。
262,2020年08月08日,岩手,ＨＰ,フォルクスワーゲン,ゴルフヴァリアント　ＴＳＩ,2008年09月,"108,406 Km",ABA-1KBLG,BLG,エンジン,２０２０年購入以前からで不明,信号待ちで停止後の発進時にジャダーが発生し、エンジンストールした。
263,2020年08月08日,東京,ＨＰ,ホンダ,フィットハイブリッド,不明,"102,000 Km",DAA-GP1,不明,電動機(モーター),２０２０年２月ぐらい,ハイブリッドバッテリー冷却ファンの不具合により、オレンジの「ＩＭＡシステム点検」が表示された。
264,2020年08月08日,神奈川,ＨＰ,メルセデス・ベンツ,Ｃ２００,2014年06月,"8,375 Km",DBA-204048,271,電気装置,２０２０年８月３日,スピードセンサーの不具合により、自動車専用道路を走行中、突然ＡＢＳやＥＰＳ、ＢＡＳなどが作動しなくなった。
265,2020年08月08日,神奈川,ＨＰ,ヤマハ,ツーリングセロー,不明,不明,DG31J,不明,かじ取り,２０２０年７月,９０ｋｍ／ｈ以上の高速走行でヨーイング、ウォブル現象が発生する。
266,2020年08月08日,神奈川,ＨＰ,トヨタ,ノア,2017年01月,"65,000 Km",DBA-ZRR80W,3ZR,エンジン,２年程前から,燃費が非常に悪い。アイドリング不調。ノッキングする。
267,2020年08月08日,静岡,ＨＰ,ニッサン,デイズルークス,2014年11月,"36,000 Km",DBA-B21A,3B20,保安灯火,２０２０年８月８日,運転終了後、左ドアミラーが格納しなくなった。
268,2020年08月08日,三重,ＨＰ,メルセデス・ベンツ,ＡＭＧ　Ｃ４３,2019年03月,"7,000 Km",CBA-205064,276M3,その他,不明,ナビゲーション画面が突然真っ暗になり、操作不能になる。
269,2020年08月08日,京都,ＨＰ,スズキ,スイフト,2019年09月,"13,840 Km",DAA-ZC43S,K12C-PB05A,動力伝達,２０２０年８月３日,ＡＧＳトランスミッションのオイル漏れにより、ギアがニュートラルになり、走行不能になった。
270,2020年08月08日,兵庫,ＨＰ,ボルボ,Ｖ７０,2013年02月,"75,000 Km",DBA-BB4164TW,B4164T,動力伝達,２０２０年３月以降,変速機の不良により、発進時にギア抜けして立ち往生した。ミッションセノウテイカの警告表示が出ていた。
271,2020年08月08日,滋賀,ＨＰ,ニッサン,セレナ,2015年02月,"130,000 Km",DAA-HFC26,MR20-SM23,車枠・車体,２０２０年８月１日,カラーナンバーＱＡＢのホワイトパール塗装の車で、スライドドア上部の塗装が剥がれた。
272,2020年08月08日,福岡,ＨＰ,ホンダ,ステップワゴン,2013年08月,"41,400 Km",DBA-RK5,R20A,乗車装置,２０２０年７月,リヤスライドドアラッチの故障により、ドアハンドルを引いてもスライドドアが開かない。
273,2020年08月07日,神奈川,ﾌﾘｰﾀﾞｲｱﾙ,ニッサン,セレナ,2013年02月,"25,000 Km",DAA-HC26,MR20-SM23,車枠・車体,不明,天井・Ａピラー・ボンネットなどの塗装がパラパラ剥がれる。
274,2020年08月07日,茨城,ＨＰ,ニッサン,エルグランド,2010年09月,"82,738 Km",DBA-PE52,VQ35,かじ取り,２０２０年６月,パワーステアリングポンプからのパワーステアリングフルード漏れにより、交差点で左折中にステアリングが重たくなり、対向車線に向かってしまったため、急停車した。警告表示は無かった。
275,2020年08月07日,愛知,ﾌﾘｰﾀﾞｲｱﾙ,ニッサン,セレナ,2013年02月,"89,200 Km",DAA-HFC26,MR20-SM23,動力伝達,不明,ＣＶＴの不具合により、高速道路を走行中に突然走行不能になった。
276,2020年08月07日,大阪,ＨＰ,メルセデス・ベンツ,ＣＬＡ２２０　４ＭＡＴＩＣ,2018年11月,"5,710 Km",DBA-117347,270M20,車枠・車体,製造時,エアコンハウジングに親指大の穴が開いていたため、車内に水が貯留し、車両本体の劣化および浸水部品の腐食が生じた。
277,2020年08月07日,兵庫,ＨＰ,ニッサン,ノートメダリスト,2013年08月,"76,500 Km",DBA-E12,HR12,車枠・車体,２０２０年５月,駐車中ボンネット内部より炎が発生し、車両が全焼した。
278,2020年08月07日,鳥取,ＨＰ,ニッサン,エルグランド,2011年02月,"62,000 Km",DBA-TNE52,QR25,かじ取り,２０２０年７月,駐車場から発進しようとしたらハンドルが重く感じ、その後、走行中にパワーステアリングが全く効かなくなった。駐車していた場所を確認したところ、パワーステアリングオイルと思われるオイルが大量に漏れていた。
279,2020年08月07日,高知,ﾌﾘｰﾀﾞｲｱﾙ,トヨタ,パッソ,2017年01月,"16,600 Km",DBA-M700A,1KR,動力伝達,不明,高速道路の本線に合流するとき、アクセルペダルを踏んでもなかなか速度が出ず、しばらく踏み続けてようやく加速する。
280,2020年08月07日,高知,ﾌﾘｰﾀﾞｲｱﾙ,ホンダ,ＣＢＲ１０００ＲＲ,2019年09月,"8,500 Km",2BL-SC77,SC77E,エンジン,２０２０年７月３１日,ツーリングで走行し、休憩でエンジンを停止した後、再始動しなくなった。
281,2020年08月07日,福岡,ＨＰ,ホンダ,ＦＲＥＥＤハイブリッド,2019年07月,"14,000 Km",DAA-GB7,LEB-H1,動力伝達,購入当初より,長い上り坂でローギヤに固定されたままでシフトアップされない。
282,2020年08月07日,福岡,ＨＰ,トヨタ,アクア,2012年10月,"111,674 Km",DAA-NHP10,1NZ-1LM,エンジン,２０２０年８月５日,一般通路を走行中突然エンジン警告灯が点灯するとともにエンジンが停止し、惰性で路肩に流れ着いた。
283,2020年08月07日,福岡,ﾌﾘｰﾀﾞｲｱﾙ,ホンダ,フィットハイブリッド,2018年02月,"15,800 Km",DAA-GP5,LEB-H1,制動装置,２０２０年７月２日,ＶＳＡモジュレータと電動ブレーキユニットの不良により、ブレーキが効かなくなった。
284,2020年08月07日,熊本,ＨＰ,ニッサン,セレナ,不明,不明,C26,不明,車枠・車体,昨年から,塗装が剥がれた。
285,2020年08月07日,熊本,ﾌﾘｰﾀﾞｲｱﾙ,三菱,ｅＫカスタム,2017年04月,"17,200 Km",DBA-B11W,3B20,保安灯火,２０２０年８月４日,ドアミラーの不具合により、走行中に左側が格納された。
286,2020年08月06日,新潟,ﾌﾘｰﾀﾞｲｱﾙ,ニッサン,エクストレイル,2015年07月,"55,000 Km",DBA-NT32,MR20,エンジン,１～２年前から,走行中にアクセルペダルを踏んでも加速しなくなったことがある。これまで３回ほどディーラーに相談をしているが、コンピューターにエラーの記録が残っておらず、症状も再現しないとのことで修理出来ていないが、年が経つにつれて発生頻度が増してきている。
287,2020年08月06日,長野,ＨＰ,ジープ,レネゲード,2019年10月,"3,700 Km",3BA-BU13,55282328,車枠・車体,２０２０年５月１１日,走行中、信号機手前の約２０ｍで突然エンジンが吹けなくなリ、赤信号で停止後、スタート時に強いノッキングと同時に発煙、出火し、車両が全焼した。
288,2020年08月06日,石川,ＨＰ,ニッサン,デイズルークス,2018年02月,"12,000 Km",DBA-B21A,3B20,保安灯火,２０２０年８月,ドアのロックボタンで左側ドアミラーが半分しか開かない事が５回以上あり、そのたびに格納ボタン、ミラー調整ボタンで調整しなくてはならない。
289,2020年08月06日,東京,ＨＰ,アウディ,Ａ７,2019年07月,"4,400 Km",AAA-F2DLZS,DLZ-4449,エンジン,２０２０年８月４日,高速を走行中にリモートキーを認識できない警告表示が発報し、運転操作が制限されエンジンが止まったような状態になり、速度が大きく減速された。
290,2020年08月06日,東京,ﾌﾘｰﾀﾞｲｱﾙ,ボルボ,Ｖ４０ＣＣ,不明,不明,不明,不明,電気装置,２０２０年８月,バッテリーの不良により、走行中に警告灯などの点灯もないまま、突然全ての電源が落ちたような形でエンジンが止まり、再始動不能になった。
291,2020年08月06日,神奈川,ＨＰ,フィアット,５００Ｃ,2014年01月,"64,000 Km",ABA-31212,169A4,エンジン,２０２０年１月～２０２０年７月　この間に,高速走行中に４気筒中、同じ２気筒が失火を繰り返す。ディーラー修理後も再発した。修理翌日に変速機故障で走行不能になり、変速機全交換後に２気筒失火が再発した。
292,2020年08月06日,神奈川,ＨＰ,フィアット,５００Ｃ,2014年01月,"64,000 Km",ABA-31212,169A4,動力伝達,２０２０年３月１５日,デュアロジック（自動変速機）の不良により、一般道の信号でＮレンジ以外にまったく入らなくなり、走行不能になった。
293,2020年08月06日,神奈川,ﾌﾘｰﾀﾞｲｱﾙ,ニッサン,ルークス,2011年07月,"50,000 Km",DBA-ML21S,K6A,かじ取り,２０２０年８月４日,ステアリングロックの不良により、突然エンジンがかからなくなった。
294,2020年08月06日,千葉,ＨＰ,ドゥカティ,ムルティストラーダ１２６０Ｓ,2018年03月,不明,2BL-AC00,1262VC,制動装置,２０１９年１０月頃と２０２０年５月頃,ブレーキディスクの歪みにより、ブレーキを一定にかけても、波打つよな効き方になる。ディスクの歪んだ部分が常にパッドに触れているため、ブレーキをかけていなくてもパッドが摩耗する。
295,2020年08月06日,千葉,ﾌﾘｰﾀﾞｲｱﾙ,メルセデス・ベンツ,Ｃ２００スポーツ,2015年03月,"33,000 Km",RBA-205242,274,緩衝装置,不明,エアサスペンションのコンプレッサーが故障し、車体が地面につくほどに車高が下がり、走行不能になった。
296,2020年08月06日,茨城,ＨＰ,トヨタ,ｉＱ,2009年10月,"117,800 Km",DBA-KGJ10,1KR,エンジン,２０２０年８月４日,ファンベルトに小石を巻き込み、ベルトが切れ、自走不能になった。
297,2020年08月06日,三重,電話,ニッサン,ノートｅ－ｐｏｗｅｒ,2019年01月,不明,DAA-HE12,HR12-EM57,動力伝達,２０２０年７月２２日,駐車場で前向きに駐車しようとしたところ、車両が急発進してしまい、車止めを乗り越えたところでブレーキをかけ停止した。
298,2020年08月06日,京都,ﾌﾘｰﾀﾞｲｱﾙ,ジャガー,Ｓタイプ,2005年08月,"77,900 Km",GH-J01JC,JB,緩衝装置,不明,車検前の検査でテンションロッドのブッシュが切れていたのを確認した。
299,2020年08月06日,兵庫,ＨＰ,ニッサン,ノートｅ－ＰＯＷＥＲ,2017年07月,"34,612 Km",DAA-HE12,HR12EM57,その他,２０２０年８月,エアコンのコンプレッサー、サーモスタットの不良により、エアコンが効かなくなった。
300,2020年08月06日,滋賀,ＨＰ,スズキ,ワゴンＲ,2014年06月,"46,000 Km",DBA-MH34S,R06A,緩衝装置,２０２０年６月,フロントストラットサポートに大きなガタツキがあった。
301,2020年08月06日,滋賀,ﾌﾘｰﾀﾞｲｱﾙ,トヨタ,ＭＲ－Ｓ,不明,不明,TA-ZZW30,1ZZ,動力伝達,不明,シーケンシャルトランスミッションの不良により、交差点の右折待ちから発進する際に突然止まってしまい、走行不能になった。
302,2020年08月06日,岡山,ＨＰ,ホンダ,ＣＲ－Ｖ,2019年02月,不明,DBA-RW1,L15B,車枠・車体,２０２０年７月２９日,前席天井の真ん中にあるルームライトと内張りの間から、雨水が流れ出てきた。
303,2020年08月06日,香川,ＨＰ,ニッサン,セレナ,2019年09月,不明,DAA-HFC27,HR12-EM57,制動装置,２０２０年５月１３日,運転中、問題がない場面で自動ブレーキが勝手に作動した。警告表示、警告アラームが出ていた。
304,2020年08月06日,福岡,ﾌﾘｰﾀﾞｲｱﾙ,三菱,ふそうキャンター,2004年01月,"150,000 Km",KK-FE71CBD,4D33,燃料装置,不明,燃料噴射ポンプの不良により、エンジンがかからなくなった。
305,2020年08月05日,富山,ﾌﾘｰﾀﾞｲｱﾙ,トヨタ,アルファード,2015年11月,"78,900 Km",DAA-AYH30W,2AR-2JM-2FM,その他,２０２０年７月末,エアコンが故障した。
306,2020年08月05日,神奈川,ﾌﾘｰﾀﾞｲｱﾙ,ＢＭＷ,３２０ｉ　Ｍスポーツ,2019年12月,"6,000 Km",3BA-5F20,B48B20A,制動装置,購入当初から,雨天時、ブレーキをかけると大きな音がする。
307,2020年08月05日,千葉,ＨＰ,ポルシェ,７１８　ボクスター,2019年05月,"13,000 Km",ABA-982J1,DDP,その他,２０２０年８月３日９：００,高速道路に入る瞬間、ＥＴＣが突然読み取り不良になる。
308,2020年08月05日,埼玉,ＨＰ,フォルクスワーゲン,ポロ,2020年01月,不明,ABA-AWCHZ,CHZ,動力伝達,新車で購入後４ヶ月くらい,車庫入れ中、シフトレバーがドライブからリバース、パーキングにシフトチェンジできなくなった。
309,2020年08月05日,茨城,ＨＰ,ホンダ,Ｎ－ＷＧＮ,2014年11月,"71,729 Km",DBA-JH1,S07A,エンジン,１か月前,アイドリングストップ後、エンジンが始動しない。
310,2020年08月05日,栃木,ＨＰ,ニッサン,セレナ,2012年07月,"69,000 Km",DBA-FC26,MR20,エンジン,２０２０年７月２３日,エンジンオイルが消費するようになった。
311,2020年08月05日,栃木,ＨＰ,ニッサン,セレナ,2012年07月,"69,000 Km",DBA-FC26,MR20,電気装置,２０２０年７月２３日,オルタネーターの不具合により、一般道を走行中にエンジンルーム付近から大きな異音が発生し、その後室内が焦げ臭くなった。
312,2020年08月05日,岐阜,ﾌﾘｰﾀﾞｲｱﾙ,ホンダ,ＳＨＵＴＴＬＥハイブリッド,2015年06月,"60,600 Km",DAA-GP7,LEB-H1,エンジン,２０２０年６月末,「Ｈｏｎｄａスマートキーシステム点検」と警告表示が出る。
313,2020年08月05日,京都,ＨＰ,フォルクスワーゲン,パサートＴＤＩ,2019年03月,"7,500 Km",LDA-3CDFC,DFC,乗車装置,２０２０年２月、７月１１日、８月４日、８,車のトランクが勝手に開いた。
314,2020年08月05日,兵庫,ﾌﾘｰﾀﾞｲｱﾙ,ホンダ,アクティトラック,2011年04月,"110,000 Km",EBD-HA8,E07Z,かじ取り,中古で購入当初から,走行中にハンドル重くて切りにくい。戻りにくい。
315,2020年08月05日,奈良,ﾌﾘｰﾀﾞｲｱﾙ,三菱,ｅＫワゴン,2019年05月,不明,5BA-B33W,BR06,制動装置,不明,走行中に不必要な場面で自動ブレーキが作動した。
316,2020年08月04日,宮城,ＨＰ,スマート,フォーツー,2015年11月,"57,400 Km",DBA-453342,281,保安灯火,２０２０年７月２８日,左後の方向指示器（ウインカー）がランプと電源コードがガタガタして通電されないために点灯しない。
317,2020年08月04日,神奈川,ＨＰ,ニッサン,ＤＡＹＺ,2019年08月,不明,4AA-B45W,BR06-SM21,エンジン,２０１９年８月～継続中,アイドリングストップ作動後、エンジンが毎回即再始動する。
318,2020年08月04日,神奈川,ＨＰ,ホンダ,フィット,2014年06月,"56,000 Km",DBA-GK5,L15B,エンジン,２０２０年７月,エンジンスタートスイッチを押すとＩＧオンされるが、エンジンが始動できない症状が発生した。何度かエンジンオンオフを繰り返すとかかるため走行を開始したところ、信号待ちでアイドリングストップに入った際にＰランプが点灯し、エンジンがかからず路上で止まった。
319,2020年08月04日,神奈川,ＨＰ,ホンダ,フィット,2014年06月,"56,000 Km",DBA-GK5,L15B,エンジン,２０２０年７月,エンジン始動時にスマートキーシステム警告灯が点灯した。
320,2020年08月04日,大阪,ＨＰ,ニッサン,セレナ,2015年02月,"55,000 Km",DAA-HC26,MR20-SM23,動力伝達,２０２０年７月２３日,ＣＶＴの故障により、高速道路走行時にアクセルペダルをべた踏みしても４０ｋｍ／ｈしか出なくなった。
321,2020年08月04日,兵庫,ＨＰ,メルセデス・ベンツ,Ｃ２００ＣＧＩ,2013年09月,"55,500 Km",DBA-204048,271,エンジン,２０２０年３月,カムアジャスターの不良により、エンジン始動時に異音がし、チェックランプが点灯した。
322,2020年08月04日,広島,ＨＰ,ホンダ,ステップワゴン,2017年11月,"26,000 Km",DBA-RP1,L15B,乗車装置,半年前から,ハッチバック（通称わくわくゲート）の開閉ボタンが反応せず、ドアが開かない。
323,2020年08月04日,愛媛,ＨＰ,スズキ,クロスビー,2019年04月,不明,DAA-MN71S,K10C-WA05A,走行装置,２０２０年７月,新車時よりタイヤバランスが狂っていた。
324,2020年08月04日,高知,ﾌﾘｰﾀﾞｲｱﾙ,ニッサン,エルグランド,2011年08月,"163,700 Km",DBA-TE52,QR25,かじ取り,２０２０年,電動油圧ポンプの故障により、パワーステアリングが効かなくなったため、ハンドルが著しく重くなった。
325,2020年08月04日,福岡,来訪,メルセデス・ベンツ,ＳＬＫ２００コンプレッサー,2008年05月,不明,CBA-171442,271,エンジン,不明,カムセンサーからオイルが進入し、エンジンコンピューターが故障したため、エンジンが始動しなくなった。
326,2020年08月04日,福岡,ＨＰ,ニッサン,セレナ,2014年01月,"121,000 Km",DAA-HC26,MR20-SM23,動力伝達,２０２０年７月２８日,ＣＶＴの不具合により、高速道路の合流で低速から加速する際にドドドドッと異常な振動が起こり、スピードが出なくなった。
327,2020年08月04日,長崎,ＨＰ,プジョー,３０８ＣＣ,2014年02月,"50,700 Km",ABA-T7C5F02,5F02,エンジン,２０２０年７月２４日,タイミングチェーンの緩みにより、エンジン始動時にガラガラ音（異音）がした。
328,2020年08月03日,福島,ＨＰ,メルセデス・ベンツ,Ｃ２００,2014年11月,"38,000 Km",RBA-205042C,274,排ｶﾞｽ･騒音,２０２０年８月１日,ＮＯｘセンサーの不良により、高速道路を走行中にエンジン診断警告灯が点灯した。
329,2020年08月03日,青森,ＨＰ,トヨタ,ヴェルファイア,2014年03月,"110,900 Km",DAA-ATH20W,2AZ-2JM-2FM,かじ取り,２０１７年７月頃,下り坂及び高速運転時のブレーキ時、ステアリングから異音が発生する（ガタガタ音）
330,2020年08月03日,青森,ＨＰ,ニッサン,セレナ,2015年03月,"76,556 Km",DBA-FNC26,MR20,電気装置,２０２０年８月,駐車場でアイドリング中、エンジンルームから異音、異臭がして発煙した。ディーラーでみてもらうとオルタネーターから火花が出ていた。
331,2020年08月03日,新潟,ﾌﾘｰﾀﾞｲｱﾙ,ニッサン,エルグランド,2010年10月,"130,000 Km",DBA-PE52,VQ35,かじ取り,不明,電動パワーステアリングポンプからオイルが漏れた。
332,2020年08月03日,長野,ＨＰ,フォード,エクスプローラー,2015年10月,"38,000 Km",ABA-1FMHK8,8,かじ取り,２０１９年１０月,ハンドルを右にきるとハンドル根本で何かが破損しているような異音と振動が発生する。
333,2020年08月03日,茨城,ﾌﾘｰﾀﾞｲｱﾙ,スバル,エクシーガ,2008年09月,"116,300 Km",DBA-YA5,EJ20,動力伝達,不明,自動変速機の不良により、変速ショックが発生する。
334,2020年08月03日,静岡,ﾌﾘｰﾀﾞｲｱﾙ,ホンダ,Ｒｅｂｅｌ２５０,2020年01月,"1,900 Km",2BK-MC49,MC49E,その他,購入当初から,速度計に結露が発生する。
335,2020年08月03日,愛媛,ＨＰ,ホンダ,フリードハイブリッド,2016年03月,"45,000 Km",DAA-GP3,LEA-MF6,保安灯火,２０２０年７月３１日,運転席パワーウインドウモーターが内部腐食のため、窓が開けたまま閉まらない。
336,2020年08月03日,佐賀,ＨＰ,ニッサン,エルグランド,2011年07月,"102,665 Km",DBA-TE52,QR25,かじ取り,２０２０年８月２日,パワーステアリングポンプよりオイルが漏れ、圧力不足になったため、走行中、カーブにさしかかった時にハンドルが重くなり、危なく対向車と衝突しそうになった。
337,2020年08月03日,長崎,ＨＰ,マツダ,アクセラスポーツ,2019年03月,"12,000 Km",DBA-BM5FS,P5,エンジン,２０２０年３月,登り坂走行時、１５００回転から２０００回転の間でエンジンがハンチングする。
338,2020年08月02日,茨城,ＨＰ,フォルクスワーゲン,ゴルフ,2019年04月,"24,000 Km",DBA-AUCPT,CPT,制動装置,２０１９年１０月から２０２０年８月,一般道路を走行中、ハンドルを少し切るとブレーキをかけていなくてもブレーキを引きずったような音が出る。通勤などで朝や夕方などで音が出やすい。走行距離９０００ｋｍぐらいから異音が出始め、２４０００ｋｍ現在で悪化している。
339,2020年08月02日,愛媛,ＨＰ,三菱,ｅＫスペースカスタム,2015年09月,"55,800 Km",DBA-B11A,3B20,その他,２０２０年７月２０日,エアコンのエバポレーターが詰まり、冷房が効かなくなった。
340,2020年08月02日,熊本,ＨＰ,マツダ,ＣＸ－５,2013年01月,"67,598 Km",LDA-KE2FW,SH,エンジン,２０２０年６月７日,ターボチャージャーの故障により、走り始めてから１００ｍほど進んだところで、「エンジンシステム点検」というチェックランプが点灯した。アクセルペダルを踏み込んだが、加速しなくなった。白煙も出ていた。クリープ現象で自宅まで走り、駐車場にてエンジン停止後、１時間ほど経ってエンジンをかけたが、かかってすぐにエンジンが停止した。
341,2020年08月01日,北海道,ＨＰ,フォルクスワーゲン,ザ・ビートル,2012年12月,"60,000 Km",DBA-16CBZ,CBZ,エンジン,２０２０年７月３０日,ステアリングロックの不良により、キーがスタート位置まで戻らなくなり、キーが抜けず、エンジンも止められなくなった。
342,2020年08月01日,東京,ＨＰ,アウディ,Ｑ７　５５　ＴＦＳＩクワトロ,2017年12月,不明,ABA-4MCREA,CRE,車枠・車体,２０２０年７月２５日,タワー型のパーキング駐車中にリアゲートが開き、壁もしくは天井等に衝突したらしく、次に出庫時に破損していた。
343,2020年08月01日,静岡,ＨＰ,スズキ,ＧＳＸ１３００Ｒ　ハヤブサ,2018年06月,"30,000 Km",GX72B,X704,動力伝達,２０２０年５月２３日,シフトフォークの焼け、曲がり、５速ギヤの焼け、摩耗により、一般道路を走行中、５速からギアチェンジができなくなった。
