番号,受付日,住所,申告方法,車名,通称名,初度登録年月,総走行距離,型式,原動機型式,不具合装置,発生時期,申告内容の要約
1,2021年03月31日,宮城,ＨＰ,ホンダ,ＦＲＥＥＤ,2017年03月,"50,000 Km",DAA-GB7,LEB-H1,制動装置,２０２１年３月１８日,走行中にブレーキペダルが半分から先に踏み込めなくなり、制動不能となった。サイド（フット）ブレーキにより停車させることが出来たが、この時、すべてのイグニッションランプが点灯していた。
2,2021年03月31日,青森,ＨＰ,マツダ,ＣＸ－５,2016年02月,"89,100 Km",LDA-KE2AW,SH,保安灯火,２０２０年９月,暖かい日中走行中に、フロントガラスか屋根付近からビリビリと異音がするようになった。
3,2021年03月31日,青森,ＨＰ,ニッサン,セレナ,2016年02月,"68,000 Km",DBA-FNC26,MR20,電気装置,２０２１年３月,エンジンかけてアクセルペダルの踏み始めに、これまで聞いた事のない異音がした。アクセルペダルを踏み込むと更に響くようにモーター音のような異音がした。
4,2021年03月31日,青森,ＨＰ,マツダ,ＣＸ－５,2016年02月,"89,100 Km",LDA-KE2AW,SH,車枠・車体,２０２０年１月,寒いとき段差で、ダッシュボードとフロントガラスの間からガタンガタン音がする。
5,2021年03月31日,長野,ＨＰ,ジープ,グランドチェロキー,2013年12月,"51,000 Km",ABA-WK36T,不明,エンジン,２０２１年３月２７日,運転後、車を見たら大量のオイル漏れを発見した。整備工場へ持ち込んだところ、オイルフィルターハウジングよりオイル漏れしているのが確認された。
6,2021年03月31日,神奈川,ＨＰ,ニッサン,ＧＴ－Ｒ,2009年05月,"34,000 Km",CBA-R35,VR38,電気装置,２０２１年３月２７日（土）,熱せられた空気がインストルメントパネル内部に集まり、オーディオのオペアンプがこわれる。（過去に２回同様不具合発生）
7,2021年03月31日,神奈川,ﾌﾘｰﾀﾞｲｱﾙ,ＢＭＷ,ＡｃｔｉｖｅＨｙｂｒｉｄ３,2015年12月,"27,000 Km",DAA-3F30,N55B30A-M230,燃料装置,不明,燃料ポンプのリコール対象範囲にあるが、個別の車台番号で対象車両では無いとされていた車で、燃料ポンプが故障し、走行中に突然燃料切れの症状が発生し、止まってしまった。
8,2021年03月31日,埼玉,ﾌﾘｰﾀﾞｲｱﾙ,マツダ,ＲＸ－８,2003年09月,"115,300 Km",LA-SE3P,13B,かじ取り,１年前,電動パワーステアリングの不良により、走行中に突然ハンドルが回ったり、停車時に勝手にハンドルがぐるぐると回った。
9,2021年03月31日,埼玉,ﾌﾘｰﾀﾞｲｱﾙ,マツダ,ＲＸ－８,2003年09月,"115,300 Km",LA-SE3P,13B,エンジン,不明,ラジエーターの水が減り、エンジンオイル経路側にまわってしまう。
10,2021年03月31日,茨城,ＨＰ,ボルボ,Ｖ６０　ＲＤＥＳＩＧＮ,2012年12月,"100,800 Km",DBA-FB4164T,B4164T,動力伝達,２０２１年３月３０日,走行中ミッションレベル低下の警告灯が表示される。その後３０ｋｍ／ｈ以上スピードが出なくなり、アクセルペダルを踏んでもエンジン回転数は上がるがスピードは出ない。その後、停車してしまうと全く動かなくなる。エンジンを切り再始動すると警告灯が消えて走行できたが、信号で止まった際にアイドリングが不安定になり、停車中エンジン回転数が上がったり下がったりして振動があった。その後、左折するため少し動いて交差点の真ん中で止まったところエンスト起こし、再始動できなくなった。
11,2021年03月31日,愛知,ＨＰ,ニッサン,ＲＯＯＸ,2020年07月,"6,609 Km",5AA-B44A,BR06-SM21,制動装置,２０２０年１０ごろから現在に至るまで,走行中及び信号待ちの時にソナーが頻回に作動することがあった。その頃から走行中に自動ブレーキが作動することが１、２ヶ月に１回程度ある。夜間に作動することが多く感じたが、最近は朝の通勤途中でも作動する。
12,2021年03月31日,大阪,ＨＰ,スバル,レヴォーグ,2015年03月,"47,000 Km",DBA-VM4,FB16,制動装置,２０２１年３月,毎回、エンジン始動時にブレーキペダルがかなり固くなり始動しにくい。
13,2021年03月31日,山口,ＨＰ,スズキ,ソリオバンディッド,2020年04月,"17,000 Km",DAA-MA36S,K12C-WA05A,エンジン,２０２０年５月２６日,手洗い洗車するとエンジンルームのカムカバーのくぼみに水がたまる。
14,2021年03月31日,福岡,ﾌﾘｰﾀﾞｲｱﾙ,ダイハツ,ムーヴ,2003年08月,"139,600 Km",UA-L150S,EF,乗車装置,不明,運転席のドアを開けようとした際にアウターハンドルが破損したため、勢いで後ろに転倒してしまった。その後も、助手席、後席のアウターハンドルが立て続けに破損している。
15,2021年03月30日,北海道,ﾌﾘｰﾀﾞｲｱﾙ,いすゞ,ギガ,2012年12月,"374,400 Km",QKG-CXZ77AT,6UZ1,エンジン,不明,エンジンコントローラーの故障により、走行中にエンジン警告灯が点灯するとともにエンジンが停止し、エンジン警告灯が消えＡＢＳ故障ランプが点灯し二度とエンジンがかからなくなった。
16,2021年03月30日,長野,ＨＰ,ホンダ,バモス,2010年03月,"10,900 Km",ABA-HM1,E07Z,かじ取り,２０１９年３月,カーブを曲がった後、手の力でハンドルを戻さないと戻らない。（セルフステアリングが効かない）
17,2021年03月30日,長野,ＨＰ,三菱,デリカＤ５,2015年01月,"170,000 Km",LDA-CV1W,4N14,排ｶﾞｽ･騒音,２０２０年８月,エキゾーストマニホールドからの排気ガス漏れにより、外気導入にしたところ、排ガスの臭いがした。
18,2021年03月30日,東京,電話,フォルクスワーゲン,パサートＣＣ,2010年04月,"200,000 Km",ABA-3CCCZC,CCZ,動力伝達,不明,高速道路で３０分程度、渋滞にはまり上り坂に差し掛かったところでガタガタする症状があったと思ったらその後数百メートル進んだところでエラー表示が出て停車した。エンジンをオフにして再始動するとエラーメッセージが消え、数百ｍ程度は走行できたが再度エラーメッセージが出て停車した。
19,2021年03月30日,東京,ＨＰ,ニッサン,ムラーノ,2009年01月,"109,000 Km",CBA-PNZ51,VQ35,動力伝達,２０２１年３月２８日,坂道を走行中、エンジン回転が空転し、走行不能になった。
20,2021年03月30日,東京,ﾌﾘｰﾀﾞｲｱﾙ,フィアット,５００Ｘ,2020年03月,"6,000 Km",3BA-33413PM,55282328,エンジン,購入当初から,アイドリングストップ機能付き車であるのにも関わらずエンジンが止まらない。
21,2021年03月30日,東京,ﾌﾘｰﾀﾞｲｱﾙ,フィアット,５００Ｘ,2020年03月,"6,000 Km",3BA-33413PM,55282328,エンジン,購入当初から,アイドリングストップ機能付き車であるのにも関わらずエンジンが止まらない。
22,2021年03月30日,神奈川,ﾌﾘｰﾀﾞｲｱﾙ,ダイハツ,タント,2006年11月,"100,000 Km",ABA-L350S,EF,エンジン,不明,プラグホール内にエンジンオイルが漏れた。
23,2021年03月30日,神奈川,ﾌﾘｰﾀﾞｲｱﾙ,ダイハツ,タント,2006年11月,"100,000 Km",ABA-L350S,EF,制動装置,不明,ブレーキペダルを踏み込んだ時にいつもよりペダルが奥に行き、効かなかった。
24,2021年03月30日,千葉,ＨＰ,スズキ,ワゴンＲスティングレー,2013年03月,"53,600 Km",DBA-MH34S,R06A,保安灯火,２０１８年３月と２０１９年２月,左右ヘッドライトバルブが故障した。
25,2021年03月30日,千葉,ＨＰ,ニッサン,セレナ,2002年01月,"125,000 Km",UA-RC24,QR25,電気装置,２０２１年１月,エンジンにオルタネータを固定する金物が破断してオルタネータが脱落した。
26,2021年03月30日,千葉,ＨＰ,ニッサン,エクストレイルハイブリッド,2015年09月,"45,000 Km",DAA-HT32,MR20-RM31,動力伝達,２０１９年４月頃から,信号待ち等の停車後、発進時にアクセルペダルを踏んでも車が進まず（坂道発進の時は下がってしまう）その後ドンという衝撃のあと急に発進する。
27,2021年03月30日,埼玉,ﾌﾘｰﾀﾞｲｱﾙ,プジョー,３０７,2005年03月,"113,300 Km",GH-M307CC,RFK,保安灯火,不明,パワーウインドウが止まらず、ずるずる下がってくる。
28,2021年03月30日,埼玉,ﾌﾘｰﾀﾞｲｱﾙ,プジョー,３０７,2005年03月,"113,300 Km",GH-M307CC,RFK,緩衝装置,不明,ショックアブソーバーからオイルが漏れた。３万ｋｍで３本同時にオイル漏れ起こし、９万ｋｍで４本とも交換した。
29,2021年03月30日,茨城,ﾌﾘｰﾀﾞｲｱﾙ,スズキ,スペーシア,2018年02月,"30,000 Km",DAA-MK53S,R06A-WA05A,電気装置,購入から２年ほどして,リアルサポートカメラ、後退時ブレーキカメラ、オートハイビーム等の警告灯が５つほど点灯する。
30,2021年03月30日,群馬,ﾌﾘｰﾀﾞｲｱﾙ,トヨタ,マークＸ,2010年03月,"98,000 Km",DBA-GRX130,4GR,緩衝装置,前輪２０１４年３月、後輪２０２０年３月,前後サスペンションの不具合により、走行中に突き上げるようなショックが発生する。
31,2021年03月30日,群馬,ﾌﾘｰﾀﾞｲｱﾙ,トヨタ,マークＸ,2010年03月,"98,000 Km",DBA-GRX130,4GR,燃料装置,２０２１年２月２７日,燃料ポンプセンサ不具合により、高速道路走行中に止まった。
32,2021年03月30日,静岡,ＨＰ,トヨタ,ハイエース,2010年10月,"85,000 Km",CBA-TRH214W,2TR,車枠・車体,２０２１年２月ころ,２０２１年２月頃にボンネット部分の塗装の剥離を確認した。２０２１年３月２９日には強風により塗装が剥離し、剥離した部分が目に入って負傷した。
33,2021年03月30日,岐阜,ＨＰ,メルセデス・ベンツ,Ｅ２５０ステーションワゴン,2013年11月,"70,000 Km",RBA-212236C,274,排ｶﾞｽ･騒音,不明,ＮＯｘセンサー不具合によりエンジン警告灯が点灯した。
34,2021年03月30日,三重,ﾌﾘｰﾀﾞｲｱﾙ,フォルクスワーゲン,パサート,2012年03月,"136,000 Km",DBA-3CCAX,CAX,動力伝達,不明,ＤＣＴの不具合により後退出来ない。前進しないこともある。
35,2021年03月30日,奈良,ＨＰ,マツダ,アテンザ,2015年05月,"53,000 Km",LDA-GJ2FW,SH,制動装置,２０２１年２月１３日,バキュームポンプの圧力低下により、車両システム異常の表示が出た。
36,2021年03月30日,福岡,ＨＰ,三菱,ふそうキャンター,2011年03月,"499,326 Km",SKG-FEB50,4P10,エンジン,２０２０年９月２日,２番吸気・排気バルブ・４番の排気バルブが破損したため、一般道走行中、エンジンからの異音がした後エンストし、そのままエンジン再始動できない状況になった。
37,2021年03月29日,北海道,ＨＰ,スバル,レヴォーグ,2015年05月,"96,000 Km",DBA-VM4,FB16,エンジン,２０２１年３月,走行中にエンストのような症状が出て、スムーズに加速しなくなり、マフラーから著しい黒煙が出る。ソレノイドバルブ等のコネクターまわりでオイル漏れしており、ケーブルを伝って奥の方までオイルが浸入している。
38,2021年03月29日,山形,ＨＰ,三菱,アウトランダー,2014年12月,"72,449 Km",DBA-GF8W,4J12,緩衝装置,２０２０年１１月ディラー１２月点検以降,フロント左右、サスペンションブーツ（ゴムのジャバラ）が破れ、シリンダーが見えている。
39,2021年03月29日,東京,ＨＰ,メルセデス・ベンツ,Ｖ２２０ｄ,不明,不明,LDA-447811,不明,車枠・車体,購入後３０ヶ月から,外装パネル接合部において、シールと塗装の接着が悪く、経年的に塗装が剥がれる。
40,2021年03月29日,神奈川,ﾌﾘｰﾀﾞｲｱﾙ,ニッサン,マーチ,不明,不明,DBA-K13,HR12,動力伝達,不明,発進しようとすると、ガタガタして速度が出ない。
41,2021年03月29日,埼玉,ＨＰ,メルセデス・ベンツ,Ｃ２００ステーションワゴン,2014年12月,"29,600 Km",RBA-205242C,274,燃料装置,２０２１年２月頃,燃料ポンプ低圧ラインからガソリンが漏れた。
42,2021年03月29日,茨城,ﾌﾘｰﾀﾞｲｱﾙ,ボルボ,ＦＨ,2019年02月,"245,800 Km",2DG-KA2TDA1,D13,車枠・車体,不明,フロントガラスの上部中央あたりから車室内に雨漏りする。
43,2021年03月29日,栃木,ＨＰ,三菱,デリカＤ５,2014年08月,"106,000 Km",LDA-CV1W,4N14,排ｶﾞｽ･騒音,不明,エキゾーストマニホールドのフランジ溶接部から排気漏れが発生した。
44,2021年03月29日,愛知,ＨＰ,アルファロメオ,ステルヴィオ,2020年10月,"5,600 Km",3DA-94922,55284529,動力伝達,新車納車時から,平坦路を約４０ｋｍ／ｈで走行中、アクセルペダルを離しブレーキを踏んだ途端にエンジン回転数が約７００ｒｐｍ上昇し加速ショックが発生する。
45,2021年03月29日,愛知,ＨＰ,フォルクスワーゲン,パサート,2014年03月,"60,000 Km",DBA-3CCAX,CAX,乗車装置,７年目の車検時,シートベルトバックルの配線切れにより、シートベルトの警告灯が点灯しなくなった。
46,2021年03月29日,愛知,ﾌﾘｰﾀﾞｲｱﾙ,ＢＭＷ,ミニクラブマン,2016年06月,"52,400 Km",LDA-LR20,B47C20A,乗車装置,不明,ドア開閉ボタンを押していないのにリヤドア（観音ドア）が勝手に開く。
47,2021年03月29日,大阪,電話,トヨタ,ルーミー,2020年08月,不明,DBA-M900A,1KR,制動装置,新車購入直後,リアドラムブレーキ付近より「ギュッギュッ」との異音が発生する。
48,2021年03月29日,兵庫,ＨＰ,三菱,パジェロイオ,2000年04月,"149,400 Km",GF-H66W,4G93,保安灯火,２０２１年３月２０日,右側ヘッドランプのｌｏｗビームが点灯しなかったので、バルブか配線か確認のため、左右のバルブを入れ換えてようとしたが、左側のソケットが外せなかった、よく見るとソケットが溶けていた。
49,2021年03月29日,鹿児島,ﾌﾘｰﾀﾞｲｱﾙ,スズキ,アルト,不明,不明,DBA-HA36S,R06A,エンジン,２年前,信号待ちなどでブレーキペダルを踏み込んでいると、エンジンの回転が上がっていき、車が押し出されそうな挙動が発生する。
50,2021年03月28日,富山,ＨＰ,スズキ,スイフトスポーツ,2018年04月,不明,CBA-ZC33S,K14C,制動装置,２０２１年３月２５日,ブレーキからキーと異音がし、走りが重く燃費悪化と通常走行後にリヤディスクだけが熱くなる症状があり、タイヤ交換時にブレーキを確認したところ、リヤパッドが斜めに偏摩耗しているのを発見した。
51,2021年03月28日,神奈川,ＨＰ,フォルクスワーゲン,ゴルフオールトラック,2017年08月,"18,777 Km",ABA-AUCJSF,CJS,エンジン,２０２１年１月１１日,ボンネットを開け、日常点検を行っていたところ、ボンネット裏にあるインシュレータの爪が熱で縮み垂れ下がってきていた。購入後２回目であり、１回目の交換は、２０１９年９月に同様事象で交換してもらっている。
52,2021年03月28日,神奈川,ＨＰ,スバル,インプレッサＧ４　２．０,2012年03月,"55,000 Km",DBA-GJ6,FB20,エンジン,２０２１年３月,ディーラーでの車検時、冷却水にエンジンオイルが混入しているため、エンジン修理の必要が連絡あると指摘された。
53,2021年03月28日,神奈川,ＨＰ,フォルクスワーゲン,ゴルフオールトラック,2017年08月,"16,500 Km",ABA-AUCJSF,CJS,エンジン,２０２０年６月２７日,車検検査でサーモスタットハウジングからの冷却水漏れが発見された。
54,2021年03月28日,神奈川,ＨＰ,フォルクスワーゲン,ゴルフオールトラック,2017年08月,"16,500 Km",ABA-AUCJSF,CJS,保安灯火,２０２０年９月１４日,エンジンを始動したら、メータパネルにウィンカーランプ切れの警告が表示された。車を降りて、ランプを確認したが切れておらず、ディーラーに持ち込み検査したところ、ドアミラーオープン回路故障の履歴が確認され、ターンシグナルレンズ交換となった。
55,2021年03月28日,愛知,ＨＰ,スズキ,パレット,2009年01月,"103,646 Km",DBA-MK21S,K6A,エンジン,不明,高速道路を走行中、突然エンジンが白煙を上げて停止した。車の制御が不可能となった。ディーラーで確認したところ、エンジンオイルがなくなり、エンジンに穴が開いていた。
56,2021年03月28日,京都,ＨＰ,ニッサン,セレナ,2019年11月,"7,000 Km",DAA-HC27,HR12-EM57,保安灯火,２０２１年１月頃に気付いた,アダプティブＬＥＤヘッドライト搭載車で、対向車が来ると減光されるが、すれ違いが完了する直前（約５ｍ）にハイビームになり、対向車の運転手の顔を照らしてしまう。また、このハイビーム照射を防止するためにロービームに切り替えようとしても対向車を感知してロービームになっている状態でライトレバーを手前に操作するとパッシングになってしまう。
57,2021年03月28日,宮崎,ＨＰ,トヨタ,プリウス,2017年02月,"20,700 Km",DAA-ZVW51,2ZR-1NM,保安灯火,２０２１年３月,左右テールランプレンズの内側一部分が白くなった。
58,2021年03月28日,沖縄,24時間電話,トヨタ,プリウス,2010年06月,"52,146 Km",DAA-ZVW30,2ZR-3JM,電動機(モーター),不明,ハイブリッドシステムチェックのエラーの表示が出て消えなくなり、エンジンがかかりっぱなしになった。
59,2021年03月27日,北海道,ＨＰ,トヨタ,ＭＲ－Ｓ,2007年06月,"96,000 Km",TA-ZZW30,1ZZ,動力伝達,２０２１年３月中頃から。,変速をすると突然トランスミッション警告灯、エンジンチェックランプが点灯し、エンストしてしまった。その際にピーピーと警告音が鳴った。キーをオフにし、もう一度エンジンをかけようとしてもエンジンがかからず、その場で５分以上停車してしまった。
60,2021年03月27日,東京,ＨＰ,マツダ,アクセラ,2019年02月,"12,000 Km",LDA-BMLFS,S5,その他,２０１９年３月,カーナビゲーションが適切なルート選択をしないときがある。また、不必要な路地等をループで一巡迂回するルートを表示する。
61,2021年03月27日,千葉,ＨＰ,ホンダ,Ｎ－ＢＯＸカスタムダーボ,2018年05月,"11,800 Km",DBA-JF3,S07b,エンジン,２０２１年３月１５日,走行中アクセルＯＦＦでエンジン回転数が落ちずに加速し続ける。違うタイミングでは極端にエンジンブレーキがかかり車速がグン！と下がり体が前のめりになる時もある。
62,2021年03月27日,千葉,ＨＰ,ＢＭＷ,Ｘ１,2016年10月,"31,830 Km",LDA-HT20,B47C20A,動力伝達,２０２０年３月２日,パーキングブレーキをかけると、コントロールディスプレイに「トランスミッションの警告」と「停車時にはパーキングブレーキをかけてください」のメッセージが、メーターパネルにはＰマークが出ているのに「車両動き出し注意」のメッセージが出る。車の動きには全くおかしいところはない。
63,2021年03月27日,福井,ＨＰ,プジョー,５００８,2015年03月,"45,000 Km",ABA-T875F02,5F02,エンジン,２０２１年１月１日,エンジンのピストンに煤が溜まっていたため、国道を約６０ｋｍ／ｈでオートクルーズ走行していたところ、エンジンの警告灯点灯とともにエンジン出力がダウンし、走行不能になった。
64,2021年03月27日,福井,ＨＰ,プジョー,５００８,2015年03月,"45,000 Km",ABA-T875F02,5F02,エンジン,２０２１年１月３１日,タイミングチェーンの破損により、エンジン始動時にガラガラとディーゼルエンジンのような異音が発生した。
65,2021年03月27日,福井,ＨＰ,プジョー,５００８,2015年03月,"45,000 Km",ABA-T875F02,5F02,制動装置,２０２１年３月１１日,ブレーキブースターの故障により、走行中にブレーキが突然効かなくなり、止まらなくなった。
66,2021年03月27日,愛媛,ＨＰ,ダイハツ,タント,2015年08月,"26,700 Km",DBA-LA600S,KF,乗車装置,２０２１年,フロント左右ドアインナーハンドルのワイヤーが切れ、内側からのドアが開けられなくなった。
67,2021年03月27日,鹿児島,ＨＰ,ニッサン,ノート,2019年07月,"12,000 Km",DAA-HE12,HR12-EM57,走行装置,２０２１年３月,左後輪のハブベアリング不良により、走行中「ゴー」という大きな異音が発生した。
68,2021年03月26日,北海道,ＨＰ,トヨタ,ライズ,2020年06月,不明,5BA-A210A,1KR,エンジン,２０２１年１月,エンジン始動時、クランキング時間が長い。
69,2021年03月26日,宮城,ﾌﾘｰﾀﾞｲｱﾙ,スズキ,ハスラー,不明,"130,000 Km",DAA-MR41S,R06A-WA04A,エンジン,２０２０年１１月,プーリーの錆びでベルトがすぐ切れる。
70,2021年03月26日,東京,ＨＰ,シトロエン,Ｃ３　ＳＨＩＮＥ,2020年02月,"9,800 Km",3BA-B6HN05,HN05,かじ取り,２０２０年２月２７日,低速時（時速約４０ｋｍまで）ハンドルが左に５０度ほど傾き（右も時々あり）その方向に車が曲がってしまう。
71,2021年03月26日,神奈川,ＨＰ,ＢＭＷ,５２３ｄ,2018年06月,"25,000 Km",LDA-JC20,B47D20A,走行装置,１回目２０２０年１２月、２回目２０２１年,高速道路走行中にタイヤから何か剥がれる音がしたため、停車して確認したところ、トレッド面が３０㎜角で厚さ２ｍｍ程度で剥がれていた。
72,2021年03月26日,神奈川,ＨＰ,マツダ,ＭＡＺＤＡ３,2020年02月,"9,600 Km",3AA-BPEP,HF-MK,電気装置,２０２０年３月２０日,エンジンを停止して数時間洗車後、エンジンをかけようとすると、全ての警告灯が点滅をはじめてエンジンがかからない。バッテリーを充電しても復旧することはなく、バッテリーごと交換すると何故かエンジンが起動できる。
73,2021年03月26日,高知,ﾌﾘｰﾀﾞｲｱﾙ,スズキ,レッツ,2018年01月,不明,2BH-CA4AA,A409,保安灯火,購入から１年後,方向指示器左折時のみスイッチが入りにくくなった。
74,2021年03月26日,熊本,ﾌﾘｰﾀﾞｲｱﾙ,ニッサン,ノート,2014年12月,"120,000 Km",DBA-E12,HR12,その他,中古車で購入当初から,冷房・暖房が効きにくい。
75,2021年03月25日,東京,ＨＰ,三菱,ふそうスーパーグレート,2017年09月,"310,000 Km",QPG-FV60VX,6R10,エンジン,２０２０年１２月５日,オイルパンにヒビが入りオイルが漏れ出した。
76,2021年03月25日,東京,ＨＰ,三菱,ふそうスーパーグレート,2017年09月,"310,000 Km",QPG-FV60VX,6R10,エンジン,２０２１年３月,水温計が上がってしまいエンジン音がうるさくなった。
77,2021年03月25日,埼玉,ＨＰ,ボルボ,ＸＣ６０　Ｂ５,2021年02月,33 Km,5AA-UB420TXCM,B420T2-3330,制動装置,２０２１年３月１２日,ブレーキペダルを踏んでドライブレンジに入れてパーキングブレーキを解除したら、ブレーキペダルを踏んでいるのに車が前にズルズルと進んで行った。
78,2021年03月25日,埼玉,ﾌﾘｰﾀﾞｲｱﾙ,ホンダ,Ｎ－ＢＯＸ,2016年09月,"50,000 Km",DBA-JF1,S07A,エンジン,不明,エンジンがかからなくなったり、道路の真ん中で止まったりする。
79,2021年03月25日,栃木,ＨＰ,ホンダ,ＣＲ－Ｖ,2020年03月,不明,DBA-RW1,L15B,電気装置,今年２月,車載レーダーが雨により機能が使用不能になる。
80,2021年03月25日,栃木,ﾌﾘｰﾀﾞｲｱﾙ,ＢＭＷ,２１８ｉ,不明,不明,DBA-2D15,B38A15A,エンジン,不明,車検から戻った直後にエンジンマウントの損傷で油漏れが発生した。
81,2021年03月25日,愛知,ＨＰ,ハーレーダビッドソン,ＦＬＦＢＳ,2018年05月,"13,000 Km",2BL-STK,K,制動装置,８０００ｋｍ走行位,リヤディスクローターが手で回すと、カタカタ音がするほどのガタが発生した。
82,2021年03月25日,愛知,ﾌﾘｰﾀﾞｲｱﾙ,ニッサン,ＮＶ３５０キャラバン,2013年03月,不明,LDF-VW6E26,YD25,車枠・車体,不明,天井の塗装が剥がれ、錆が発生している。
