番号,受付日,住所,申告方法,車名,通称名,初度登録年月,総走行距離,型式,原動機型式,不具合装置,発生時期,申告内容の要約
269,2021年05月08日,東京,ＨＰ,トヨタ,ＳＯＲＡ,2019年02月,"55,000 Km",ZBC-MUM1NAE,4JM-4JM,保安灯火,２０２０年７月２０日,車両点検中、側面窓ガラスがボディーから剥離しているのを発見した。
270,2021年05月08日,東京,ＨＰ,トヨタ,ＳＯＲＡ,2020年02月,"26,600 Km",ZBC-MUM1NAE,4JM-4JM,保安灯火,２０２１年５月３日,車両点検中、側面窓ガラスがボディーから剥離しているのを発見した。
271,2021年05月08日,東京,ＨＰ,トヨタ,ＳＯＲＡ,2020年01月,"26,200 Km",ZBC-MUM1NAE,4JM-4JM,保安灯火,２０２０年１０月１７日,車両点検中、側面窓ガラスがボディーから剥離しているのを発見した。
272,2021年05月08日,東京,ＨＰ,トヨタ,ＳＯＲＡ,2019年02月,"25,800 Km",ZBC-MUM1NAE,4JM-4JM,保安灯火,２０２０年７月２０日,車両点検中、側面窓ガラスがボディーから剥離しているのを発見した。
273,2021年05月08日,神奈川,ＨＰ,プジョー,２０８ファーストセレクション,2018年12月,"31,489 Km",ABA-A9HN01,HN01,エンジン,２０２１年４月１８日,信号にてアイドリングストップ状態から発進時、セルは回ったがエンジンかからない。
274,2021年05月08日,愛知,ＨＰ,スバル,ＸＶ,2017年05月,"61,000 Km",DBA-GT7,FB20,エンジン,２０２１年３月,クルーズコントロールで信号待ちのでアイドリングストップ停止中にエンジンが始動、ピロンと音がして電動ブレーキが解除されて動き出し前車に追突しそうになったためブレーキペダルを踏んで停車させた。
275,2021年05月08日,大阪,ＨＰ,ニッサン,セレナ,2013年04月,"94,500 Km",DAA-HC26,MR20-SM23,電気装置,２０２１年３月,オルタネーターの不良により、アイドリングストップランプが点滅し、アイドリングストップが作動しなくなった。
276,2021年05月08日,京都,ＨＰ,スズキ,ソリオ　フルハイブリッド,2017年09月,"38,000 Km",DAA-MA46S,K12C-PB05A,動力伝達,購入時より,勾配の有る踏切での一旦停止後の発進で　クラッチジャダーと同時にクラッチ滑りが発生する。
277,2021年05月08日,兵庫,ＨＰ,ニッサン,モコ,2013年02月,"120,000 Km",DBA-MG33S,R06A,エンジン,２０２１年４月２０日,５０ｋｍほど走行後、買い物のため駐車場へ停車し、発車のため再始動した際にエンストをした。もう一度エンジンをかけるとかかったがバッテリーの警告ランプが点灯し、数メートル走行したところ水温計がＨを示したため、走行を止めてロードサービスを要請し、作業員が車両を確認したところ、ファンベルトが外れてぶら下がっていた。整備工場へ搬送して確認したところ、アイドルプーリーブラケットが破断していた。
278,2021年05月08日,佐賀,ＨＰ,ニッサン,ＤＡＹＺ,2019年11月,不明,5AA-B44W,BR06-SM21,電気装置,２０１９年１２月納車　半年後の６月より,シャシー制御故障の表示が出て、自動ブレーキがＯＦＦになりバックモニターも映らなくなる。何度もディーラーへ持って行き部品の交換をするが改善されない。
279,2021年05月07日,山形,ＨＰ,ニッサン,エクストレイルハイブリッド,2015年11月,"176,903 Km",DAA-HNT32,MR20-RM31,動力伝達,２０２１年４月１４日,電磁クラッチの故障により信号待ちの後、動き出すと共にエンジンストップし、交差点の中で立ち往生を余儀なくされた。
280,2021年05月07日,千葉,ＨＰ,ニッサン,セレナ,2014年07月,"35,000 Km",DAA-HFC26,MR20-SM23,動力伝達,２０２１年４月３０日,低速走行時ノッキングのような症状でガクガクとなる、エンジン掛けて発進した直後にガツンとぶつけたような症状が起きる。
281,2021年05月07日,千葉,ＨＰ,ニッサン,マーチ,2011年04月,"87,681 Km",DBA-K13,HR12,動力伝達,２０２１年４月２９日,高速道路の料金所にてスピードを下げ、料金所通過後、少ししたらアクセルペダルを踏んでも中々エンジンの回転数が上がらずスピードが出ないので、右車線から路肩に寄って停車した。
282,2021年05月07日,埼玉,ＨＰ,ＢＭＷ,ミニクーパー,2013年11月,"27,300 Km",CBA-SU16,N16B16A,保安灯火,２０２０年１１月,ブレーキランプのバルブホルダーが熱により焼けて変形し、点灯しなくなった。メーターパネル内の警告灯が点灯した。
283,2021年05月07日,栃木,ﾌﾘｰﾀﾞｲｱﾙ,マツダ,デミオ,2014年11月,"13,000 Km",LDA-DJ5FS,S5,その他,２０２１年４月末,速度計が速度の計測はされているが、表示されない。
284,2021年05月07日,静岡,ＨＰ,ニッサン,セレナ,2015年01月,"96,000 Km",DAA-HFC26,MR20-SM23,動力伝達,１５０００ｋｍ超えたあたりから,停止状態から軽くアクセルペダルに足を乗せると、ガタガタ振動があり、加速しない。
285,2021年05月07日,岐阜,ﾌﾘｰﾀﾞｲｱﾙ,ニッサン,エクストレイル,2014年02月,"47,000 Km",DBA-NT32,MR20,動力伝達,不明,ＣＶＴの不具合により、３０ｋｍ／ｈでガタガタいう。
286,2021年05月07日,京都,ＨＰ,三菱,デリカＤ２カスタム,2018年10月,"7,886 Km",DAA-MB46S,K12C-PB05A,動力伝達,時々　月に何回か,ギアをバックに入れようとすると、「ガッ」とギア鳴りをしたり、３～４秒ギアが入らない事が有る。
287,2021年05月07日,鳥取,ﾌﾘｰﾀﾞｲｱﾙ,トヨタ,ヴェルファイア,2008年11月,"134,300 Km",DBA-ANH20W,2AZ,車枠・車体,２０２１年５月,塗装が剥がれた。
288,2021年05月07日,香川,来訪,メルセデス・ベンツ,Ｂ１８０,2013年01月,"26,300 Km",DBA-246242,270,制動装置,不明,夕方、ガソリンスタンドから道路へ出て４０ｋｍ／ｈ程で数百メートル走行したところ、インパネ内に警告が表示され、ブレーキペダルを踏んでもブレーキがほぼ効かなくなった。なんとか近くのスーパーの駐車場に止めることができた。
289,2021年05月07日,福岡,ﾌﾘｰﾀﾞｲｱﾙ,ダイハツ,タント,2013年03月,"75,500 Km",DBA-L375S,KF,車枠・車体,不明,塗装コードＧ５１のマスカットグリーンメタリック色塗装の車両で、屋根とボンネットにおいてこけがはえたようにでこぼこだったり、やすりをかけられたような状態になっている。
290,2021年05月06日,北海道,ＨＰ,スバル,フォレスター,2013年05月,"77,000 Km",DBA-SJG,FA20,エンジン,２０２０年４月,定期点検の際、オイルコントロールバルブよりオイルが漏れ、ハーネスを伝いＥＣＵまで浸透しているのが確認された。
291,2021年05月06日,新潟,ＨＰ,ダイハツ,タフトＧターボ,2020年12月,"1,800 Km",5BA-LA900S,KF,エンジン,２０２１年２月ごろより,平地を４０ｋｍ／ｈ～５０ｋｍ／ｈで走行するようなエンジン低負荷（１２００～１３００回転）時にカタカタと異音がする。
292,2021年05月06日,石川,ＨＰ,ニッサン,セレナ,2018年09月,"30,000 Km",DAA-GFC27,MR20-SM24,かじ取り,２０２１年４月,ステアリングラック本体のガタにより、ハンドルがフラフラするようになった。
293,2021年05月06日,神奈川,ﾌﾘｰﾀﾞｲｱﾙ,その他,パナソニック　ストラーダ,不明,不明,CN-MW200D,不明,装置その他,不明,車側のバッテリーを上げてしまい、ジャンプスタートにて給電、再始動をしたところ、カーナビが作動しなくなった。
294,2021年05月06日,岐阜,ﾌﾘｰﾀﾞｲｱﾙ,トヨタ,ハイエース,2011年03月,"130,000 Km",CBA-TRH214W,2TR,車枠・車体,２０２１年４月２６日,ホワイトパール塗装色の車両で、塗装が剥がれた。
295,2021年05月06日,三重,ﾌﾘｰﾀﾞｲｱﾙ,スズキ,スペーシア,2020年08月,不明,DAA-MK53S,R06A-WA05A,制動装置,不明,特定の道路を夜間に走行すると、前方に障害物が無く、問題がないのにも関わらず衝突被害軽減ブレーキが作動する。この急ブレーキによりむち打ち症状になってしまった。
296,2021年05月06日,大阪,ＨＰ,ダイハツ,タフト,2020年09月,"8,000 Km",6BA-LA900S,KF,排ｶﾞｽ･騒音,２０２１年２月,アクセルペダルを踏み込んだらＰＣＶバルブからガタガタと異音がしだす。ディーラーにて車体に取り付けてあるＰＣＶバルブを取り外し、太い管に結束バンドで取り付ける対応をうけた結果、加速時の異音が落ち着いたが、今度は坂道走行などで別の金属が当たるような異音がし解決できていない。
297,2021年05月06日,大阪,ＨＰ,ダイハツ,タフト,2020年09月,"8,000 Km",6BA-LA900S,KF,その他,２０２０年９月,走行中、ナビに「車速パルスが検出できません。接続情報画面で接続状態を確認してください。」と表示される。
298,2021年05月06日,大阪,ＨＰ,いすゞ,フォワード,2016年02月,"503,851 Km",TKG-FRR90T2,4HK1,エンジン,２０２１年４月１６日,高速道路を走行中、突然金属音がし、白煙を吹いてエンジンが止まった。
299,2021年05月06日,京都,ﾌﾘｰﾀﾞｲｱﾙ,ニッサン,セレナ,2012年08月,不明,DBA-FC26,不明,電気装置,不明,ストップランプスイッチの不良により、ブレーキペダルを踏んでいてもスライドドアが開かなくなる症状が発生した。部品の交換を行ったが、２年後に故障が再発し、スライドドアの開閉やエンジン始動が出来なくなった。
300,2021年05月06日,滋賀,ＨＰ,メルセデス・ベンツ,ＧＬＡ２５０,2014年06月,"49,800 Km",DBA-156946,270M20,動力伝達,２０２１年５月２日,高速道路走行中に警告灯が点灯し、トランスミッション制御不能になり、惰性で路肩に停車した。
301,2021年05月06日,広島,ＨＰ,トヨタ,ランドクルーザープラド,2020年11月,"2,000 Km",3BA-TRJ150W,2TR,かじ取り,納車１か月後,走行中に突然パワーステアリングが効かなくなった。
302,2021年05月05日,長野,ＨＰ,ニッサン,サファリ,2007年06月,"100,000 Km",TA-WFGY61,TB48,電気装置,２０２０年１２月,先ずハンドブレーキランプが消えなくなり、程なくして燃料メーター針が満タン付近を指して動かなくなった。
303,2021年05月05日,東京,ＨＰ,アルファロメオ,ジュリア　クアドリフォリオ,2018年09月,"17,000 Km",ABA-95229,670050436,エンジン,２０１９年－現在,エンジンが突然停止し、２０－３０分再始動しない。
304,2021年05月05日,東京,ＨＰ,アルファロメオ,ステルヴィオ,2020年11月,"1,000 Km",3DA-94922,55284529,エンジン,２０２１年５月１日,右左折時にブレーキペダルを踏み、減速しているにも関わらずエンジンの回転数が上昇し、加速するような動作となる。
305,2021年05月05日,広島,ＨＰ,マツダ,ＣＸ－３０,2020年02月,不明,3AA-DMFP,HF-MK,保安灯火,２０２０年,シートポジションメモリー機能使用時、リバース連動ドアミラー使用時からの復帰などで規定の位置へミラーが戻らない。
306,2021年05月05日,広島,ＨＰ,マツダ,ＣＸ－３０,2020年02月,不明,3AA-DMFP,HF-MK,保安灯火,２０２０年,フェリー降車時の夜中の走行時に光軸が１０ｍくらいに下がり走行出来なくなった。
307,2021年05月04日,岩手,ＨＰ,マツダ,ＣＸ－８,2019年01月,"100,571 Km",3DA-KG2P,SH,乗車装置,２０２０年１２月頃から,パワーリフトゲートを開けた後、ゲートが所定の位置を維持できずに徐々に下がってくる。
308,2021年05月04日,長崎,ＨＰ,ホンダ,ＣＢＲ６５０Ｒ,2020年05月,"7,777 Km",2BL-RH03,RH03E,エンジン,２０２１年４月２０日,エンジン下部のウォーターポンプの取り付け面と思われるところからオイルが漏れている。
309,2021年05月03日,長野,ＨＰ,ホンダ,アコード,2021年01月,不明,6AA-CV3,LFB-H4,電気装置,２０２１年４月２５日,補機バッテリーの充電不良により、一般道路を走行中、１２Ｖバッテリー異常の警告が表示され、すぐに停車するよう警告が表示された。ディーラーでパワーコントロールユニット（ＤＣ－ＤＣコンバータ）を交換したところ、給電されるようになった。
310,2021年05月03日,東京,ＨＰ,レクサス,ＲＸ４５０ｈ,2014年04月,"42,794 Km",DAA-GYL10W,2GR-4JM,電動機(モーター),２０２１年３月,ハイブリッドシステムチェック／ナビー・ブレーキアシストシステムチェックアラートが表示される。
311,2021年05月03日,滋賀,ＨＰ,メルセデス・ベンツ,Ｃ２００,2015年03月,"53,500 Km",RBA-205042,274,排ｶﾞｽ･騒音,２０１９年１月　２０２０年８月　２０２１,ＮＯｘセンサーの不良により、走行中にエンジンチェックランプが点灯した。
312,2021年05月03日,奈良,ＨＰ,メルセデス・ベンツ,Ｖ２２０ｄ,2015年12月,"55,000 Km",LDA-447811,651,緩衝装置,２０２１年１月,一般道走行中（高速道路でも）リアの挙動がふらつく。最近はフロントも運転していて非常に神経質になる程ショックアブソーバーのヘタリを感じる。
313,2021年05月02日,神奈川,ＨＰ,ホンダ,スーパーカブ１１０,不明,"8,300 Km",JA07,不明,動力伝達,２０２１年４月,１速からシフトチェンジをした際に２速に入らない。
314,2021年05月02日,埼玉,ＨＰ,ボルボ,Ｓ６０,2011年11月,"45,500 Km",DBA-FB4164T,B4164T,動力伝達,２０２１年３月頃,トランスミッションがギア抜けし、信号停止後に発進できず空ぶかし状態になった。その後、エンジンの回転数が高い状態でギアが繋がり、後ろから蹴られたような衝撃が発生した。
315,2021年05月02日,愛知,ＨＰ,ニッサン,セレナ,2015年07月,"45,685 Km",DAA-HFC26,MR20-SM23,動力伝達,２０２１年４月２３日,Ｄレンジで２０ｋｍ／ｈぐらいまでの加速時にガクガクする。Ｄレンジで５５ｋｍ／ｈ一定速でもガクガクする。
316,2021年05月02日,愛知,ＨＰ,スズキ,ジムニー,2020年03月,"11,186 Km",3BA-JB64W,R06A,動力伝達,２０２１年１月１２日,マニュアルトランスミッション車で１速・２速・３速・バックギアの入りが悪い。自分でミッションを下ろして点検したところ、クラッチのインプットシャフトとクラッチレリーズベアリングにクラッチグリスが塗られていない事を確認した。
317,2021年05月02日,愛知,ＨＰ,マツダ,ＣＸ－３,2017年02月,"17,600 Km",LDA-DK5FW,S5,エンジン,２０２１年４月末,高速道路で本線に合流するために加速したところ、６０ｋｍ／ｈくらいの速度から車体が振動し始め、加速できず、ウォーニングランプが点灯した。
318,2021年05月02日,鹿児島,ＨＰ,ニッサン,セレナ　Ｓ－ＨＹＢＲＩＤ,2012年12月,"68,000 Km",DAA-HFC26,MR20-SM23,電気装置,不明,オルタネーターの不具合によりガタガタと異音がする。
319,2021年05月01日,青森,ＨＰ,ボルボ,Ｖ５０,2012年01月,"50,500 Km",CBA-MB4204S,B4204S,動力伝達,２０２１年４月,走行中、トランスミッション性能低下のメッセージが表示され、アクセルペダルを踏んでも加速せず、減速して停止した。
320,2021年05月01日,東京,ﾌﾘｰﾀﾞｲｱﾙ,トヨタ,アルファード,2021年01月,"1,970 Km",3BA-AGH30W,2AR,車枠・車体,２０２１年４月１０日,ボンネット先端のモールの取り付けが悪く、ボンネットを傷つけて塗装が剥がれた。
321,2021年05月01日,神奈川,ＨＰ,トヨタ,ヴェルファイア,2010年01月,"144,938 Km",DBA-ANH25W,2AZ,車枠・車体,２０２１年１月,シャイニングホワイトの塗装がパリパリとまるでフィルムのように剥がれ出し、どんどん広がり下地の灰色面が露出。剥がれ続けている。
322,2021年05月01日,千葉,ＨＰ,ハーレーダビッドソン,ソフテイルデラックスＣＶＯ,2015年07月,"62,000 Km",TF9,9,エンジン,１回目は２０１７年、２回目は２０２０年１,一般道を走行中にエンジン警告灯が点灯し、エンジンから異音が発生した。エンジン内の可動する部分のベアリングが破損して、他の部品に接触して音がしているということでエンジンを交換したが、再発した。
323,2021年05月01日,茨城,ＨＰ,ニッサン,ノートｅ－ＰＯＷＥＲ,2018年06月,"20,000 Km",DAA-HE12,HR12-EM57,保安灯火,２０１９年６月,ヘッドライトの内側に液垂れのような縦筋状の線ができた。
324,2021年05月01日,福井,ＨＰ,メルセデス・ベンツ,Ｅ４００　ＨＹＢＲＩＤ,2014年03月,"70,200 Km",DAA-212095C,276-21227,制動装置,２０２０年１２月２７日　２０２１年１月２,ＥＳＰコントロールユニットの不良により、走行中に突然警告文が表示された。道路を走行中に突然メーターパネルに「アクティブラインドスポット現在使用できません」「プレセーフ機能が現在制限されています」「作動できません（ａｂｓの警告ランプ、ｅｓｐの警告ランプが点灯）」と表示された。
325,2021年05月01日,広島,ＨＰ,スバル,レヴォーグ,2014年08月,"82,000 Km",DBA-VM4,FB16,動力伝達,２０２１年３月頃から,ＣＶＴの不良により、走行時、ガラガラ音がする。
326,2021年05月01日,福岡,ＨＰ,トヨタ,プリウス,2017年04月,"43,569 Km",DAA-ZVW50,2ZR-1MN,保安灯火,２０２０年２月２６日,テールレンズの主にクリア部分に白濁したくもりがある。
