番号,受付日,住所,申告方法,車名,通称名,初度登録年月,総走行距離,型式,原動機型式,不具合装置,発生時期,申告内容の要約
181,2021年05月16日,千葉,ＨＰ,ニッサン,エクストレイル,2013年12月,"72,000 Km",DBA-NT32,MR20,動力伝達,２０２１年５月,ＣＶＴの不具合により、走行中に黄色いエンジンマークがついてアイドリングストップ異常の警告がメーターの液晶画面に表示された。
182,2021年05月16日,埼玉,ＨＰ,ダイハツ,ムーヴコンテカスタム,2013年05月,"67,168 Km",DBA-L575S,KF,動力伝達,２０２１年５月１２日１８時,１年定期点検を２１年５月２日に済ませた車両で、１０日後にロードサービスにてドライブシャフトブーツグリス漏れを指摘された。
183,2021年05月16日,埼玉,ＨＰ,ヤマハ,ＸＶＳ９５０,2018年03月,"20,614 Km",EBL-VN04J,N605E,かじ取り,２０１９年４月,ヘルメットのシールドを下ろそうとして片手運転した２～３秒で、転倒しそうなほどの尋常ではないハンドルの揺れが起こった。
184,2021年05月16日,奈良,ＨＰ,三菱,ｅＫワゴン,2017年06月,"20,000 Km",DBA-B11W,3B20,エンジン,２０２１年４月,走行中失速し、アクセルペダル踏んでもスピード上がらなくなった。
185,2021年05月15日,千葉,ＨＰ,ニッサン,ノート,2016年02月,"46,000 Km",DBA-E12,HR12,エンジン,２０２１年５月１１日,メーターパネルに警告灯が色々表示された後、エンジンが停止して走行不能になった。
186,2021年05月15日,福井,ＨＰ,メルセデス・ベンツ,Ｅ４００　ＨＹＢＲＩＤ,2014年03月,"70,200 Km",DAA-212095C,276-21227,電気装置,２０２１年４月３０日,ヨーレートセンサー不良により、走行中に突然マルチファンクションディスプレイに「ＡＢＳ、ＥＳＰ作動できません」「タイヤ空気圧警告システム作動できません」「アクティブブラインドスポット作動できません」「アクティブブレーキアシスト作動できません」「プレセーフ機能制限されています」と表示された。
187,2021年05月15日,鳥取,ＨＰ,三菱,ＭＩＮＩＣＡＢ－ＭｉＥＶ,2017年09月,"10,300 Km",ZAB-U68V,Y51,車枠・車体,２０２１年,車体が歪み、真っすぐ走らなくなってしまった。
188,2021年05月15日,大分,ＨＰ,トヨタ,ランドクルーザープラド,2018年09月,"70,000 Km",LDA-GDJ150W,1GD,排ｶﾞｽ･騒音,２０２１年５月９日,アドブルーポンプの不具合により、アドブルー補充後、３０００ｋｍ程でアドブルー補充表示がされ、メーターパネル上にエンジン警告灯、スリップ警告灯が点灯した。
189,2021年05月14日,宮城,ＨＰ,ＢＭＷ,２１８ｉ　ＡｃｔｉｖｅＴｏｕｒｅｒ,2017年01月,"10,000 Km",DBA-2A15,B38A15A,制動装置,不明,エンジン停止時に「動き出し注意」の警告ランプが点灯する。
190,2021年05月14日,新潟,ﾌﾘｰﾀﾞｲｱﾙ,三菱,アウトランダー,2008年10月,"178,800 Km",DBA-CW5W,4B12,エンジン,２０２１年５月,国４１６９（補機駆動ベルト用オートテンショナー）のリコール通知が来ないうちにベルトテンショナー本体が割れた。
191,2021年05月14日,東京,ＨＰ,ホンダ,フィット,2014年09月,"40,300 Km",DBA-GK3,L13B,エンジン,２０２０年ごろから,交差点にてアイドリングストップ後、ブレーキを放してもエンジンが再始動しなかった。
192,2021年05月14日,東京,ﾌﾘｰﾀﾞｲｱﾙ,ランドローバー,レンジローバー　Ｅｖｏｑｕｅ,2018年11月,"14,900 Km",DBA-LV2XB,PT204,動力伝達,２０２１年９月,デファレンシャルの不具合により、ハンドルを切るとガガガと異音が出る。
193,2021年05月14日,神奈川,ＨＰ,ホンダ,Ｎ－ＷＧＮ,2019年08月,不明,6BA-JH3,S07B,制動装置,２０２１年３月１８日,２１時頃、一般道を５０ｋｍ／ｈ走行中に前方車両無い交差点進入時突然に衝突軽減ブレーキが作動し急停止、頸椎胸椎のむち打ち状態になった。
194,2021年05月14日,神奈川,ＨＰ,ニッサン,スカイライン,2016年07月,"15,000 Km",DAA-HV37,VQ35-HM34,電気装置,購入して少ししたら,右前スピーカーが鳴ったり鳴らなかったりする。
195,2021年05月14日,埼玉,ＨＰ,ホンダ,ＦＩＴ　ＣＲＯＳＳＴＡＲ,2020年10月,"1,800 Km",6AA-GR6,LEB-H5,車枠・車体,２０２１年２月２３日,強風注意報発令下、一般道走行中にフォグ取付ガーニッシュ前方上部にある牽引口カバーが脱落した。
196,2021年05月14日,埼玉,ＨＰ,フォルクスワーゲン,ゴルフ　ＧＴ－ＴＳＩ,2007年10月,"66,000 Km",ABA-1KBLG,BLG,エンジン,２０２１年５月４日,タイミングチェーンの伸びにより、メーターパネルに警告灯が点いた。
197,2021年05月14日,茨城,ＨＰ,三菱,ふそうキャンター,2016年10月,"266,091 Km",TPG-FEB50,4P10,エンジン,２０２１年５月７日,走行中エンジン警告灯、ＥＮＧ－ＳＹＳが点灯し、故障診断リセットが出来ない。
198,2021年05月14日,愛知,ＨＰ,ニッサン,セレナ,2002年03月,"112,996 Km",UA-TC24,QR2O,エンジン,２０２０年９月１８日,スパークプラグ長寿命タイプ（タクティーＶＫＨ１６）に交換し、２６０００ｋｍしか使用していないのに、スパークプラグがまた交換に成った。
199,2021年05月14日,愛知,ＨＰ,ＢＭＷ,Ｒ１２００ＧＳ,2014年09月,"49,300 Km",EBL-R12NA,122EN,制動装置,２０２１年５月１日,ブレーキレバーのみでブレーキ操作を繰り返すと、ＡＢＳ装置のエア噛みにより、ブレーキペダルが操作できなくなる。
200,2021年05月14日,岐阜,ＨＰ,マツダ,ＭＡＺＤＡ３,2020年07月,"4,749 Km",3AA-BPEP,HF-MK,保安灯火,新車納車時から,左にウインカーを出し、左折後、右方向にハンドルを戻す際、素早くハンドルを戻すと右ウインカー作動の位置までレバーが勝手に動く。
201,2021年05月14日,三重,ﾌﾘｰﾀﾞｲｱﾙ,ダイハツ,ミライース,2014年10月,"80,500 Km",DBA-LA300S,KF,制動装置,不明,ＡＢＳアクチュエーターの不良により、警告灯が点灯するようになった。
202,2021年05月14日,大分,電話,トヨタ,アルファード,2009年09月,"104,800 Km",DBA-ANH20W,2AZ,車枠・車体,不明,天井の塗装が剥がれた。
203,2021年05月14日,大分,電話,トヨタ,アルファード,2010年04月,"147,300 Km",DBA-GGH20W,2GR,車枠・車体,不明,天井の塗装が剥がれた。
204,2021年05月13日,北海道,ＨＰ,スズキ,スペーシアカスタム,2017年06月,"11,617 Km",DAA-MK42S,R06A-WA04A,動力伝達,２０２１年５月１１日,右折待ちの停車から発進時、アクセルペダルを踏んでも回転数が上がらずクリープ現象でしか進まなくなる。
205,2021年05月13日,宮城,ＨＰ,いすゞ,フォワード,2006年09月,"135,800 Km",ADG-FRR90C3S,4HK1,排ｶﾞｽ･騒音,２０２１年５月,ＤＰＤ（粒子状物質除去装置）の不良によりエンジンチェックランプが点灯し、黒煙が排気される。
206,2021年05月13日,青森,ＨＰ,三菱,ふそうスーパーグレート,2017年02月,"410,000 Km",QKG-FV60VJR 改,6R10,エンジン,２０２１年３月頃から,エンジンオイルパンの亀裂によるオイル漏れが複数回発生している。
207,2021年05月13日,山形,ＨＰ,ダイハツ,タント,2005年02月,"119,700 Km",6BA-LA650S,K6A,電気装置,不明,右フロントタイヤハウス付近のハーネスの防水性能が不十分でハーネスの短絡等が発生する。
208,2021年05月13日,東京,ＨＰ,その他,グラフィットｇｒａｆｉｔ　ＬＯＭスクーター,2021年05月,12 Km,LOM-01,不明,保安灯火,購入し、使用直後より,バックミラーが固定されず、走行時の振動ですぐに緩んでしまい後方確認が不能になる。
209,2021年05月13日,東京,ＨＰ,日野,プロフィア,2019年11月,"59,000 Km",2PG-SH1EDGG,E13C,エンジン,２０２１年４月１５日,新車で購入し、１年５カ月目、走行距離５８０００Ｋｍで燃料タンク真ん中辺りより亀裂が生じ、燃料が漏れた。
210,2021年05月13日,埼玉,ﾌﾘｰﾀﾞｲｱﾙ,その他,ＬＯＭ,2021年04月,不明,LOM-01,不明,走行装置,不明,走行中タイヤのバルブが破損し、走行不能になった。
211,2021年05月13日,茨城,ﾌﾘｰﾀﾞｲｱﾙ,ランドローバー,レンジローバーイヴォーク,2016年12月,"30,000 Km",CBA-LV2A,204PT,制動装置,不明,走行中にブレーキブースターが破損したため、ブレーキペダルが途中で引っかかり、硬くて踏み込めなくなった。
212,2021年05月13日,群馬,ﾌﾘｰﾀﾞｲｱﾙ,マツダ,フレア,2013年01月,"15,000 Km",DBA-MJ34S,R06A,保安灯火,不明,エンジン始動時に右前照灯がオートで点かず、再始動すると点灯する。
213,2021年05月13日,愛知,ﾌﾘｰﾀﾞｲｱﾙ,ダイハツ,トール,2020年03月,不明,DBA-M900S,1KR,車枠・車体,不明,新車購入当初からバンパーに傷があった。
214,2021年05月13日,静岡,ＨＰ,三菱,デリカＤ５,2018年08月,"55,000 Km",LDA-CV1W,4N14,エンジン,４００００ｋｍ走行後、ＡＴオイル交換後く,アクセルペダルを離すとエンジンブレーキが掛かるはずの走行状態にもかかわらず、エンジンブレーキが全く効かず、エンジン回転数がアイドリング程度に落ちてしまう。
215,2021年05月13日,静岡,ﾌﾘｰﾀﾞｲｱﾙ,ニッサン,ノート,2012年01月,不明,DBA-E12,HR12,エンジン,５／６,スーパーチャージャーにエアーを供給するパーツが破損し、走行中にエンジンストールが発生した。
216,2021年05月13日,静岡,ﾌﾘｰﾀﾞｲｱﾙ,ニッサン,ノート,2015年12月,"38,000 Km",DBA-E12,HR12,エンジン,２０２１年５月１日,スーパーチャージャーにエアーを供給するパーツが破損したため、高速道路を走行中にエンジンがストールし、出力を失った。トンネルを走行中だったが、なんとかトンネル出口までたどり着き、緊急停車した。
217,2021年05月13日,静岡,ﾌﾘｰﾀﾞｲｱﾙ,ダイハツ,ムーヴ,2015年03月,"28,330 Km",DBA-LA150S,KF,保安灯火,中古車で購入当初から,バックカメラが映している向きがおかしく、自分の車両のナンバープレートが写っている。
218,2021年05月13日,大阪,ﾌﾘｰﾀﾞｲｱﾙ,フォルクスワーゲン,ポロ,2010年06月,不明,DBA-6RCBZ,CBZ,その他,不明,バッテリー交換したらナビがつかなくなった。
219,2021年05月13日,岡山,ＨＰ,スズキ,アルトワークス,2016年07月,"62,400 Km",DBA-HA36S,R06A,車枠・車体,不明,ダッシュボードが熱で膨張・収縮を繰り返す事で固定部分付近から裂けていく。
220,2021年05月13日,高知,ＨＰ,スマート,フォーツー,2011年04月,"70,000 Km",CBA-451380,3B21,制動装置,２０２１年１月,交差点を右折するべく、１０～２０ｋｍ／ｈ程度で右折車線へ進入し、停止しようとしたところ、ブレーキがきかず、前方の右折待ちしている車両に衝突した。
221,2021年05月12日,北海道,ﾌﾘｰﾀﾞｲｱﾙ,フォルクスワーゲン,ゴルフ,2011年10月,"105,000 Km",DBA-1KCAV,CAV,燃料装置,不明,エンジンルームにある燃料ポンプからエンジンオイルの経路に燃料が漏れており、オイルの警告灯が点灯したり、信号待ちで、エンスト、アイドリング不調の症状が出ている。
222,2021年05月12日,青森,ＨＰ,三菱,ふそうスーパーグレート,2016年11月,"380,200 Km",QKG-FV60VJR,6R10,エンジン,２０１９年１月～２０２１年５月,樹脂製オイルパンに亀裂が生じてオイル漏れした。新品に交換をしたが、交換後も亀裂が発生し、補修を繰り返している。
223,2021年05月12日,青森,ＨＰ,三菱,ふそうスーパーグレート,2019年01月,"215,000 Km",2KG-FV70HJR,6R20,排ｶﾞｽ･騒音,２０２１年４月１２日,ＰＣＶオイルセパレータからのオイルが漏れ、マフラー（ＤＰＤ）のパイプ等高温部に付着して煙と異臭がして停車した。
224,2021年05月12日,新潟,ﾌﾘｰﾀﾞｲｱﾙ,ニッサン,エルグランド,2011年04月,"80,000 Km",DBA-PE52,VQ35,車枠・車体,半年前に発見,ダッシュボードの助手席側エアバッグが設置されている表面部分に亀裂が発生した。
225,2021年05月12日,東京,ＨＰ,三菱,ふそうキャンター,2019年12月,不明,2PG-FEB50,4P10,排ｶﾞｽ･騒音,２０２０年２月,アドブルーのレベルインジケーターランプの減る割合が均等でなく、４つのうち１つ目のランプが消えるまでが異常に長く、２つ目と３つ目が同時に消えるまでが異常に短い。
226,2021年05月12日,愛知,ＨＰ,ＢＭＷ,ＭＩＮＩ　クラブマン,2015年10月,"45,000 Km",DBA-LN15,B38A15A,動力伝達,２０２１年４月末,エンジンを停止した際に「車両動き出し注意」の警告が突然出るようになった。
227,2021年05月12日,愛知,ﾌﾘｰﾀﾞｲｱﾙ,ニッサン,エクストレイル,2015年09月,"50,000 Km",DBA-NT32,MR20,電気装置,２０２１年５月,オルタネーターから異音が出るようになった。
228,2021年05月12日,静岡,ＨＰ,フォルクスワーゲン,ゴルフ　ヴァリアント,2015年01月,"140,000 Km",DBA-AUCHP,CHP,動力伝達,２０２１年２月,小物入れに手れる時に、手前にあるシフトプレートに触れたところ、負傷し、出血した。確認するとシフトプレートのメッキの一部が剥がれ浮いていた。
229,2021年05月12日,静岡,ﾌﾘｰﾀﾞｲｱﾙ,日野,デュトロ,不明,不明,SD2-32,不明,車枠・車体,不明,３ｔ車用ローダーダンプで、シリンダーケースのヘッドのネジがカシメ作業不良により変形しており、早期にオイルが漏れる。
230,2021年05月12日,福井,ＨＰ,ホンダ,Ｎ－ＢＯＸ,2012年07月,"66,000 Km",DBA-JF2,S07A,エンジン,２０２１年３月,タイミングチェーンのずれにより、ＰＧＭ－ＦＩ警告灯とＶＳＡ警告灯が点灯した。
231,2021年05月12日,福井,ﾌﾘｰﾀﾞｲｱﾙ,トヨタ,ヴェルファイア,2011年11月,"95,900 Km",DBA-ANH20W,2AZ,エンジン,不明,エンジンオイルが著しく消費するようになった。
232,2021年05月12日,福岡,ﾌﾘｰﾀﾞｲｱﾙ,トヨタ,カローラツーリング,2021年03月,不明,3BA-ZRE212W,2ZR,制動装置,不明,バックで駐車する際、後方に異常がないのにも関わらず自動ブレーキが不要作動し、車が急停止する。この際、警告音が出ずに突然停止したこともある。
233,2021年05月12日,鹿児島,電話,トヨタ,トヨエース,2017年12月,"42,200 Km",QDF-KDY231,1KD,排ｶﾞｽ･騒音,不明,新車から３年しか経ってないが黒煙が多量に出ている。
234,2021年05月12日,鹿児島,ﾌﾘｰﾀﾞｲｱﾙ,ダイハツ,キャスト,2018年02月,"12,700 Km",DBA-LA250S,KF,乗車装置,不明,運転後、シートレールを後方へ動かそうとすると引っかかる。
235,2021年05月11日,福島,ﾌﾘｰﾀﾞｲｱﾙ,三菱,ふそうキャンター,2012年12月,"198,000 Km",TKG-FEA80,4P10,エンジン,不明,走行中にガタガタとなってエンストした。ディーラーで確認したところ、エンジンのロッカーアームが破損し、カムが中に落ちていると診断された。
236,2021年05月11日,東京,ﾌﾘｰﾀﾞｲｱﾙ,ＢＭＷ,ＭＬ３５０　ブルーテック,2015年10月,"50,700 Km",LDA-166024,642,排ｶﾞｽ･騒音,不明,アドブルーポンプの不良により、車検整備から戻って１か月目に排気ガスがアンモニアのような臭いがし、マフラーからは黒煙が噴き出した。
237,2021年05月11日,東京,ﾌﾘｰﾀﾞｲｱﾙ,ＢＭＷ,ＭＬ３５０　ブルーテック,2015年10月,"50,700 Km",LDA-166024,642,排ｶﾞｽ･騒音,２０２０年１２月末、２０２１年１月,ＮＯｘセンサーの不良により、高速道路を走行中にエンジン警告灯が点いた。
238,2021年05月11日,神奈川,ＨＰ,トヨタ,シエンタ,2009年05月,"31,200 Km",DBA-NCP81G,1NZ,車枠・車体,購入した３ヶ月後,ドアの塗装が剥がれた。最近は屋根も５００円玉以上の大きさで２か所剥がれ、他にも何ヶ所も剥がれてきている。
239,2021年05月11日,神奈川,ＨＰ,マツダ,ＣＸ－８,2021年02月,"3,000 Km",3DA-KG2P,SH,電気装置,２０２１年４月５日,なんの前触れも無く突然バッテリーが完全に上がった。
240,2021年05月11日,神奈川,ﾌﾘｰﾀﾞｲｱﾙ,マツダ,ＣＸ－３０,不明,40 Km,5BA-DMEP,不明,乗車装置,不明,ドアを開けている累積時間によってバッテリー充電量に関係なく警告音・警告灯点灯する。
241,2021年05月11日,埼玉,ﾌﾘｰﾀﾞｲｱﾙ,ボルボ,ＸＣ６０,2011年10月,"105,000 Km",CBA-DB4204TXC,B4204T,動力伝達,不明,ＤＣＴの不具合により、偶数速に入らない。
242,2021年05月11日,栃木,ＨＰ,マツダ,ＣＸ－５,2012年10月,"77,972 Km",LDA-KE2FW,SH,電気装置,２０２１年５月５日,夜に走っていたらエンジンから異音が発生してバッテリー異常とメーター警告した。ボンネット開けて見たらオルタネーターのプーリーが外れていた。
243,2021年05月11日,愛知,ＨＰ,トヨタ,プリウス,2016年11月,"48,000 Km",DAA-ZVW51,2ZR-1NM,保安灯火,２０２０年１２月,突然テールランプの内部が白く濁った。
244,2021年05月11日,愛知,ﾌﾘｰﾀﾞｲｱﾙ,スズキ,ワゴンＲ,2019年07月,不明,DAA-MH55S,R06A-WA05A,エンジン,不明,セルモーターが回ってエンジンが始動するまでに時間がかかり、７秒かかることがある。
245,2021年05月11日,岐阜,ＨＰ,ニッサン,セレナ,2013年03月,"75,500 Km",DAA-HC26,MR20-SM23,車枠・車体,不明,フロントピラー部の塗装がはがき大以上の大きさで剥がれている。他にフードの塗装も剥がれている。
246,2021年05月11日,大阪,ﾌﾘｰﾀﾞｲｱﾙ,プジョー,５００８,不明,不明,LDA-P87AH01,不明,エンジン,２０２１年４月,高速道路走行中、大きな音がしてエンストした。
247,2021年05月11日,京都,ﾌﾘｰﾀﾞｲｱﾙ,三菱,ふそうキャンター,2016年11月,"100,000 Km",TPG-FEA50,4P10,エンジン,不明,走行中大きな音がしてエンストする。警告灯は点灯しない。
248,2021年05月11日,岡山,ＨＰ,ホンダ,Ｎ－ＢＯＸ,2014年03月,"32,000 Km",DBA-JF1,S07A,動力伝達,不明,ＣＶＴから異音がするようになった。
249,2021年05月11日,沖縄,電話,ニッサン,ＮＶ２００　バネット,2016年09月,不明,DBF-VM20,HR16,車枠・車体,最近,ルームランプカバーから滝のように水が流れ込むように雨漏りが発生した。
250,2021年05月10日,北海道,ＨＰ,トヨタ,アルファード,2010年01月,"107,000 Km",DBA-GGH25W,2GR,車枠・車体,２０２１年５月,ホワイトパール色塗装の車でルーフの一部塗装が剥がれた。
251,2021年05月10日,新潟,ﾌﾘｰﾀﾞｲｱﾙ,ホンダ,フィットハイブリッド,2014年03月,"48,000 Km",DAA-GP5,LEB-H1,動力伝達,２０２１年４月２７日,トランスミッションの不良により、一時停止後に強制的にギアがパーキングレンジに入り、メーター横に複数の点検表示が出て、シフトがＰから変わらなくなった。
252,2021年05月10日,千葉,ﾌﾘｰﾀﾞｲｱﾙ,トヨタ,ランドクルーザープラド,2015年09月,"25,000 Km",LDA-GDJ150W,1GD,排ｶﾞｽ･騒音,２０２１年５月９日発見,アドブルータンク・ポンプアッセンブリーから、アドブルーが漏れた。
253,2021年05月10日,埼玉,ﾌﾘｰﾀﾞｲｱﾙ,トヨタ,ノア,2014年02月,"38,000 Km",DBA-ZRR85G,3ZR,動力伝達,不明,ＣＶＴの内部不良により、アクセルペダルを踏み込んだ際にガラガラと異音が出るようになった。
254,2021年05月10日,茨城,ﾌﾘｰﾀﾞｲｱﾙ,スズキ,スペーシア,2020年05月,不明,DAA-MK53S,R06A-WA05A,その他,不明,走行中に自車の進行方向と無関係なところを含めて進入禁止警告がむやみに表示される。
255,2021年05月10日,茨城,ﾌﾘｰﾀﾞｲｱﾙ,スズキ,スペーシア,2020年05月,不明,DAA-MK53S,R06A-WA05A,制動装置,３月２９日１回、５月８日２回,走行中に被害軽減ブレーキが不要作動する。
256,2021年05月10日,静岡,ＨＰ,ニッサン,デイズルークス,2016年10月,"71,200 Km",DBA-B21A,3B20,保安灯火,２０２１年１月中旬,運転席側のドアミラーが格納できなくなった。
257,2021年05月09日,北海道,ＨＰ,三菱,アウトランダーＰＨＥＶ,2016年02月,"53,000 Km",DLA-GG2W,4B11-S61-Y61,制動装置,２０２１年５月５日,音がカランカランとなり、ブレーキシステム異常と表示、ブレーキが効きにくくなった。ディーラーでの確認で、左後輪のブレーキキャリパーが外れたものと診断された。
258,2021年05月09日,東京,ＨＰ,ＢＭＷ,２１８ｄ　Ｍスポーツ,2016年06月,"79,000 Km",LDA-2E20,B47C20A,動力伝達,２０２０年１１月,１時間程度経過すると、ドライブトレーン異常表示が点灯し、慎重に走行してくださいとの表示が出る。最大駆動力は使用できませんとの表示もある。
259,2021年05月09日,神奈川,ＨＰ,ルノー,ルーテシア４,2014年03月,"55,500 Km",ABA-RH5F,H5F,動力伝達,２０２１年５月８日,メーターにＣＨＥＣＫ　ＡＵＴＯＧＥＡＲ　ＢＯＸとＣＨＥＣＫ　ＡＮＴＩ－ＰＯＬＬＵＴＩＯＮ　ＳＹＳＴＥＭというメッセージと、エンジンマークとスパナマークが表示され、１、３速のギアに入らなくなった。発進時は駆動力が通常より低下し、交差点の右折時に発進出遅れで怖い思いをした。
260,2021年05月09日,大阪,ＨＰ,トヨタ,エスティマ,2006年03月,"139,200 Km",DBA-ACR50W,2AZ,かじ取り,２０２１年４月１０日,パワーステアリングの不良により、駐車後、エンジンを再始動し、発進しようとしたところ、ハンドルが重すぎて操作することができず、安全に走行できないと判断し、レッカー搬送依頼をした。メーターパネルを確認するとハンドル操作に関係した警告表示が点灯していた。
261,2021年05月09日,奈良,ＨＰ,マツダ,ＭＡＺＤＡ３,2019年12月,"6,590 Km",3AA-BPEP,HF-MK,電気装置,２０２１年５月３日,荷物の積み込みで頻繁にドアを開け閉めしたら、バッテリーが上がった。
262,2021年05月09日,福岡,ＨＰ,ニッサン,セレナＳハイブリッド,2013年03月,"117,810 Km",DAA-HFC26,MR20-SM23,動力伝達,２０２０年３月末頃,オルタネーターの不良により、通勤中にエンジンから異音が発生し、３日後にはけたたましい音に変わったため修理を販売店で実施した。
263,2021年05月08日,北海道,ＨＰ,フォルクスワーゲン,ゴルフＲ,2011年05月,"74,000 Km",ABA-1KCDLF,CDL,緩衝装置,２０２１年５月,右リアコイルスプリングが折れた。
264,2021年05月08日,福島,ＨＰ,ホンダオブザユーケー,シビックハッチバック,2018年03月,"20,556 Km",DBA-FK7,L15C,制動装置,２０２１年５月７日,見通しの良い片側２車線道路において、障害物がないのにも関わらずＣＭＢＳが誤作動し、メーターパネルに接近警告と警告音が発報。その直後、ブレーキペダルを踏んでいたにもかかわらず、緊急停止が作動した。
265,2021年05月08日,岩手,ＨＰ,ホンダ,フィット,2014年04月,"46,152 Km",DBA-GK4,LB13,車枠・車体,２０２１年５月８日,雨漏りで助手席フロアに１０ｃｍ以上の水溜まりができた。
266,2021年05月08日,山形,ＨＰ,スズキ,ワゴンＲスティングレーＸ,不明,不明,DBA-MH22S,不明,保安灯火,購入時から,ブレーキ・テールランプのアース線不良により不点灯になる。
267,2021年05月08日,東京,ＨＰ,トヨタ,ＳＯＲＡ,2019年02月,"58,400 Km",ZBC-MUM1NAE,4JM-4JM,保安灯火,２０２０年１１月１日,車両点検中、側面窓ガラスがボディーから剥離しているのを発見した。
268,2021年05月08日,東京,ＨＰ,トヨタ,ＳＯＲＡ,2019年02月,"52,600 Km",ZBC-MUM1NAE,4JM-4JM,保安灯火,２０２０年７月１８日,車両点検中、側面窓ガラスがボディーから剥離しているのを発見した。
