番号,受付日,住所,申告方法,車名,通称名,初度登録年月,総走行距離,型式,原動機型式,不具合装置,発生時期,申告内容の要約
81,2019年03月23日,滋賀,ＨＰ,三菱,ふそうキャンター,1993年11月,"392,416 Km",U-FE439F,4D34,制動装置,２０１９年３月２０日,前日、峠越えでブレーキがゴロゴロと異音がした。翌日、街中の交差点でブレーキを踏んだら利かなくなった。
82,2019年03月22日,北海道,ＨＰ,ニッサン,オッティ,2007年10月,"73,000 Km",DBA-H92W,3G83,車枠・車体,２０１９年３月１７日,右後輪の緩衝装置上部にあるフレームが腐食により破断し、足回りが後ろにズレた。
83,2019年03月22日,北海道,ﾌﾘｰﾀﾞｲｱﾙ,トヨタ,ハリアーハイブリッド,2017年12月,"44,000 Km",DAA-AVU65W,2AR-2JM-2FM,制動装置,２０１９年２月２５日,約６０ｋｍ／ｈで走行中、前車に接近してしまったため、ブレーキをかけたが、意図したよりもブレーキが弱くしか効かず、前車に追突した。
84,2019年03月22日,北海道,ﾌﾘｰﾀﾞｲｱﾙ,スズキ,ワゴンＲ,2012年09月,"93,900 Km",DBA-MH34S,R06A,エンジン,不明,補機ベルトが頻繁に鳴く。整備工場で整備をしてもらったが、すぐに再発した。
85,2019年03月22日,宮城,ＨＰ,三菱,ｅＫカスタム,2016年11月,"6,850 Km",DBA-B11W,3B20,走行装置,２０１９年３月１３日,タイヤ交換において、適正な手順でボルトを仮締めした後、トルクレンチを用いて適正トルク内（適正値８８～１０８Ｎのところ、１００Ｎ）で増し締めしていたところ、左後輪の１本のハブボルトが破断した。
86,2019年03月22日,東京,ＨＰ,メルセデス・ベンツ,Ｂ１８０,2013年02月,"40,164 Km",DBA-246242,270,動力伝達,２０１９年３月１０日,左フロントアクスルシャフト・スプライン部の摩耗により、駆動伝達が出来ず、一時停止後、突然走行不能になった。
87,2019年03月22日,東京,ﾌﾘｰﾀﾞｲｱﾙ,スバル,レガシィ,2012年07月,"15,000 Km",DBA-BRG,FA20,かじ取り,不明,ステアリングギアボックスのユニバーサルジョイント部で、ガタが出るようになった。
88,2019年03月22日,神奈川,ﾌﾘｰﾀﾞｲｱﾙ,三菱,ふそうキャンター,2011年03月,"155,200 Km",SKG-FEA70,4P10,エンジン,不明,エンジンオイルキャップが破損したため、高速道路を走行中にオイルが吹き出し、エンジンが壊れてエンストした。
89,2019年03月22日,神奈川,ﾌﾘｰﾀﾞｲｱﾙ,アディバ,ＡＤ１　２００,2018年05月,不明,AD1,不明,車枠・車体,不明,坂道で左折をすると、車体が倒れ込み、転倒してしまう。
90,2019年03月22日,千葉,ＨＰ,ボルボ,Ｖ４０,2018年12月,200 Km,LDA-MD4204T,D4204T,エンジン,２０１９年３月２１日,エンジン性能が低下していますという表示が出て、車がガタガタしてエンストしそうになる。
91,2019年03月22日,茨城,ＨＰ,マツダ,ＡＺ－ワゴン,2011年11月,"47,200 Km",DBA-MJ23S,K6A,かじ取り,２０１８年１２月,ハンドルロック機構装置の不具合により、エンジンがかからなくなった。
92,2019年03月22日,愛知,ＨＰ,クライスラー,３００Ｓ,2015年10月,"28,000 Km",ABA-LX36,G,動力伝達,車検の車載コンピュータアップデート時,走行時に設定できる「ｓｐｏｒｔｓ」モードの表示がメータパネルに表示されないようになった。「ｓｐｏｒｔｓモード」の表示が確認できないので、変則的なギアチェンジにより走行が不安定になる。
93,2019年03月22日,愛知,ﾌﾘｰﾀﾞｲｱﾙ,ニッサン,スカイラインハイブリッド,2016年02月,不明,DAA-HV37,VQ35-HM34,電動機(モーター),不明,炎天下で、アスファルトの温度が高温になり、その影響でインバーターのＩＧＢＴ（絶縁ゲートバイポーラトランジスタ）が過熱すると、駆動モーターの出力トルク制限が行われるため、警告などの表示関係は何も出ないまま、５０ｋｍ／ｈくらいまでしか出なくなる。
94,2019年03月22日,福井,電話,トヨタ,ＲＡＶ４,2007年03月,"60,000 Km",DBA-ACA31W,2AZ,動力伝達,２０１９年２月,走行中にカーンという大きな音がしたので、修理工場に持って行ったところ、オートマチックトランスミッションのケースが割れていた。
95,2019年03月22日,大阪,ﾌﾘｰﾀﾞｲｱﾙ,フォルクスワーゲン,ティグアン,2018年12月,100 Km,LDF-5NDFGF,DFG,制動装置,購入直後から,前方に何もないところで、衝突被害軽減ブレーキの赤い警告が点く。
96,2019年03月22日,兵庫,ＨＰ,ＢＭＷ,１１６ｉ,2013年05月,"72,000 Km",DBA-1A16,N13B16A,燃料装置,２０１９年３月１７日,燃料ポンプの不良により、駐車場においてアイドリング状態で待機中に、エンジン回転数がバラついたと思ったら、エンジンが停止し、その後、再始動出来なくなった。
97,2019年03月22日,兵庫,ﾌﾘｰﾀﾞｲｱﾙ,三菱,ふそうキャンター,2014年08月,"150,000 Km",TKG-FEA60,4P10,エンジン,２０１９年３月１５日,走行中にエンジンが停まり、走行不能になった。
98,2019年03月22日,山口,ＨＰ,トヨタ,カムリハイブリッド,2012年09月,"40,000 Km",DAA-AVV50,2AR-2JM,電動機(モーター),２０１９年２月,インバーターの故障により、高速道路走行中にハイブリットシステムエラー表示が出て、エンジンが停止した。
99,2019年03月22日,福岡,ﾌﾘｰﾀﾞｲｱﾙ,ホンダ,Ｎ－ＢＯＸ,2014年09月,"50,000 Km",DBA-JF1,S07A,エンジン,今年に入ってから,アイドリングストップ後、エンジンが始動しないことが有り、始動操作をはじめからやり直すことになってしまう。
100,2019年03月22日,不明,電話,スズキ,アルト,不明,不明,不明,不明,エンジン,２０１９年３月２１日,信号待ちで停止中、突如エンジンが吹け上がり、ブレーキを踏んでいたにもかかわらず前進し、前方にいたバイクと接触した。
101,2019年03月21日,宮城,ＨＰ,フォルクスワーゲン,ゴルフヴァリアント,2012年02月,"76,000 Km",DBA-1KCAV,CAV,動力伝達,２０１９年３月２１日,ＤＳＧ（自動変速機）の不良により、走行中にメーターパネルに警告表示が現れてからタイヤに駆動力が伝わらなくなり、車両停車後には再発進不能になった。
102,2019年03月21日,千葉,ＨＰ,ニッサン,ルークス,2011年05月,"74,500 Km",DBA-ML21S,K6A,その他,２０１９年２月２４日,エアコンのコンプレッサーロックにより、走行中に突然激しくノッキングし、停止寸前になった。
103,2019年03月21日,島根,ＨＰ,ニッサン,ＮＶ３５０キャラバン,2016年12月,"39,000 Km",LDF-VW6E26,YD25,エンジン,２０１８年１月頃,冷却水のサブタンクの液量が著しく減る。
104,2019年03月21日,福岡,24時間電話,フォルクスワーゲン,パサートヴァリアント,不明,不明,不明,不明,動力伝達,２０１９年３月２０日,ＤＳＧ（自動変速機）のメカトロニクスの故障により、走行中に突然ギアが入らなくなり、走行不能になった。
105,2019年03月21日,福岡,ＨＰ,スバル,インプレッサスポーツ,2015年08月,"23,800 Km",DBA-GP7,BF20,緩衝装置,２０１９年３月１７日,アイサイトが動作し、右側前輪のみロックした直後にハンドルを右側に回すと、右側ストラット側あたりから　ゴトゴト音がする。
106,2019年03月20日,長野,ﾌﾘｰﾀﾞｲｱﾙ,スズキ,キャリイ,2013年04月,"50,000 Km",EBD-DA63T,K6A,エンジン,不明,愛車無料点検を受けた後、５速５０ｋｍ／ｈ～６０ｋｍ／ｈ位からアクセルを離して惰性減速する時の減速度が早くなった。
107,2019年03月20日,東京,ＨＰ,トヨタ,カムリ,不明,不明,DAA-AXVH70,不明,保安灯火,不明,ヘッドライトＡＳＳＹ内に、側方向けの白色反射板が入っているように見える。
108,2019年03月20日,東京,ﾌﾘｰﾀﾞｲｱﾙ,フォルクスワーゲン,クロストゥーラン,2013年07月,"60,000 Km",DBA-1TCTHW,CTH,緩衝装置,２週間くらい前,走行中に左前輪のサスペンションスプリングが折損した。
109,2019年03月20日,愛知,ＨＰ,ホンダ,バモス,不明,"154,000 Km",LA-HM1,E07Z,保安灯火,２０１５年１２月入手時より,ヘッドライトレンズの劣化、濁り、細かい亀裂により、光軸不良と光量不足になる。
110,2019年03月20日,大阪,ＨＰ,ホンダ,ＳＨＵＴＴＬＥハイブリッド,2018年01月,"3,800 Km",DAA-GP7,LEB-H1,エンジン,２０１９年３月１６日,ＰＧＭ－ＦＩ警告灯点滅後にアクセル全開状態でも、４０ｋｍ／ｈでしか走行できなくなった。
111,2019年03月20日,兵庫,ﾌﾘｰﾀﾞｲｱﾙ,ニッサンディーゼル,クオン,2002年07月,"100,500 Km",KK-MK25A,FE6,エンジン,不明,交差点の右折レーンでアクセル操作を緩めたところ、エンストし、走行不能になった。
112,2019年03月20日,鳥取,ﾌﾘｰﾀﾞｲｱﾙ,日野,レンジャー,2012年02月,"123,100 Km",SKG-FD7JLAG,J07E,エンジン,不明,シリンダーヘッドのガスケット部分からエンジンオイルが漏れた。
113,2019年03月20日,鳥取,ﾌﾘｰﾀﾞｲｱﾙ,日野,レンジャー,2012年02月,"123,100 Km",SKG-FD7JLAG,J07E,エンジン,２０１８年８月～９月,ターボチャージャーのアクチュエーター不良により、エンジン警告灯が点灯して５０～６０ｋｍ／ｈしか出なくなった。
114,2019年03月20日,熊本,ＨＰ,ボルボ,ＸＣ６０Ｒデザイン,2013年02月,"80,000 Km",CBA-DB4204TXC,B4204T,動力伝達,２０１８年１２月頃,走行中「トランスミッションセイノウテイカ」の表示が出て、ギアが抜けたようになる。バックギアにも入らなくなる。
115,2019年03月19日,新潟,ＨＰ,ニッサン,リーフ,2018年12月,"1,700 Km",ZAA-ZE1,EM57,電動機(モーター),購入後すぐ,時々ではあるが、加速がスムースでない。アクセル操作に反応していない時間がある。
116,2019年03月19日,富山,ＨＰ,スズキ,ＧＳＸ１３００Ｒ,2014年04月,"5,700 Km",EBL-GX72B,X704,保安灯火,２０１９年３月１９日,ヘッドライトハイビーム側のレンズが白濁して光量不足となり、車検に通らなくなった。
117,2019年03月19日,神奈川,ﾌﾘｰﾀﾞｲｱﾙ,スバル,エクシーガ,2012年07月,"50,200 Km",DBA-YAM,FB25,保安灯火,不明,右前照灯が時々消える。
118,2019年03月19日,埼玉,ＨＰ,ボルボ,Ｖ４０　Ｔ３,2016年05月,"24,000 Km",DBA-MB4154T,B4154T,エンジン,２０１９年３月１０日,交差点でアイドリングストップ後リスタートせず。シフトレバーが動かなくなり、エンジンスタート出来なくなった。警告が表示された。
119,2019年03月19日,埼玉,ﾌﾘｰﾀﾞｲｱﾙ,ニッサン,ＮＶ２００バネット,2018年08月,不明,DBF-VM20,HR16,乗車装置,不明,後部ドアや、スライドドアのしまりが悪く、強く閉めても半ドアになりやすい。
120,2019年03月19日,埼玉,ﾌﾘｰﾀﾞｲｱﾙ,スズキ,ハスラー,2017年01月,不明,DAA-MR41S,R06A-WA04A,エンジン,不明,車両の方向転換をするため、バックをして、前進しようとしたところ、突然車が急加速をし、暴走状態になった。
121,2019年03月19日,愛知,ＨＰ,メルセデス・ベンツ,Ａ１８０,2013年02月,"46,673 Km",DBA-176042,270,車枠・車体,２０１９年３月,雨漏りにより、運転席側リアシートの床が水浸しになった。
122,2019年03月19日,静岡,ﾌﾘｰﾀﾞｲｱﾙ,スズキ,スペーシア,2013年10月,"47,000 Km",DBA-MK32S,R06A,排ｶﾞｽ･騒音,不明,スチフナ（触媒フランジの固定プレート）の破断により、走行中にカラカラと異音が出る。
123,2019年03月19日,大阪,電話,いすゞ,フォワード,2014年04月,不明,TKG-FRR90S2,4HK1,エンジン,２０１９年３月１５日夜,車両を停車するためシフトをニュートラルにしたところ、エンジン回転がレッドゾーンまで急上昇し、回転数が下がらないまま大量の白煙が出た。その状態が１０分程度継続し、「ガラガラ」との異音がした後にエンジンが停止し、その後はエンジンがかからなくなった。
124,2019年03月19日,大阪,ﾌﾘｰﾀﾞｲｱﾙ,スズキ,ハスラー,2016年05月,"23,510 Km",DAA-MR41S,R06A-WA04A,エンジン,不明,エンスト防止のプログラム不良により、意図しない急加速・急発進をする。
125,2019年03月19日,兵庫,ﾌﾘｰﾀﾞｲｱﾙ,トヨタ,プリウス,2018年01月,不明,DAA-ZVW50,2ZR-1NM,保安灯火,不明,修理で交換後のフロントガラスにおいて、ガラスが曇った際にガラス内部で縞模様のシミのようなものが出る。
126,2019年03月19日,広島,ﾌﾘｰﾀﾞｲｱﾙ,トヨタ,ノア,2014年11月,"75,000 Km",DBA-ZRR85G,3ZR,動力伝達,中古購入直後,ＣＶＴ（無段変速機）の不良により、冷間始動時にガチャガチャと異音がし、オイルを吸うようなキュイーンという異音がする。車を動かし始める時には、ジャダーのような症状があり、停止直前にも車がガタガタする。
127,2019年03月19日,熊本,ﾌﾘｰﾀﾞｲｱﾙ,ダイハツ,ムーヴ,2008年05月,不明,CBA-L175S,KF,エンジン,不明,シリンダーヘッド周りからガラガラと異音が出るようになった。
128,2019年03月18日,北海道,電話,三菱,ふそうスーパーグレート,2017年03月,"300,000 Km",QPG-FP64VDR,6R10,制動装置,不明,連結しているトレーラ側の制動力が弱かったため、一時停車中のトレーラに追突してしまった。
129,2019年03月18日,北海道,ﾌﾘｰﾀﾞｲｱﾙ,トヨタ,マークＸ,2005年06月,不明,DBA-GRX125,4GR,かじ取り,２０１９年３月１７日,車室内側のハンドルとギヤボックスを接続している部品のねじが外れ、接続が外れたため、突然ハンドルを回してもタイヤが回らない状態になった。
130,2019年03月18日,東京,ﾌﾘｰﾀﾞｲｱﾙ,カワサキ,ＺＲＸ１２００　ＤＡＥＧ,2011年03月,"12,300 Km",EBL-ZRT20D,ZRT20AE,電気装置,数年前から,ハンドルとカウルの固定部を通っている配線が損傷して短絡し、テールランプが点かなくなる。
131,2019年03月18日,神奈川,ＨＰ,トヨタ,ハイエース,2015年03月,"89,489 Km",QDF-KDH201V,1KD,排ｶﾞｽ･騒音,購入当時から,排ガス燃焼装置が故障した。
132,2019年03月18日,神奈川,ＨＰ,トヨタ,ヴェルファイア,2012年03月,"50,000 Km",DBA-ANH25W,2AZ,車枠・車体,２０１９年３月１５日,自宅の駐車場に停めていたが、風で屋根部分の塗装が剥がれてきた。
133,2019年03月18日,神奈川,ﾌﾘｰﾀﾞｲｱﾙ,ニッサンＭＴ,マーチ,2014年08月,"65,400 Km",DBA-K13改,HR15,車枠・車体,３、４年前に異音が発生していた。,ドアヒンジの固定ボルトがドアの鉄板に食い込み、鉄板側が破断した。
134,2019年03月18日,茨城,ﾌﾘｰﾀﾞｲｱﾙ,トヨタ,ラクティス,2009年10月,不明,DBA-SCP100,2SZ,保安灯火,日常点検時,前照灯上部の固定ボルト部が割れ、触ると前照灯がぐらつくのを発見した。
135,2019年03月18日,茨城,ﾌﾘｰﾀﾞｲｱﾙ,スズキ,ワゴンＲ,2017年02月,"22,000 Km",DAA-MH55S,R06A-WA05A,電気装置,不明,制御基板の不良により、走行中に警告が４つくらい点灯し、エンジンが停まった。
136,2019年03月18日,栃木,電話,メルセデス・ベンツ,マイバッハ　Ｓ５５０,2016年01月,不明,DBA-222982C,222,走行装置,２０１７年１０月、２０１８年１１月に２回,タイヤが短期間に３度裂傷を起こしている。
137,2019年03月18日,栃木,ＨＰ,フォルクスワーゲン,ゴルフ,2010年10月,"67,000 Km",DBA-1KCBZ,CBZ,動力伝達,２０１９年３月８日,通常走行後、減速中に床下で小さな異音が「コチッ」っと聞こえた後、駆動力が無くなり、交差点手前で停車した。その際、警告メッセージは何も表示されなかった。再発進を試みたが、エンジンの回転は上がっても、駆動力は全くなく、再発進不能となった。
138,2019年03月18日,三重,ＨＰ,ＢＭＷ,Ｘ５　ＸＤＲＩＶＥ３５Ｄ,2012年08月,"88,000 Km",LDA-ZW30S,N57D30A,排ｶﾞｽ･騒音,２０１９年１月９日,アドブルーアクティブタンクとＮＯｘセンサー不良により、「アドブルー警告、あと８００ｋｍしか走れません」と言う警告が出た。部品の交換を行ったが、二か月も経たないうちに、尿素誤充填の警告がでて、「あと７９４ｋｍしか走れません」という警告が出た。
139,2019年03月18日,大阪,ＨＰ,トヨタ,ウィッシュ,2009年08月,"100,600 Km",DBA-ZGE20W,2ZR,車枠・車体,２０１９年３月１０日,ホワイトパールクリスタルシャイン塗装の車で、天井、フェンダーの塗装が剥がれた。
140,2019年03月18日,京都,ﾌﾘｰﾀﾞｲｱﾙ,ダイハツ,ミライース,2012年01月,"27,000 Km",DBA-LA300S,KF,動力伝達,不明,エンジンが冷えている状態で、前進中にアクセルをオフにして惰性のような状態にすると、助手席前方から鈴虫が鳴くような異音が出るようになった。修理工場に相談したところ、メーカーに相談の上でＣＶＴオイルが交換されたが、オイル交換後はアクセルオンでも異音が出るようになった。
141,2019年03月18日,兵庫,ﾌﾘｰﾀﾞｲｱﾙ,ニッサン,クリッパーバン,2017年06月,不明,HBD-DR17V,R06A,エンジン,２０１９年３月９日,ＡＧＳ（機械式自動変速機）搭載車で、買い物先の駐車場から発進時、軽くブレーキペダルに足を置き、アクセル操作は行っていない状態だったにも関わらず、突然エンジンが吹け上がり、コンクリート壁に衝突した。
142,2019年03月18日,和歌山,ﾌﾘｰﾀﾞｲｱﾙ,トヨタ,プリウスα,2013年05月,"42,000 Km",DAA-ZVW41W,2ZR-5JM,エンジン,２０１９年３月１８日,ブレーキペダルを踏んでいるにも関わらず、エンジンが回り、駐車ブレーキをかけようとブレーキペダルから駐車ブレーキに踏み変えようとした途端に車が急発進し、自宅の玄関に衝突した。
143,2019年03月18日,岡山,ＨＰ,スバル,インプレッサＸＶハイブリッド,2013年07月,"56,550 Km",DAA-GPE,FB20-MA1,電動機(モーター),２０１９年３月１２日,メーターパネルに「トランスミッションシステムの点検が必要です」「ＶＯＤシステムの点検が必要です」「ヒルスタートアシストの点検が必要です」の警告表示があり、ＡＴ　ＯＩＬ　ＴＥＭＰが赤点滅となった。また、アイサイトが作動しなくなった。
144,2019年03月18日,福岡,ＨＰ,ホンダ,フィットＲＳ,2009年12月,"95,200 Km",DBA-GE8,L15A,車枠・車体,２０１６年夏頃,新車で納車後、わずか６年半後にルーフとボンネットのクリア塗装が白くなって剥がれてきた。
145,2019年03月18日,福岡,ＨＰ,ニッサン,リーフ,2019年02月,不明,ZAA-ZE1,EM57,車枠・車体,納車時から発生,空気入れ替えのため、走行中に運転席窓ガラスを数ｃｍ開放したところ、運転席側のドアスイッチパネルとスピーカー部分からかなりの隙間風が発生した。
146,2019年03月18日,福岡,ﾌﾘｰﾀﾞｲｱﾙ,フォルクスワーゲン,ゴルフ,2018年12月,不明,DBA-AUCJZ,CJZ,制動装置,２０１９年３月,ディスクブレーキに人差し指の第一関節分くらいの大きさの小石が挟まったため、非常ベルのような激しい異音が発生した。
147,2019年03月18日,鹿児島,ＨＰ,ニッサン,ＮＶ３５０キャラバン,2013年02月,"196,000 Km",LDF-VW2E26,YD25,エンジン,２０１８年１２月,走行中にエンジン異常音後、白煙に包まれ走行不可能になった。
148,2019年03月18日,鹿児島,ＨＰ,ニッサン,ＮＶ３５０キャラバン,2013年02月,"196,000 Km",LDF-VW2E26,YD25,制動装置,２０１８年０７月,車庫入れの低速走行中にブレーキペダルの踏み込みが出来なくなり、減速できなくなった。何度かペダル踏みなおし、フットサイドブレーキにて停止した。
149,2019年03月17日,北海道,ＨＰ,ニッサン,ノートｅ－ＰＯＷＥＲ,2017年11月,不明,DAA-HE12,HR12-EM57,エンジン,２０１９年１月８日,駐車場内で駐車スペースを探す徐行中に、車が突然急加速し、前方に駐車していた車両に追突した。
150,2019年03月17日,福島,ＨＰ,ニッサン,セレナ,2013年02月,"80,000 Km",DAA-HFC26,MR20-SM23,電気装置,２０１９年３月,オルタネーターの破損により、飛行機のような異音が出るようになった。
151,2019年03月17日,東京,ＨＰ,ＢＭＷ,ミニＪＣＷ,2011年05月,"48,939 Km",ABA-MFJCW,N14B16C,燃料装置,２０１８年１２月,高圧ポンプの不良により、エンジンがかかりづらくなり、アイドリングが不安定でエンジンが止まるようになった。
152,2019年03月17日,千葉,ＨＰ,フォルクスワーゲン,パサートヴァリアント,2010年09月,"65,094 Km",ABA-3CCDA,CDA,エンジン,２０１９年２月下旬頃,ウォーターポンプの劣化により、冷却水が漏れ、冷却水警告灯が点灯した。リザーブタンクを確認したところ、冷却水がほぼ無くなっていた。
153,2019年03月17日,福岡,ＨＰ,ＢＭＷ,１１６ｉ,2012年08月,"42,400 Km",DBA-1A16,N13B16A,エンジン,２０１８年夏頃,走行中、突然ドライブトレーン異常の警告が表示され、エンジンはストップしないものの、その後、エンジンパワーの低下が感じられるようになった。
154,2019年03月17日,宮崎,ＨＰ,アルファロメオ,ジュリア,2018年10月,"1,513 Km",ABA-95220,55273835,かじ取り,２０１９年２月２４日,一般道路を走行中、突然ハンドルが重くなり、パワーステアリング無し状態で操舵困難になった。ステアリングに関する警告以外にも複数の警告灯が表示された。
155,2019年03月16日,新潟,ＨＰ,ニッサン,フェアレディＺ,2013年03月,"73,000 Km",CBA-Z34,VQ37,かじ取り,２０１９年３月,ステアリングロック故障により、キーマークの警告灯が点いたり消えたりを繰り返してから点灯しっぱなしになり、エンジンスタートが出来なくなった。
156,2019年03月16日,神奈川,ＨＰ,ホンダ,Ｎ－ＢＯＸカスタム,2017年01月,不明,DBA-JF3,S07B,制動装置,２０１９年３月１６日,踏切（少しだけ登った先にある）通過時に、自動ブレーキが誤作動し、急停車した。
157,2019年03月16日,神奈川,ＨＰ,フォルクスワーゲン,ゴルフ　ＧＴＩ,2019年01月,"1,220 Km",ABA-AUCHH,CHH,電気装置,２０１９年２月　納車直後に発見,ＤＣＣ（ダイナミックシャシーコントロール）装着車で、エンジンを始動すると、ＤＣＣが前日に設定した内容が勝手にノーマルに変わってしまい、正しくない表示になる。
158,2019年03月16日,埼玉,24時間電話,スズキ,スイフト,2017年07月,不明,DBA-ZC83S,K12C,乗車装置,２０１９年３月１５日,隣の車両の人がスマートフォンを触っていたところ、自車のキーロックが自動で閉まってしまう事が数回あった。
159,2019年03月16日,群馬,ＨＰ,ＢＭＷ,１２０ｉ,2011年12月,"56,000 Km",DBA-1A16,N13B16A,保安灯火,２０１９年３月,雨天、晴天に関わらず、助手席側ヘッドライトが結露してしまう。
160,2019年03月16日,栃木,ＨＰ,ニッサン,フェアレディＺ,2010年07月,"64,500 Km",CBA-Z34,VQ37,かじ取り,２０１９年１月,エンジン始動時、メーターにキー警告灯が表示され、エンジン停止後も警告灯は消えず、再びエンジン始動しようとしてもできず。ステアリングロックが効いていない状態になった。
161,2019年03月16日,愛知,ＨＰ,トヨタ,アルファード,不明,不明,ANH20,2AZ,エンジン,不明,プラグホールにオイルが溜まり、プラグが失火したため、エンジンが不調になった。
162,2019年03月16日,兵庫,ＨＰ,トヨタ,ヴェルファイア,2010年01月,"110,000 Km",DBA-ANH20W,2AZ,車枠・車体,２０１９年３月１３日,走行中に屋根の塗装が１３ｃｍ×４５ｃｍくらい一気に剥離し、周りに飛び散った。
