番号,受付日,住所,申告方法,車名,通称名,初度登録年月,総走行距離,型式,原動機型式,不具合装置,発生時期,申告内容の要約
163,2019年03月16日,福岡,ＨＰ,トヨタ,カローラルミオン,2012年08月,不明,DBA-NZE151N,1NZ,車枠・車体,２０１７年３月頃,購入してから、天井横の右側　左側両方と、天井の塗装がどんどん剥がれてきた。
164,2019年03月15日,富山,24時間電話,スズキ,キャリイ,2018年10月,"2,000 Km",EBD-DA16T,R06A,燃料装置,２０１９年３月１５日,給油キャップの鍵穴の不良により、キーが奥まで入らず、キャップが開けられなくなった。
165,2019年03月15日,東京,ＨＰ,スズキ,アルトワークス,不明,不明,DBA-HA36S,R06A,車枠・車体,２０１６年,新車からフロントのロアアーム、スタビライザーのボルトが錆びている。
166,2019年03月15日,東京,ＨＰ,メルセデス・ベンツ,ＳＬＫ２３０,2000年05月,"110,000 Km",GF-170447,1117,保安灯火,２０１７年４月,ブレーキランプ接点不良による発熱でバルブソケットが溶解し、左右とハイマウント不点灯になった。
167,2019年03月15日,山梨,ﾌﾘｰﾀﾞｲｱﾙ,日野,プロフィア,2014年06月,"314,300 Km",QPG-SH1EDBG,E13C,エンジン,不明,エアドライヤのパージバルブよりオイルが排出され、地面を汚してしまう。
168,2019年03月15日,愛知,ＨＰ,ニッサン,エルグランド,2005年04月,"101,600 Km",CBA-E51,VQ35,その他,２０１８年１０月,燃料メーターの針が動かなくなる。エンジンの始動のたびに針の位置が変わる。走行中燃料メーターが上がったり下がったりする。
169,2019年03月14日,長野,ﾌﾘｰﾀﾞｲｱﾙ,いすゞ,ギガ,2015年03月,"30,000 Km",QKG-CYZ77A,6UZ1,緩衝装置,不明,リヤのリーフスプリングが、中央のセンターボルト部から真っ二つに折れた。
170,2019年03月14日,東京,電話,ホンダ,ステップワゴン　スパーダ,2017年11月,不明,6AA-RP5,LFA-H4,乗車装置,２０１９年２月１９日,車両が全損となる事故を起こした。その際、エアバッグが非展開であり、ホンダセンシングが非作動であった。
171,2019年03月14日,神奈川,ﾌﾘｰﾀﾞｲｱﾙ,トヨタ,エスティマハイブリッド,2008年03月,"130,000 Km",DAA-AHR20W,2AZ-2JM-2FM,電動機(モーター),不明,ハイブリッドバッテリーの不良により、パネル上に警告表示が出た。
172,2019年03月14日,千葉,ＨＰ,ＢＭＷ,ミニクロスオーバー　クーパーＳ,2011年11月,"56,000 Km",DBA-ZC16,N18B16A,燃料装置,２０１７年８月,高速道路走行中にエンジンチェックランプの点灯と警告音がなり、安全措置が働き、エンジン回転数が３０００ｒｐｍ程度に抑えられた。
173,2019年03月14日,千葉,ﾌﾘｰﾀﾞｲｱﾙ,ホンダ,Ｓ６６０,2016年02月,不明,DBA-JW5,S07A,その他,購入直後から,オプションのセンターディスプレー装着車で、ホンダ純正のナビアプリを入れたスマートフォンからの起動シグナルを応答するプログラムに不具合があり、スマートフォンを接続しても車側が反応しない。
174,2019年03月14日,埼玉,電話,ホンダ,ＶＥＺＥＬ,2016年02月,"43,600 Km",DBA-RU1,L15B,エンジン,不明,エンジン始動時に異音（ガラガラ）が発生する。
175,2019年03月14日,茨城,ＨＰ,ホンダ,Ｎ－ＢＯＸ,2012年06月,"66,639 Km",DBA-JF1,S07A,エンジン,２０１６年３月,登り坂及び高速道路を走行中にアクセルペダルを踏むとノッキング状態になり、失速してエンジン警告灯が点滅した。アクセルを弱めながら走行したところ、警告灯のランプが消えた。
176,2019年03月14日,群馬,ＨＰ,ホンダ,Ｎ－ＢＯＸカスタム,2014年07月,"50,264 Km",DBA-JF1,S07A,車枠・車体,２０１６年４月,高速道路を走行中に助手席左上から異常な音が鳴り、びっくりしてブレーキを踏みそうになった。
177,2019年03月14日,愛知,ＨＰ,フォルクスワーゲン,ゴルフ,2012年11月,"48,000 Km",DBA-1KCAX,CAX,動力伝達,２０１９年２月末,前日よりＡＴのレンジ表示にスパナマークが表示された。シフトショックの変化もなくシフトチェンジ可能であったが、翌日に一般道を走行中、駆動力が全くなくなり走行不能となった。
178,2019年03月14日,静岡,ＨＰ,トヨタ,エスティマ,2006年07月,"125,000 Km",DAA-AHR20W,2AZ-2JM-2FM,エンジン,５年前位から,１年で、エンジンオイルが半分以下になってしまう。
179,2019年03月14日,大阪,ﾌﾘｰﾀﾞｲｱﾙ,三菱,ふそうスーパーグレート,2013年08月,"337,800 Km",QKG-FS55VZ,6R10,エンジン,２０１８年１０月１８日,高速道路のパーキングエリアから出発し、本線合流をしたと同時にエンジンが焼き付き、エンジンが停止したため、惰性で路肩に流れ着いた。
180,2019年03月14日,和歌山,ＨＰ,トヨタ,ハイエースバン,2012年07月,"65,700 Km",QDF-KDH201V,1KD,車枠・車体,新車購入７年目,パールホワイトですが、ボンネットの塗装が浮き出して、次第にその範囲が広がって来ており、また、その部分の塗装にひび割れも目立ってきている。
181,2019年03月14日,島根,ＨＰ,マツダ,アテンザ,2012年12月,"117,000 Km",LDA-GJ2FP,SH,エンジン,３週間前,一般道路を走行中にエンジン警告灯が点灯し、１分ぐらい走行後、アクセルペダルを踏んでも前に進まなくなった。
182,2019年03月14日,熊本,ＨＰ,ボルボ,ＸＣ６０Ｒデザイン,2013年02月,"83,800 Km",CBA-DB4204TXC,B4204T,動力伝達,２０１８年１１月ごろ,ミッションセイノウテイカの表示が出て走行中にギア抜けする。
183,2019年03月14日,鹿児島,ＨＰ,ホンダ,Ｎ－ＯＮＥ,2012年11月,"77,800 Km",DBA-JG1,S07A,動力伝達,２０１９年３月１１日,ＣＶＴより３０ｋｍ／ｈ以上出すとカタカタ音がする。
184,2019年03月13日,岩手,ﾌﾘｰﾀﾞｲｱﾙ,ニッサン,セレナ,2012年03月,"66,000 Km",DBA-FNC26,MR20,電気装置,２年半前から,オルタネーターから異音が出るようになった。
185,2019年03月13日,東京,電子メール,三菱,ふそうエアロクィーン,2010年03月,"333,300 Km",BKG-MS96JP,6M70,その他,不明,運転注意力モニター（ＭＤＡＳ－Ⅲ）が作動せず、故障表示も出なかった。
186,2019年03月13日,神奈川,ＨＰ,ＢＭＷ,３２０ｉ,2006年08月,"127,300 Km",ABA-VA20,N46B20B,車枠・車体,２０１８年４月９日,エンジンフードを支えるダンパーのガスまたはオイル漏れ等により、圧力が低下し、ボンネットを支えきれなくなったため、エンジンルームを点検中に、ボンネットが突然閉まり、指を骨折した。
187,2019年03月13日,千葉,ＨＰ,マツダ,ＣＸ－５,2012年07月,"197,222 Km",LDA-KE2AW,SH,電気装置,２０１９年３月９日,一般道路走行中に異音が発生したため、路肩に停車する。ボンネットを開け確認するとオルタネータープーリーが破損により脱落していた。
188,2019年03月13日,千葉,ﾌﾘｰﾀﾞｲｱﾙ,ホンダ,オデッセイ,2015年09月,不明,DBA-RC1,K24W,エンジン,２０１９年２月１４日,走行中に突然エンストをした。販売店で燃料ポンプの交換が行われたが、修理完了３日後に再びエンストした。
189,2019年03月13日,埼玉,ﾌﾘｰﾀﾞｲｱﾙ,三菱,パジェロミニ,2003年06月,"91,000 Km",TA-H58A,4A30,動力伝達,不明,自動変速機のバルブボディの不良により、変速ショックが発生する。
190,2019年03月13日,静岡,ﾌﾘｰﾀﾞｲｱﾙ,プジョー,２０７ＳＷ,2011年09月,"34,000 Km",ABA-A7W5F01,5F01,かじ取り,不明,走行中に突然パワーステアリングが効かなくなった。
191,2019年03月13日,京都,ﾌﾘｰﾀﾞｲｱﾙ,マツダ,デミオ,2014年03月,"18,400 Km",DBA-DEJFS,P3,エンジン,２０１９年３月８日,車庫入れで徐行前進時、ブレーキペダルを踏んでいたら、エンジンが吹け上がり、暴走状態で衝突して停止した。
192,2019年03月13日,兵庫,ＨＰ,スズキ,ワゴンＲスティングレーＴ,2015年05月,"43,000 Km",DBA-MH34S,R06A,緩衝装置,２０１８年１２月２７日,下回り点検時、左側スタビリンクロッドからグリスが漏れていた。
193,2019年03月13日,山口,ﾌﾘｰﾀﾞｲｱﾙ,ダイハツ,ムーヴ,2015年10月,"56,600 Km",DBA-LA150S,KF,エンジン,不明,アクセル～コンピューターの配線が内部で断線したため、走行中に突然黄色の警告が出ると共に車が失速し、路上に停止してしまった。
194,2019年03月13日,香川,ＨＰ,トヨタ,アリオン,2010年01月,"214,300 Km",DBA-ZRT260,2ZR,車枠・車体,２０１９年３月７日頃,パールマイカ塗装の車で、フロントガラス左右ピラーの塗装が剥がれ、剥がれた周りは塗装が浮いている状態。触れると剥がれる。
195,2019年03月13日,大分,24時間電話,スバル,ステラ,2008年08月,"35,500 Km",DBA-RN1,EN07,保安灯火,不明,助手席と、後席窓の開閉が出来ない。
196,2019年03月12日,宮城,ﾌﾘｰﾀﾞｲｱﾙ,ニッサン,セレナ,2009年01月,"120,300 Km",DBA-C25,MR20,緩衝装置,不明,左前輪のロアアームが外れ、ドライブシャフトも外れたため、走行不能になった。
197,2019年03月12日,山形,ＨＰ,ニッサン,フーガハイブリッド,2013年11月,"85,000 Km",DAA-HY51,VQ35-HM34,制動装置,２０１９年２月,ブレーキペダルを踏みながら緩めても徐行発進せず、かなり緩めて徐行発進できた後に軽くブレーキペダルを踏むと急停止することがある。
198,2019年03月12日,秋田,ＨＰ,トヨタ,アルファード,2011年12月,"67,210 Km",DAA-ATH20W,2AZ-2JM-2FM,車枠・車体,不明,ボンネットの塗装が突然剥がれた。
199,2019年03月12日,東京,ＨＰ,三菱,ふそうエアロスター,2011年03月,"208,162 Km",LKG-MP35FM,6M60,エンジン,２０１９年２月８日,エンジンの圧縮ガスがヘッドガスケットの抜けにより冷却水側へ漏れたため、冷却水が吹き出し、冷却水ウォーニングランプの点灯、ブザーが鳴動した。
200,2019年03月12日,東京,ＨＰ,三菱,ふそうエアロスター,2011年08月,"195,632 Km",LKG-MP35FM,6M60,エンジン,２０１８年３月５日,エンジンの圧縮ガスがヘッドガスケットの抜けにより冷却水側へ漏れたため、冷却水が吹き出し、冷却水ウォーニングランプの点灯、ブザーが鳴動した。
201,2019年03月12日,千葉,ＨＰ,フォルクスワーゲン,パサート,2012年12月,"41,200 Km",DBA-3CCAX,CAX,走行装置,２０１９年１月,フロントロアアームブッシュの劣化により、前輪内側が約４万ｋｍの走行で、前輪タイヤ内側がツルツルなるまで摩耗した。
202,2019年03月12日,岐阜,電話,ＢＭＷ,７４０ｉ,2011年11月,"30,000 Km",ABA-KB30改,N54B30A,エンジン,１ヶ月ほど前,高速走行中、追い越し車線や、合流後に加速をしようとアクセルを踏み込んだ時にエンジンの警告表示がでてエンジンが吹けなくなった。
203,2019年03月12日,岐阜,ＨＰ,マツダ,ＣＸ－５,2013年07月,"133,000 Km",LDA-KE2AW,SH,エンジン,不明,一般道を走行中にオルタネーターのプーリーが破損し、ベルトが回らない状態になったため、走行中に「充電システム異常」が点灯し、水温が１００℃に達した。
204,2019年03月12日,広島,ＨＰ,三菱,パジェロミニ,1998年07月,"115,000 Km",E-H56A,4A30,エンジン,中古車店で購入後約２年,高速道路を走行中、アクセルペダルを踏み込むとエンジンルームから「ガリっ」という異音が聞こえ、オイル警告灯が点滅した。ブレーキ、パワーステアリング等の電装部品も動かなくなり、キーを回してもセルも回らない。そのためギアをパーキングに入れサイドブレーキをかけながら停止した。
205,2019年03月12日,不明,ﾌﾘｰﾀﾞｲｱﾙ,マツダ,デミオ,2014年12月,不明,LDA-DJ5FS,S5,乗車装置,不明,ドアロックアクチュエーターの不良により、ドアロック装置から異音が出る。
206,2019年03月11日,北海道,ＨＰ,ニッサン,キュ－ブ,2010年09月,"40,600 Km",DBA-NZ12,HR15,エンジン,２０１９年３月１０日ＡＭ８時頃　車庫内、,朝、最初のエンジン始動時、セルモーターはまわるが、着火しない症状が発生した。３回操作をしても始動できず、ブレーキペダルから一旦足を離し、再度踏み直してセルモーターを回すと、やっと着火し、始動した。
207,2019年03月11日,岩手,ﾌﾘｰﾀﾞｲｱﾙ,ニッサン,セレナ,2018年06月,"1,500 Km",DAA-GFNC27,MR20-SM24,エンジン,２０１９年２月,車庫内における車の入替等で、エンジンを一度始動して停止後、１分くらいの間隔をあけてから再始動をしようとすると、著しくエンジン始動性が悪くなり、セルばかりが回ってなかなか始動しない。
208,2019年03月11日,新潟,ＨＰ,三菱,ふそうキャンター,2013年11月,"26,723 Km",TKG-FDA20,4P10,動力伝達,２０１９年２月,ＤＵＯＮＩＣ車でシフトレバーをＤレンジにいれようとしても、Ｔ／Ｍ警告灯（赤色）が点灯しＤレンジに入らず前進、後退ともに全く発進できなくなった。
209,2019年03月11日,東京,ﾌﾘｰﾀﾞｲｱﾙ,ニッサン,ＮＶ３５０キャラバン,不明,不明,VW2E26,不明,制動装置,不明,主に坂の手前や、坂を上りきった場所において、前方に何の障害物もないところで被害軽減ブレーキの警報が作動する。
210,2019年03月11日,神奈川,ＨＰ,ニッサン,エクストレイル,2018年08月,"4,500 Km",DBA-NT32,MR20,エンジン,２０１９年３月８日,渋滞を走行中、停止からの加速中に突然アクセルが約２秒間無反応になり異音が発生し、運転席足元付近で振動も感じた。
211,2019年03月11日,埼玉,ＨＰ,カワサキ,Ｚ２５０ＳＬ,不明,"3,500 Km",JBK-BR250,不明,エンジン,購入して４か月くらいで発生,エンジンが暖まって、信号待ち、渋滞時の発進時にアクセルを開けると、エンジンが停止する。
212,2019年03月11日,愛知,ＨＰ,ホンダ,シビック　ＴＹＰＥ－Ｒ,2010年05月,"77,460 Km",ABA-FD2,K20A,車枠・車体,２０１９年３月１１日,運転中、フットレストが外れ、ブレーキ操作が出来なくなった。
213,2019年03月11日,愛知,ﾌﾘｰﾀﾞｲｱﾙ,メルセデス・ベンツ,Ｓ４５０,2018年12月,不明,DAA-222158,256-EM0014,エンジン,不明,アイドリングストップ機能搭載車であるが、車両が暖まってくると、アイドリングストップ後、そのままアクセサリーモードのような状態になり、エンジンが再始動しなくなる。
214,2019年03月11日,静岡,ＨＰ,ニッサン,エクストレイル,2014年02月,"41,500 Km",DBA-NT32,MR20,動力伝達,２０１８年１２月頃から,登坂加速時、車体に異常な振動が発生し、走行に支障がでる。アクセルペダルを放してもう一度踏み込むと普通に走る。
215,2019年03月11日,兵庫,24時間電話,ニッサン,ノート,2013年08月,"58,000 Km",DBA-E12,HR12,エンジン,２０１９年２月２０日,始動直後、エンジンルームからガンゴンガンゴンと、大きな異音、車体振動が発生した。
216,2019年03月11日,滋賀,電話,ダイハツ,タント,2017年09月,不明,DBA-LA600S,KF,エンジン,２０１９年３月２日,身体障害者用に右足左足どちらでも操作可能なようにアクセルペダルを左足側にも取付け、片方は使用しないときに格納できるように改造した車両で、使用中の方のアクセルペダルが突如格納された状態になり操作不能になった。また、ブレーキを操作するとアクセルに干渉し、突如加速し事故となった。
217,2019年03月11日,香川,ﾌﾘｰﾀﾞｲｱﾙ,ホンダ,フィット,2018年09月,不明,DBA-GK3,L13B,かじ取り,２０１９年３月,道路から右折をして、ガソリンスタンドへ入ろうとした際、左の電柱に当たった。
218,2019年03月11日,佐賀,ﾌﾘｰﾀﾞｲｱﾙ,ニッサン,セレナ,2014年03月,"17,200 Km",DAA-HFC26,MR20-SM23,制動装置,２０１８年５月,ブレーキをかけていなくてもブレーキからキーキーと異音が出た。
219,2019年03月11日,佐賀,ﾌﾘｰﾀﾞｲｱﾙ,ニッサン,セレナ,2014年03月,"17,200 Km",DAA-HFC26,MR20-SM23,エンジン,２０１８年１１月１６日,スロットルチャンバーの不良により、エンストした。
220,2019年03月11日,佐賀,ﾌﾘｰﾀﾞｲｱﾙ,ニッサン,セレナ,2014年03月,"17,200 Km",DAA-HFC26,MR20-SM23,その他,２０１７年８月,エアコンのファンモーターの不良により、エアコンが効かなくなった。
221,2019年03月11日,佐賀,ﾌﾘｰﾀﾞｲｱﾙ,ニッサン,セレナ,2014年03月,"17,200 Km",DAA-HFC26,MR20-SM23,乗車装置,２０１９年３月,車体が振動する度に左後部ドアからキュキュキュッと異音が出る。
222,2019年03月11日,佐賀,ﾌﾘｰﾀﾞｲｱﾙ,ニッサン,セレナ,2014年03月,"17,200 Km",DAA-HFC26,MR20-SM23,その他,２０１７年９月,純正カーナビで電源落ち、タッチパネル不良、ＣＤ、ＤＶＤの作動不良が発生した。
223,2019年03月11日,佐賀,ﾌﾘｰﾀﾞｲｱﾙ,ニッサン,セレナ,2014年03月,"17,200 Km",DAA-HFC26,MR20-SM23,動力伝達,２０１５年４月,ＣＶＴの不良により、前進後退時や３０ｋｍ／ｈで走行時にガタガタと振動する症状が出た。
224,2019年03月11日,熊本,ﾌﾘｰﾀﾞｲｱﾙ,トヨタ,ヴェルファイア,2017年01月,不明,DBA-AGH35W,2AR,エンジン,購入して１か月ごろから,走行中に突然エンストする。ディーラーにて修理や部品交換が行われているが、度々再発している。
225,2019年03月10日,福島,ＨＰ,トヨタ,プリウス,2018年09月,不明,DAA-ZVW55,2ZR-1NM-1MM,車枠・車体,２０１８年１０月,発進時キーキーという大きな金属音、及び走行中キーという金属音あり、数ヵ月かけて異音が大きくなっている。
226,2019年03月10日,東京,ＨＰ,ヤマハ,ＭＴ－０７,2014年11月,"4,800 Km",EBL-RM07J,M403E,エンジン,新車納車後すぐに　２０１４年１２月,暖機後、信号待ちなど、停止中から発進時にエンストする。
227,2019年03月10日,埼玉,ＨＰ,ニッサン,ステージア,2006年11月,"52,600 Km",GH-M35,VQ25,車枠・車体,２０１８年１２月,リアハッチのダンパーに不具合があり、リアゲートが上から落下した。
228,2019年03月10日,愛知,ＨＰ,スバル,レガシィツーリングワゴン,2011年01月,"68,938 Km",DBA-BR9,EJ25,動力伝達,２０１９年２月,走行中にクラッチの操作性が変化し、エンジンルーム付近から金属の焼けるような匂いと金損の削れるような音がして、走行不能となった。
229,2019年03月10日,福井,ＨＰ,ニッサン,キューブ,2009年07月,"160,000 Km",DBA-Z12,HR15,かじ取り,２０１９年３月,プッシュスタートボタンを押してもセルも回らず　キーランプのみ点灯状態でエンジンが始動しない。
230,2019年03月10日,和歌山,ＨＰ,トヨタ,ピクシス　スペース,2014年03月,"28,700 Km",DBA-L575A,KF,エンジン,２０１９年３月８日,走行中に突然エンジンから大きな音がして、走行不能になり、ボンネットを開けて見ると、エンジンマウントが割れ、エンジンが脱落状態になっていた。
231,2019年03月09日,長野,ＨＰ,トヨタ,ヴァンガード,2012年09月,"36,200 Km",DBA-GGH20W,2GR,車枠・車体,２０１７年,左側フェンダーのボンネットとの境目で、塗装が水ぶくれの様に膨らみ、割れて、剥がれてしまう。そのまま面積が広がっていった。
232,2019年03月09日,千葉,ＨＰ,スズキ,スペーシア,2015年09月,"16,000 Km",DAA-MK42S,R06A-WA04A,エンジン,購入直後から,停止寸前に突然エンジン回転数が２０００ｒｐｍ程度に上がり、停止した瞬間にショックがでる。
233,2019年03月09日,千葉,ＨＰ,スズキ,スペーシア,2015年09月,"16,000 Km",DAA-MK42S,R06A-WA04A,制動装置,購入直後から,ブレーキペダルを踏む時、負圧が無くなったかの様に踏み応えが重くなる。
234,2019年03月09日,千葉,ＨＰ,スズキ,スペーシア,2015年09月,"15,300 Km",DAA-MK42S,R06A-WA04A,乗車装置,購入直後から（気が付いたのは２年後）,リアシートを畳める構造でかつ、自転車が積載できるという広さで販売していたが、実際に畳むには、運転席を前方に移動しなければ畳むことができず、運転ポジションが変わってしまい運転に支障がでる。
235,2019年03月09日,熊本,ＨＰ,ボルボ,Ｖ６０,不明,不明,DBA-FB4164T,不明,動力伝達,購入３年過ぎ,デュアルクラッチトランスミッションの不良により、トランスミッション能力低下という表示が出て、ギア抜けする。
236,2019年03月08日,新潟,ﾌﾘｰﾀﾞｲｱﾙ,レクサス,ＮＸ３００ｈ,不明,不明,DAA-AYZ15,2AR-2JM-2FM,排ｶﾞｽ･騒音,不明,エンジン始動後、マフラーから水を噴射する。
237,2019年03月08日,新潟,ﾌﾘｰﾀﾞｲｱﾙ,ダイハツ,ムーヴ,2014年03月,"20,000 Km",DBA-LA100S,KF,走行装置,不明,新車装着されていたファルケン製のタイヤが、１年程度でひび割れ初め、年々酷くなっている。
238,2019年03月08日,東京,ＨＰ,三菱,アウトランダーＰＨＥＶ,2018年10月,不明,5LA-GG3W,4B12-S61-Y61,電動機(モーター),２０１９年３月７日,車を起動したらパネルにＥＶシステム点検の表示が出た。
239,2019年03月08日,神奈川,ﾌﾘｰﾀﾞｲｱﾙ,スズキ,スイフト,2017年08月,"11,000 Km",DBA-ZC83S,K12C,制動装置,不明,フロントブレーキから低速停車前にザザザッという異音、リヤブレーキからはギギギッという異音が出た。
240,2019年03月08日,神奈川,ﾌﾘｰﾀﾞｲｱﾙ,スズキ,スイフト,2017年08月,"11,000 Km",DBA-ZC83S,K12C,その他,不明,コンプレッサーの不良により、エアコン作動時に唸り音が出る。
241,2019年03月08日,神奈川,ﾌﾘｰﾀﾞｲｱﾙ,スズキ,スイフト,2017年08月,"11,000 Km",DBA-ZC83S,K12C,車枠・車体,不明,メーター周りとインストルメントパネル周りでカチャカチャと言う異音が出た。メーターは対策品への交換で解消したが、インストルメントパネルの音は対策がなく、そのままになっている。
242,2019年03月08日,神奈川,ﾌﾘｰﾀﾞｲｱﾙ,スズキ,スイフト,2017年08月,"11,000 Km",DBA-ZC83S,K12C,緩衝装置,不明,足回りが、急に固くなり、突っ張ったような状態になり乗り心地が悪くなる。
243,2019年03月08日,神奈川,ﾌﾘｰﾀﾞｲｱﾙ,スズキ,スイフト,2017年08月,"11,000 Km",DBA-ZC83S,K12C,かじ取り,不明,ハンドルが重く、スムーズに回らない。また、左右で重さが異なり、ガクンガクンという異音が出た。
244,2019年03月08日,神奈川,ﾌﾘｰﾀﾞｲｱﾙ,スズキ,スイフト,2017年08月,"11,000 Km",DBA-ZC83S,K12C,制動装置,不明,駐車ブレーキのワイヤーが早期に伸び、１か月ちょっとで引き代が上がる。また、レバーが左右方向にガタが有る。
245,2019年03月08日,神奈川,ﾌﾘｰﾀﾞｲｱﾙ,スズキ,スイフト,2017年08月,"11,000 Km",DBA-ZC83S,K12C,エンジン,購入直後,インジェクターの不良により、エンジン吹け不良、出力不良が発生し、ノッキングとカチャカチャ、カリカリという異音が発生した。
246,2019年03月08日,埼玉,ＨＰ,ニッサン,セレナ,2011年02月,"115,766 Km",DBA-NC26,MR20,制動装置,２０１８年６月頃,ブレーキローターの振れにより、ブレーキペダルを踏むとＡＢＳが効いたような症状が出る。
247,2019年03月08日,埼玉,ＨＰ,ニッサン,セレナ,2011年02月,"120,889 Km",DBA-NC26,MR20,走行装置,２０１８年３月,ロアアームの不良により、左右前輪内側のタイヤ溝が偏摩耗した。
248,2019年03月08日,三重,ﾌﾘｰﾀﾞｲｱﾙ,三菱,ふそうキャンター,2011年02月,"200,000 Km",SKG-FEB50,4P10,動力伝達,不明,変速機の不良により、国道を走行中に突然ニュートラル状態になり、走行不能になった。
