番号,受付日,住所,申告方法,車名,通称名,初度登録年月,総走行距離,型式,原動機型式,不具合装置,発生時期,申告内容の要約
171,2021年03月16日,三重,ＨＰ,マツダ,ＣＸ－５,2012年06月,"140,000 Km",LDA-KE2AW,SH,エンジン,不明,オイルポンプ不良により、走行時油圧不良の警告灯が点灯し、走行不良を起こした。
172,2021年03月16日,大阪,ﾌﾘｰﾀﾞｲｱﾙ,トヨタ,ハイエース,1999年05月,"429,900 Km",KG-LH178V,5L,乗車装置,２０２１年３月３日,車両の左前方が衝突する事故で、両側のドアがゆがむほどの衝撃だったにも関わらず、エアバッグ展開しなかった。
173,2021年03月16日,兵庫,ﾌﾘｰﾀﾞｲｱﾙ,ニッサン,エクストレイル,2003年02月,"68,000 Km",TA-NT30,QR20,乗車装置,２０２０年１０月２８日,トラックと接触事故となり、ボンネットが吹き飛ぶような衝突であったにも関わらず運転席・助手席両方ともエアバッグが開かなかった。
174,2021年03月16日,兵庫,ﾌﾘｰﾀﾞｲｱﾙ,ニッサン,エクストレイル,2003年02月,"68,000 Km",TA-NT30,QR20,その他,中古車で購入当初,エアコン吹き出し口から白い煙が室内に充満した。
175,2021年03月16日,兵庫,ﾌﾘｰﾀﾞｲｱﾙ,ニッサン,エクストレイル,2003年02月,"68,000 Km",TA-NT30,QR20,エンジン,不明,ＥＣＵの不具合により、高速道路を走行中、出力不良で停止した。
176,2021年03月16日,和歌山,ＨＰ,ハーレーダビッドソン,ＦＬＸＸＳＥ　ＣＶＯ,2016年05月,"41,000 Km",EBL-FLN,N,エンジン,２０１７年１１月と２０２１年３月に同じ部,２０１７年１１月にエンジンを冷やすクーラントポンプを交換したが、２０２１年３月に同じ部品が壊れて交換した。
177,2021年03月16日,和歌山,ﾌﾘｰﾀﾞｲｱﾙ,ＢＭＷ,３シリーズ,2020年12月,"4,000 Km",不明,不明,動力伝達,不明,勾配になった所で駐車時、自動で入るはずのＰに入らず、Ｎになっていたため後退し、物損事故になった。
178,2021年03月16日,山口,電話,トヨタ,クラウン,2013年06月,"50,000 Km",DAA-AWS210,2AR-1KM,保安灯火,不明,運転席のパワーウインドウを閉める際、一番上まで上がってもすぐまた下がってしまう。
179,2021年03月16日,香川,ＨＰ,三菱,ふそうスーパーグレート,2017年07月,"515,019 Km",QPG-FS64VZ,6R10,エンジン,２０２１年３月１２日,樹脂製オイルパンの数か所にヒビが入ったため、駐車場にオイルが数滴落ちていた。
180,2021年03月16日,不明,ﾌﾘｰﾀﾞｲｱﾙ,ホンダ,Ｎ－ＢＯＸ,2021年02月,不明,6BA-JF4,S07B,車枠・車体,不明,右リアフェンダー開始点（スライドドア側）の溶接部に溶接痕と思われる盛り上がりがあり、左側は、それが無い。左の薄い方が誤りであると溶接不良による強度不足の懸念があり、厚い方が誤りであると外観が悪い。
181,2021年03月15日,北海道,ＨＰ,スバル,エクシーガ,2011年06月,"115,000 Km",DBA-YA5,EJ20,動力伝達,２０２１年３月１３日,低速走行で２速から３速のギアアップ時に、エンジンが空転した後、追突された様な強い衝撃が発生してギアが繋がる。
182,2021年03月15日,東京,ﾌﾘｰﾀﾞｲｱﾙ,マツダ,ＭＸ－３０,2021年02月,700 Km,5AA-DREJ3P,不明,電気装置,不明,バッテリーの不良により、突然エンジンがかからなくなった。
183,2021年03月15日,神奈川,ＨＰ,ホンダ,Ｎ－ＢＯＸ,2014年03月,"68,147 Km",DBA-JF1,S07A,動力伝達,２０２１年３月１３日,セレクトレバーがＰに入らなくなった。
184,2021年03月15日,埼玉,ﾌﾘｰﾀﾞｲｱﾙ,ホンダ,Ｎ－ＢＯＸ,2021年02月,不明,不明,不明,車枠・車体,不明,左右後輪のシャーシ溶接部に錆が発生していた。
185,2021年03月15日,山梨,ﾌﾘｰﾀﾞｲｱﾙ,ホンダ,Ｎ－ＶＡＮ,2019年01月,不明,HBD-JJ1,S07B,電気装置,不明,自動ブレーキ等の検知に使うセンサーがバンパーの低い位置に設置されているため、除雪用の散水等ですぐに汚れ、検知が行われなくなってしまう。
186,2021年03月15日,山梨,ﾌﾘｰﾀﾞｲｱﾙ,ホンダ,Ｎ－ＶＡＮ,2019年01月,不明,HBD-JJ1,S07B,その他,不明,給油メーターが満タン給油後にメーター表示が上がるまでに著しく時間がかかる。
187,2021年03月15日,愛知,ＨＰ,メルセデス・ベンツ,ＣＬＳ３５０,2013年12月,"35,000 Km",RBA-218959C,276,排ｶﾞｽ･騒音,２０２１年２月,ＮＯｘセンサーの不良により、走行中にチェックランプが点灯した。
188,2021年03月15日,愛知,ＨＰ,スズキ,ＭＲワゴン,2014年03月,"38,290 Km",DBA-MF33S,R06A,エンジン,２０２０年１２月,発進時や登り坂を走行する際、ドライブベルトの共振により、低い振動音が発生する。
189,2021年03月15日,愛知,ＨＰ,メルセデス・ベンツ,Ｅ２５０,2014年05月,"75,000 Km",RBA-212236C,274,排ｶﾞｽ･騒音,２０１９年６月　２０２０年４月　２０２１,ＮＯｘセンサーの不良により、エンジンチェックランプが点灯し、微振動が発生、燃費も悪化した。
190,2021年03月15日,大阪,ﾌﾘｰﾀﾞｲｱﾙ,トヨタ,ピクシスエポック,2011年12月,"47,900 Km",DBA-L575A,KF,エンジン,不明,クランクセンサーの不良により、エンジンが不調になり、チェックランプが点灯する。
191,2021年03月15日,山口,電話,メルセデス・ベンツ,Ｇ３５０ブルーテック,2015年11月,不明,LDA-463346,642,かじ取り,購入時から,購入時からハンドルから異音がしていて、ディーラで確認したところ異常とのことで修理をしたが、最近になって異音が発生している。
192,2021年03月15日,福岡,ﾌﾘｰﾀﾞｲｱﾙ,日通,ダンプセミトレーラ,2011年12月,不明,NT2920 改,不明,緩衝装置,半年に１回,過積載はなく、グリスアップの整備を行っているにもかかわらず、トルクロッドのピンが割れる。
193,2021年03月15日,福岡,ﾌﾘｰﾀﾞｲｱﾙ,日通,ダンプセミトレーラ,2011年11月,"30,000 Km",NT2920 改,不明,緩衝装置,半年に１回,過積載はなく、グリスアップの整備を行っているにもかかわらず、イコライザーのピンが割れてしまう。
194,2021年03月14日,新潟,ＨＰ,ホンダ,フィット,2020年03月,"8,000 Km",6AA-GR3,LEB-H5,動力伝達,２０２１年２月２１日,自宅の駐車場に入れるためにバックしていたところ、アクセル操作をしていないのに車が急加速し、自宅の壁に激突した。
195,2021年03月14日,新潟,ＨＰ,ＢＭＷ,１１８ｉ,2019年12月,不明,3BA-7K15,B38A15A,乗車装置,２０２０年１１月頃,ガソリンスタンドで給油中に勝手にリヤゲートが開いた。自宅でホースで洗車中に勝手にゲートが開いたため、車内に水が入った事もある。
196,2021年03月14日,長野,ＨＰ,フォルクスワーゲン,アップ,2013年02月,"37,900 Km",DBA-AACHY,CHY,保安灯火,２０２１年３月１４日,一般道路を走行中、何もしていないのに突然ミラーが剥がれ落ちてしまい割れてしまった。
197,2021年03月14日,神奈川,ＨＰ,メルセデス・ベンツ,Ａ１８０セダン,2020年07月,"5,319 Km",5BA-177184,282,保安灯火,２０２１年３月,機械式駐車場でエンジン停止・降車・施錠後、車が回転するとヘッドライトが点灯してしまう。
198,2021年03月14日,群馬,ＨＰ,三菱,デリカＤ５,2017年06月,"36,000 Km",LDA-CV1W,4N14,排ｶﾞｽ･騒音,２０２０年２月,アイドリング時や停止時にエキゾーストマニホールドからの排気ガス漏れで外気導入口から室内に排気ガスが侵入してきて、めまいがしてきたので運転を中断した。
199,2021年03月14日,栃木,ＨＰ,三菱,デリカＤ５,2013年02月,"101,700 Km",LDA-CV1W,4N14,エンジン,２０２１年１月２８日,エンジンの出力が急に低下し、エンストに至り、再始動不能になった。整備工場で確認したところ、グロープラグが根元から折れて脱落し、シリンダー内で暴れてエンジン内を傷つけたことにより圧縮不足となっており、エンジンは再起不能の損傷をしていた。
200,2021年03月14日,京都,ＨＰ,フォルクスワーゲン,ゴルフトゥーラン,2016年05月,"28,000 Km",DBA-1TCZD,CZD,乗車装置,４年目,テールゲートが開けられない。手動解除もできない。
201,2021年03月14日,京都,ＨＰ,ボルボ,Ｖ４０,2013年10月,"61,000 Km",DBA-MB4164T,B4164T,エンジン,２０２１年３月１３日,高速道路を走行中に急ブレーキをかけたところ、その後アクセルペダルを踏んでも加速せず、エンジン回転が上がるだけで失速した。
202,2021年03月14日,和歌山,ＨＰ,トヨタ,ランドクルーザープラド,2008年06月,"90,500 Km",CBA-TRJ120W,2TR,車枠・車体,２０１３年頃,塗装に亀裂ができ、そこから剥がれたり、窓枠からも塗装が剥がれた。
203,2021年03月14日,福岡,ＨＰ,ニッサン,ムラーノ,2006年03月,"109,700 Km",CBA-TZ50,QR25,乗車装置,２０２１年３月１２日,突然、シートリフターブラケットの破損により運転席にガタが発生し、アクセルなどがうまく操作できない状況になった。
204,2021年03月13日,青森,ＨＰ,ニッサン,セレナ,2015年02月,"49,700 Km",DBA-FNC26,MR20,動力伝達,２０２０年１２月頃,ＣＶＴの不具合により、アクセルペダルを踏んでも進むまでに時間がかかる。
205,2021年03月13日,栃木,ＨＰ,トヨタ,クラウン,2014年03月,"36,000 Km",DAA-AWS210,2AR-1KM,緩衝装置,２０２１年３月１２日,車検時にショックアブソーバからオイル漏れがあるので交換が必要だと診断された。
206,2021年03月13日,栃木,ＨＰ,ＢＭＷ,１１６ｉ,2012年07月,"91,900 Km",DBA-1A16,N13B16A,エンジン,２０１９年５月、２０１９年７月、２０２１,エンジン始動時、ドライブトレインの警告とエンストしそうな感じでブルブルする。
207,2021年03月13日,大阪,ＨＰ,スバル,レガシィツーリングワゴン,2013年03月,"150,000 Km",DBA-BRG,FA20,動力伝達,２０２１年３月６日,変速機のコントロールバルブの不良により、エンジンチェックランプの点灯のあと、ＡＴＦ　ＯＩＬ警告灯が点灯し、ミッションがつながらない。
208,2021年03月13日,滋賀,ＨＰ,ニッサン,ムラーノ,2010年03月,"77,600 Km",CBA-PNZ51,VQ35,エンジン,２０２１年３月１３日,エンジンから冷却水が漏れる。
209,2021年03月13日,徳島,24時間電話,ＢＭＷ,２１８ｄアクティブツアラー,2015年11月,"28,629 Km",LDA-2C20,B47C20A,動力伝達,不明,トランスミッションの不良により、走行中に突然２０ｋｍ／ｈ位しか速度が出なくなった。路肩に停車し、エンジンを再始動してみたが、症状が解消せず、何度か再始動等を行っているうちにナビパネル上にドライブトレーンの警告表示が出た。
210,2021年03月12日,北海道,ﾌﾘｰﾀﾞｲｱﾙ,トヨタ,アクア,2017年07月,"41,400 Km",DAA-NHP10,1NZ-1LM,エンジン,不明,自損事故の修理後、バックモニターの画面の鮮明度が低くなっていた。エンジンの音が異なっていた。ハイブリッドに切り替わる音がしなくなった。
211,2021年03月12日,新潟,ＨＰ,レクサス,ＣＴ２００ｈ,2012年11月,"68,200 Km",DAA-ZWA10,2ZR-3JM,燃料装置,１週間前から,駐車中の車からガソリンが漏れていた。
212,2021年03月12日,千葉,ＨＰ,アウディ,Ａ４アバント２．０Ｔｑ,2009年09月,"100,000 Km",ABA-8KCDNF,CDN,エンジン,２０１６年９月,エンジンオイルの消費が激しく、５００ｋｍ走行で１リットル消費する。
213,2021年03月12日,千葉,ＨＰ,プジョー,プジョー５０８ＳＷグリフ,2014年03月,"55,270 Km",ABA-W2W5F02,5F02,エンジン,購入２、３年後くらいから頻繁に,エンジンオイルの減りが異常に早く、走行１０００ｋｍごとに「Ｔｏｐ　ｕｐ　ｅｎｇｉｎｅ　ｏｉｌ　ｌｅｖｅｌ」警告が表示され、その都度ディーラーでエンジンオイルを補充している。
214,2021年03月12日,埼玉,ﾌﾘｰﾀﾞｲｱﾙ,ＢＭＷ,Ｘ３,2007年09月,"100,000 Km",ABA-PC25,N52B25A,エンジン,２０２１年３月９日,エンジンルームからガタンと音がし、ハンドルがガタガタと操作がおかしくなり、キーキーと異音が発生した。整備工場で確認したところ、エンジンマウントに固定するボルトが折れ、ハンドルシャフトに干渉している事が判った。
215,2021年03月12日,栃木,ＨＰ,クライスラー,ジープグランドチェロキー,2012年03月,"67,300 Km",ABA-WK36A,G,保安灯火,２０２１年２月２５日,クラクションが鳴らない、ハンドルメニューボタン等が全て機能しなくなった。
216,2021年03月12日,愛知,ＨＰ,トヨタ,ハイラックス,2018年06月,"58,200 Km",QDF-GUN125,2GD,車枠・車体,２年程前,メーカーオプションで取り付けた荷台のハードカバーが、購入して１年ぐらいして扉が閉まらなくなった。ディーラーで調整を行ったがそれからもカバーの金具の噛み合わせが悪くカバーが閉まらなくなり、ずれてきて荷台の接触するボディーが数カ所傷が付いてきた。
217,2021年03月12日,愛知,ＨＰ,ホンダ,フィットハイブリッド,2014年01月,"38,000 Km",DAA-GP5,LEB-H1,動力伝達,１０℃以下の冷間時,冷間時に始動するとミッションからキリキリと異音がする。
218,2021年03月12日,島根,ﾌﾘｰﾀﾞｲｱﾙ,ニッサン,ＲＯＯＸ,2020年07月,"12,750 Km",5AA-B44A,BR06-SM21,電気装置,２０２０年１２月ごろから,コンピューター・センサーの不具合により、障害物が何もないのに有ると検知したり、後退駐車時に何もないのにブレーキがかかる。高速道路走行中に白線を誤認識する。
219,2021年03月12日,長崎,ﾌﾘｰﾀﾞｲｱﾙ,レクサス,ＲＸ,不明,不明,6AA-GYL25W,不明,かじ取り,新車購入当初から,エアバッグのところに筋があり、毎度運転する度に目にするので気になる。
220,2021年03月12日,熊本,ＨＰ,トヨタ,プリウス,2010年06月,"77,265 Km",DAA-ZVW30,2ZR-3JM,燃料装置,２０２１年３月１０日,燃料噴射バルブの不具合により、走行中、エンジンが息つく様な感じでエンジンチェックランプが点灯した。
221,2021年03月12日,沖縄,ﾌﾘｰﾀﾞｲｱﾙ,ホンダ,フィット,2020年04月,不明,6BA-GR1,L13B,保安灯火,新車購入当初から,ワイパーからガガガと異音が出る。
222,2021年03月11日,宮城,ＨＰ,ＢＭＷ,Ｘ１,2017年11月,"57,000 Km",LDA-HT20,B47C20A,エンジン,２０２１年２月２８日と２０２１年３月８日,走行中に突然アクセルが戻されるような感覚になり、ヒュルンヒュルンと音がしてエンストしそうな止まる感じになった。メーターに警告灯が点灯し、モニター画面にはドライブトレーン慎重に走行して下さい。最大駆動力は使用できません。正規ディーラーで点検を受けて下さい。と表示された。
223,2021年03月11日,岩手,ﾌﾘｰﾀﾞｲｱﾙ,フォルクスワーゲン,ポロ,2018年06月,"82,000 Km",ABA-AWCHZ,CHZ,エンジン,不明,カムシャフトのバルブタイミング制御用油圧装置のボルトが脱落し、タイミングベルトのところへ大量にオイルが漏れた。
224,2021年03月11日,長野,ＨＰ,ＢＭＷ,Ｘ３,2013年01月,"40,000 Km",LDA-WY20,N47D20C,動力伝達,２０２０年８月末から,メカトロニクスの不具合により、アイドリングストップ後のエンジンが再始動時に、シフトが勝手にＤレンジからＰレンジに切り替わる。
225,2021年03月11日,東京,ＨＰ,トヨタ,ルーミー,2020年10月,"3,000 Km",5BA-M900A,1KR,制動装置,購入時から,ブレーキホールドシステム作動中に、ブレーキペダルを再度踏むとホールド状態が解除される。
226,2021年03月11日,東京,ＨＰ,メルセデス・ベンツ,Ｃ１８０　ステーションワゴン,2012年02月,"74,500 Km",DBA-204249,271,乗車装置,２０２１年３月５日,運転席ドアの車室内側の取っ手がブラブラの状態になり、全く機能しなくなった。止む無く、窓を開けて手を外に出して、外のドア取っ手を引くことでドアを開け、外に出ることが出来た。
227,2021年03月11日,神奈川,ＨＰ,スバル,レガシィツーリングワゴン,2013年10月,"47,083 Km",DBA-BRG,FA20,制動装置,２０２１年１月ごろ,数日間エンジンを掛けないと始動時にブレーキペダルが硬くなり、深く踏み込めない。エンジン始動後は通常の踏みしろに戻る。
228,2021年03月11日,神奈川,ＨＰ,シトロエン,Ｃ４グランドピカソ,2017年05月,"14,876 Km",ABA-B7875G01,5G01,排ｶﾞｽ･騒音,２０２１年３月１日、２０２１年３月１１日,キャニスターラインへ燃料が余分に流れ込んだため、高速道路ループランプを走行後、エンジン警告灯、Ｒｅｐａｉｒ　ｎｅｅｄｅｄ、Ｓｅｒｖｉｃｅ警告灯が点灯およびアラームが発報すると同時に、エンジン燃焼異常が発生、アクセルを踏んでも吹けない「かぶり」現象および燃焼異常による振動が断続的に発生した。緊急回避のため、駐車場へ退避しようとした途中でエンストも発生した。
229,2021年03月11日,群馬,ﾌﾘｰﾀﾞｲｱﾙ,マツダ,デミオ,2014年03月,"35,900 Km",DBA-DE5FS,ZY,制動装置,不明,ブレーキをかける際、ペダルを踏み込んでいると倍力装置の効きが途中で変化し、不自然に制動力が強くなる。
230,2021年03月11日,群馬,ﾌﾘｰﾀﾞｲｱﾙ,マツダ,デミオ,2014年03月,"35,900 Km",DBA-DE5FS,ZY,エンジン,不明,アクセルペダルセンサーの異常により、アクセルを一定にして走行しているにもかかわらずエンジン回転が上下する。
231,2021年03月11日,愛知,ＨＰ,三菱,ふそうスーパーグレート,2016年11月,"526,572 Km",QPG-FS65VZ,6R10,エンジン,２０２１年２月２０日,オイル交換時にオイルパン横よりオイル漏れしているのを確認した。
232,2021年03月11日,愛知,ﾌﾘｰﾀﾞｲｱﾙ,ニッサン,デイズルークス,2018年01月,不明,DBA-B21A,3B20,保安灯火,不明,バックに入れた際に、左のドアミラーが下の方を映すように角度が変わる機能において、バックを終えてＤレンジに入れると、前進時用に設定していた元の位置よりも上を映す角度に戻りすぎるため、何度か前後進を繰り返していると、上ばかり映してしまう状態になる。
233,2021年03月11日,愛知,ﾌﾘｰﾀﾞｲｱﾙ,ニッサン,デイズルークス,2015年05月,"64,300 Km",DBA-B21A,3B20,エンジン,不明,信号から発進する際などに、アクセルペダルを踏んでもエンジンがうなるばかりで速度が出ないことがある。
234,2021年03月11日,静岡,ﾌﾘｰﾀﾞｲｱﾙ,トヨタ,ハイエース,2019年03月,不明,CBF-TRH200K 改,1TR,車枠・車体,不明,乗降ステップの自動・手動を切り替えるレバーを固定するボルトが緩み、自動にしていたレバーが勝手に手動に切り替わってしまう。
235,2021年03月11日,静岡,ﾌﾘｰﾀﾞｲｱﾙ,トヨタ,ハイエース,2018年04月,"53,900 Km",CBF-TRH200K 改,1TR,車枠・車体,不明,乗降ステップの自動・手動を切り替えるレバーを固定するボルトが緩み、自動にしていたレバーが勝手に手動に切り替わってしまう。
236,2021年03月11日,奈良,ＨＰ,スズキ,スペーシアカスタム,2018年03月,"20,000 Km",DAA-MK53S,R06A-WA05A,その他,２０１８年８月,ガソリンを満タンにしても燃料計がＦｕｌｌまで上がらない。
237,2021年03月10日,北海道,ＨＰ,スズキ,スイフト,2010年10月,"73,700 Km",DBA-ZD72S,K12B,エンジン,２０２１年２月,オートステアリングロックの不良で、エンジンがかからない時があり、時間を置くとかかる。
238,2021年03月10日,北海道,ﾌﾘｰﾀﾞｲｱﾙ,ダイハツ,ミライース,2018年05月,"13,000 Km",DBA-LA360S,KF,車枠・車体,不明,バンパーやリアゲートが凹んだり、リアワイパーの根元が盛り上がっていたり、パワーウインドウの上下でも車体が盛り上がったりしてきている。
239,2021年03月10日,宮城,ＨＰ,スズキ,アルトワークス,2019年03月,"17,000 Km",DBA-HA36S,R06A,動力伝達,新車初期不良,５ＡＧＳ搭載車で、クラッチの作動不良により、Ｄモードにおいて三速から四速に変速しない時がある。
240,2021年03月10日,青森,ＨＰ,トヨタ,ヴィッツＲＳ　Ｇ’ｓ,2011年12月,"53,000 Km",DBA-NCP131,1NZ,車枠・車体,２０２０年秋頃,ホワイトパール色塗装の車で、５ｍｍ程の塗装剥げを確認し、触ったらベロっと剥がれて１．５ｃｍ程になった。
241,2021年03月10日,神奈川,ＨＰ,ニッサン,セレナｅ－ＰＯＷＥＲ,2020年10月,200 Km,6AA-HFC27,HR12-EM57,電気装置,２０２０年１２月１日,ヘッドライトコントロールスイッチの接触不良により、エンジンを切って駐車数時間後、勝手にヘッドライトが点滅を繰り返し車内灯とテールランプが点灯。バッテリーが上がりアンロックになっていた。
242,2021年03月10日,神奈川,ＨＰ,トヨタ,プリウス,2016年04月,"28,000 Km",DAA-ZVW51,2ZR-1NM,保安灯火,２０２０年１月頃,テールランプレンズ及びリアランプレンズの内側が白く濁り、車検が通らないと診断された。
243,2021年03月10日,神奈川,ﾌﾘｰﾀﾞｲｱﾙ,ＢＭＷ,ミニクロスオーバー,2015年02月,"69,000 Km",LDA-ZB20,N47C20A,燃料装置,不明,燃料ポンプがロックしたためにタイミングチェーンが切れた。
244,2021年03月10日,千葉,ＨＰ,トヨタ,ランドクルーザープラド,2007年09月,"115,100 Km",CBA-TRJ120W,2TR,車枠・車体,２０２０年頃,ホワイトパール色塗装の車でドア付近を中心に塗装が剥がれた。
245,2021年03月10日,千葉,ＨＰ,スズキ,スイフトスポーツ,2012年03月,"5,486 Km",CBA-ZC32S,M16A,かじ取り,２０２１年１月３０日,車庫から出そうとした際にパワーステアリングが効かず、インパネを見たらパワーステアリング警告灯が点灯していた。
246,2021年03月10日,埼玉,ＨＰ,三菱,ふそうスーパーグレート,2015年12月,"376,358 Km",QPG-FS64VZ,6R10,エンジン,２０２１年２月,クランクケースベンチレーションバルブに詰まりが発生した。
247,2021年03月10日,埼玉,ＨＰ,三菱,ふそうスーパーグレート,2015年12月,"320,363 Km",QPG-FS64VZ,6R10,エンジン,２０２１年１月,クランクケースベンチレーションバルブに詰まりが発生した。
248,2021年03月10日,埼玉,ＨＰ,三菱,ふそうスーパーグレート,2015年12月,"320,363 Km",QPG-FS64VZ,6R10,エンジン,２０２１年１月,樹脂製オイルパンがひび割れ、オイル漏れした。
249,2021年03月10日,埼玉,ＨＰ,三菱,ふそうスーパーグレート,2015年12月,"376,358 Km",QPG-FS64VZ,6R10,エンジン,２０２１年２月,樹脂製オイルパンがひび割れ、オイル漏れした。
250,2021年03月10日,愛知,ﾌﾘｰﾀﾞｲｱﾙ,ボルボ,Ｓ６０,2016年06月,"20,000 Km",LDA-FD4204T,D4204T,その他,不明,燃料計センサーの不具合により、燃料の残量があり、まだ走れると思っていたところ、燃料切れになったため、走行中にエンストした。
251,2021年03月10日,熊本,ＨＰ,ニッサン,セレナ,2013年01月,"67,100 Km",DAA-HFC26,MR20-SM23,動力伝達,不明,走行中、ガタガタとエンストみたいな症状が出る。
252,2021年03月09日,福島,ﾌﾘｰﾀﾞｲｱﾙ,ニッサン,エクストレイルＨＶ,2015年08月,"85,000 Km",DAA-HNT32,MR20-RM31,動力伝達,不明,ＣＶＴの不具合により、エンジンが止まった。
253,2021年03月09日,青森,ＨＰ,トヨタ,アクア,2014年03月,"89,000 Km",DAA-NHP10,1NZ-1LM,保安灯火,１年ほど前に確認,テールランプレンズに曇りが発生している。レンズユニット内に水が溜まる。レンズ接着面の歪みによる剥がれがある。
