番号,受付日,住所,申告方法,車名,通称名,初度登録年月,総走行距離,型式,原動機型式,不具合装置,発生時期,申告内容の要約
69,2021年12月18日,滋賀,ＨＰ,スズキ,ワゴンＲ,2016年01月,"77,000 Km",DAA-MH44S,R06A-WA04A,燃料装置,２０２１年１１月２５日　午前１０時,燃料ポンプの不良により、高速道路を走行中にアクセルペダルを踏んでもスピードが落ち、エンジンが停止し再始動不可能になった。
70,2021年12月18日,福岡,ＨＰ,ニッサン,キューブキュービック,不明,"145,000 Km",UA-BGZ11,CR14DE,電気装置,２０２１年１０月,エアコンのエアミックスドアの軸が折れたため、暖房が効かなくなった。送風口の切り替えもできない。
71,2021年12月17日,福島,ＨＰ,アウディ,アウディ　Ａ６　４５Ｔｑ,2021年06月,"1,000 Km",3AA-F2DKNF,DKN-4413,電気装置,２０２１年７月１８日,テレビに切り替えると、「画面にＴＶを起動中お待ちください」というメッセージが出て延々とＴＶに切り替わらない。
72,2021年12月17日,埼玉,ＨＰ,メルセデス・ベンツ,Ｅ２５０,2013年05月,"52,000 Km",RBA-212036C,274,排ｶﾞｽ･騒音,２０２１年３月１３日,ＮＯｘセンサーの誤作動により、エンジンチェックランプが点灯した。
73,2021年12月17日,栃木,ﾌﾘｰﾀﾞｲｱﾙ,ニッサン,デイズルークス,不明,不明,DBA-B21A,3B20,エンジン,２０２１年１２月１４日,ターボチャージャーのウェストゲートバルブが故障し、ターボチャージャーとエンジンが焼けてしまった。
74,2021年12月17日,愛知,ＨＰ,トヨタ,ｉＱ,2009年01月,"85,900 Km",DBA-KGJ10,1KR,車枠・車体,不明,塗装が剥がれ、再塗装を行ったが、１年経過したところ、右フェンダーの塗装が剥がれた。
75,2021年12月17日,愛知,ﾌﾘｰﾀﾞｲｱﾙ,ホンダ,Ｎ－ＯＮＥ,2021年04月,不明,6BA-JG3,S07B,制動装置,不明,ブレーキペダルを強めに踏み込み、パッと放した際にガガガ・・と異音が発生する。ブレーキペダルを放したのに、ブレーキが一瞬かかったままになる症状を体験したこともある。
76,2021年12月17日,岐阜,ＨＰ,ボルボ,ボルボ　Ｖ４０,2014年03月,"177,149 Km",DBA-MB4164T,B4164T,制動装置,２０２１年１２月と２０２０年１月,ブレーキペダルを踏んだ後、ペダルを戻す時に、ブレーキペダル付近からピー音の笛吹音が発生した。ペダルを戻すのを止めてそのまま保持すると、笛吹音はなり続き、だんだんブレーキペダルが重くなって、ペダルを押し返された。その状態が寒い時期を中心に散発し、時々インパネに「ブレーキシステムサービスが必要です」の表示が出た。本件で２０２０年１月にブレーキシブースタを交換するも、２０２１年１２月に再発した。
77,2021年12月17日,京都,ＨＰ,トヨタ,パッソ,2017年02月,"13,700 Km",DBA-M700A,1KR,エンジン,２０２１年１１月下旬,アクセルの応答が悪いことがある。
78,2021年12月16日,北海道,電話,三菱,ｅＫスポーツ,2004年06月,"140,400 Km",CBA-H81W,3G83,動力伝達,不明,変速機の改善対策（４５０）の措置を済ませた車で、改善対策の不具合情報と同じ４速に入らない症状が発生した。
79,2021年12月16日,長野,ＨＰ,テスラ,モデル３　ＡＷＤ,2021年03月,"4,902 Km",ZAA-3L23,3D3-3D5,電気装置,２０２１年１１月２４日,高速道路を８０ｋｍ／ｈ走行中、追い越しのため車線変更から加速のためアクセルペダルを踏んだところ軽い衝撃と同時に各種エラーが発生した。「低バッテリー」「５５ｋｍ／ｈに制限」等各種エラー表示が出た。この時バッテリーは５８％で、実際には加速・回生ブレーキは効かず惰性のみでの走行となった。その後、サブバッテリーを含む全電源の喪失のため、けん引・ドアの開閉等に支障が生じた。ディーラーではＨＶバッテリーのコンタクターのショートと診断された。
80,2021年12月16日,長野,ＨＰ,マツダ,ＣＸ－３,2020年01月,"49,000 Km",6BA-DKEAW,PE,かじ取り,４４０００ｋｍ走行後くらいから,時速５０ｋｍ以上などで走行中、緩いカーブがあるとき、ハンドルが固まって微細な調整がしづらくなる。一定の角度以上動かすと、カクッという振動があってからスムーズに動く。
81,2021年12月16日,千葉,ＨＰ,ＵＤトラックス,クオン,2018年07月,"268,400 Km",2PG-CG5CA,GH11,エンジン,不明,冷却水サブタンクの樹脂合わせ目の圧着不良により、冷却水漏れが発生して、サブタンク及左フェンダー付近に冷却水漏れ痕が出来ている。
82,2021年12月16日,千葉,ＨＰ,ＵＤトラックス,クオン,2018年05月,"321,000 Km",2PG-CG5CA,GH11,エンジン,２０２１年６月,冷却水サブタンクの樹脂合わせ目の圧着不良により、冷却水漏れが発生して、サブタンク及左フェンダー付近に冷却水漏れ痕が出来ている。
83,2021年12月16日,千葉,ＨＰ,ＵＤトラックス,クオン,2018年06月,"290,700 Km",2PG-CG5CA,GH11,エンジン,不明,冷却水サブタンクの樹脂合わせ目の圧着不良により、冷却水漏れが発生して、サブタンク及左フェンダー付近に冷却水漏れ痕が出来ている。
84,2021年12月16日,千葉,ＨＰ,ＵＤトラックス,クオン,2018年12月,"152,000 Km",2PG-CD5BA,GH11,エンジン,不明,冷却水サブタンクの樹脂合わせ目の圧着不良により、冷却水漏れが発生して、サブタンク及左フェンダー付近に冷却水漏れ痕が出来ている。
85,2021年12月16日,千葉,ＨＰ,三菱,ふそうスーパーグレート,2016年06月,"440,000 Km",QPG-FS64VZ,6R10,エンジン,２０２１年１１月,駐車中にオイルパン前付近にオイル漏れ痕を確認した。ディーラーの確認で、樹脂製オイルパンが劣化による亀裂が生じたものと診断された。
86,2021年12月16日,埼玉,ＨＰ,ＢＭＷ,ＢＭＷ　１１６ｉ,2012年08月,"36,000 Km",DBA-1A16,N13B16A,燃料装置,２０２１年１０月ころから頻発,起動の直後からエンジンの回転が不安定になり、そのままエンストする。画面に「ドライブトレーンに異常」が表示され、そのままエンジンがストップした。
87,2021年12月16日,埼玉,ＨＰ,ホンダ,オデッセイ,2014年01月,"71,000 Km",DBA-RC1,K24,制動装置,２０２１年１１月,ＣＴＢＡシステム点検の警告灯のランプが点灯したままになった。ディーラーでリセット作業を行ったが警告が再点灯し、バックアップカメラ交換が必要と診断された。
88,2021年12月16日,兵庫,ＨＰ,スバル,インプレッサ,2015年10月,"29,500 Km",DBA-GP7,FB20,走行装置,２０２１年１１月,左後方ハブベアリングより音がする。
89,2021年12月16日,岡山,ﾌﾘｰﾀﾞｲｱﾙ,フォルクスワーゲン,ポロ,不明,不明,ABA-AWCZP,CZP,かじ取り,不明,エンジン始動後、ディスプレイにレーンキープアシストが使用できない。という警告メッセージが出る。ディーラーで、センサーやカメラ交換を行う対応が取られているものの、原因が特定されていない。
90,2021年12月16日,山口,ＨＰ,マツダ,デミオ,不明,"60,000 Km",LDA-DJ5FS,S5,その他,不明,雨の日にエアコンをつけても窓ガラスの曇りがとれない。ディーラーの確認で、低圧側のホースからガスが漏れている。ヒーターコアの出入り口がスラッジで通りが悪くなっている。エバポレータからガスが漏れている。と診断された。
91,2021年12月16日,山口,ＨＰ,マツダ,デミオ,不明,"60,000 Km",LDA-DJ5FS,S5,その他,不明,雨の日にエアコンをつけても窓ガラスの曇りがとれない。ディーラーの確認で、低圧側のホースからガスが漏れている。ヒーターコアの出入り口がスラッジで通りが悪くなっている。エバポレータからガスが漏れている。と診断された。
92,2021年12月16日,山口,ＨＰ,マツダ,デミオ,不明,"60,000 Km",LDA-DJ5FS,S5,かじ取り,２０２０年２月,ハンドルを左に切るとパキパキと異音が鳴る。ディーラーの確認でベアリングの樹脂製カバーが割れて異物が入っていたと診断された。
93,2021年12月16日,不明,電話,ボルボ,Ｖ６０,不明,100 Km,5AA-ZB420TM,B420T2,制動装置,不明,ブレーキペダルを踏んだ時にギーギーと異音が出た。ディーラーで確認した結果ブレーキ周りの部品交換になった。
94,2021年12月15日,長野,ﾌﾘｰﾀﾞｲｱﾙ,マツダ,ＣＸ－３,不明,不明,LDA-DK5AW,S5,動力伝達,不明,購入直後からアクセルを開けても反応が悪く、数秒待ってから駆動力が伝わってくるような加速遅れの症状が出ていた。ディーラーに相談しても故障履歴などが検出されず、使用を続けていたのだが、その後に変速機の警告灯が点灯し、新たに診断を受けた結果、変速機不良として交換を行ったところ、警告灯が点灯した不具合と共に、過去に出ていた加速遅れの症状も解消した。
95,2021年12月15日,神奈川,ﾌﾘｰﾀﾞｲｱﾙ,ホンダ,ＰＣＸ１６０,2021年07月,"1,000 Km",2BK-KF47,不明,かじ取り,不明,ハンドルのホルダー下部に装着されているクッションラバーの不良により、走行時にハンドルが前後方向にぐらつくようになった。
96,2021年12月15日,静岡,ＨＰ,ホンダ,フィット,2013年09月,"142,461 Km",DBA-GE6,L13A,動力伝達,２０２１年９月１日,加速時、並びにエンジンブレーキをかけた際にＣＶＴからウィーンというモーターのような音が出るようになり、次第に大きくなっていった。ディーラーで確認し、ＣＶＴベアリングからの音と診断された。
97,2021年12月15日,静岡,ＨＰ,マツダ,デミオ,不明,不明,不明,不明,エンジン,２０２１年１２月１２日,エンジンルームから大量の煙が噴き出した。
98,2021年12月15日,兵庫,ＨＰ,ダイハツ,タント,2020年02月,"11,000 Km",6BA-LA650S,KF,エンジン,２０２１年６月～２０２１年１２月まで計５,段差が２ｃｍ～３ｃｍ有る１０ｍ程の下り坂の途中でエンジンが止まる。
99,2021年12月15日,和歌山,ﾌﾘｰﾀﾞｲｱﾙ,ニッサン,リーフ,2014年02月,"107,000 Km",ZAA-AZE0,EM57,制動装置,２０２１年１１月２５日,電動型制御ブレーキユニットの不良により、走行中に突然メーターの警告灯がすべて点灯するとともにブレーキの効きが著しく悪くなった。登坂路であったためブレーキペダルを全力で踏み込んだところ、じわじわと減速して停止したがこの時にガガガと異音も出ていた。
100,2021年12月15日,長崎,ＨＰ,ニッサン,ノート,2016年11月,"101,076 Km",DAA-HE12,HR12-EM57,電動機(モーター),２０２１年１１月２８日,下山のための下り坂をワンペダルモードで走行中、アクセルペダルを放しても減速せず、そのまま加速をしてしまうためブレーキペダルを踏んで減速しなければいけなくなった。
101,2021年12月14日,富山,ﾌﾘｰﾀﾞｲｱﾙ,スバル,レヴォーグ,2015年03月,"49,400 Km",DBA-VM4,FB16,制動装置,不明,ブレーキマスターバックの負圧漏れにより、エンジン始動時にブレーキペダルが固くなり、始動しにくくなった。
102,2021年12月14日,神奈川,ﾌﾘｰﾀﾞｲｱﾙ,ダイハツ,タント,2014年05月,"75,700 Km",DBA-LA600S,KF,エンジン,最近,ファンベルトが鳴くようになったため、交換したが、しばらくしてまた鳴くようになった。
103,2021年12月14日,茨城,ＨＰ,三菱,ふそうキャンター,2016年12月,"382,934 Km",TPG-FEB50,4P10,燃料装置,２０２１年１２月１０日,走行中にエンジンからカランカランと音がするようになり、ＥＮＧＳＹＳの赤ランプが点灯してエンストしたため、レッカー牽引された。ディーラーで確認したところ、１番インジェクターの配線カプラの接触不良と診断された。
104,2021年12月14日,愛知,ﾌﾘｰﾀﾞｲｱﾙ,シトロエン,ＤＳ５,2017年09月,"10,000 Km",LDA-B8AH02,AH02,燃料装置,不明,長期間停車させておくと、燃料タンクが腐食してその後の使用時にエンジンがガタガタと振動してエンストするようになる。
105,2021年12月14日,愛知,ﾌﾘｰﾀﾞｲｱﾙ,シトロエン,ＤＳ５,2017年09月,"10,000 Km",LDA-B8AH02,AH02,排ｶﾞｽ･騒音,不明,外２９８９のアドブルータンクに対するリコールの対象範囲外の車両で、アドブルータンク不良による警告灯の点灯が発生した。タンク交換を行ったが、その後、エンジンがガタガタと振動してエンストする症状が出るようになった。
106,2021年12月14日,静岡,ﾌﾘｰﾀﾞｲｱﾙ,スズキ,ワゴンＲスティングレー,2014年04月,"76,900 Km",DBA-MH34S,R06A,その他,２０２１年１２月９日,駐車をしてエアコンを使用していたところ、車室内に異臭がし、その２分後くらいにエアコンの圧力ホースが破裂して白煙が上がった。
107,2021年12月14日,奈良,ﾌﾘｰﾀﾞｲｱﾙ,三菱,ふそうスーパーグレート,2019年06月,"264,000 Km",2PG-FS74HZ,6R20,燃料装置,２週間前,燃料噴射ポンプのフィルターに金属片が詰まり、エンストした。ディーラーで修理をしたが、２週間後、走行中に車室内のヒューズボックス付近の配線から異臭、発煙をし、再びエンストした。
108,2021年12月14日,広島,ＨＰ,三菱,デリカ,2013年01月,"100,000 Km",LDA-CV1W,4N14,排ｶﾞｽ･騒音,２０２１年８月,エキゾーストマニホールドのひび割れにより、走行中に車内に排気ガスの臭気が入ってきた。
109,2021年12月14日,鹿児島,ＨＰ,スバル,レヴォーグ,2021年02月,"4,000 Km",4BA-VN5,CB18,かじ取り,２０２１年１１月５日,ステアリングの不具合により、運転中に音声メッセージが流れてアイサイトＸ、クルーズコントロールが操作出来なくなった。
110,2021年12月13日,福島,ＨＰ,トヨタ,ノア,2015年10月,"34,000 Km",DBA-ZRR80W,3ZR,エンジン,２０２１年１２月１０日,エンジンを始動しようとしたところ、なかなか始動せず、アクセルペダルを踏んでも回転数が上がらない症状が出た。ディーラーで確認したところ、バルブリフトコントローラーの固着と診断された。
111,2021年12月13日,東京,電話,スズキ,アルト,2015年08月,"139,900 Km",DBA-HA36S,R06A,乗車装置,２０２１年１１月９日,スマートフォンの電磁波計測アプリで計測したところ、運転席シートの頭部から最大５０００ｍＧの電磁波が発生していると測定された。
112,2021年12月13日,東京,ﾌﾘｰﾀﾞｲｱﾙ,ポルシェ,Ｔａｙｃａｎ　Ｔｕｒｂｏ　Ｓ,不明,不明,ZAA-J1MD,不明,乗車装置,不明,うっかりミスでリモコンキーを落としてしまい、キーの半分が破損した状態で車内でリモコンキーの操作を誤り、ドアロックボタンを押してしまったところ、ドアロックが作動し、システムも一切起動できない状態で車室内に閉じ込められた。携帯電話によりディーラーに確認を取ったが、この状態から手動による解除方法が無いということが判り、ガラスを割って脱出する事態になった。
113,2021年12月13日,神奈川,ＨＰ,フォルクスワーゲン,ティグアン　１．５／１１０ｋＷ,2021年10月,673 Km,3BA-5NDPC,DPC,車枠・車体,２０２１年１１月７日,新車として納車された車両のセンターピラー部分に凹みや鋭角に折れ曲がった傷があり、鋭角の傷については未修復のまま再塗装されていた。助手席側の窓枠部分が歪んでいるのかゴムに突起や隙間が生じている。
114,2021年12月13日,神奈川,ﾌﾘｰﾀﾞｲｱﾙ,ダイハツ,タント,2013年07月,"6,000 Km",DBA-L375S,KF,エンジン,不明,エンジンオイルが著しく消費するようになった。
115,2021年12月13日,千葉,ＨＰ,ボルボ,ボルボ　Ｖ６０,2012年06月,"120,700 Km",DBA-FB4164T,B4164T,動力伝達,２０２１年１２月１０日,走行中にギアが固定され、変速時にはショックが出るようになった。
116,2021年12月13日,埼玉,ＨＰ,三菱,ｅＫ　ＳＰＡＣＥ,2021年04月,"2,503 Km",4AA-B35A,BR06-SM21,制動装置,購入後すぐ,どこかの一時停止や進入禁止の標識を拾い、ディスプレーに表示が出る。前方衝突予測警報システムのアイコンの誤点灯が数回あった。走行中、ディスプレー全体が白転し、表示していた画面のサイズが拡大表示され、自動ブレーキが勝手に掛かった。
117,2021年12月13日,愛知,ﾌﾘｰﾀﾞｲｱﾙ,ＢＭＷ,Ｘ３,2016年03月,"55,200 Km",LDA-WY20,N47D20C,動力伝達,２０１９年８月、２０２１年,高速道路を走行中に突然ギアがＮレンジ状態になり、エンジンがストールして惰性で路肩に流れ着いた。ディーラーで大量の部品を交換する修理となったが、２０２１年にメカトロニクスが故障し、信号待ちでシフトが勝手にＤレンジからＰレンジに切り替わる症状が出るようになった。
118,2021年12月13日,三重,ＨＰ,三菱,デリカ,2007年10月,"86,320 Km",DBA-CV5W,4B12,制動装置,２０２１年８月２０日,時速３０ｋｍで走行中、軽くブレーキをかけたら急に右後部から異音（金属音）が発生し、煙が出てブレーキが片効きになった。整備工場で確認したところ、ブレーキローターの溶接部分が外れていた。
119,2021年12月13日,京都,ﾌﾘｰﾀﾞｲｱﾙ,スズキ,ソリオ,2014年03月,"110,000 Km",DBA-MA15S,K12B,かじ取り,２０２１年１２月,パワーステアリングが突然効かなくなり、ハンドルが重たくなった。整備工場で確認してみたところ、ステアリングシャフトの樹脂製ギアが欠けていた。
120,2021年12月13日,高知,ﾌﾘｰﾀﾞｲｱﾙ,ニッサン,ＮＶ３５０キャラバン,2017年01月,"21,000 Km",CBF-VR2E26,QR20,車枠・車体,不明,パールホワイト色塗装の車で、ルーフの左前方の部分の塗装が剥がれた。
121,2021年12月13日,鹿児島,ＨＰ,トヨタ,８６,2012年12月,"100,000 Km",DBA-ZN6,FA20,かじ取り,２０２１年５月,ステアリングからの異音が発生している。
122,2021年12月13日,沖縄,ＨＰ,フォルクスワーゲン,ＶＷゴルフ　１．２／７７ｋＷ,2015年07月,"55,641 Km",DBA-AUCJZ,CJZ,動力伝達,２０２１年１２月頃,一時停止後、上り坂で発進しようとした際にブレーキペダルを踏んでください、と警告が出た。ブレーキペダルを踏んでアクセルペダルを踏むが進まなかった。エンジンをかけて発進するまでに時間がかかる症状もあり、ディーラーに確認したところ、メカトロモジュールが機能していないと診断された。
123,2021年12月12日,岩手,ＨＰ,フォルクスワーゲン,ゴルフ　１．０／８１ｋＷ,2021年10月,500 Km,3AA-CDDLA,DLA-4450,電気装置,購入直後,ミッションをリバースに入れてもバックモニターの画面が写らず真っ暗になる事がある。テレビがフリーズして立ち上がらない事がある。ディーラーに持ち込んでもその場で症状が再現せず、コンピュータで診断してもエラーが出ない。
124,2021年12月12日,青森,ＨＰ,スバル,インプレッサ,2015年02月,"68,000 Km",DBA-GP7,FB20,制動装置,２０２１年１１月,ブレーキマスターバックの気密不良により、エンジン停止後一日半くらい経って車に乗ったとき、ブレーキペダルが固くて踏み込めずエンジンをかけられなかった。強く踏み込んでやっとかかった。
125,2021年12月12日,神奈川,ＨＰ,メルセデス・ベンツ,Ａ４５　ＡＭＧ,2013年11月,不明,CBA-176052,133,エンジン,２０１９年１２月頃,ターボチャージャーブラケットが割れた。
126,2021年12月12日,神奈川,ＨＰ,スズキ,ジムニー,2013年03月,"100,000 Km",ABA-JB23W,K6A,エンジン,２０２１年２月,３番シリンダーの失火により、エンジン警告灯が点灯、点滅し、エンジンのふけあがりが悪くなった。点火コイルと点火プラグの交換を行ったが症状が再発し、ディーラーで確認したところ、３番シリンダーの圧縮漏れが判明した。
127,2021年12月12日,岡山,ＨＰ,マツダ,デミオ,2013年01月,"22,638 Km",DBA-DE3FS,ZJ,動力伝達,２０２１年１２月１０日,駐車場に前進で入れる際、斜めになったのでまっすぐ入れるため一度バックし、再びＤレンジに入れたところ、突然もの凄いエンジン音とともに暴走し、用水路の柵にぶつかり停車した。車はフロント部分が大破した。
128,2021年12月12日,福岡,ＨＰ,ＢＭＷ,ＢＭＷ　４２０ｉ,2016年08月,"51,166 Km",DBA-4N20,B48B20A,電気装置,２０２１年１１月２６日,停止中の車両がスマートキーで開錠できず、メカキーで開錠して乗り込むが電源が入らず、エンジンはもとより、ルームライト、窓ガラス、ライト、モニター等全てが機能しない状態になっていた。ディーラーで確認した結果、ＦＥＭコントロールユニットの不具合と判った。
129,2021年12月12日,鹿児島,ＨＰ,ニッサン,リーフ,2015年12月,"87,890 Km",ZAA-AZE0,EM57,緩衝装置,２０２１年１２月　１年点検時,右フロントサスペンションのアッパーマウントに雨水が溜まって錆びていると指摘され、交換を提案された。
130,2021年12月11日,神奈川,ＨＰ,ボルボ,ボルボ　Ｖ４０クロスカントリー,2018年01月,"18,500 Km",LDA-MD4204T,D4204T,電気装置,２０２１年１０月３０日,ミリ波レーダーのコンピュータが故障したため、一般道を走行中メーターパネルに「レーダーが遮られています」の表示が出てＡＣＣが使用不可能となった。
131,2021年12月11日,千葉,ＨＰ,マツダ,デミオ,2016年03月,"46,500 Km",LDA-DJ5FS,S5,かじ取り,２０２０年６月,高速道路走行中にＰＡへ入ろうと左にステアリングを切ったところ、オーバーステアの症状が出た。警告灯は点灯しておらず、右に旋回させた時の曲がり方よりも明らかに大きな曲がり方を左に旋回させると発生させた。更にステアリングをまっすぐにしようとすると引っ掛かって固まってしまい、力を入れて戻さないとやや左に曲がった状態で引っ掛かってしまった。ディーラーで確認したところ、ステアリングロッドの調子が悪いと言われ交換することになった。
132,2021年12月11日,千葉,ＨＰ,マツダ,デミオ,2016年03月,"46,500 Km",LDA-DJ5FS,S5,電気装置,２０２０年６月,幹線道路走行中にウインカーを点滅させていないのにブラインドスポットモニタリング（ＢＳＭ）の警告音が鳴動した。２回目は、１車線幅の山道を走行中にＢＳＭ　ＯＦＦ警告灯が点灯したため、ＢＳＭをＯＦＦにしようとしたらボタンが反応しなかった。山道を２０分ほど走行した後、外観を確認して異常が無かった為エンジンをオフにすると警告灯が消灯した。ディーラーで確認したところ、ＢＳＭユニットの不調と診断され交換をした。
133,2021年12月11日,埼玉,ＨＰ,ニッサン,ノート,2014年03月,"37,000 Km",DBA-E12,HR12,エンジン,２０２１年１２月１０日,スーパーチャージャーのインレットチューブが破損したため、高速道路を走行中にエンジン回転数が不安定になり、エンストして全ての警告灯が点灯した。インレットチューブを交換
134,2021年12月11日,愛知,ＨＰ,ＢＭＷ,ＢＭＷ　２１８ｄ　Ｇｒａｎ　Ｔｏｕｒｅｒ,2016年01月,"69,300 Km",LDA-2E20,B47C20A,動力伝達,２０２１年１１月,走行中にドライブトレーン警告表示が出て、パワーが落ちた感じになった。ディーラーでトランスミッションのロックアップクラッチの異常記録が確認され、トランスミッションの交換と診断された。
