番号,受付日,住所,申告方法,車名,通称名,初度登録年月,総走行距離,型式,原動機型式,不具合装置,発生時期,申告内容の要約
254,2021年03月09日,千葉,ﾌﾘｰﾀﾞｲｱﾙ,スバル,レガシィ,2013年04月,"95,000 Km",DBA-BRM,FB25,制動装置,２０２１年はじめごろから,エンジン停止後、半日程度あけてエンジンを始動する時、ブレーキペダルが相当な強い力をかけないと踏み込めなくなった。
255,2021年03月09日,埼玉,ＨＰ,三菱,ランサーエボリューション１０,2008年01月,"78,000 Km",CBA-CZ4A,4B11,動力伝達,不明,ツインクラッチＳＳＴ搭載車で、アクセルペダルを踏み込むとミッション付近でガチャガチャと音が鳴り変速される。また、クラッチ滑りのようにアクセルペダルを踏み込んでも加速しない。
256,2021年03月09日,埼玉,ＨＰ,メルセデス・ベンツ,Ｃ６３,2012年07月,"34,000 Km",CBA-204377,156,制動装置,２０２０年８月,右フロントＡＢＳセンサー不良により、走行中に突然警告灯が点灯し、ハンドルが重くなった。
257,2021年03月09日,埼玉,ＨＰ,メルセデス・ベンツ,Ｅ２５０アバンギャルドスポーツ,2017年03月,"21,000 Km",RBA-213045C,274,制動装置,２０２１年３月９日,トンネルをくぐる際、緩やかな坂で突然急ブレーキがかかった。
258,2021年03月09日,茨城,ﾌﾘｰﾀﾞｲｱﾙ,トヨタ,ハイエース,2018年04月,"32,800 Km",QDF-GDH201V,1GD,制動装置,納車１年後くらいから,ブレーキ鳴きが酷い。購入店でブレーキパッドの加工など調整修理を受けているが、すぐに再発する。
259,2021年03月09日,茨城,ﾌﾘｰﾀﾞｲｱﾙ,ホンダ,ステップワゴン,2010年02月,"60,000 Km",DBA-RK5,R20A,エンジン,不明,ピストンリングの不良により、エンジンオイルの消費が激しくなった。
260,2021年03月09日,愛知,ＨＰ,ホンダ,フィット,2015年12月,"50,241 Km",DBA-GK3,L13B,エンジン,２０２１年３月５日,スターターモーターピニオンギアの戻り不良により、エンジン始動後にガーと大きな音が出た。
261,2021年03月09日,静岡,ＨＰ,ニッサン,ノート,2012年09月,"81,153 Km",DBA-E12,HR12,エンジン,２０２１年３月６日　夕方,インテークエアダクトの破損により、高速道路の加速路にてアクセルペダルを踏み込んだ瞬間に音が鳴り、直後にエンスト気味になり、走行困難になった。
262,2021年03月09日,大阪,ﾌﾘｰﾀﾞｲｱﾙ,スズキ,スウィッシュ１２５,不明,不明,2BJ-DV12B,不明,車枠・車体,不明,走行中に前輪軸付近からピーピーと異音が出る。
263,2021年03月09日,大阪,ﾌﾘｰﾀﾞｲｱﾙ,ニッサン,セレナ,2013年03月,"53,600 Km",DAA-HFC26,MR20-SM23,電気装置,１か月くらい前から,オルタネーターから異音が出るようになった。
264,2021年03月09日,広島,ﾌﾘｰﾀﾞｲｱﾙ,ニッサン,セレナ,不明,不明,-,不明,エンジン,不明,何らかの原因でエンジンが止まったため、ブレーキペダルが固くなって踏み込めなくなり、ブレーキがほぼ効かない状態となっため、ギアをパーキングに入れて停車させた。
265,2021年03月09日,宮崎,ＨＰ,スズキ,ジムニー,2019年12月,不明,3BA-JB64W,R06A,動力伝達,２０２１年２月４日,ギアの入りが悪く、１速は停止しないとギアが入らない。
266,2021年03月08日,北海道,ﾌﾘｰﾀﾞｲｱﾙ,ホンダ,インサイト,2019年09月,不明,6AA-ZE4,LEB-H4,電動機(モーター),不明,ブレーキサーブモーターの不具合により、ブレーキをかけた際に異音がし、回生ブレーキが効かない。
267,2021年03月08日,長野,ＨＰ,ボルボ,Ｓ６０,2014年06月,"28,900 Km",DBA-FB4164T,B4164T,動力伝達,２０２１年３月,エンジンをかけバックで発進しようとしたところギアが抜けたような感じがした。メーターパネルを見ると「トランスミッション性能が低下しています」というメッセージが表示されていた。
268,2021年03月08日,石川,ＨＰ,ホンダ,ＳＨＵＴＴＬＥハイブリッド,2015年12月,"76,650 Km",DAA-GP7,LEB-H1,動力伝達,２０２１年２月１４日,クラッチのオイルが漏れ、滑る状態で高温になったため、一般道を走行中にスピードが落ち、走れなくなった。家の近くであったため、徐行運転で運転を継続し、たどり着くと間も無くトランスミッション高温表示が出た。
269,2021年03月08日,神奈川,ＨＰ,フォルクスワーゲン,パサートヴァリアント,2007年03月,"65,000 Km",GH-3CBVY,BVY,動力伝達,不明,バルブボディの不具合により、エンジンが温まると５速から４速への変速時に「ドン」という追突されたかのような大きな変速ショックが出る。
270,2021年03月08日,千葉,ＨＰ,トヨタ,パッソ,2010年09月,"61,600 Km",DBA-KGC30,1KR,エンジン,購入３か月目に発生。その後も２０回ぐらい,赤信号が長いため、ギアをニュートラルにして待機後、青信号でギアをドライブにして発進するもエンジンが停止した。慌ててギアをパーキングにしてエンジンを始動した。
271,2021年03月08日,千葉,ﾌﾘｰﾀﾞｲｱﾙ,ホンダ,フィット,2013年12月,"23,100 Km",DBA-GK5,L15B,エンジン,不明,スターターモーターの不具合により、エンジンがかからない時があった。
272,2021年03月08日,埼玉,ＨＰ,ニッサン,シビリアン,2003年03月,"40,800 Km",KK-BHW41,TD42,動力伝達,２０１０年頃から,発進時にシフトレバーＤで発進しない。走行中ギアが入らなくなる。
273,2021年03月08日,埼玉,ﾌﾘｰﾀﾞｲｱﾙ,トヨタ,Ｃ－ＨＲ,2018年04月,"25,000 Km",DAA-ZYX10,2ZR-1NM,その他,不明,カーナビの不具合により、ＴＶ画面のフリーズや、音が出ない症状が断続的に起きる。
274,2021年03月08日,埼玉,ﾌﾘｰﾀﾞｲｱﾙ,マツダ,ロードスター,2018年08月,"3,000 Km",5BA-ND5RC,P5,燃料装置,２０２１年３月７日,燃料ポンプの不具合により、エンジンが停止し、再始動不能になった。
275,2021年03月08日,茨城,ＨＰ,ニッサン,セレナｅ－ＰＯＷＥＲ,2020年01月,"14,000 Km",DAA-HFC27,HR12-EM57,動力伝達,２０２１年２月１５日発生（その後２回発生,一般道をＤレンジで走行中にギアが突然ニュートラルに入り、エンジンオイルの警告灯が点灯し、自力走行できなくなった。
276,2021年03月08日,愛知,電話,トヨタ,クラウンハイブリッド,2013年04月,不明,DAA-AWS210,2AR-1KM,乗車装置,２年前から,運手席シートに装備されているエアバッグが、エンジンを掛けると作動して体を圧縮させて痛い。また、アクセルやブレーキの操作がしづらい。
277,2021年03月08日,愛知,ﾌﾘｰﾀﾞｲｱﾙ,スバル,ＸＶ,2019年09月,"7,000 Km",DBA-GT3,FB16,エンジン,不明,電気ハーネスのショートによる不完全燃焼で、エンジンの出力不良が起こり、アクセル操作が効かなくなった。
278,2021年03月08日,大阪,電話,三菱,ふそうエアロエース,2018年12月,"364,922 Km",2TG-MS06GP,6S10,エンジン,令和１年１２月、令和３年２月、令和３年３,高速乗合バスとして使用している平成３０年１２月初度登録の車両について、ラジエーターホースからの水漏れの不具合が一昨年から今年にかけて３回も発生した。発生時期は、令和１年１２月２２日、令和３年２月１１日、令和３年３月２日。発生状況はいずれも同じで、乗客を乗せて高速道路を運行中に警告ランプが点灯し、最寄りのパーキングエリアに停車して確認するとラジエーター付近から水漏れが発生していた。
279,2021年03月08日,大阪,ﾌﾘｰﾀﾞｲｱﾙ,三菱,ふそうエアロエース,2018年02月,"500,000 Km",2TG-MS06GP,6S10,かじ取り,不明,ステアリングコラムロックが効かず、走行中に脱落した。
280,2021年03月08日,滋賀,ＨＰ,ニッサン,エクストレイル,2016年02月,"37,000 Km",DBA-NT32,MR20,動力伝達,不明,ＣＶＴコントロール不具合により、走行中にメーターパネルに異常表示が出て変速が不安定になり、加速が効かなくなったり、突然スピードが落ち、エンジン音があがる。
281,2021年03月08日,滋賀,ﾌﾘｰﾀﾞｲｱﾙ,スバル,ＸＶ,2018年10月,"10,000 Km",5AA-GTE,FB20-MA1,電動機(モーター),不明,ハイブリッドの電池周りに水が浸入したため、ＨＶ警告灯が点灯した。ディーラーからは後付けしたドライブレコーダーの配線のせいであると判断された。
282,2021年03月07日,福島,ＨＰ,ニッサン,セレナ,2013年06月,"121,342 Km",DAA-HFC26,MR20-SM23,電気装置,２０２１年１月中旬,オルタネーターから異音が発生した。
283,2021年03月07日,岩手,ＨＰ,トヨタ,アルファード,2010年07月,"160,000 Km",DBA-ANH25W,2AZ,車枠・車体,２月上旬,パールホワイト塗装の車で、気が付いたら屋根の上部の塗装が剥げていた。
284,2021年03月07日,長野,ＨＰ,ＢＭＷ,Ｘ３,2015年08月,"64,500 Km",LDA-WY20,N47D20C,動力伝達,２０２１年２月中旬,走行中に突然、ドライブトレーン異常と表示され変速のショックが大きくなり、少しするとシフトがＰに固定され走行出来なくなる。エンジンを一度かけ直すと少しの間ＤやＲにギアが入る。
285,2021年03月07日,長野,ＨＰ,スバル,ＢＲＺ,2016年10月,"88,557 Km",DBA-ZC6,FA20,エンジン,２０２１年２月,バルブスプリングの破損により、一般道走行中にエンジンが停止した。
286,2021年03月07日,東京,ＨＰ,ホンダ,オデッセイ,2006年06月,"60,000 Km",ABA-RB1,K24A,その他,不明,エアコンが故障した。
287,2021年03月07日,東京,ＨＰ,ホンダ,オデッセイ,2006年06月,"100,000 Km",ABA-RB1,K24A,動力伝達,不明,トランスミッションが故障した。
288,2021年03月07日,東京,ＨＰ,ホンダ,オデッセイ,2006年06月,"60,000 Km",ABA-RB1,K24A,制動装置,不明,ブレーキが故障した。
289,2021年03月07日,東京,ＨＰ,ホンダ,オデッセイ,2006年06月,"30,000 Km",ABA-RB1,K24A,その他,不明,カーナビが故障した。
290,2021年03月07日,東京,ＨＰ,ホンダ,オデッセイ,2006年06月,"30,000 Km",ABA-RB1,K24A,かじ取り,不明,パワーステアリングポンプ、ギアボックスが故障した。
291,2021年03月07日,神奈川,ＨＰ,ニッサン,セレナ,2014年02月,"42,600 Km",DAA-HC26,MR20-SM23,動力伝達,２０１９年１０月,ＣＶＴコントロールバルブの不良により、スタートして２０ｋｍ／ｈ～３０ｋｍ／ｈの低速運転をすると、ガタガタとエンストしそうになることがある。
292,2021年03月07日,神奈川,ＨＰ,メルセデス・ベンツ,Ｂ１８０,2012年04月,"46,457 Km",DBA-246242,270,動力伝達,２０２０年２月,車庫入れのため、Ｄレンジで車庫スペースの前まで運転してきて、一時停止してからＤレンジからＲレンジへ切り替えたところ、Ｒレンジに入らず。車のモニタにサービスへ持ち込むように指示が出た。
293,2021年03月07日,埼玉,ＨＰ,ホンダ,フィット,2013年11月,"43,000 Km",DAA-GP5,LEB-H1,動力伝達,２０２１年２月,朝、エンジンをかけるとキーという高い音がし、しばらく走ると音がしなくなる。
294,2021年03月07日,静岡,ＨＰ,マツダ,デミオ,2015年09月,"130,000 Km",LDA-DJ5FS,S5,その他,２０２１年１月頃,マツダコネクトのセンターディスプレイにひびかカビのようなものが生じて画面が見づらい。誤反応も生じている。
295,2021年03月07日,大阪,ＨＰ,メルセデス・ベンツ,Ｖ２２０ｄ,2016年10月,"59,400 Km",LDA-447811,651,排ｶﾞｽ･騒音,不明,ＮＯｘセンサーの不良により、エンジンチェックランプが点灯した。
296,2021年03月07日,鹿児島,ＨＰ,ニッサン,セレナＳハイブリッド,2016年06月,"126,000 Km",DAA-HFC26,MR20-SM23,電気装置,２０２０年１１月,オルタネーターから異音が発生し、交換になった。
297,2021年03月07日,沖縄,ＨＰ,ホンダ,フィットハイブリッド,2013年10月,"57,000 Km",DAA-GP5,LEB-H1,動力伝達,２０２０年１２月,高速走行中に急に空ぶかし状態になり、トランスミッション高温と表示され、微速走行しかできなくなった。
298,2021年03月06日,北海道,ＨＰ,三菱,デリカＤ５,2015年07月,"66,350 Km",LDA-CV1W,4N14,排ｶﾞｽ･騒音,２０２１年１月頃,エキゾーストマニホールドからの排ガス漏れにより、アイドリングおよび通常走行中、排気ガス臭を感じる。
299,2021年03月06日,北海道,ＨＰ,ダイハツ,タント,2010年04月,"75,000 Km",CBA-L385S,KF,エンジン,２０２１年２月,エンジンからカタカタと異音が出始め、オイル量を点検したところゲージにつかないほど減っていた。
300,2021年03月06日,宮城,ＨＰ,ニッサン,エクストレイル,2014年03月,"195,584 Km",DBA-NT32,MR20,動力伝達,２０１４年～２０１６年と２０１９年～２０,ＣＶＴに異常な振動が出るようになり、２０１６年頃も交換をしたが２０１９年頃からシフトショックが出るようになった。２０２０年にはエンジンの回転が上下するようになり、危険だと思い停止したら前にも後ろにも動かなくなった。
301,2021年03月06日,埼玉,ＨＰ,ホンダ,フィット,2011年03月,"107,700 Km",DBA-GE6,L13A,エンジン,２０２１年３月６日,エンジンオイル消費が激しくなっており、規定量３．２リットルに対し、１．５リットルしか残っていなかった。
302,2021年03月06日,茨城,ＨＰ,トヨタ,ヤリスＧ,2021年01月,200 Km,6AA-MXPH10,M15A-1NM,保安灯火,２０２１年１月　当初から,Ｇクラスの標準のハロゲンヘッドライト灯火時、運転席からボンネットの２－３ｍ先に柱状の影が出る。
303,2021年03月06日,愛知,ＨＰ,ホンダ,ＶＥＺＥＬ,2014年02月,"37,200 Km",DBA-RU1,L15B,エンジン,２０２０年８月,エンジンを始動するとガガガガッと異音が発生する。
304,2021年03月06日,熊本,ＨＰ,トヨタ,プリウス,2017年06月,"77,900 Km",DAA-ZVW50,2ZR-1NM,保安灯火,２０２１年３月３日,テールレンズの内側が白くくもっている。白いペンキが付いたようになっているところもある。
305,2021年03月05日,北海道,ＨＰ,三菱,デリカＤ５,2013年10月,"120,000 Km",LDA-CV1W,4N14,排ｶﾞｽ･騒音,去年秋ごろ,車室内で仮眠中に異臭がしていた。後日にディーラーでの点検時に相談したところ、エキゾーストマニホールド、タービンの割れと黒い煤が確認された。
306,2021年03月05日,宮城,ＨＰ,ホンダ,フィット,2020年09月,不明,6BA-GR1,L13B,保安灯火,購入時,壁面がミラー状になっているメリーゴーランド方式の駐車場に入るとオートライトが作動し、光源が壁面のミラーに反射してまぶしくて車両幅等が確認できない。
307,2021年03月05日,宮城,ＨＰ,ホンダ,フィットハイブリッド,2014年06月,"120,000 Km",DAA-GP5,LEB-H1,動力伝達,冬、朝寒冷状態エンジンスタート時,エンジンスタートすると、エンジンルームからキュイーンと音が鳴り、しばらくすると消える。
308,2021年03月05日,新潟,ＨＰ,プジョー,３０８,2014年12月,"18,000 Km",ABA-T9HN02,HN02,車枠・車体,２０２０年４月,走行中、リア車軸と思われる部分から「キシッ、キシッ」と異音が聞こえる。
309,2021年03月05日,東京,ＨＰ,シトロエン,グランドＣ４ピカソ,2015年03月,"17,600 Km",ABA-B7875G01,5G01,排ｶﾞｽ･騒音,２０２０年８月２３日、１１月２２日,高速道路及び下り坂道を走行中にエンジン警告灯が点灯してエンジンの出力が低下し、速度のコントロールができなくなったため、減速を余儀なくされた。
310,2021年03月05日,東京,ＨＰ,トヨタ,カローラツーリング,2020年02月,"12,000 Km",6AA-ZWE211W,2ZR-1NM,かじ取り,２０２０年１２月から２０２１年２月,寒い朝の走行中にハンドル付近からキュッキュッと不快な音が鳴る。
311,2021年03月05日,神奈川,ﾌﾘｰﾀﾞｲｱﾙ,メルセデス・ベンツ,Ｃ２２０ｄ,2017年08月,"56,700 Km",LDA-205204,651,燃料装置,不明,インジェクターの不良により、走行中に突然エンジンがガタガタしギアが上がらなくなった。エンジンを止め、しばらく駐車した後で再度始動してみたところ、２ｋｍくらい走行したところで症状が再発し、エンジンチェックの警告表示が出たため、運転を中止し、レッカーでディーラーへ入庫した。
312,2021年03月05日,愛知,ＨＰ,スズキ,ジムニーシエラ,2019年05月,"12,000 Km",3BA-JB74W,K15B,かじ取り,購入してすぐに,低速でカーブを曲がったり、段差を乗り越えると、アクセルペダル付近から「カコッ」という異音がなる。
313,2021年03月05日,静岡,ﾌﾘｰﾀﾞｲｱﾙ,ホンダ,ＶＥＺＥＬ,2018年01月,"37,000 Km",DAA-RU4,LEB-H1,制動装置,２０２１年３月,駐車ブレーキのモーターが故障し、パーキングブレーキのＯＮ／ＯＦＦ時に、モーター作動音が突然ギーギーと鳴るようになった。
314,2021年03月05日,大阪,ＨＰ,ＭＩＮＩ,ＭＩＮＩ,2021年01月,不明,3DA-XV20MW,B47C20B,燃料装置,２０２１年２月８日納車日,運転中アイドリングストップの都度、燃料タンクから燃料がバシャバシャ強い音が鳴っている。
315,2021年03月05日,大阪,ﾌﾘｰﾀﾞｲｱﾙ,トヨタ,アイシス,2011年11月,"100,000 Km",DBA-ZGM10W,2ZR,走行装置,２０２１年３月,スペアタイヤを固定しているフックが緩み、走行中にスペアタイヤが脱落した。
316,2021年03月05日,兵庫,ＨＰ,マツダ,アテンザ,2014年03月,"91,000 Km",LDA-GJ2FP,SH,保安灯火,２０２１年２月,ヘッドライト反射板のメッキ剥がれにより光量が不足し、車検で不合格になった。
317,2021年03月05日,兵庫,ＨＰ,ニッサン,セレナ,2013年07月,"46,700 Km",DAA-HFC26,MR20-SM23,電気装置,最近,オルタネーターの不具合により、エンジンルームからガタガタ異音がする。
318,2021年03月05日,広島,ﾌﾘｰﾀﾞｲｱﾙ,ニッサン,マーチ,2011年03月,"100,100 Km",DBA-K13,HR12,制動装置,不明,後輪ドラムブレーキのバックプレートの不良により、ドラムブレーキのシューがドラムに正しく当たっておらず、ライニングが２～３ｍｍの範囲で残る状態になっていた。この影響で、５人乗車時等でのブレーキが甘く、意図した距離よりも停止距離が延びる症状が出た。
319,2021年03月05日,香川,電話,三菱,ふそうキャンター,2012年03月,不明,SKG-FEB90,4P10,エンジン,２０２１年３月４日,タイミングチェーンのリコール対象車としてチェーンを交換した車で、タイミングチェーンが切損し、走行不能になった。
320,2021年03月05日,大分,ＨＰ,スズキ,ソリオ,2018年06月,"26,526 Km",DAA-MA46S,K12C-PB05A,車枠・車体,２０２１年２月５日８時１０分頃,交差点で突然アクセルペダルを踏んでも車が動かなくなった。
321,2021年03月04日,東京,ﾌﾘｰﾀﾞｲｱﾙ,ＢＭＷ,ミニクーパー,2012年03月,"46,000 Km",DBA-ZF16,N16B16A,保安灯火,２０２０年２月２０日ごろ,制動灯のソケットが溶損し、不点灯になった。
322,2021年03月04日,千葉,電話,マツダ,スクラム,2016年10月,不明,HBD-DG17V,R06A,制動装置,２０２０年１１月,小雨の中、時速２０ｋｍ／ｈぐらいで走行中に踏切で停止するためにブレーキを掛けたところ、普通に停止できるはずが、ＡＢＳが作動したために停止距離が伸びて踏切に入る直前で停止した。
323,2021年03月04日,千葉,電話,トヨタ,プリウス,不明,不明,NHW20,不明,制動装置,不明,ＡＢＳが不要作動して、ブレーキが効かなくて事故になりそうになった。
324,2021年03月04日,埼玉,ＨＰ,三菱,ふそうスーパーグレート,2015年11月,"280,000 Km",QKG-FV60VX,6R10,エンジン,２０２１年２月,オイルパンが割れ、エンジンオイルが漏れた。
325,2021年03月04日,埼玉,ﾌﾘｰﾀﾞｲｱﾙ,ニッサンディーゼル,クオン,2008年02月,"260,000 Km",ADG-CW2XL,MD92,動力伝達,不明,ＭＴクラッチブースターを押すボールジョイントが破損し、エンストし走行不能になった。
326,2021年03月04日,愛知,ﾌﾘｰﾀﾞｲｱﾙ,ダイハツ,タント,2017年10月,"19,000 Km",DBA-LA600S,KF,その他,不明,エアコン吹き出し口から異音がする。
327,2021年03月04日,兵庫,ＨＰ,スズキ,ワゴンＲ　スティングレー,2009年11月,"43,076 Km",CBA-MH23S,K6A,制動装置,中古購入後、１０ｋｍ未満,ＡＢＳアクチュエーターの不良により、ＡＢＳのチェックランプが点灯した。
328,2021年03月04日,熊本,ＨＰ,マツダ,ＣＸ－５,2013年07月,"83,000 Km",LDA-KE2AW,SH,かじ取り,２０２１年２月,一般道を走行中に警告灯が点灯し、同時にパワーステアリングが効かなくなった。
329,2021年03月03日,山形,ＨＰ,トヨタ,プリウス,2016年05月,"34,900 Km",DAA-ZVW55,2ZR-1NM-1MM,保安灯火,２０２１年２月頃、気が付いた,テールランプユニット全てクリア部分に曇りが発生した。
330,2021年03月03日,東京,ﾌﾘｰﾀﾞｲｱﾙ,ＢＭＷ,３３５ｉカブリオレ,2010年11月,"63,000 Km",ABA-DX35,N55B30A,電気装置,不明,タイヤのパルストランスミッタの不良により、前輪の車輪速度が検出できなくなったため、変速不良等、車輪速情報を使う部分で不具合が発生した。
331,2021年03月03日,神奈川,ＨＰ,ニッサン,モコ,2013年11月,"49,300 Km",DBA-MG33S,R06A,保安灯火,２０１８年７月と２０２１年３月,左右のドアミラーが開閉できなくなった。
332,2021年03月03日,千葉,ＨＰ,三菱,アウトランダーＰＨＥＶ,2013年01月,"119,452 Km",DLA-GG2W,4B11-S61-Y61,電動機(モーター),２０２０年９月６日,走行してすぐＥＶシステム異常、回生ブレーキ点灯、ＡＣＣシステム点検がメーター内に出てスピードが出なくなった。メーカーで調査が行われた結果、モーターコイル引き出し線の成型不十分かつ保護スリーブが短いため引き出し線とブラケットが製造当時から接触しており擦れたことでエナメル被覆が剥がれ、ショート（漏電）したことが原因でフェールセーフ制御が作動したものと判った。
333,2021年03月03日,千葉,ﾌﾘｰﾀﾞｲｱﾙ,ニッサン,セレナ,2016年12月,"25,700 Km",DAA-GFC27,MR20-SM24,制動装置,２０２１年２月,一般道の何も障害物が無いところで衝突被害軽減ブレーキが作動し、急ブレーキがかかったことがある。また、信号停止時にソナーが誤検知をして発進できなくなったこともある。
334,2021年03月03日,愛知,ﾌﾘｰﾀﾞｲｱﾙ,ニッサン,ＮＶ２００バネット,2010年11月,"150,000 Km",DBA-M20,HR16,電気装置,２０２１年３月３日,国４４８０（スパイラルケーブル）のリコールについて、対象外とされた一般車でスパイラルケーブルの破損が発生し、エアバッグ警告灯が点滅した。
335,2021年03月03日,三重,ＨＰ,トヨタ,プリウス,2019年05月,"40,453 Km",DAA-ZVW51,2ZR-1NM,エンジン,２０２０年１２月２２日,駐車するためブレーキペダルを踏んで減速したが、停車する寸前に急発進したため、３メートル先の無人の車に正面から衝突した。
336,2021年03月03日,三重,ＨＰ,ホンダ,フィットハイブリッド,2014年01月,"141,000 Km",DAA-GP5,LEB-H1,動力伝達,２０２１年２月,朝のエンジン始動後、ミッション辺りから金属音がする。
337,2021年03月03日,福井,ＨＰ,ボルボ,Ｖ６０　Ｔ４,2012年12月,"93,000 Km",DBA-FB4164T,B4164,動力伝達,２０２０年７月,ギヤが抜けるような症状になり、トランスミッションエラーの表示が出る。バックギヤが入らず、エンジンを再始動すると一旦治る。
