番号,受付日,住所,申告方法,車名,通称名,初度登録年月,総走行距離,型式,原動機型式,不具合装置,発生時期,申告内容の要約
135,2021年12月10日,北海道,ﾌﾘｰﾀﾞｲｱﾙ,ニッサン,エクストレイル,不明,"62,000 Km",DBA-NT32,MR20,動力伝達,不明,ＣＶＴの不良により、アクセルペダルを踏んでも加速が鈍く、エンジン回転を３０００～４０００ｒｐｍまで上げてやっと動くような症状が出るようになり、エンジン警告灯が点灯したため、ディーラーに見せたところ、ＣＶＴ不良と診断された。
136,2021年12月10日,福島,ＨＰ,ダイハツ,タント,2017年09月,"86,628 Km",DBA-LA610S,KF,乗車装置,２０２１年１２月５日,ドアロックアクチュエーターの不良により、運転席のドアロックが動かなくなった。
137,2021年12月10日,長野,ＨＰ,フォルクスワーゲン,ＶＷゴルフヴァリアント１．４／１０３ｋＷ,2016年05月,"55,000 Km",DBA-AUCHP,CHP,動力伝達,２０２１年１２月,シフトノブのトリムメッキが剥がれていたため、清掃時に小指を負傷した。
138,2021年12月10日,長野,ＨＰ,アウディ,アウディ　ＴＴ　２．０Ｔｑ,2017年02月,"17,800 Km",ABA-FVCHHF,CHH,エンジン,２０２１年１１月,冷却水減少の警告灯がメーターパネルに表示され同時に警告音が鳴り、直ちに車両を停車した。パネルには最寄りのディーラーでの修理が必要とのメッセージが表示された。整備工場でサーモスタットハウジングからの冷却水漏れと診断された。
139,2021年12月10日,東京,ＨＰ,ニッサン,シーマ,2013年06月,"102,000 Km",DAA-HGY51,VQ35-HM34,動力伝達,２０２１年１１月２３日（火）,高速道路を走行中に、急激にスローダウンしアクセルを踏んでも速度があがらない状態になった。高速道路から一般道路へ降りたが、通常のように速度は出せず、インパネの警告灯も多数点灯していた。ディーラーで確認したところ、クラッチＡの摩耗によるものでトランスミッション交換が必要と診断された。
140,2021年12月10日,東京,ＨＰ,ニッサン,シーマ,2013年06月,"102,000 Km",DAA-HGY51,VQ35-HM34,かじ取り,２０１９年２月,高速道路を走行中、ハンドルロックのように一瞬固まった状態が何度か発生した。ディーラーで確認したところ、ハンドルのピニオンギア、パワステポンプをＡＳＳＹ交換した。
141,2021年12月10日,愛知,ＨＰ,ニッサン,セレナ,2016年06月,"57,638 Km",DAA-HC26,MR20-SM23,電気装置,２０２１年１２月８日,オルタネーターの不良により、やや上り坂の交差点でブレーキペダルを踏んで停止後、発進時にブレーキを放した際にエンストしていたため、後方へ進んでしまった。慌ててブレーキペダルを踏んで、再始動操作を行った。
142,2021年12月10日,大阪,ﾌﾘｰﾀﾞｲｱﾙ,ダイハツ,ムーヴ,2016年02月,"158,600 Km",DBA-LA150S,KF,その他,不明,単眼カメラの不良により、スマートアシスト故障の警告表示が出た。
143,2021年12月09日,山形,ＨＰ,スズキ,ハスラー,2017年11月,"23,000 Km",DAA-MR41S,R06A-WA04A,乗車装置,最近気が付いた,バックドアが保持できず、勝手に閉まって頭をぶつけてしまう。
144,2021年12月09日,富山,ＨＰ,ＢＭＷ,Ｋ１３００ＧＴ,2009年11月,"36,500 Km",K1300GT,134EA,制動装置,２０２１年１０月２日,ＡＢＳユニットの故障により、エンジン始動後、走行を開始してもＡＢＳの警告灯が消えなくなった。
145,2021年12月09日,東京,ＨＰ,ホンダ,ＰＣＸ,不明,不明,2BJ-JK05,JK05E,エンジン,２０２１年４月　頃,停車時のアイドリングが高めになる。エンジン始動後、高回転でエンジンがまわり続ける。センタースタンドを立てた状態にすると、メーター読みで６０ｋｍ／ｈ近くまでタイヤが回転する状態になる。
146,2021年12月09日,埼玉,ＨＰ,アウディ,アウディ　ＴＴクーペ　１．８Ｔ,2014年09月,"42,000 Km",ABA-8JCDA,CDA,動力伝達,２０２１年１１月２２日,２０ｋｍ程走った後、交差点での発進しようとＤレンジにギアを投入した際に大きな異音がし、エンジン排気系異常警告灯が表示された。エンジンをいったん切り、再度かけ直してＮ→Ｄに投入するも同様の現象となり、アクセルペダルを踏んでもゆっくりとしか進まなかった。ディーラーにみせたところ、クラッチ本体の交換が必要と診断された。
147,2021年12月09日,埼玉,ＨＰ,三菱,デリカ,2017年07月,"51,000 Km",LDA-CV1W,4N14,排ｶﾞｽ･騒音,２０２１年９月ごろから（５００００ｋｍ手,エンジン始動時、外気導入にしてエアコン起動したら排ガス臭がしたため、販売店で確認したところ、エキゾーストマニホールドの亀裂が発見された。
148,2021年12月09日,静岡,ﾌﾘｰﾀﾞｲｱﾙ,ニッサン,バネット,2013年12月,"38,300 Km",ABF-SKP2MN,L8,緩衝装置,不明,後輪のリーフスプリングの３枚の内、真ん中が折れる。これまでに左右合計で４回折れている。
149,2021年12月09日,静岡,ﾌﾘｰﾀﾞｲｱﾙ,ニッサン,バネット,2013年02月,"77,800 Km",ABF-SKP2MN,L8,緩衝装置,不明,後輪のリーフスプリングの３枚の内、真ん中が折れる。これまでに左右合計で５回折れている。
150,2021年12月09日,大阪,ﾌﾘｰﾀﾞｲｱﾙ,三菱,ミニキャブ,2009年06月,"126,000 Km",GBD-U61V,3G83,エンジン,１週間前,走行中にエンジンが止まった。整備工場で確認したところラジエータが割れていると確認された。
151,2021年12月09日,京都,ﾌﾘｰﾀﾞｲｱﾙ,ホンダ,オデッセイ,2017年11月,"100,000 Km",DAA-RC4,LFA-H4,動力伝達,２０２１年１１月,変速機から異音が出るようになった。
152,2021年12月09日,兵庫,ＨＰ,ニッサン,セレナ,2014年07月,"64,100 Km",DAA-HFC26,MR20-SM23,動力伝達,２０２０年７月頃,信号待ちで青になってアクセルペダルを踏んでもすぐに発進せず３～４秒してから発進した。時速３０ｋｍぐらいで走行中、突然エンジンが唸りを上げ、速度が安定しなかった。ディーラーに見てもらったところ、ＣＶＴからの異常信号があると言われリセットしてもらった。
153,2021年12月09日,広島,ＨＰ,ニッサン,エクストレイル,2016年01月,"55,000 Km",DAA-HT32,MR20-RM31,制動装置,２０２１年９月,走行中にブレーキの警告灯（赤と橙）が点灯し、数秒後に警告音が鳴った。２００ｍ先のディーラーに向かったが、途中でフットブレーキが全く効かなくなり、サイドブレーキを引いて緊急停止をし、レッカー車でディーラーに搬送した。ディーラーで車両を確認した結果、ブレーキマスターシリンダーの不良と診断された。
154,2021年12月09日,福岡,ﾌﾘｰﾀﾞｲｱﾙ,ＢＭＷ,ＢＭＷ　１１６ｉ,2014年08月,"60,000 Km",DBA-1A16,N13B16A,制動装置,２０２１年１１月２１日,雨天の渋滞時、ブレーキペダルが固くなり効かなかった。
155,2021年12月09日,佐賀,ＨＰ,トヨタ,ヴォクシー,2014年09月,"106,800 Km",DBA-ZZR80W,3ZR,動力伝達,２０２１年１２月５日,ＣＶＴの不良により、バッテリーと横滑りのマークが点灯した。
156,2021年12月08日,北海道,ＨＰ,トヨタ,エスクァイア,2018年01月,"38,800 Km",DBA-ZRR85G,3ZR,制動装置,２０２１年１２月０６日,片側１車線の国道を制限速度で走行中に対向車線を走行中の大型ダンプとすれ違う直前くらいに突如プリクラッシュセーフティの警告音ならびにブレーキの表示がマルチインフォメーションディスプレイに表示された。
157,2021年12月08日,秋田,ＨＰ,トヨタ,ＲＡＶ４　ＰＨＶ,2021年06月,不明,6LA-AXAP54,A25A-5NM-4NM,車枠・車体,２０２１年１２月,気温が低い日（朝、夕）に始動直後１０秒程度、共振音（かなり大きいブーンという音）がする。
158,2021年12月08日,新潟,ＨＰ,ニッサン,エクストレイル,2015年09月,"59,000 Km",DAA-HNT32,MR20-RM31,動力伝達,２０２１年１１月,ＣＶＴの不具合により、走行（低速）時に車体がガタガタと揺れることがあった。後進する際に回転数が上昇し、急加速することがあった。回転数が１０００ｒｐｍ～１５００ｒｐｍになるとウィーンという機械音やカラカラと異音がするようになった。
159,2021年12月08日,富山,ＨＰ,アウディ,アウディ　Ａ５　３．２ｑ,2008年10月,"106,000 Km",ABA-8TCALF,CAL,車枠・車体,２０２１年１２月６日,高速道路を走行中に最初にパーキングブレーキの警告表示と警告音が鳴り、続けてヘッドライトレベリングの警告表示と警告音、ＥＳＰの警告表示、ＥＰＣの警告表示がでてナビ画面が消灯した。危険と判断し、最寄りのインターで降りたが、この際にウインカーとパワーステアリングも作動しなかった。ディーラーで確認したところ、トランクのパッキン、ならびに給油口から雨水が浸入し、配線を伝ってトランク内に設置されたコンピューターに達したために誤作動を及ぼしたと診断された。
160,2021年12月08日,石川,ＨＰ,トヨタ,エスティマ,2006年03月,"142,000 Km",DBA-ACR50W,2AZ,エンジン,数年まえから,エンジンオイルがすごく減り、メーターのオイル警告ランプが約２０００ｋｍで点くたびに３Ｌ補充を行っている。
161,2021年12月08日,石川,ＨＰ,トヨタ,アルファード,2012年02月,"55,000 Km",DBA-ACR20W改,2AZ,エンジン,１～２年前から気になりだした,エンジンオイルが減り、オイル警告灯が約３０００ｋｍで点く。
162,2021年12月08日,石川,ＨＰ,トヨタ,アルファード,2012年01月,"74,000 Km",DBA-ANH20W,2AZ,エンジン,１～２年前から気になりだした,エンジンオイルが減り、メーターのオイル警告ランプが約３０００ｋｍで点く。
163,2021年12月08日,神奈川,文書,ホンダ,ＳＨＵＴＴＬＥ,2018年12月,"10,360 Km",DAA-GP7,LEB-H1,制動装置,不明,立体駐車場より出庫する際、エンジン起動後に警告灯が点灯した。少しすると「ＧＯ　ＴＯ　ＤＲＩＶＥ」と表示されたので駐車スペースから移動したが、ブレーキが効かなかった。エンジンを再始動させたが改善せず、その後も症状が続いたため、ディーラーへ入庫して確認したところ、電気系統が二段階で正常に動作させているが、この二つとも異常となったものと診断された。
164,2021年12月08日,千葉,ＨＰ,トヨタ,エスクァイア,2015年06月,"146,184 Km",DBA-ZRR85G改,3ZR,動力伝達,１ヶ月前くらいから,ＣＶＴの不良により、加速時や減速時、高速走行中に異音がするようになった。
165,2021年12月08日,千葉,ＨＰ,ホンダ,アクティ,不明,"78,000 Km",EBD-HA9,E07Z,かじ取り,中古販売店から公道に出たとき,電動パワーステアリングの不良により、ハンドルに舵角を与えてやると、直進状態へのハンドルの戻りが悪く、そのままスーッと曲がってってしまう。
166,2021年12月08日,千葉,ﾌﾘｰﾀﾞｲｱﾙ,三菱,ふそうキャンター,2015年11月,"161,400 Km",TKG-FEB90,4P10,燃料装置,最近,燃料ポンプの不具合により、走行中・停車中にエンストした。燃料ポンプを刺激すると燃料が送られて始動出来る。
167,2021年12月08日,千葉,ﾌﾘｰﾀﾞｲｱﾙ,三菱,ふそうキャンター,2016年02月,"145,100 Km",TKG-FEA50,4P10,燃料装置,最近,燃料ポンプの不具合により、走行中・停車中にエンストした。燃料ポンプを刺激すると燃料が送られて始動出来る。
168,2021年12月08日,埼玉,ﾌﾘｰﾀﾞｲｱﾙ,トヨタ,プリウス,2010年03月,"64,394 Km",DAA-ZVW30,2ZR-3JM,排ｶﾞｽ･騒音,２０２１年１２月４日,１５分位走行後、駐車場に止めた際にエンジンから異常な振動と異音を感じるとともに硫黄臭が車室内に入ってきた。降車して排気管を確認したところ、排気ガスの臭いであると判った。ディーラーで確認をうけたところ、排気系のバルブ不良ではないかという見解が出ている。
169,2021年12月08日,栃木,ﾌﾘｰﾀﾞｲｱﾙ,スバル,レガシィ,2006年11月,"170,000 Km",DBA-BP9,EJ25,動力伝達,不明,駐車のため、ギアをＲにした後、Ｐレンジにしようとした際にチェンジレバーが正しく動かず、Ｄレンジにも動かせない状態になった。自分でシフトパネルを外してみたところ、内部の部品が外れており、シフトの動きを邪魔していた。
170,2021年12月08日,愛知,ＨＰ,ニッサン,セレナ,2012年11月,"86,000 Km",DAA-HFC26,MR20-SM23,電気装置,２０２１年１１月,オルタネーターの不良により、エンジンからゴーっという異音が発生するようになった。
171,2021年12月08日,静岡,ＨＰ,スズキ,スイフト,2018年02月,"49,500 Km",DAA-ZC53S,K12C-WA05A,エンジン,２０２１年１１月,坂道でアイドリングストップ後、動き出す時にファンベルトが滑りエンジンが掛からなかったため、プッシュスタータースイッチを押して、エンジンを再始動した。
172,2021年12月08日,静岡,ﾌﾘｰﾀﾞｲｱﾙ,スバル,インプレッサ,不明,不明,不明,不明,保安灯火,２０２１年１１月６日、１２月８日,自動車専用道路を走行中にひびが入り、飛び石ということで修理を行ったが、その翌月に高速道路を走行中、またひびが入った。
173,2021年12月08日,岐阜,ＨＰ,ホンダ,Ｎ－ＯＮＥ,不明,不明,DBA-JG1,不明,制動装置,２０２１年１２月３日,車検後にサイドブレーキの調子が悪く効かない時がある。
174,2021年12月08日,岐阜,ﾌﾘｰﾀﾞｲｱﾙ,ホンダ,ステップワゴン,2016年05月,"72,800 Km",DBA-RP3,L15B,エンジン,不明,アイドリングストップでエンジンが停止後、再始動せず、ギアをパーキングに入れて再始動せよ。というメッセージがでた。販売店でバッテリー交換などを試してみたが解消しておらず、その後も何度も再発している。
175,2021年12月08日,兵庫,ＨＰ,ホンダ,Ｎ－ＶＡＮ,2020年07月,"21,000 Km",HBD-JJ1,S07B,その他,２０２０年８月,ガソリンを入れてもガソリンメータや航続可能距離表示が正確に反応しない。
176,2021年12月08日,兵庫,ＨＰ,ホンダ,ＶＥＺＥＬ,2016年02月,"92,200 Km",DAA-RU3,LEB-H1,動力伝達,２０２１年１２月１日,走行中にアクセルペダルを踏んでも進まなくなり停車した。ドライブ、パーキングも入らずに後続は渋滞になってしまった。この時、ヒルスタートアシストシステム点検、ブレーキシステム点検、ブレーキホールドシステム点検と表示されていた。５分後にエンジン再始動で運転可能になった。ディーラーで確認したところ、トランスミッション交換を勧められた。
177,2021年12月08日,兵庫,ＨＰ,ホンダ,Ｎ－ＶＡＮ,2020年07月,"21,000 Km",HBD-JJ1,S07B,車枠・車体,２０２０年８月,朝、エンジンをかけて２～３ｍ移動後、エンジンを切ると、その後、室内でブルブルと振動と異音が発生する。特に気温の低い冬季は振動と異音が出る。
178,2021年12月07日,長野,ﾌﾘｰﾀﾞｲｱﾙ,シトロエン,Ｃ４カクタス,2017年01月,"6,300 Km",ABA-E3HM01,HM01,動力伝達,２０２１年１１月１９日,信号でアイドリングストップし、その後、右折をしようとした際に再始動できなくなった。しばらくして再始動できたが、その翌日にはギアがバックに入らず、出先の駐車場で身動きが出来なくなってしまった。ディーラーに搬送し、コンピューターをリセットして様子をみることとしたが、翌日に再びギアが入らなくなり走行不能になってしまった。ディーラーで再検査したところシフトアクチュエーター不良ではないかという見解があったが、市場の情報でバッテリー不良により当該症状が発生するという物があり、試しにバッテリーを交換したところ、それ以降症状が発生しなくなっている。
179,2021年12月07日,東京,ＨＰ,その他,ＥＶＤ　ＳＯＦＴＷＡＲＥ　Ｋ６－Ｂｉｋｅ,不明,不明,不明,不明,制動装置,新車購入当初から,ブレーキが効きの悪く、自転車並みである。
180,2021年12月07日,東京,ＨＰ,その他,ＥＶＤ　ＳＯＦＴＷＡＲＥ　Ｋ６－Ｂｉｋｅ,不明,不明,不明,不明,保安灯火,新車購入当初から,ブレーキランプが暗い。
181,2021年12月07日,東京,ＨＰ,その他,ＥＶＤ　ＳＯＦＴＷＡＲＥ　Ｋ６－Ｂｉｋｅ,不明,不明,不明,不明,その他,新車購入当初から,最高速度調整スイッチが機能していない。下り坂等でアクセルを回さず走行時にスピードメーターが０になる。
182,2021年12月07日,東京,ＨＰ,ニッサン,セレナ,2017年03月,"18,000 Km",DAA-GFC27,MR20-SM24,制動装置,２０１９年１１月,車を停車させパーキングブレーキを掛けようとしたところ、パーキングスイッチが点滅、メーターパネルに異常灯が点灯し、パーキングブレーキが機能しなかった。
183,2021年12月07日,栃木,ＨＰ,フォルクスワーゲン,ＶＷゴルフ　１．４／１０３ｋＷ,2013年11月,"52,000 Km",DBA-AUCPT,CPT,保安灯火,２０２１年１２月７日,走行中に左側（助手席側）ドアミラーガラスが基板から剥離して脱落した。
184,2021年12月07日,愛知,ＨＰ,ホンダ,フィット,2014年06月,"57,666 Km",DBA-GK3,L13B,エンジン,２０２１年１１月３０日,走行していて、信号待ちで停止後にエンジンが再起動できなくなった。ディーラーでセルの異常と診断された。
185,2021年12月07日,静岡,ﾌﾘｰﾀﾞｲｱﾙ,スズキ,アルト,2016年12月,"12,000 Km",不明,不明,動力伝達,１１月初旬,ＡＧＳ（自動変速機）のアクチュエータ不良により、トランスミッション警告灯が点灯するとともに、走行中にギアが抜ける、ギアが入らない、エンジンが始動できない、勝手にシフトダウンする等の症状が出るようになった。
186,2021年12月07日,静岡,ﾌﾘｰﾀﾞｲｱﾙ,トヨタ,プリウス,2016年01月,"111,800 Km",DAA-ZVW50,2ZR-1NM,車枠・車体,不明,白色塗装の車で、ピラー部分の塗装が剥がれた。
187,2021年12月07日,静岡,ﾌﾘｰﾀﾞｲｱﾙ,トヨタ,プリウス,2016年01月,"111,800 Km",DAA-ZVW50,2ZR-1NM,保安灯火,不明,テールランプの内側が白く曇るようになった。
188,2021年12月07日,大阪,ﾌﾘｰﾀﾞｲｱﾙ,ルノー,キャプチャー,2021年03月,"3,000 Km",7BA-HJBH5H,H5H,保安灯火,購入直後から,ウインカーが出ない。メーターパネルが真っ黒になり、何も表示されなくなる。駐車しておくと勝手にライトが点く。リモコンキーを持って車両に近づいても開錠されないなどの不具合が立て続けに発生している。
189,2021年12月07日,滋賀,ＨＰ,ＢＭＷ,ＢＭＷ　３２０ｉ,2015年04月,"38,491 Km",DBA-3B20,N20B20B,動力伝達,２０２１年１１月１３日,信号待ちからＤレンジに入らずニュートラルに戻り、エンジンは稼働しているが走行不能になった。ディーラーで確認したところ、ミッションの１速が検知不良でミッションの交換が必要と診断された。
190,2021年12月07日,島根,ﾌﾘｰﾀﾞｲｱﾙ,ニッサン,ＮＶ３５０キャラバン,2013年10月,"185,209 Km",LDF-CW8E26改,YD25,排ｶﾞｽ･騒音,去年から,ＤＰＦの再生処理の頻度が高くなったため、ディーラーに相談したところ、マフラーの詰まりということで交換したが、１年経過後にＤＰＦ警告灯が点灯するとともに、再生ボタンで処理が作動しない状態になったため、改めてディーラーで調べてもらったところ、インジェクター不良と診断された。
191,2021年12月07日,福岡,ＨＰ,三菱,アウトランダー,2010年07月,"77,760 Km",DBA-CW4W,4B11,制動装置,２０２１年１０月,ＡＢＳ／ＡＳＣ油圧ユニットの不良により、走行中、メーターパネルの警告灯が点灯及び警告音が鳴った。
192,2021年12月06日,宮城,ﾌﾘｰﾀﾞｲｱﾙ,ＢＭＷ,７４０ｄ,2017年11月,"17,000 Km",LDA-7C30,B57D30B,エンジン,２０２１年８月１１日,スタートストップスイッチが鋭利な状態になっていたため、操作をした際に手を負傷した。１年１か月前に同じことがあり、部品を交換していたが、再発した。
193,2021年12月06日,秋田,ＨＰ,スズキ,ワゴンＲ,2021年08月,不明,5AA-MH95S,R06D-WA04C,保安灯火,購入当日　受け取り後に自宅へ向かう途中で,フロントガラスの内側が曇ったときに多数の輪が現れ、濡れタオルで拭き取っても消えなかった。販売店からはガラス製造工場で成形直後に吸盤で移動させた際にガラスが円形に変形して凹凸が生じたと推定すると説明され、研磨でない拭き取りを試みたところ八割がた改善できたと言われている。
194,2021年12月06日,富山,ﾌﾘｰﾀﾞｲｱﾙ,ダイハツ,ハイゼット,2001年10月,"114,500 Km",GD-S210P,EF,かじ取り,不明,使用中にパワーステアリング警告灯が点灯した。
195,2021年12月06日,東京,ＨＰ,アルファロメオ,ステルヴィオ,2021年11月,50 Km,3DA-94922,55284529,動力伝達,納車後からすぐ,信号で停止するためアクセルペダルから足を離してブレーキペダルを踏むと、一瞬エンジン回転数が上がり加速する。
196,2021年12月06日,千葉,ＨＰ,アウディ,アウディ　ＴＴクーペ　２．０Ｔｑ,2014年12月,"26,000 Km",ABA-8JCESF,CES,電気装置,２０２１年９月２２日,メーターパネルにバルブ異常の警告表示と、警報が出た。ランプの点灯は全て正常で、しばらくすると警告灯は消えるが、連日のように繰り返す症状が出た。ディーラーで確認したところ、右テールライトのコネクターのアース端子が焼損しており周辺の樹脂部品は溶けていた。
197,2021年12月06日,千葉,ＨＰ,アウディ,アウディ　ＴＴクーペ　２．０Ｔ　ｑ,2014年12月,"19,000 Km",ABA-8JCESF,CES,動力伝達,２０２０年３月１日,走行中にシフトチェンジを右パドルシフトで行おうとしたが、パドルシフトが固着して動かないためシフトチェンジが出来ず危険な状態になった。しばらく走行していると何事もなかったように正常となるが、突然同じ症状が発生しこれを繰り返した。ディーラーで確認したところ、パドルシフトスイッチの中にある樹脂の爪が中で折損しており、それが中で可動部に挟まってしまいシフトスイッチが動かなくなっていた。
198,2021年12月06日,茨城,ＨＰ,三菱,ふそうキャンター,2016年10月,"286,234 Km",TPG-FEB50,4P10,燃料装置,２０２１年１２月４日,一般道走行中、ＥＮＧＳＹＳの表示が赤点灯し、エンジンストールした。一旦キーＯＦＦ後、再始動すると走行はできた。ディーラーで確認したところ、「コモンレール・サプライポンプ交換になる。」と診断された。
199,2021年12月06日,茨城,ＨＰ,スバル,レヴォーグ,2015年01月,"39,000 Km",DBA-VM4,FB16,制動装置,２０２１年７月～,エンジン始動時ブレーキペダルの踏みごたえが凄く重く、踏み込めない。始動後は、軽くなり普通に踏み込める。
200,2021年12月06日,茨城,ﾌﾘｰﾀﾞｲｱﾙ,スバル,ＸＶ　ハイブリッド,2014年05月,"35,600 Km",DAA-GPE,FB20-MA1,動力伝達,３年前と２０２１年５月,走行中に振動と共にカンカンと異音が出るようになった。ディーラーで確認してもらった結果、ＣＶＴの不良によるものと診断されて交換を行ったが、２０２１年５月に再びＣＶＴが故障し、高速道路の３車線の真ん中で止まってしまった。
