番号,受付日,住所,申告方法,車名,通称名,初度登録年月,総走行距離,型式,原動機型式,不具合装置,発生時期,申告内容の要約
1,2021年05月31日,北海道,ﾌﾘｰﾀﾞｲｱﾙ,トヨタ,ハイエース,2003年04月,"101,000 Km",KG-LH178V,5L,エンジン,不明,タイミングベルトの警告灯が点灯した。
2,2021年05月31日,岩手,ﾌﾘｰﾀﾞｲｱﾙ,ホンダ,フィット,2016年09月,"41,000 Km",DAA-GP6,LEB-H1,動力伝達,不明,トランスミッションの油漏れでエンストした。
3,2021年05月31日,東京,ＨＰ,スバル,ＷＲＸ　ＳＴＩ,2019年06月,"25,000 Km",CBA-VAB,EJ20,かじ取り,購入当初から現在まで,駐車時の据え切り時にハンドルコラム付近からキューまたはブッ！と異音が出る。
4,2021年05月31日,東京,ＨＰ,ヤマハ,ＳＲ４００,2020年08月,不明,2BL-RH16J,H342E,エンジン,２０２０年６月から１１月,停止または低速走行時、１速でクラッチを握っているとエンジンが止まることがある。
5,2021年05月31日,東京,ＨＰ,トヨタ,ＲＡＶ４,2021年04月,不明,6AA-AXAH54,A25A-3NM-4NM,車枠・車体,２０２１年４月２０日,ルーフレールから雨漏りする。
6,2021年05月31日,東京,ＨＰ,ホンダ,ＶＥＺＥＬ,2015年03月,"49,600 Km",DAA-RU3,LEB-H1,制動装置,２０２０年４月,電子パーキングブレーキの動作時に「キュッ、キューッ」とカモメが鳴くような異音がするようになった。
7,2021年05月31日,東京,ＨＰ,ヤマハ,ＳＲ４００,2020年06月,不明,2BL-RH16J,H342E,エンジン,２０２０年６月から１１月,停止または低速走行時、１速でクラッチを握っているとエンジンが止まることがある。
8,2021年05月31日,神奈川,ﾌﾘｰﾀﾞｲｱﾙ,ＢＭＷ,ＭＩＮＩ,2015年04月,"23,000 Km",LDA-XD20F,N47C20A,エンジン,不明,整備後のディーラーでの試運転中に、エンジン内部が破損し、エンストした。
9,2021年05月31日,埼玉,ﾌﾘｰﾀﾞｲｱﾙ,ＵＤトラックス,クオン,2010年07月,"618,400 Km",ADG-CV2YL,MD92,乗車装置,不明,リモコンキーで施錠・解錠したのち、シリンダーに鍵を挿し、ドアを閉めて離れたところ、勝手に施錠されて閉め出されてしまった。
10,2021年05月31日,栃木,ＨＰ,カワサキ,ＺＲＸ１２００　ＤＡＥＧ,2010年10月,"48,519 Km",EBL-ZRT20D,ZRT20AE,エンジン,アイドリングで停車時,ＥＣＵ不具合により電動ファンが動かず、オーバーヒートの警告灯が点灯し冷却水がリザーブタンクから噴き出した。
11,2021年05月31日,栃木,ＨＰ,カワサキ,ＺＲＸ１２００　ＤＡＥＧ,2010年10月,"48,519 Km",EBL-ZRT20D,ZRT20AE,エンジン,アイドリングで停車時,ＥＣＵ不具合により電動ファンが動かず、オーバーヒートの警告灯が点灯し冷却水がリザーブタンクから噴き出した。
12,2021年05月31日,愛知,ＨＰ,スバル,ＸＶ,2013年08月,"19,000 Km",DBA-GP7,FB20,動力伝達,２０２１年５月２９日,ＣＶＴ（トランスミッション）の故障によりＰ、Ｒ、Ｎレンジで異音が発生する。
13,2021年05月31日,愛知,ﾌﾘｰﾀﾞｲｱﾙ,トヨタ,アクア,2012年06月,"160,000 Km",DAA-NHP10,1NZ-1LM,保安灯火,不明,バックランプに水が浸入し不点灯になった。
14,2021年05月31日,静岡,ﾌﾘｰﾀﾞｲｱﾙ,トヨタ,シエンタ,2013年09月,"55,000 Km",DBA-NCP81G,1NZ,制動装置,不明,駐車ブレーキを解除しても駐車ブレーキ・ＡＢＳ表示が消えない。
15,2021年05月31日,大阪,ＨＰ,ニッサン,セレナ,2013年01月,"79,044 Km",DAA-HC26,MR20-SM23,電気装置,半年前,オルタネーターの不良によりエンジンをかけるとエンジンルームから異音がする。
16,2021年05月31日,大阪,ﾌﾘｰﾀﾞｲｱﾙ,トヨタ,ポルテ,2016年11月,"13,000 Km",DBA-NSP141,2NR,その他,不明,プリクラッシュセーフティ歩行者用のデータを書き換えた後、カーナビの「地図ソフト認識出来ません」という警告が出た。
17,2021年05月31日,広島,ＨＰ,マツダ,アテンザ,2013年06月,"144,000 Km",LDA-GJ2FW,SH,エンジン,２０２１年５月,バイパスを走行中に速度が出なくなり、水温警告が数分後に一瞬表示された。路肩にとめて確認すると、樹脂製冷却水パイプが破裂していた。
18,2021年05月31日,広島,ＨＰ,スバル,ＸＶハイブリッド,2014年02月,"75,000 Km",DAA-GPE,FB20MA-1,制動装置,２０２１年２月頃,エンジン始動時にブレーキペダルが硬くなっており、強く踏み込まないとエンジンがかからない。
19,2021年05月31日,熊本,ﾌﾘｰﾀﾞｲｱﾙ,いすゞ,ビッグホーン,不明,"260,000 Km",KH-UBS73GW,4JX1,エンジン,不明,坂の途中で停車したため、ディーラーで確認してもらったところ、クランクシャフト内オイルリング等のすり減りと診断された。
20,2021年05月30日,北海道,ＨＰ,シボレー,トレイルブレイザー,2004年06月,"147,000 Km",GH-T360,4L,燃料装置,不明,給油ホースと燃料タンクの繋ぎに亀裂があって燃料が漏れているような染み跡がある。
21,2021年05月30日,宮城,ＨＰ,ニッサン,ＤＡＹＺ,2020年11月,"5,443 Km",4AA-B45W,BR06-SM21,制動装置,２０２１年５月１３日　１８時１０分頃,下り坂に面している駐車場からバックで車を出し、ブレーキペダルを踏んでシフトチェンジをしようとした際にブレーキが効かずに前進したため、エンストを起こし、坂をくだって山に激突した。
22,2021年05月30日,福島,ＨＰ,三菱,デリカＤ５,2015年05月,"90,000 Km",LDA-CV1W,4N14,排ｶﾞｽ･騒音,２０２０年１０月,エキゾーストマニホールドからの排気ガス漏れにより、車内が排ガス臭くなる。
23,2021年05月30日,東京,ＨＰ,スバル,レガシィ　アウトバック,2018年04月,"30,000 Km",DBA-BS9,FB25,緩衝装置,２０２１年４月１０日,左後ろのショックアブソーバーからオイルが漏れた。
24,2021年05月30日,千葉,ＨＰ,ニッサン,セレナ,2013年05月,"72,272 Km",DAA-HFC26,MR20-SM23,エンジン,２０１７年５月４日、２０２１年５月２４日,路肩に停車中にエンジンルームから発煙した。すぐにエンジンを停止し、エンジンルームを見ると、冷却水が沸騰して吹き出し蒸発して発煙していた。整備工場で確認したところ、ラジエーターファンモーターの故障と判った。
25,2021年05月30日,千葉,ＨＰ,ニッサン,セレナ,2013年05月,"67,357 Km",DAA-HFC26,MR20-SM23,電気装置,２０２０年１１月１４日,オルタネーターの不良により、エンジンルームから異音が発生した。
26,2021年05月30日,栃木,ＨＰ,ＢＭＷ,１１６ｉ,2015年02月,"39,200 Km",DBA-1A16,N13B16A,保安灯火,２０２０年６月及び２０２１年５月,ヘッドライト内部が結露した。
27,2021年05月30日,愛知,ＨＰ,マツダ,ＣＸ－５,2014年05月,"42,400 Km",LDA-KE2AW,SH,エンジン,２０２０年,エンジンのシリンダに亀裂が発生してオイル漏れ発生したため、駐車場にオイル汚れが着くようになった。
28,2021年05月30日,静岡,ＨＰ,ホンダ,ＮＣ７００Ｘ,2013年02月,"32,203 Km",EBL-RC63,RC61E,動力伝達,２０２１年５月,ＤＣＴ搭載車で走行中や停止中にギア表示が「－」となり自動変速しなくなった。エンジンを一度切って再始動したところ復旧した。販売店で確認したところシフターピンが破損していた。
29,2021年05月30日,岐阜,ＨＰ,ニッサン,セレナ,2013年05月,"50,000 Km",DAA-HFC26,MR20-SM23,車枠・車体,２０２０年８月１１日ごろ,他との接触もなく洗車回数も多くないのにピラー・ボンネット・ボディ側面の複数個所の塗装が剥がれてきた。
30,2021年05月30日,岐阜,ＨＰ,ニッサン,セレナ,2013年05月,"50,000 Km",DAA-HFC26,MR20-SM23,保安灯火,２０２１年５月１日ごろ,接触歴がないのにも関わらずハイマウントストップランプが中央で縦に割れた。
31,2021年05月30日,岐阜,ＨＰ,ニッサン,セレナ,2013年05月,"50,000 Km",DAA-HFC26,MR20-SM23,保安灯火,２０２１年５月１日ごろ,接触歴がないのにも関わらずハイマウントストップランプが中央で縦に割れた。
32,2021年05月30日,京都,ＨＰ,三菱,アウトランダーＰＨＥＶ,2019年09月,"9,584 Km",5LA-GG3W,4B12-S61-Y61,電気装置,２０２１年４月,電源コンダクター不良により、パネルにＥＶシステム点検と表示されエンジンがかからなくなった。
33,2021年05月30日,滋賀,ＨＰ,ニッサン,セレナ,2005年08月,"160,000 Km",CBA-C25,MR20,燃料装置,２０２１年２月,ガソリンタンク内の仕切り板が外れ、異音が出るようになった。
34,2021年05月30日,大分,ＨＰ,ニッサン,セレナ,2014年02月,"68,400 Km",DAA-HC26,MR20-SM23,電気装置,２０２１年５月,オルタネーターの不良により、走行中に突然エンジンルームからガラガラといった異音が発生した。
35,2021年05月29日,北海道,ＨＰ,ＢＭＷ,ミニクーパー,2014年09月,"55,000 Km",LDA-XD20A,N47C20A,エンジン,エンジン始動直後,エンジン始動直後に異音が発生したため点検したところ、バイブレーションダンパーのゴム部に割れがあり、ガタが出ていた。
36,2021年05月29日,神奈川,ＨＰ,メルセデス・ベンツ,Ｃ３５０ｅ,2018年01月,"11,565 Km",DLA-205047,274-EM0011,車枠・車体,２０２１年５月２３日,高速道路を走行中にパノラマルーフの一部（前部分）が剥がれて飛んだ。
37,2021年05月29日,愛知,ＨＰ,トヨタ,アクア,2012年07月,"46,200 Km",DAA-NHP10,1NZ-1LM,保安灯火,２０２０年,雨が降ると、右テールランプ内に水が溜まり、レンズが水滴で曇る。
38,2021年05月29日,兵庫,ＨＰ,スズキ,ソリオバンディット,2014年06月,"50,000 Km",DBA-MA15S,K12B,エンジン,２０２０年,屋上駐車場に登る際にたまに加速せずに減速してしまう。
39,2021年05月29日,兵庫,ＨＰ,スズキ,ソリオバンディット,2014年06月,"50,000 Km",DBA-MA15S,K12B,エンジン,２０１６年,走行中にエンジン回転数が不安定になりノッキングする。
40,2021年05月29日,広島,ＨＰ,フォルクスワーゲン,シロッコ,2011年10月,"84,700 Km",DBA-13CAV,CAV,エンジン,２０２１年５月,タイミングチェーンの不良により、冷間時エンジンを始動すると異音がし、しばらく様子を見ていると再始動不可になった。
41,2021年05月29日,愛媛,ＨＰ,スバル,レガシィＢ４,2015年07月,"130,000 Km",DBA-BN9,FB25,制動装置,２０２０年７月,エンジン停止後、しばらくしてエンジンをかけようとするとブレーキペダルが固く、エンジンが始動しづらい。エンジン始動後は、固さが元に戻る。
42,2021年05月29日,福岡,ＨＰ,ＢＭＷ,３２０ｉツーリング,2012年12月,"40,000 Km",ABA-VR20,N46B20B,エンジン,２０２０年８月,エンジンから白煙が上がり、緊急停車した。工場に持ち込むとタペットカバーガスケットよりオイル漏れ、バキュームポンプよりオイル漏れが確認された。
43,2021年05月29日,福岡,ＨＰ,ＢＭＷ,３２０ｉツーリング,2012年12月,"40,000 Km",ABA-VR20,N46B20B,緩衝装置,２０２０年８月,リアサスペンション不良により、走行中の段差でリアが跳ねて、ハンドルの制御を失いかけた。
44,2021年05月29日,大分,ＨＰ,ホンダ,フィット,2015年01月,"68,300 Km",DBA-GK3,L13B,エンジン,２０２１年４月,アイドリングストップ後にエンジンがかからない。
45,2021年05月29日,鹿児島,ＨＰ,ニッサン,セレナ,2015年02月,"54,200 Km",DAA-HFC26,MR20-SM23,動力伝達,２０２１年５月,ＣＶＴの油圧システム異常により、走行中に、突然アクセル操作が効かなくなり減速した。
46,2021年05月29日,鹿児島,ＨＰ,ニッサン,セレナ,2015年02月,"54,200 Km",DAA-HFC26,MR20-SM23,電気装置,２０２１年５月,オルタネーターの不良により、エンジンルーム内から異音が出るようになった。
47,2021年05月28日,埼玉,ＨＰ,ダイハツ,アトレーワゴン,2008年09月,"245,610 Km",ABA-S321G,KF,エンジン,走行距離１６００００ｋｍの購入時より,２０００ｋｍ走行するとタペットカバーパッキンからエンジンオイルが警告灯がつくほどに漏れる。タペットカバーパッキン交換し、オイル漏れを止めても３０００ｋｍ走行するとオイルゲージのＬｏｗレベルに届かないほどまで減る。
48,2021年05月28日,大阪,ＨＰ,ヤマハ,ＸＶＳ４００Ｃドラッグスタークラシック,2018年09月,"14,600 Km",EBL-VH02J,H602E,燃料装置,２０２１年２月,リコールで取替えした部品で燃料が漏れ、同じ部品を２度交換したが、それでもガソリンが漏れ出す。
49,2021年05月28日,岡山,ﾌﾘｰﾀﾞｲｱﾙ,トヨタ,クラウン,不明,不明,不明,不明,緩衝装置,不明,ショックアブソーバーが６万ｋｍで油漏れする。
50,2021年05月28日,山口,ＨＰ,スバル,フォレスター,2016年02月,"40,000 Km",DBAｰSJ5,FB20,制動装置,２０２１年５月,エンジン始動時にブレーキペダルが固くなっていて、強い力をかけないと踏み込めず、エンジンが始動しない。
51,2021年05月27日,長野,ﾌﾘｰﾀﾞｲｱﾙ,スズキ,スペーシア,2015年10月,"38,000 Km",DAA-MK42S,R06A-WA04A,その他,不明,エアコンが効かない。
52,2021年05月27日,石川,ﾌﾘｰﾀﾞｲｱﾙ,トヨタ,アクア,2014年01月,"29,000 Km",DAA-NHP10,1NZ-1LM,動力伝達,不明,ブレーキペダルを踏んで急発進することが今までに３回あった。
53,2021年05月27日,神奈川,ＨＰ,ヤマハ,ＳＲ４００,2019年11月,不明,2BL-RH16J,H342E,エンジン,２０２０年８月１日～９月１日,４０ｋｍ／ｈで走行中、突然エンジンがストップした。
54,2021年05月27日,神奈川,ＨＰ,ニッサン,ノート,不明,"75,000 Km",DBA-E12,E12,エンジン,２０２１年１月２１日,インテークパイプの破損により、走行中にエンジンが停止し、ブレーキも効きが悪くなる。
55,2021年05月27日,千葉,電話,ＢＭＷ,３２０ｄ,2013年06月,"39,500 Km",LDA-3D20,N47D20C,制動装置,不明,一般道路を走行中にブレーキシステムの警告、衝突警告機能制限、走行安定性走行注意の警告と共にブレーキがだんだん効かなくなった。
56,2021年05月27日,千葉,ＨＰ,三菱,ふそうスーパーグレート,2019年08月,"113,500 Km",2PG-FS75HZ,6R20,動力伝達,２０２０年８月,走行中に突然オートマチックトランスミッションが壊れ走行できなくなった。車検時に修理してもらうも、そこから変速時にニュートラルに入るようになり、スムーズな変速が出来なくなった。
57,2021年05月27日,埼玉,ﾌﾘｰﾀﾞｲｱﾙ,スバル,レヴォーグ,2017年12月,"2,000 Km",DBA-VMG,FA20,保安灯火,不明,前照灯の反射板が溶けている。
58,2021年05月27日,群馬,ﾌﾘｰﾀﾞｲｱﾙ,ＢＭＷ,ＭＩＮＩ,2014年04月,"80,000 Km",LDA-XD20F,不明,エンジン,不明,タイミングチェーンが伸びた。
59,2021年05月27日,栃木,ＨＰ,三菱,デリカＤ５,2013年09月,"59,000 Km",DBA-CV5W,4B12,エンジン,２０２０年５月２６日,オートテンショナーの不良により、補機ベルトが外れたため、交差点でいきなりパワーステアリングが効かなくなり、その後オーバーヒートの表示が出て自走不可能になった。
60,2021年05月27日,栃木,ＨＰ,ニッサン,セレナ,2013年01月,"75,000 Km",DAA-HFC26,MR20-SM23,電気装置,２０２１年３月,オルタネーターの不良により、アイドリング・低速時、エンジンから異音がする。
61,2021年05月27日,鳥取,ＨＰ,ホンダ,ＳＨＵＴＴＬＥハイブリッド,2017年02月,"77,141 Km",DAA-GP7,LEB-H1,その他,２０２１年５月初旬,コンデンサーの不良により、エアコンが効かなくなった。
62,2021年05月27日,福岡,ＨＰ,ボルボ,Ｖ４０　Ｄ４,2017年12月,"16,200 Km",LDA-MD4204T,D4204T,その他,３年半で３回,ブライドスポットインフォメーションシステムが故障し、メーターパネルに警告表示が出る。この３年半で３回故障（左が２回、右が１回）している。
63,2021年05月27日,福岡,ＨＰ,ホンダ,Ｎ－ＢＯＸ,2020年03月,"4,681 Km",6BA-JF3,S07B,制動装置,２０２１年４月８日,立体駐車場（自走式）を走行中、角を曲がらずに直進し、壁（車止めＨ鋼）に激突した。この際にＣＭＢＳが作動しなかった。また、シートベルトは着用していたが、衝突の衝撃で運転者及び助手席搭乗者とも肋骨多数骨折した。
64,2021年05月27日,福岡,ﾌﾘｰﾀﾞｲｱﾙ,フォルクスワーゲン,ゴルフトゥーラン,2020年06月,300 Km,LDA-1TDFG,DFG,エンジン,不明,アイドリングストップからの発進時にエンストし、再始動出来なかった。
65,2021年05月27日,長崎,ＨＰ,トヨタ,アクア,2012年03月,"67,000 Km",DAA-NHP10,1NZ-1LM,制動装置,雨天時,雨天時、下り坂で停車しようとすると前輪あたりから「グゥゴー」と異音が鳴る。
66,2021年05月26日,長野,ＨＰ,フォード,エクスプローラー,2012年11月,"100,000 Km",ABA-1FMHK9,9,かじ取り,１か月くらい前から,パワーステアリングギアボックスの故障により、ハンドルが重くなって来ている。
67,2021年05月26日,東京,ﾌﾘｰﾀﾞｲｱﾙ,ＢＭＷ,５２３ｄ,2015年07月,"49,500 Km",LDA-FW20,N47D20C,保安灯火,２０２０年１月、２月ごろから,前照灯内部に水滴が溜まり、曇る症状が出ていた。ディーラーでそのまま使用して良いという指示があり、様子を見ていたところ、症状が悪化し、ユニット内部の基盤が故障して警告灯が点灯した。
68,2021年05月26日,神奈川,ＨＰ,トヨタ,プリウス,2009年10月,"60,100 Km",DAA-ZVW30,2ZR-3JM,車枠・車体,２０１９年８月,塗装コード０７０のパールホワイト色塗装の車で、ボンネット、バンパー、ルーフの上塗り部分がペリペリと剥がれ、下塗り部分が露出してきた。
69,2021年05月26日,埼玉,ＨＰ,ポルシェ,ポルシェ９１１カレラＳ,2014年11月,"16,557 Km",ABA-991MA103,MA103,保安灯火,２０１８年５月頃から,フロントガラスとリアガラスの縁ゴムが溶ける。
70,2021年05月26日,愛知,ＨＰ,トヨタ,プリウス,2017年03月,"22,000 Km",DAA-ZVW50,2ZR-1NM,保安灯火,不明,バックレンズ等の内側が、白くペンキを吹いた様に曇ってきている。
71,2021年05月26日,愛知,ﾌﾘｰﾀﾞｲｱﾙ,ニッサン,ジューク,2019年10月,"9,974 Km",DBA-YF15,HR15,電気装置,２０２１年５月１４日夜,エンジンルーム内にあるヒューズボックスのヒューズが溶断したため、走行中に突然テールライト、助手席側車幅灯、ＬＥＤのフォグランプが一斉に点かなくなった。
72,2021年05月26日,大阪,電話,スズキ,スペーシア,2018年09月,"16,000 Km",DAA-MK53S,R06A-WA05A,乗車装置,２０２１年５月２１日,走行中、またはエンジンを切っていても右後部座席のドアが勝手に開いてしまう。
73,2021年05月26日,大阪,24時間電話,ホンダ,ハンターカブ１２５,不明,不明,JA55,不明,エンジン,不明,走行中や、信号待ちで１速にいれて発進しようとした際にエンジンが止まる。
74,2021年05月26日,福岡,ＨＰ,ボルボ,Ｖ７０,2008年04月,"88,300 Km",DBA-BB5254W,B5254,エンジン,不明,ファン自体の欠相による導通不良による回転停止、その時コントロールユニットに過電流で発熱、その後故障する。
75,2021年05月25日,宮城,ＨＰ,フィアット,５００,2009年11月,"108,335 Km",ABA-31212,169A4,車枠・車体,２０２１年５月以前発見,助手席エアバッグ設置場所の上部カバーが膨らみ、５ｃｍほどの亀裂ができた。
76,2021年05月25日,宮城,ＨＰ,アウディ,Ａ３スポーツバック,2009年10月,"89,102 Km",ABA-8PCCZF,CCZ,エンジン,２０２０年１２月１７日,メーターパネルにＥＰＣとエンジンチェックランプが点灯した。バックギアに入れても後退せず、ガクガクと振動した。エンジン回転数が３０００ｒｐｍを超えるとアクセルペダルを踏んでも出力が上がらなくなりエンストした。
77,2021年05月25日,福島,ＨＰ,シトロエン,Ｃ４ピカソ,2017年02月,"22,300 Km",LDA-B78AH01,AH01,排ｶﾞｽ･騒音,一ヶ月前,アドブルータンク内の圧力が下がり、エラー表示され、タンクごとの交換になった。
78,2021年05月25日,福島,ＨＰ,プジョー,５０８,2016年07月,"19,900 Km",LDA-W2WAH02,AH02,排ｶﾞｽ･騒音,一ヶ月前,アドブルータンク内の圧力が下がり、エラー表示され、タンクごとの交換になった。
79,2021年05月25日,長野,ﾌﾘｰﾀﾞｲｱﾙ,ダイハツ,ムーヴ,2007年03月,"70,000 Km",CBA-L185S,KF,エンジン,不明,エンジンと変速機のマウントゴムが切れたため、異音、振動が出るようになった。
80,2021年05月25日,石川,ﾌﾘｰﾀﾞｲｱﾙ,ホンダ,フィット,2015年07月,"130,000 Km",DBA-GK4,L13B,エンジン,不明,時速４０ｋｍで走行中に警告灯が点灯し、エンストした。コンピューターやＡＢＳを交換したが再発している。
81,2021年05月25日,群馬,ＨＰ,ニッサン,セレナ,2012年10月,"154,900 Km",DAA-HFC26,MR20-SM23,電気装置,２０１９年５月,オルタネーターから異音が発生している。発電しない。
82,2021年05月25日,静岡,ＨＰ,ニッサン,エクストレイル,2014年06月,"71,863 Km",DBA-NT32,MR20,その他,２０１８年、２０２０年、２０２１年,気温が高い日に走行中、エアコンが冷えなくなる。
83,2021年05月25日,岐阜,ＨＰ,マツダ,ＣＸ－５,2014年02月,"92,000 Km",LDA-KE2FW,SH,電気装置,不明,オルタネーターの不良により、高速道路走行中、充電システム異常のエラーが出た。プーリーから異音が出た。
84,2021年05月25日,岐阜,ＨＰ,マツダ,ＣＸ－５,2014年02月,"90,000 Km",LDA-KE2FW,SH,保安灯火,不明,左ドアミラーモーターが空回りで動かなくなった。
85,2021年05月25日,岐阜,ＨＰ,マツダ,ＣＸ－５,2014年02月,"10,000 Km",LDA-KE2FW,SH,車枠・車体,不明,雨の日に斜めに駐車していたらフロントドアスピーカー部から水が入ってフロアマットに水溜まりができていた。
86,2021年05月25日,大阪,ＨＰ,三菱,ミニキャブ,2015年05月,"75,200 Km",HBD-DS17V,R06A,動力伝達,２０２１年５月,ＡＧＳのスライドシャフトが破損したため、走行中に突然ギアがニュートラル状態になり、走行できなくなった。
87,2021年05月25日,京都,ﾌﾘｰﾀﾞｲｱﾙ,スズキ,アドレス１１０,2018年08月,"16,396 Km",2BJ-CE47A,不明,エンジン,不明,ススの噛み込みにより、発進時にエンストする。。
88,2021年05月25日,兵庫,ﾌﾘｰﾀﾞｲｱﾙ,ニッサン,ノートｅ－ｐｏｗｅｒ,2021年04月,830 Km,6AA-E13,HR12-EM47,電気装置,不明,航続可能距離が極端に減った。
89,2021年05月24日,東京,ﾌﾘｰﾀﾞｲｱﾙ,テスラ,モデルＸ,不明,不明,不明,不明,緩衝装置,不明,高速道路を走行中にガシャンと音がするとともにサスペンションエラーの表示が出た。その後、１０秒もしないうちにシステムがシャットダウンしてしまったため、路肩に流れ着き、そのまま走行不能になってレッカー搬送をした。
90,2021年05月24日,神奈川,ＨＰ,アウディ,Ｓ５スポーツバック,2013年03月,"75,000 Km",ABA-8TCGWL,CGW,動力伝達,２０２０年１０月,Ｓトロニック（自動変速機）のメカトロニクス不良により、バックの際に、ハンドルを切って曲がりながら後退する、あるいはバックする側が上り坂などアクセル開度に対し抵抗がある場合にアクセルペダルを踏んでも加速せず、止まってしまう。
91,2021年05月24日,千葉,ＨＰ,トヨタ,ＭＲ－Ｓ,2005年10月,"110,000 Km",TA-ZZW30,1ZZ,動力伝達,２０２１年３月,走行中に自動変速機に異常が生じ、ニュートラル表示になった後に変速不能となった。
