番号,受付日,住所,申告方法,車名,通称名,初度登録年月,総走行距離,型式,原動機型式,不具合装置,発生時期,申告内容の要約
74,2022年06月24日,群馬,ＨＰ,ニッサン,セレナ,2012年08月,"114,500 Km",DAA-HFC26,MR20-SM23,動力伝達,２０２２年６月１日,時速３０ｋｍ位から大型ファンが回っている様な音が聞こえ始め、時速５８ｋｍ位になるとしっかり聞こえるようになる。時速８０ｋｍ位になるとペダルに若干振動が伝わって来る。ディーラーへ持込み点検してもらったところ、ＣＶＴからタイヤへ繋がっているシャフトのギア部分のクリアランスが広がってしまい異音が出ていると診断された。
75,2022年06月24日,山梨,ﾌﾘｰﾀﾞｲｱﾙ,スバル,フォレスター,2017年10月,"25,500 Km",DBA-SJ5,FB20,その他,２０２１年１２月,走行中に異音と焼けるような異臭がし、急ブレーキ状態で車が減速をした。ディーラーで確認したところ、エアコンのコンプレッサーがロックしたことで急ブレーキ症状が発生し、コンプレッサープーリーがロックによる発熱で塗料が焼けたことから異臭と発煙に至ったと診断された。
76,2022年06月24日,愛知,ﾌﾘｰﾀﾞｲｱﾙ,メルセデス・ベンツ,Ｓ５００,2022年03月,"1,000 Km",不明,不明,制動装置,不明,走行中に突然ブレーキが勝手にかかり、ロックしたかのような状態で止まる。これまでに２回発生している。【未修理】
77,2022年06月24日,三重,ＨＰ,トヨタ,エスティマハイブリッド,2011年10月,"177,761 Km",DAA-AHR20W,2AZ-2JM-2FM,制動装置,２０２２年５月３０日　６：５０,一般道を走行中ＶＳＣチェック、ブレーキ警告（赤と黄）ＡＢＳなどの警告灯が点灯し、慌ててブレーキをかけたが、ブレーキペダルが底まで踏み抜け、まったく効かなかった。その結果前車に追突した。
78,2022年06月24日,大阪,ＨＰ,スズキ,スイフト,2020年09月,"98,900 Km",5BA-ZC83S,K12C,保安灯火,２０２２年６月１７日,電動格納ミラーが動かない。作動時力がない感じで途中で止まる。
79,2022年06月24日,大阪,ＨＰ,ニッサン,ＡＤバン,2019年02月,"79,132 Km",DBF-VY12,HR15,制動装置,２０２２年６月,ＶＤＣ、ＡＢＳの警告灯が運転中、常に点灯した。整備工場でホイール裏のセンサーの固着物が要因との見解が出た。
80,2022年06月24日,滋賀,ＨＰ,スバル,ＸＶ,2016年08月,"52,000 Km",DBA-GP7,FB20,制動装置,２０２２年６月２２日,エンジン始動時ブレーキペダルの踏み込みが硬い。
81,2022年06月24日,岡山,ﾌﾘｰﾀﾞｲｱﾙ,ダイハツ,タントカスタム,不明,不明,不明,不明,乗車装置,不明,シートヒーターを使用するとシートの座るところにシワができる。
82,2022年06月24日,山口,ﾌﾘｰﾀﾞｲｱﾙ,ダイハツ,ミライース,2018年03月,"102,200 Km",DBA-LA350S,KF,保安灯火,新車購入当初から,ディーラーオプション前照灯ＬＥＤホワイトバルブの寿命が短く、ほぼ１年ごとに球切れになる。
83,2022年06月23日,埼玉,ＨＰ,ルノー,ルーテシア,2015年08月,"84,000 Km",ABA-RH5F,H5F,エンジン,２０２２年５月,高速道路を走行中にエンジン警告灯が点灯するとともにエンジンの出力が低下した。
84,2022年06月23日,山梨,ＨＰ,トヨタ,ヴィッツ,2011年04月,"81,800 Km",DBA-NSP130,1NR,車枠・車体,２０２１年くらいから,屋根の塗装が剥がれはじめた。最初は気にならない程度の大きさだったが、最近は５００円玉の大きさで剥がれ、箇所も日に日に多くなってきている。
85,2022年06月23日,愛知,ＨＰ,ドゥカティ,モンスター１２００,2015年05月,"6,300 Km",ZDMM603JAEB,ZDM1198WH,エンジン,２０１５年購入後頻繁,ギアを１速から２速に変えながら交差点で右折中にエンストし倒れそうになった。
86,2022年06月23日,愛知,ＨＰ,ドゥカティ,モンスター１２００,2015年05月,"6,300 Km",ZDMM603JAEB,ZDM1198WH,制動装置,２０１５年購入後頻繁,リアブレーキが全く効かなくなる。エア抜きをすると直るがしばらく乗らない期間があるとまた効かなくなっている。
87,2022年06月23日,不明,電話,アウディ,Ａ３,2021年11月,"5,900 Km",3AA-GYDLA,DLA-4450,その他,不明,高速で追越し時に勝手にブレーキが掛かり減速する。調整したら一般道で追い越し時にブレーキが掛かり、横断歩道を横切るとき等にハンドルを取られるようになった。またエンジンがかからなくなることもあった。先月に駐車場に入る際にはパーキングブレーキ警告灯が表示されディーラーに引き渡した。
88,2022年06月23日,不明,ﾌﾘｰﾀﾞｲｱﾙ,アウディ,Ｓ７,不明,"70,000 Km",不明,TEU,エンジン,２０２２年６月１５日,高速道路を走行後、サービスエリアの駐車場で車を止めた際に勝手にエンジンが止まっていた。３０分後に再始動は出来たが、信号で止まる時などにエンストする等の症状が続いた。ディーラーへ相談したところ、タービンブローの可能性を指摘された。
89,2022年06月22日,東京,ＨＰ,ニッサン,ＮＶ２００バネットバン,2020年07月,"22,000 Km",DBF-VM20,HR16,車枠・車体,２０２０年９月ころ,空車状態から車体が右下がりに傾いている。段差を超えた際などの挙動、カーブを曲がっているときの挙動が、右側だけ大きく動き、収まりが悪い。また、後方から車軸を見ると、左右で見える位置が異なる。車軸の傾き方（キャンバー角？）が左右で異なる。左に寄せて荷物を載せても平坦にならず、左側だけではなく右側もさらに下がってしまう。
90,2022年06月22日,神奈川,ＨＰ,ニッサン,セレナ,2014年11月,"60,000 Km",DAA-HFC26,MR20-SM23,電気装置,６月に入ってから,オルタネーターから異音がするようになり、徐々に音が大きくなってきて、最近では、振動が室内にひびく。アイドリングストップ時にエンジンが停止したことがある。
91,2022年06月22日,埼玉,ＨＰ,アプリリア,ＲＳ６６０,2022年04月,不明,ZD4KS,M581M,エンジン,２０２２年５月,渋滞時に水温計が上がり、発進する際にエンジンが停止してしまう。
92,2022年06月22日,愛知,ＨＰ,スバル,ステラ,2016年11月,"13,000 Km",DBA-LA150F,KF,エンジン,２０２２年６月２１日,約３０分間走行、４０ｋｍ／ｈで走行中にエンジンの回転数落ちてきて、アクセルペダルを数回踏み込むも、エンジンが停止した。エンジン始動を試みたが、エンジンがかからない。３０分ほど経過して、再度エンジン始動したら、エンジンがかかった。
93,2022年06月22日,愛知,ﾌﾘｰﾀﾞｲｱﾙ,ホンダ,Ｎ－ＢＯＸ,2014年08月,"135,800 Km",DBA-JF1,S07A,エンジン,８年間で７回,坂道走行中や、交差点など、さまざまな場所で突然エンジンが止まる。
94,2022年06月22日,静岡,ＨＰ,マツダ,ＣＸ－８,不明,不明,6BA-KG5P,不明,乗車装置,２０２１年１０月,ドアロックモータのチャタリングで、キーレスで鍵を開けた際にドアロックが何度か勝手に開閉する。
95,2022年06月22日,静岡,ＨＰ,マツダ,ベリーサ,不明,不明,DBA-DC5W,不明,かじ取り,２０２１年８月,駐車動作を何度か繰り返すとパワステが効かなくなる。そのまましばらく走行するとパワステが効くようになる。
96,2022年06月22日,大阪,来訪,ＢＭＷ,１１８ｄ,2021年02月,"9,797 Km",3DA-7M20,B47C20B,電気装置,不明,停車中（エンジン停止状態）車両のエンジンルームから出火した。出火原因はＡＢＳの基板上において何らかの要因でトラッキングが発生した可能性が高いと考えられる。
97,2022年06月22日,兵庫,ﾌﾘｰﾀﾞｲｱﾙ,三菱,ふそうスーパーグレート,2013年07月,"694,500 Km",QKG-FS54VZ,6R10,エンジン,不明,１５万～２０万ｋｍ使用するとエンジンが壊れる。
98,2022年06月22日,兵庫,ﾌﾘｰﾀﾞｲｱﾙ,三菱,ふそうスーパーグレート,2013年01月,"771,600 Km",QKG-FS54VZ,6R10,エンジン,不明,１５万～２０万ｋｍ使用するとエンジンが壊れる。
99,2022年06月22日,福岡,ＨＰ,その他,スプリングチェーン,不明,不明,F-R7412-S,不明,装置その他,２０２２年２月１７日,スバル純正スプリングチェーンがそれほどの勾配でもないのに滑って登らない。チェーン内輪側のフックが、板を曲げたものを差し込む方式なので、反対方向の外力だけで、簡単に外れやすい。
100,2022年06月22日,福岡,ＨＰ,ＢＭＷ,Ｘ５,不明,"48,000 Km",不明,不明,緩衝装置,２０２１年５月,走行中にリヤサスペンションが落ち、走行不能になった。シャシー警告灯が出た。
101,2022年06月22日,熊本,ﾌﾘｰﾀﾞｲｱﾙ,ニッサン,キューブ,2012年08月,"108,000 Km",DBA-Z12,HR15,かじ取り,２０２２年６月１９日,ステアリングロックの不良により、エンジンがかからなくなった。
102,2022年06月21日,埼玉,ＨＰ,ニッサン,セレナ,2021年02月,"14,000 Km",6AA-HFC27,HR12-EM57,制動装置,２０２２年６月,走行中にエマージェンシーブレーキの警告灯が点滅した。
103,2022年06月21日,埼玉,ﾌﾘｰﾀﾞｲｱﾙ,ヤマハ,ＭＴ－０９,2017年05月,"21,600 Km",2BL-RN51J,N711E,制動装置,不明,車検のスピードメーター検査で、後輪だけを２０秒以上回すとエラーが出て警告が点いてしまう。
104,2022年06月21日,愛知,ＨＰ,スバル,インプレッサ,2005年10月,"133,623 Km",TA-GDA,EJ20,制動装置,２０２２年１月頃から,ブレーキマスターバックの不具合により、エンジン始動前にブレーキペダルが固くなり、踏みしろがなくなる。
105,2022年06月21日,愛知,ﾌﾘｰﾀﾞｲｱﾙ,ニッサン,ティーダ,2005年09月,"77,000 Km",DBA-C11,HR15,動力伝達,２０２２年６月,ＣＶＴの不具合により、突然動力が伝わらなくなり、走行不能になった。
106,2022年06月21日,兵庫,ﾌﾘｰﾀﾞｲｱﾙ,マツダ,デミオ,2016年04月,"85,000 Km",DBA-DJ3FS,P3,保安灯火,購入して３～４年あたり,前照灯が前方１０ｍくらいの範囲しか照らさない。
107,2022年06月20日,新潟,ＨＰ,ホンダ,オデッセイ,2019年11月,不明,6BA-RC2,K24W,制動装置,購入時より,ブレーキをかけるとキーキー音が鳴る。
108,2022年06月20日,新潟,ﾌﾘｰﾀﾞｲｱﾙ,ＵＤトラックス,クオン,2017年07月,"160,400 Km",TKG-MK38L,GH5,車枠・車体,２０２１年１２月２０日,荷台にシートをかける作業のため、キャビンの梯子を使用して登っていたが、梯子の上部が狭くなっていてつま先で支えるような姿勢になることから、繰り返し作業をしている内にアキレス腱を負傷してしまった。
109,2022年06月20日,東京,ＨＰ,ニッサン,ノート,2013年04月,"78,600 Km",DBA-E12,HR12,エンジン,２０２２年０６月,高速道路走行中エンジンからウィーンという異音がし、アクセルを全開にしても８０ｋｍ／ｈ程度しか出せなくなった。自走で一般道に降りて停車し、エンジンを再始動してみたところ、シフトのＰレンジ、Ｎレンジいずれも１０秒経たずエンストとなり自走不可状態となった。ディーラーで確認した結果、スーパーチャージャーのインレットチューブが破損していると判った。
110,2022年06月20日,神奈川,ＨＰ,スバル,レヴォーグ,2015年04月,"23,000 Km",DBA-VMG,FA20,制動装置,２０２１年１１月頃,エンジン始動時にブレーキペダルの踏力が重くなった。
111,2022年06月20日,千葉,ﾌﾘｰﾀﾞｲｱﾙ,スズキ,スペーシア,2017年06月,"50,900 Km",DAA-MK42S,R06A-WA04A,動力伝達,不明,エンジンを始動し、ギアをＤに入れるときにチェンジレバーが固くなって動かしづらくなることがある。この際に強引に操作するとガチンと大きな音がする。
112,2022年06月20日,茨城,ＨＰ,その他,ＸＥＡＭ　ｎｏｔｔｅＶ２,不明,"3,800 Km",不明,不明,車枠・車体,半年前,後方の車輪カバーが壊れて、ケーブルがタイヤに噛み動かなくなった。
113,2022年06月20日,茨城,ＨＰ,その他,ＸＥＡＭ　ｎｏｔｔｅＶ２,不明,"3,800 Km",不明,不明,エンジン,不明,メインスイッチが故障した。
114,2022年06月20日,茨城,ＨＰ,その他,ＸＥＡＭ　ｎｏｔｔｅＶ２,不明,"3,800 Km",不明,不明,電気装置,乗り始めて一年九ヶ月,走っていないのにスピードメーターにスピードが表示され、エンジンがかからない。
115,2022年06月20日,山梨,ﾌﾘｰﾀﾞｲｱﾙ,ニッサン,ＡＤバン,2016年10月,"10,783 Km",DBF-VY12,HR15,その他,不明,エアコンのエバポレーターが故障し、エアコンが効かなくなった。エバポレーターの修理を行ったところ、その後に高圧パイプからガス漏れしていることが判った。また、コンプレッサーを確認すると異音が出ていた。
116,2022年06月20日,愛知,ＨＰ,トヨタ,ハイエース,2018年10月,"173,000 Km",QDF-GDH201V,1GD,排ｶﾞｽ･騒音,２０２１年１１月～２０２２年６月,加速が徐々に悪化。アドブルーの消費が徐々に増加。その結果アドブルー噴射部分以後のマフラーに余剰噴霧されたアドブルーが固着。除去清掃が不可能なためマフラーを交換した。
117,2022年06月20日,兵庫,ＨＰ,三菱,ふそうキャンター,2011年09月,"99,600 Km",SKG-FBA60,4P10,電気装置,２０２２年６月６日,リコール国３４６１で、バッテリーイコライザーの修理を受けた車で、イコライザーから発火した。
118,2022年06月20日,滋賀,ＨＰ,ボルボ,ボルボ　ＸＣ６０,2021年11月,不明,5AA-UB420TXCM,B420T2-3330,制動装置,２０２２年３月ごろより,車庫入れの際に非常に低速で入庫し、周囲との距離も保たれているにも関わらずオートブレーキが度々作動し、非常に強い衝撃が何度も起こっている。
119,2022年06月20日,滋賀,ＨＰ,ボルボ,ボルボ　ＸＣ６０,2021年11月,不明,5AA-UB420TXCM,B420T2-3330,保安灯火,２０２２年４月頃より,バックモニター、３６０度カメラが突然映らなくなることが度々起こる。
120,2022年06月20日,滋賀,ＨＰ,ボルボ,ボルボ　ＸＣ６０,2021年11月,不明,5AA-UB420TXCM,B420T2-3330,走行装置,２０２２年２月２日,「タイヤ空気圧監視システム点検・整備が必要です」という表示がでるようになり、一旦消えてもまた表示され続ける、ということが何日も続いた。
121,2022年06月20日,滋賀,ＨＰ,ボルボ,ボルボ　ＸＣ６０,2021年11月,不明,5AA-UB420TXCM,B420T2-3330,保安灯火,２０２２年４月頃より,バックモニター、３６０度カメラが突然映らなくなることが度々起こる。
122,2022年06月20日,滋賀,ＨＰ,ボルボ,ボルボ　ＸＣ６０,2021年11月,不明,5AA-UB420TXCM,B420T2-3330,保安灯火,２０２１年１１月２３日,走行中に突然左右のウインカーやハザードの音が鳴らなくなった。
123,2022年06月20日,滋賀,ＨＰ,ボルボ,ボルボ　ＸＣ６０,2021年11月,不明,5AA-UB420TXCM,B420T2-3330,動力伝達,２０２１年１２月１５日,信号待ちでブレーキペダルを踏んでいて、信号が青になったのでアクセルペダルを踏んだところ、突然アクセルが効かず、エンジンのモーター音しかしなくなった。運転席の表示画面には「トランスミッションの加速性能が低下しました。」と出ていた。
124,2022年06月20日,佐賀,ﾌﾘｰﾀﾞｲｱﾙ,ニッサン,セレナ,2012年02月,"76,700 Km",DBA-FC26,MR20,動力伝達,２０２２年６月,ＣＶＴの不良により、走行中に突然走れなくなった。
125,2022年06月20日,沖縄,ﾌﾘｰﾀﾞｲｱﾙ,ＢＲＰ,カンナムライカー,不明,不明,不明,不明,保安灯火,新車購入当初から,ギアをバックにするとハザードが点灯する。
126,2022年06月19日,富山,ＨＰ,ニッサン,ノート,2016年12月,"50,198 Km",DBA-E12,HR12,エンジン,２０２２年４月,エアコンが効かなくなった。ディーラーで点検の結果、ラジエーターに詰まりがあるためクーラントが通常通り回っておらず水温が通常より高めになり強制的にエアコンプレッサーを止めてしまう制御が入るのでエアコンが効かなくなるものと診断された。
127,2022年06月19日,東京,ＨＰ,プジョー,ｅ－２００８,2021年04月,"10,160 Km",ZAA-P24ZK01,ZK01,電気装置,２０２２年５月１９日,交差点で減速中に突然エラー音が発生し減速し停止。メータパネルには「電動走行システム異常」と表示され、シフトがＰに入って動かなくなった。ディーラーの確認で電気系統がＥＶシステムと同一であり、電気系統の漏電が発生した場合にＥＶの全体システムが止まる。コンプレッサーが原因と思われると説明された。
128,2022年06月19日,茨城,ＨＰ,三菱,デリカ,2016年08月,"100,870 Km",LDA-CV1W,4N14,エンジン,２０２２年６月８日,走行中、エンジンから白煙があがった。ディーラーで確認したところ、シリンダヘッドのインジェクター装着部分の腐食により燃料漏れ、排気ガス漏れで、ヘッド交換が必要と診断された。
129,2022年06月19日,茨城,ＨＰ,フォルクスワーゲン,ゴルフヴァリアント　１．５／１１０ｋＷ,2021年08月,"3,300 Km",3AA-CDDFYV,DFY-4450,電気装置,２０２２年２月７日,運転開始から１５分程度経過した停車中に黄色の警告灯が点灯した。バッテリー容量が下がったのであれば運転すればと思いそのまま運転したところ、赤色の警告が点灯したため、指示に従い車を停止したが、直ぐに警告ランプが消え、異常は感じなかったので走行を再開したところ２～３回警告が出ては車を停止、また消えて運転を繰り返し、その後突然エンジンが停止して止まった。その後はエンジンがかからず、ロードサービスの対応を受けるまで片側２車線の制限速度５０ｋｍ／ｈの道路の走行車線に１時間停車した。
130,2022年06月19日,群馬,ＨＰ,マツダ,アクセラ,2017年01月,"66,000 Km",LDA-BMLFS,S5,電気装置,初年度登録から５年後,純正センターディスプレイのタッチパネル機能が誤動作し、ディスプレイの操作カーソルが勝手に一方向に移動し続ける。また、決定ボタンも常時押され続けている状態になっている。そのため、ナビや安全装備（衝突検知）等の操作、設定ができなくなる。
131,2022年06月19日,三重,ＨＰ,ホンダ,オデッセイ,2016年09月,"28,617 Km",DBA-RC1,K24W,その他,２０２２年５月３１日,高速道路を走行中、ＬＫＡＳ、ＣＭＢＣ、ＥＰＳ他、いくつかの点検警告灯が点きハンドル操作が容易にできなくなった。
132,2022年06月19日,大阪,ＨＰ,ニッサン,サファリ,2005年06月,"106,500 Km",TA-WFGY61,TB48,その他,今年に入ってから,燃料計の針が実際の燃料残量より多く表示し、なかなか下がらなくなった。
133,2022年06月19日,兵庫,ＨＰ,ホンダ,タクト,不明,不明,JBH-AF79,AF74E,保安灯火,２０２１年１２月２５日,国４３８８のリコールで、ブレーキレバーブラケットの交換を済ませている車両で、ブレーキレバーを放した状態でブレーキランプが点いたままになる。
134,2022年06月19日,奈良,24時間電話,ニッサン,リーフ,不明,不明,ZE0,不明,制動装置,不明,直線道路を走っていると、ブレーキとサイドブレーキが効かなくなりなんとか停止した。【未修理】
135,2022年06月19日,和歌山,ＨＰ,トヨタ,ヴェルファイア,2013年04月,"65,000 Km",DBA-ANH20W,2AZ,制動装置,２０２２年４月,２～３日車に乗らなかったらブレーキが固くなる。ハンドルの奥でコトコト鳴ってる気がする。
136,2022年06月19日,島根,ＨＰ,スバル,レヴォーグ,2015年03月,"54,000 Km",DBA-VM4,FB16,制動装置,２０２２年６月６日,エンジン停止後時間が経つとマスターバックの負圧が抜けてしまい、次回始動時にブレーキペダルの踏みしろが無くなってしまう。
137,2022年06月19日,沖縄,ＨＰ,スズキ,アルト,2017年09月,"32,900 Km",DBA-HA36S,R06A,エンジン,２０２２年６月１８日,エンジンへッドガスケットが切れ、オーバーヒートランプも点くようになった。
138,2022年06月18日,長野,ＨＰ,ホンダ,フィット,2014年09月,"132,000 Km",DAA-GP6,LEB-H1,制動装置,２０２２年６月２日　７：３０,一般道路を走行中に突然ポーンと警報音が鳴り、警告表示で「ブレーキシステム点検」「ＶＳＡシステム点検」「ヒルスタートシステム点検」を繰返し表示となり、ブレーキペダルを踏んでも全く効かず感触として風船を踏んでいるが跳ね返されるような状態で全く踏み込めなかった。ペダルを強く踏み込んでもＡＢＳがダダダダと聞こえるがブレーキとしてはまったく効かなかった。サイドブレーキが有ったのでサイドを引くことで何とか止まることはできた。
139,2022年06月18日,東京,ＨＰ,スバル,レガシィ,2017年10月,"35,385 Km",DBA-BS9,FB25,制動装置,２０２２年４月２２日,エンジン始動時、ブレーキブースターの与圧が完全に抜けてしまうため、ブレーキペダルを思いっきり踏み込まないとエンジンがかけられない。
140,2022年06月18日,東京,ＨＰ,アウディ,アウディ　Ａ３　３０Ｔ,2021年06月,"8,600 Km",3AA-GYDLA,DLA-4450,その他,２０２２年５月,アダプティブドライブアシストを使用し、自車は追越車線を走って、左側の走行車線上の前方を走る遅い車両を追い抜こうとする際、左側車線の遅い車両に自車が近づき横に並びかけると、アダプティブドライブアシストが自車にブレーキをかけて追い抜きを妨げる挙動になる。
141,2022年06月18日,埼玉,24時間電話,ニッサン,ＮＶ１００クリッパー,2021年09月,不明,EBD-DR16T,R06A,車枠・車体,２０２２年６月,荷台の布扉をとめるためのゴムにおいて４か所固定するうちの一か所が破損し、留められなくなってしまった。
142,2022年06月18日,愛知,ＨＰ,シトロエン,Ｃ４ピカソ,2018年10月,"25,532 Km",LDA-B787AH01,AH01,排ｶﾞｽ･騒音,２０２２年６月１１日,走行中、排気システム故障とエンジン故障の警告灯が警告音とともに点灯。その後、エンジン停止まで１１００ｋｍの表示が出た。ディーラーで確認したところ、尿素ポンプの不具合で尿素タンクごと交換が必要と診断された。
143,2022年06月18日,奈良,ＨＰ,スバル,フォレスター,2016年02月,"122,000 Km",DBA-SJ5,FB20,制動装置,２０２２年６月６日,ブレーキマスターバックの空気漏れにより、一晩放置するとブレーキペダルの踏み込みが硬くなる。
144,2022年06月17日,山形,ﾌﾘｰﾀﾞｲｱﾙ,スズキ,スイフト,2016年09月,"106,000 Km",DBA-ZD72S,K12B,保安灯火,数年前と先日,左右のドアミラーのギアが破損し、格納できなくなった。
145,2022年06月17日,新潟,ﾌﾘｰﾀﾞｲｱﾙ,ニッサン,ＤＡＹＺ,2020年03月,"60,900 Km",5BA-B43W,BR06,保安灯火,２０２１年１０月くらいから,運転席側の電動ドアミラーが開くときに完全に開く位置まで動かずに引っかかることがある。
146,2022年06月17日,東京,ﾌﾘｰﾀﾞｲｱﾙ,三菱,エクリプスクロス,2021年08月,不明,5LA-GL3W,4B12-S61-Y61,その他,不明,誤発進抑制装置が前方や後方に障害物がない場面でアクセルを一気に踏みこんでも作動しない。
147,2022年06月17日,東京,ﾌﾘｰﾀﾞｲｱﾙ,三菱,エクリプスクロス,2021年08月,不明,5LA-GL3W,4B12-S61-Y61,保安灯火,不明,オートライトの感度不良で、昼間の走行でも高架下を通っただけでライトが点灯したり、明るい場所に出たにもかかわらずいつまでもライトが消えなかったりする。
