番号,受付日,住所,申告方法,車名,通称名,初度登録年月,総走行距離,型式,原動機型式,不具合装置,発生時期,申告内容の要約
148,2022年06月17日,東京,ﾌﾘｰﾀﾞｲｱﾙ,三菱,エクリプスクロス,2021年08月,不明,5LA-GL3W,4B12-S61-Y61,その他,不明,周辺ソナーの感度不良で、周囲に危険が無くてもピーピーと警報音が鳴ることがある。
149,2022年06月17日,千葉,ﾌﾘｰﾀﾞｲｱﾙ,ホンダ,Ｎ－ＢＯＸ,2016年07月,"107,000 Km",DBA-JF1,S07A,動力伝達,２０２２年３月,ＣＶＴの不良により、異音がする。
150,2022年06月17日,愛知,ＨＰ,ニッサン,スカイライン,2015年09月,"75,000 Km",DAA-HV37,VQ35-HM34,かじ取り,２０２２年６月,ハンドルを動かしてないのに直進せず左へ寄って行ってしまう。常に右にハンドルを切って軌道修正しないとまっすぐ走らない。５分ほど走った後、補正されて正常に戻り今まで通り問題なくまっすぐ走れるようになる。
151,2022年06月17日,愛知,ＨＰ,スズキ,スペーシア,2015年02月,不明,DBA-MK32S,R06A,動力伝達,２０２２年５月,ＣＶＴの不良により、加速時のノッキングや加速不良が常に発生する。
152,2022年06月17日,三重,ＨＰ,スバル,レヴォーグ,2016年10月,"64,300 Km",DBA-VM4,FB16,動力伝達,不明,走行中に突然メーター表示パネルに全ての警告表示が現れ、速度が１０ｋｍ／ｈ未満でしか上がらなくなった。
153,2022年06月17日,兵庫,電話,マツダ,デミオ,2016年04月,"80,500 Km",DBA-DJ3FS,P3,燃料装置,最近,インジェクター不良により、エンジン警告灯点灯が点灯した。一度入庫をして警告灯を消した後にアイドリングストップのランプが消えて、使えなくなった。
154,2022年06月17日,兵庫,ﾌﾘｰﾀﾞｲｱﾙ,ヤマハ,マジェスティ２５０,不明,不明,4D9,不明,動力伝達,不明,高速道路上で、１００～１２０ｋｍ／ｈ走行中に、三速に落ちたような状態で急減速になった。
155,2022年06月17日,兵庫,ﾌﾘｰﾀﾞｲｱﾙ,スズキ,ワゴンＲ,2011年03月,"78,000 Km",DBA-MH23S,K6A,保安灯火,２０２２年,ドアミラーが故障し、開閉できなくなった。
156,2022年06月17日,奈良,ﾌﾘｰﾀﾞｲｱﾙ,ホンダ,Ｎ－ＷＧＮ,2014年02月,"66,378 Km",DBA-JH1,S07A,エンジン,不明,停車中にアイドリングストップがかかり、エンジンが自動停止した後、発進しようとしたらエンジンがかからずエンストしてしまった。
157,2022年06月17日,島根,ＨＰ,ニッサン,スカイライン,2015年03月,"92,300 Km",DAA-HNV37,VQ35-HM34,緩衝装置,２０２２年５月,車庫に何か黒い跡があったため、点検をうけた結果、リヤサスペンションメンバーのデファレンシャル取付のリヤ側のマウントのブッシュよりオイルが漏れていると説明がありサスペンションメンバーの交換になった。
158,2022年06月16日,新潟,ﾌﾘｰﾀﾞｲｱﾙ,ＢＭＷ,１１６ｉ,2014年08月,"56,000 Km",DBA-1A16,N13B16A,制動装置,２０２２年,ＡＢＳのハイドロユニットの不良でリヤブレーキに引きずりが発生し、ブレーキディスクが変色している。
159,2022年06月16日,岐阜,ＨＰ,ニッサン,セレナ,2016年10月,"37,000 Km",DAA-GFC27,MR20-SM24,燃料装置,２０２２年６月,エンジン始動時、ゆっくりキュルキュルとなって掛かり切らずにシステム異常表示になった。３回ほど繰り返したが掛からず、５分程してからエンジンを掛けたらうまく動いた。システム異常表示は残っていたので　再度掛け直したら異常画面も消えた。ディーラーで確認したところ、テスターでインジェクターの異常値が出ていると診断された。
160,2022年06月16日,徳島,ﾌﾘｰﾀﾞｲｱﾙ,スズキ,エブリイ,2020年04月,"50,000 Km",EBD-DA17V,R06A,動力伝達,不明,手動変速車で、１速、２速、Ｒギアが入りづらい。クラッチも重い。
161,2022年06月16日,沖縄,ＨＰ,スズキ,スペーシア,不明,不明,MK53S,不明,エンジン,不明,ファンベルトテンショナーが時々変な音を出す。テンショナーを２個交換した。
162,2022年06月15日,新潟,ﾌﾘｰﾀﾞｲｱﾙ,ホンダ,フィット,2013年11月,不明,DAA-GP5,LEB-H1,エンジン,２０２２年６月,バイパスを６０ｋｍ／ｈで走行中、トランスミッション点検という警告が出て２０ｋｍ／ｈくらいしか出なくなった。
163,2022年06月15日,茨城,ＨＰ,レクサス,ＩＳ２５０Ｃ,2009年07月,"122,700 Km",DBA-GSE20,4GR,車枠・車体,２０２２年１月,燃料関係のリコール対策を済ませた車でガソリンの臭いがする。
164,2022年06月15日,愛知,ＨＰ,ジャガー,Ｆ－ＰＡＣＥ,2016年12月,"85,000 Km",LDA-DC2NA,204DT,エンジン,２０２０年８月　２０２２年５月,２０２０年８月ターボチャージャーの不良により、幹線道路を走行中に突然エンジンが停止した。２０２２年５月には、排気バルブの破損によりエンジンブローしたため、路地にて３０ｋｍ／ｈで走行中に突然エンジンが停止した。
165,2022年06月15日,岐阜,ＨＰ,テスラ,モデルＸ,2017年12月,"89,400 Km",不明,L2S-L2S,かじ取り,２０２２年６月１４日,ステアリングが突然、重くなり操作が困難になった。ディーラーで確認したところ、ステアリングｉ－シャフト（下側）のＵジョイント部分が路面に近く露出しており防水が不十分なため、錆が発生したとの説明を受けた。
166,2022年06月15日,熊本,ﾌﾘｰﾀﾞｲｱﾙ,日野,レンジャー,2012年09月,"80,000 Km",TKG-FC9JCAP,J05E,エンジン,２０２２年６月,坂道を走行中にガタガタと異音がして正常な走行が出来なくなった。整備工場へレッカー搬送をして確認したところ、フライホイールの固定ボルト８本が全て欠損していると判った。
167,2022年06月14日,山形,ﾌﾘｰﾀﾞｲｱﾙ,フォルクスワーゲン,ゴルフ　Ｒライン,2021年07月,不明,3AA-CDDFY,DFY-4450,制動装置,購入３か月後から,後退時衝突軽減ブレーキ搭載車で、駐車時に後方にヒトや障害物等が無いのにもかかわらず、ブレーキが作動して車両が急停車する。
168,2022年06月14日,山形,ﾌﾘｰﾀﾞｲｱﾙ,スズキ,ハスラー,2020年05月,不明,4AA-MR52S,R06A-WA05A,エンジン,不明,通常の走行から停止に向けて減速をしていくと、ある速度のところで突然加速する挙動が出る。ディーラーで確認したところ、エアコンがオフになったことによる挙動だと言われている。
169,2022年06月14日,山形,ﾌﾘｰﾀﾞｲｱﾙ,スズキ,ハスラー,2020年05月,不明,4AA-MR52S,R06A-WA05A,エンジン,不明,信号、踏切などでの停止状態から発進しようとする時に、アクセルペダルを踏んでから車が発進するまでに時間差があり、速やかに発進できない。
170,2022年06月14日,千葉,ＨＰ,マツダ,ＲＸ－８,2004年04月,"85,100 Km",LA-SE3P,13B,エンジン,２０２２年３月６日,停車中、アイドリング時にエンジンが停止し、再始動を試みたところ、ボンネット内で破裂音がし、白煙が上がった後に炎上し全損判定の廃車になった。
171,2022年06月14日,三重,ＨＰ,ホンダ,Ｎ－ＯＮＥ,2022年01月,"7,900 Km",6BA-JG3,S07B,制動装置,新車納車時から,ブレーキべダルがカチカチでブレーキが効かない。
172,2022年06月14日,大阪,ＨＰ,ニッサン,デイズルークス,2015年11月,"24,600 Km",DBA-B21A,3B20,その他,２０２１年９月頃,エアコンが効かず、１８℃に設定しても冷たい風が出ない。２０２２年４月にエバボレーターからガス漏れと判明した。
173,2022年06月14日,兵庫,ＨＰ,三菱,パジェロ,2002年08月,"139,000 Km",TA-V75W,6G74,車枠・車体,２０２１年１１月頃から,エンジンスタート後、常に異音が鳴っている。
174,2022年06月14日,福岡,ＨＰ,スバル,インプレッサ,2018年07月,14 Km,DBA-GT6,FB20,走行装置,２０２２年２月１７日,スバル純正スプリングチェーンで新品を初めて使用し、雪の坂道の走行時に、はげしく滑って、なかなか登って行かなかった。その後、チェーンの片方が外れて使用不可能になった。
175,2022年06月13日,北海道,ＨＰ,スバル,インプレッサ,2010年01月,"32,000 Km",CBA-GRF,EJ25,動力伝達,２０２２年６月７日,ＡＴ　ＯＩＬ　ＴＥＭＰ、ＡＢＳ、ＶＤＣランプが点灯し、後ろから衝突されたような衝撃があった。ドライブモード「Ｄ」の表示が「－」と表示された。整備工場による確認で、ＣＶＴコントロールバルブの不具合と診断された。
176,2022年06月13日,北海道,ＨＰ,スズキ,アルト,2016年04月,"42,200 Km",DBA-HA36S,R06A,保安灯火,２年前,フォグランプのレンズにクラックが入っているのを発見した。
177,2022年06月13日,石川,ﾌﾘｰﾀﾞｲｱﾙ,ニッサン,ノートｅ－ＰＯＷＥＲ,2017年04月,"67,500 Km",DAA-HE12,HR12-EM57,動力伝達,不明,駐車のため、ギアをＰレンジに入れたにも関わらず、車がスーッと動くことがある。
178,2022年06月13日,東京,ﾌﾘｰﾀﾞｲｱﾙ,ホンダ,ＡＤＶ１５０,2020年04月,"12,262 Km",2BK-KF38,KF38E,エンジン,２０２２年２月１０日～,走行中に突然エンストし、再始動不能になる。ディーラーで多数の部品交換を行っているが、再発し、何度も入庫を繰り返している。
179,2022年06月13日,神奈川,ＨＰ,ＢＭＷ,ＢＭＷ　１１６ｉ,2013年11月,"38,800 Km",DBA-1A16,N13B16A,車枠・車体,少なくとも１年前から、２０２１年６月,エンジン室から異常なにおいが発生する。
180,2022年06月13日,千葉,ＨＰ,マツダ,ロードスター,2016年12月,"54,000 Km",DBA-NDERC,PE,乗車装置,車に乗り込むために鍵を開けようとしたとき,アドバンストキーを使用し解錠しようとしたが、解錠できなかった。その際に解錠シグナルを受信したことを示すハザードは点灯していたことからバッテリー切れではないと思料される。加えて、緊急解錠用の物理キーを使用しても解錠できなかったため、車に乗り込むことができず援助を要請した。
181,2022年06月13日,埼玉,ＨＰ,ＢＭＷ,ＢＭＷ　Ｚ４Ｍロードスター,2006年10月,"96,400 Km",ABA-BT32,326S4,保安灯火,２０２２年６月１日,一般道を５０ｋｍ／ｈキロぐらいで走行中、運転席のドアミラーの鏡が飛んで行った。
182,2022年06月13日,埼玉,ﾌﾘｰﾀﾞｲｱﾙ,マツダ,デミオ,2016年11月,"25,700 Km",LDA-DJ5FS,S5,排ｶﾞｽ･騒音,不明,国４１７２でＤＰＦのリコールを済ませた車で、措置後にも煤が堆積する。
183,2022年06月13日,山梨,ＨＰ,ヤマハ,ＸＶＳ９５０ＣＵ　ＢＯＬＴ－Ｒ（Ａ）,2019年06月,不明,2BL-VN09J,N609E,かじ取り,購入時から,ハンドルの揺れが酷く、高速では無理やり抑え込んでいる感じで、手が痺れてくる。
184,2022年06月13日,静岡,ＨＰ,スズキ,クロスビー,2019年01月,"11,300 Km",DAA-MN71S,K10C-WA05A,電気装置,２０２２年６月,リアカメラが接触不良で映らない。
185,2022年06月13日,大阪,ＨＰ,スズキ,ＧＳＸ－Ｓ１０００,2021年08月,850 Km,8BL-EK1AA,DTB1,動力伝達,購入当初から,クイックシフトシステムがＯＮの状態で、走行中にクラッチ操作を行ってのシフトチェンジを行うと、一時的にアクセルの反応がなくなる。
186,2022年06月13日,京都,ＨＰ,アウディ,アウディ　Ａ８　４．０Ｔｑ,2017年03月,"56,000 Km",ABA-4HCTGF,CTG,エンジン,２０２２年６月９日,警告灯が点灯し、急にエンジンが振動、停止した。整備工場で確認したところ、ターボチャージャーの破損が確認された。
187,2022年06月13日,広島,ﾌﾘｰﾀﾞｲｱﾙ,トヨタ,プレミオ,2016年10月,"77,400 Km",DBA-NZT260,1NZ,エンジン,２０２２年,オイル交換時に、オイルポンプ周りからのオイル漏れがあると指摘された。
188,2022年06月12日,東京,ＨＰ,プジョー,ｅ－２０８,2020年11月,不明,ZAA-P21ZK01,ZK01,その他,２０２２年４月,停車状態からＳＴＡＲＴボタンを押しても「電動走行システム故障」とメータパネルに警告表示が出て、車が走行可能な状態にならない。ディーラーではエアコンのコンプレッサーの漏電と診断された。
189,2022年06月12日,神奈川,ＨＰ,メルセデス・ベンツ,Ｂ１８０,2013年12月,"37,000 Km",DBA-246242,270,電気装置,４年程前から年１回程度、直近では、およそ,走行中、様々な警告ランプが点灯し、減速時にＡＢＳが常時作動したり、変速時に飛び出すような挙動をしたり、変速しなくなったりといった現象が発生した。原因は、すべて４輪個々に装備されている車速センサの不良によるもので、故障する輪により症状が少しずつ異なる。
190,2022年06月12日,愛知,ＨＰ,ホンダ,Ｎ－ＢＯＸ　Ｃｕｓｔｏｍ,2017年09月,"20,400 Km",DBA-JF3,S07B,動力伝達,２０２２年６月１０日,駐車場にてミッションオイルが漏れていることに気が付いた。ディーラーで確認したところ、ミッションに亀裂のような穴があると診断された。
191,2022年06月12日,岐阜,ＨＰ,マツダ,ＣＸ－３,2016年02月,"74,800 Km",LDA-DK5FW,S5,乗車装置,２０２２年５月,右側後席のシートベルトがシートを倒した際に戻らなくなった。
192,2022年06月12日,福井,ＨＰ,三菱,ふそうスーパーグレート,2019年11月,"33,370 Km",2PG-FS70HZ,6R20,電気装置,２０２１年６月２１日～現在も継続,ルームランプやエアコン操作パネルランプなどがライトスイッチをＯＦＦにしているにもかかわらず点灯したままになっていた。ディーラーで確認したところ、電気系統の制御を司るコンピュータ（ＡＳＡＭ）の交換が必要と診断された。
193,2022年06月12日,熊本,ＨＰ,ホンダ,ＣＲＦ２５０ＲＡＬＬＹ,2022年05月,457 Km,2BK-MD47,MD47E,エンジン,２０２２年５月と６月　３回,信号停車前の減速時にエンジンがストップしてしまう。
194,2022年06月11日,千葉,ＨＰ,ホンダオブザユーケー,シビック,2019年09月,"20,008 Km",DBA-FK7,L15C,制動装置,２０２２年６月１１日,駐車時に電動パーキングブレーキ警告灯が点き、その後使用不能になった。
195,2022年06月11日,千葉,ＨＰ,シトロエン,ベルランゴ,2020年11月,"20,000 Km",3DA-K9CYH01,YH01,車枠・車体,納車４ヶ月後、さらに１年半後,左スライドドア上部、右スライドドア上部、助手席側ドア上部から雨漏りが発生した。
196,2022年06月11日,奈良,ＨＰ,プジョー,ｅ－２０８,2020年12月,"19,000 Km",ZAA-P21ZK01,ZK01,電気装置,２０２２年６月１１日,一般道を時速４０ｋｍ程度で走行中に突然、電子走行に異常（ｏｒ故障？）が生じましたという警告灯が点灯し、Ｎに切り替わり、Ｄ／ＢまたはＲに切り替え不可となり、惰性で交差点から５ｍ以内の路肩に流れ着いた。その間、フットブレーキ操作は機能したが、モーターの回生ブレーキは機能しなかった。その後、Ｐモードに入れることができ、ｐａｒｋｉｎｇ　ｌｏｃｋは機能したが、再起動は不能であった。ディーラーに連絡し、レッカー移動となった。
197,2022年06月11日,広島,ＨＰ,三菱,ミラージュ,2012年08月,"34,000 Km",DBA-A05A,3A90,エンジン,２０２１年１２月,エンジン内部からメタルが流れているようなカチカチ音がする。
198,2022年06月11日,熊本,ＨＰ,スズキ,クロスビー,2022年03月,不明,4AA-MN71S,K10C-WA05A,車枠・車体,２０２２年０４月３日,車体の下回り及び、ディファレンシャルの溶接部において、黒色の塗料が剥げ、中塗りの茶褐色塗料及び、下塗り塗装のクリーム色の塗料が露見している。
199,2022年06月11日,熊本,ＨＰ,スズキ,クロスビー,2022年03月,不明,4AA-MN71S,K10C-WA05A,車枠・車体,２０２２年０５月１８日,車体の下回りを見たところ、左前輪側のアンダーパネルが垂れ下がっていた。
200,2022年06月10日,福島,ＨＰ,ホンダ,ＶＥＺＥＬ,2014年03月,"138,337 Km",DAA-RU4,LEB-H1,燃料装置,２０２２年６月７日,下り坂を走行中に突然警告音がなり、ＣＴＢＡ、ＡＷＤ、ＥＰＳシステム、ＶＳＡ、ブレーキシステム、ブレーキホールドの警告灯が点灯した。停車しブレーキが作動すること、バックに入ること、ライト関係も問題ないため走行したが、回転数が上がらなくなり上り坂が登りづらくなった。ディーラーで確認したところ、燃料ポンプ不良で燃料圧力がかからないのが原因と説明された。
201,2022年06月10日,新潟,ＨＰ,三菱,ｅＫ,2018年02月,"35,000 Km",DBA-B11W,3B20,エンジン,不明,カタログ値２３ｋｍ／Ｌのところ、実燃費が平均１３ｋｍ／Ｌ前後である。
202,2022年06月10日,新潟,ＨＰ,三菱,ｅＫ,2018年02月,"35,000 Km",DBA-B11W,3B20,エンジン,２０２２年５月１０日,キーをスタートに回してもスターターが作動せずにエンジンが始動出来なかった。整備工場でスターター交換を行った。
203,2022年06月10日,東京,ＨＰ,スバル,レヴォーグ,2018年03月,"25,000 Km",DBA-VMG,FA20,動力伝達,２０２１年初頭より,一般道を法定速度で走行中、段差や道路くぼみを通過すると、ドカンと寿命の縮むくらいの衝撃と音が出る。
204,2022年06月10日,東京,ＨＰ,ランドローバー,レンジローバーヴェラール,2018年07月,"28,100 Km",LDA-LY2NA,204DT,エンジン,２０２２年５月１１日,走行中にパチっと異音がして突然減速し、加速できなくなり、マフラーから大量の白煙が上がり車内も熱くなった。ディーラーで確認したところ、タービンが壊れエンジンルームに入り込みエンジン内部が破損しオイルが漏れたとの報告があった。
205,2022年06月10日,埼玉,ＨＰ,プジョー,３０８,2016年08月,"50,000 Km",LDA-T9WBH01,BH01,排ｶﾞｽ･騒音,２０２２年６月,エンジン始動時にエンジン警告灯が点灯、その後ｅｍｉｓｓｉｏｎ　ｆａｕｌｔが表示され、ＵＲＥＡの警告が点灯した。ディーラーで確認したところ、尿素リザーバータンク交換が必要と診断された。
206,2022年06月10日,埼玉,ﾌﾘｰﾀﾞｲｱﾙ,トヨタ,ハリアー,2017年01月,"39,000 Km",DBA-ZSU60W,3ZR,車枠・車体,不明,左右のフロントバンパー、フェンダーとの接合部付近に割れが発生した。
207,2022年06月10日,愛知,ＨＰ,スズキ,ソリオ,2016年06月,"41,930 Km",DAA-MA36S,K12C-WA05A,緩衝装置,２０２２年６月９日,１２か月点検を受けたところ、フロントストラットブーツが切れ（破れ）ていた。
208,2022年06月10日,大阪,ﾌﾘｰﾀﾞｲｱﾙ,アウディ,Ａ３スポーツバック,2009年11月,"122,000 Km",ABA-8PCAX,CAX,制動装置,２０２２年４月,ＡＢＳ警告灯、ＥＳＣ、ブレーキランプのエラーが出たため、ディーラーで見積もりを依頼したところ、入庫時に症状は消えていたものの、こちらの申告を元にＡＢＳ／ＥＳＣコントロールユニットの交換という見積もりが出た。
209,2022年06月10日,大阪,ﾌﾘｰﾀﾞｲｱﾙ,アウディ,Ａ３スポーツバック,2009年11月,"122,000 Km",ABA-8PCAX,CAX,動力伝達,不明,７速ＤＳＧ搭載車で、２速ギアにおいてジャダーが発生する。
210,2022年06月10日,兵庫,ＨＰ,フォルクスワーゲン,ＶＷゴルフ　１．４／１０３ｋＷ,2016年01月,"35,000 Km",DBA-AUCPT,CPT,保安灯火,２０２２年６月９日,走行中に運転席側のドアミラーにはめ込まれている鏡が落下した。
211,2022年06月09日,北海道,ﾌﾘｰﾀﾞｲｱﾙ,ホンダ,ＶＥＺＥＬ,2017年05月,"38,000 Km",DAA-RU4,LEB-H1,エンジン,２０２２年５月,踏切発進時にアクセルペダルを普段通りに操作しても車が動かず、強く踏みこんだら一気に急発進する症状が出た。ディーラーへ点検を依頼し、コンピューターのリセット作業等が行われて引き取ったが、その後交差点右折時に同じようにエンジンが吹けなくなる症状が発生した。
212,2022年06月09日,福島,ＨＰ,トヨタ,アクア,2012年05月,"280,000 Km",DAA-NHP10,1NZ-1LM,保安灯火,５年くらい前から,テールランプカバーの内部に曇りが生じ、年月が経つにつれて水がたまる様になった。
213,2022年06月09日,東京,ＨＰ,ボルボ,ボルボ　ＸＣ６０,2012年09月,"80,000 Km",CBA-DB4204TXC,B4204T,動力伝達,２０２２年６月,発進時にギアが入らない。突然にガクンと１速に入るがシフトアップせず、そのまま走行するしかなくなる。たまに２速か３速に入ってもすぐ１速に戻りガクンと急減速し追突されそうになった。Ｒギアに入らない。セミオートマの＋－が全く機能しない。トランスミッション機能低下の警告表示が出た。
214,2022年06月09日,神奈川,ﾌﾘｰﾀﾞｲｱﾙ,ポルシェ,カイエン,2021年01月,"5,000 Km",ABA-E3K30,不明,電気装置,２０２２年５月２９日,バッテリー上がりが発生した。ディーラーで確認したところ、当該車両に使用されているリチウムイオンバッテリーは一度バッテリー上がりになると充電ができないため交換が必要と診断された。
215,2022年06月09日,千葉,ﾌﾘｰﾀﾞｲｱﾙ,スズキ,スイフト,2012年01月,不明,DBA-ZC72S,不明,その他,２０２２年６月,エアコンのスイッチを押してもコンプレッサーが動いておらず、エアコンが効かない。
216,2022年06月09日,埼玉,ﾌﾘｰﾀﾞｲｱﾙ,ホンダ,Ｎ－ＷＧＮ,2018年02月,"64,400 Km",DBA-JH1,S07A,エンジン,２０２１年末頃,アクセルを開けても加速がわるく詰まるような症状が発生した。その後、警告ランプが２～３個点灯したため、ディーラーに相談したところ、点火コイル、プラグの弱りではないかということで１本交換したが、加速不良、アイドリング不安定の症状が出ている。
217,2022年06月09日,茨城,ＨＰ,ホンダ,ＰＣＸ,2021年10月,"2,800 Km",2BJ-JK05,JK05E,かじ取り,１０００ｋｍ走行の２０２１年１２月頃から,ハンドルのガタツキが出て上下左右に動いてしまう。最近はその振動が原因でメーターパネルにもヒビの前兆の模様が入っている。販売店で確認したところ、ハンドルクッションラバーの交換になった。
218,2022年06月09日,兵庫,ﾌﾘｰﾀﾞｲｱﾙ,ホンダ,インテグラ,2013年04月,"5,800 Km",EBL-RC62,RC61E,エンジン,今年の初め,エンジンオイルの交換量について、マニュアル上では３．２Ｌと指定されているところ、実際には４Ｌでオイルゲージが適正になる。この影響なのか、エンジンがかからなくなったことがある。
219,2022年06月09日,山口,ＨＰ,ホンダ,Ｎ－ＢＯＸ,2018年07月,"17,600 Km",DBA-JF3,S07B,燃料装置,２０２２年４月、５月,道路走行中に突然エンストした。バッテリーマークが警告表示された。車を動かそうとしたが、少しも動かなくなった。販売店で修理を受けたが翌月に再発し、燃料が供給されていないとのことでまた部品交換を行った。
220,2022年06月09日,山口,ﾌﾘｰﾀﾞｲｱﾙ,三菱,ｉ－ＭｉＥＶ,2013年02月,"118,600 Km",ZAA-HA3W,Y4F1,動力伝達,２０２２年５月１０日,駐車場所でバックをするためにギアをＲに入れて発進させたところ、車が前進してしまい道路に飛び出してしまったことから、横から来た車とぶつかってしまい、人身事故となった。
221,2022年06月08日,北海道,ＨＰ,三菱ユンボ,ＢＤ２Ｈ,1997年03月,不明,BD2H(E),S4S-E1,電気装置,２０２０年１２月,エンジンを停止させようとキースイッチをＯＦＦに操作したところ、エンジンルームにあるエンジンストップソレノイド作動用タイマーから白煙が上がった（焦げた）。
