番号,受付日,住所,申告方法,車名,通称名,初度登録年月,総走行距離,型式,原動機型式,不具合装置,発生時期,申告内容の要約
164,2021年08月17日,大阪,ＨＰ,トヨタ,ハリアー,2015年08月,"46,000 Km",DBA-ZSU60W,3ZR,車枠・車体,２０２１年５月から８月の間,左右のフロントバンパー、フェンダーとの接合部付近に割れが発生した。
165,2021年08月17日,大阪,ＨＰ,トヨタ,シエンタ,2021年02月,不明,6AA-NHP170G,1NZ-2LM,車枠・車体,不明,雨天駐車時、エンジンルーム内に左側に雨水が流れ込む。
166,2021年08月17日,兵庫,ＨＰ,メルセデス・ベンツ,Ｃ２００,2014年07月,"80,031 Km",RBA-205042,274,エンジン,２０２１年８月１１日,２０２１年７月車検の際にサーモスタット交換を強く勧められ交換したら、その１２日後にオーバーヒートして走行不能に陥った。
167,2021年08月17日,兵庫,ＨＰ,ダイハツ,ミラカスタム,2007年07月,"94,800 Km",DBA-L275S,KF,走行装置,不明,通常走行時にハンドルのセンターがずれていることに気づき、車体の周りを確認すると左後ろタイヤが異常にネガティブ側にキャンバーが付いてる事を視認した。車体下部を確認するとハブを保持しているアクスルが腐食により破断寸前になっていた。
168,2021年08月17日,滋賀,ＨＰ,ニッサン,セレナ,2013年02月,"123,500 Km",DAA-HFC26,MR20-SM23,動力伝達,２０２１年８月１６日,バイパス走行中、若干の上り坂で加速しなくなり、車体がガタガタと振動するようになった。
169,2021年08月17日,山口,電話,いすゞ,ギガ,2010年06月,"892,400 Km",PDG-CXM77K8,6UZ1,緩衝装置,不明,左右のリアスプリングサドルの爪がよく折れて破損する。
170,2021年08月17日,山口,電話,いすゞ,ギガ,2009年08月,"831,400 Km",PDG-CXM77K8,6UZ1,緩衝装置,不明,左右のリアスプリングサドルの爪がよく折れて破損する。
171,2021年08月17日,山口,電話,いすゞ,ギガ,2011年09月,"734,500 Km",LKG-CXM77AT,6UZ1,緩衝装置,不明,左右のリアスプリングサドルの爪がよく折れて破損する。
172,2021年08月17日,熊本,ＨＰ,スズキ,エブリイ,2007年01月,"123,800 Km",ABA-DA64W,K6A,車枠・車体,２０２１年８月１１日,エアークリーナー交換しようとボックス開けたら水が溜まっていた。
173,2021年08月16日,東京,ﾌﾘｰﾀﾞｲｱﾙ,ニッサン,エルグランド,2020年12月,不明,5BA-TNE52,QR25,制動装置,不明,なにもないところで自動ブレーキが不要作動した。
174,2021年08月16日,千葉,ﾌﾘｰﾀﾞｲｱﾙ,ＵＤトラックス,クオン,2011年10月,"387,900 Km",LKG-CG5ZA,GH11,燃料装置,不明,燃料噴射装置のエア噛みで、エンジンがかからなくなる。
175,2021年08月16日,京都,ＨＰ,ニッサン,エクストレイル,2015年09月,"29,000 Km",DAA-HNT32,MR20-RM31,動力伝達,購入時から,発進時にクリープ現象がでない。その後、遅れて急発進する。
176,2021年08月16日,兵庫,ＨＰ,ニッサン,セレナ,不明,不明,DAA-HFC26,MR20-SM23,車枠・車体,２０２１年８月,パールホワイト色塗装の車でＣピラーの端から塗装がペラペラ剥がれる。
177,2021年08月16日,奈良,ﾌﾘｰﾀﾞｲｱﾙ,ホンダ,Ｎ－ＢＯＸ,不明,不明,DBA-JF1,不明,保安灯火,不明,後部ドアガラスの支持部が破損したため、駐車しておいたところガラスが下がっていた。
178,2021年08月16日,和歌山,ﾌﾘｰﾀﾞｲｱﾙ,スバル,レヴォーグ,2014年08月,"65,000 Km",DBA-VM4,FB16,エンジン,２０２１年８月６日,点検時、オイルコントロールバルブから油漏れでワイヤーハーネスに垂れる恐れがあると指摘された。現在油漏れしていないし警告灯も点いていない。
179,2021年08月16日,福岡,ＨＰ,トヨタ,アクア,2018年01月,"58,284 Km",DAA-NHP10,1NZ-1LM,保安灯火,２０２１年８月１６日,何の衝撃も無しに、突然フロントガラスに２５ｃｍ位のヒビが入った。
180,2021年08月16日,長崎,ＨＰ,ニッサン,デイズルークス,2014年07月,"39,000 Km",DBA-B21A,3B20,エンジン,以前から症状はあったものの、２０２１年８,エンジンのプッシュボタンが接触不良で作動しない。
181,2021年08月15日,北海道,ＨＰ,スバル,レガシィ,2010年11月,"116,000 Km",DBA-BM9,EJ25,制動装置,２０２１年４月１０日,信号停止中、突如メーターパネルにＡＢＳ及びＶＤＣ警告灯が点灯した。
182,2021年08月15日,東京,ＨＰ,マツダ,ＣＸ－５,2017年09月,"20,800 Km",LDA-KF2P,SH,その他,２０２１年５月頃,発生した状況：運転していると、何も操作してないのに、ナビ画面がスクロールしたり、縮尺が変更されたりする。ナビゲーションに支障があるほか、画面設定が変更されてしまうので、都度、修正（元に戻す）手間がかかる。
183,2021年08月15日,神奈川,ＨＰ,スバル,フォレスター,2016年04月,"14,749 Km",DBA-SJG,FA20,制動装置,２０２１年６月,マスターバックの気密不良により、エンジン始動時にブレーキペダルが硬くなる。
184,2021年08月15日,愛知,ＨＰ,トヨタ,アルファード２４０Ｘ,2010年03月,"90,000 Km",DBA-ANH20W,2AZ,車枠・車体,２０２１年７月,洗車していた時にボンネットの塗装が浮いて膨らんでいるのを発見した。
185,2021年08月15日,香川,ＨＰ,フィアット,パンダ４×４,2014年12月,"58,800 Km",ABA-13909,312A2,エンジン,２０２１年,高速道路のパーキングエリアから合流加速中、急にエンジン振動が大きくなった。走行は可能だが、エンジン回転を４０００ｒｐｍ程度まで上昇させるとエンジン振動が大きくなり、それ以上回転を上げることが困難な状況になった。
186,2021年08月14日,愛知,ＨＰ,フィアット,パンダ,2014年05月,"19,439 Km",ABA-13909,312A2,エンジン,２０２１年８月６日,坂道でパワーが無くなり、エンストした。
187,2021年08月13日,宮城,来訪,ポルシェ,マカン,2016年08月,"13,000 Km",ABA-J1H1,CYP,保安灯火,２０２０年２月頃,リヤワイパーブラケットの溶損により、リンク部品が外れた。
188,2021年08月13日,長野,ＨＰ,ＢＭＷ,ＭＩＮＩ　クロスオーバーＳＤ,2015年11月,"85,000 Km",LDA-ZB20,N47C20A,エンジン,２０２１年７月,信号待ちの後、発進しようとアクセルペダルを踏んでも反応が悪くなり、駐車場に駐車する為バックギアに入れたとたん、エンジンが停止した。その後再起動を試みるが、一旦エンジンはかかるがすぐに停止してしまう。特に警告ランプは点灯しなかった。
189,2021年08月13日,茨城,ＨＰ,ニッサン,スカイライン,2020年07月,"9,000 Km",5BA-RV37,VR30,エンジン,２０２１年５月、６月、７月,エンジン起動後にエンジン警告灯が点灯し、アクセルペダルを踏み込んでもエンジン回転数が上がらず走行できない。
190,2021年08月13日,静岡,ＨＰ,マツダ,ベリーサ,2012年02月,不明,DBA-DC5W,ZY,かじ取り,２０２１年８月１３日,低速走行時（交差点や車庫入れ時）にパワーステアリングが重くなる。
191,2021年08月13日,岐阜,ＨＰ,トヨタ,ハリアー,2021年07月,不明,6AA-AXUH80,A25A-3NM,かじ取り,新車時,走行中、道路の横断方向の勾配に反応しやすく、ハンドルが引かれて車体が予想しないほうへ流れていく。
192,2021年08月13日,京都,ﾌﾘｰﾀﾞｲｱﾙ,ホンダ,Ｎ－ＢＯＸ,2018年08月,不明,DBA-JF3,S07B,燃料装置,不明,フューエルポンプ不良でエンジンが吹けなくなった。
193,2021年08月13日,京都,ﾌﾘｰﾀﾞｲｱﾙ,ホンダ,Ｎ－ＢＯＸ,2018年08月,不明,DBA-JF3,S07B,エンジン,不明,エキゾーストバルブの不良により、エンジンチェックランプが点灯した。
194,2021年08月13日,京都,ﾌﾘｰﾀﾞｲｱﾙ,スズキ,スペーシアカスタム,2016年08月,"57,000 Km",DAA-MK42S,R06A-WA04A,エンジン,不明,ステレオカメラによるブレーキサポートシステム搭載車で、エンジンキーをオンにしてからオフにするまでの１運転サイクルで衝突防止が多く働いた場合、交差点の右折発進などにおいてアクセルペダルを踏み続けても、５～１０秒間程度クリープ状態の速度しか出なくなる制御がかかるようになる。
195,2021年08月13日,京都,ﾌﾘｰﾀﾞｲｱﾙ,ホンダ,Ｎ－ＢＯＸ,2018年08月,不明,DBA-JF3,S07B,乗車装置,不明,給油口センサーの不良で、給油口が閉まっているにもかかわらず、スライドドアがロックされて開閉できなくなった。
196,2021年08月13日,兵庫,ＨＰ,スバル,レヴォーグＳＴＩスポーツＥＸ,2021年01月,不明,4BA-VN5,CB18,その他,２０２１年６月,アイサイトＸ作動、車線中央維持走行中、片側一車線対面通行車線にてセンターライン及びセンターポール沿いに接近してセンターラインにタイヤが乗るか乗らないか位近くをトレースして走行した。
197,2021年08月13日,広島,ﾌﾘｰﾀﾞｲｱﾙ,スズキ,アルトワークス,2020年10月,"5,700 Km",4BA-HA36S,R06A,車枠・車体,２０２１年８月４日,降雨後、後席足元やカーペットが濡れており、バックドアを開けて確認したところ、パンク修理材等を格納しているところにも水が溜まっていた。
198,2021年08月13日,高知,ＨＰ,ニッサン,セレナ,2013年02月,"122,270 Km",DAA-HFC26,MR20-SM23,車枠・車体,３年位前から,パールホワイト色塗装の車で、ボンネット、スライドドア、Ａピラー両側の塗装が剥がれた。
199,2021年08月12日,千葉,ＨＰ,その他,ｇｌａｆｉｔ　ＬＯＭ,2021年08月,不明,LOM-01,不明,走行装置,納車時点,リヤタイヤ用インナーチューブとホイールの構造に問題があり納車時点でパンクしていた。
200,2021年08月12日,栃木,ﾌﾘｰﾀﾞｲｱﾙ,ニッサン,セレナ,2013年10月,"87,000 Km",DAA-HFC26,MR20-SM23,動力伝達,不明,ＣＶＴのリコールでリプログラムの対応を行った車で、ＣＶＴが故障した。
201,2021年08月12日,三重,ﾌﾘｰﾀﾞｲｱﾙ,プジョー,２００８,2021年07月,300 Km,ZAA-P24ZK01,ZK01,電気装置,不明,満充電でも航続距離が短い。
202,2021年08月12日,大阪,ＨＰ,マツダ,ＣＸ－３０,2019年12月,"1,550 Km",3AA-DMFP,HF-MK,制動装置,２０２１年６月２５日,エンジン始動後、駐車場からの発進時にギアをＤに入れ、フットブレーキは踏んでいる状態で車が前進した。
203,2021年08月12日,宮崎,来訪,ダイハツ,ムーヴ,2007年08月,868 Km,DBA-L175S,KF,エンジン,２０２１年８月１日,一般道路走行中、突然エンジンが停止し走行不能になった。車両を整備工場に持ち込み、原動機を分解して状態を確認してみたらコンロッドが折損し一部に穴が開いていた。
204,2021年08月11日,宮城,来訪,三菱,ふそうエアロスター,2019年03月,"78,821 Km",2PG-MP38FK,6M60,排ｶﾞｽ･騒音,２０２１年７月１７日及び８月６日,乗客１６人を乗せ運行中に突然ＡＴが１足から変速しなくなり、ディーラーへレッカー移動となった。ディーラーでＥＧＲバルブ関連部品を交換したが、翌日に同じ症状が再発した。
205,2021年08月11日,青森,ＨＰ,トヨタ,ランドクルーザープラド,2020年05月,"15,000 Km",LDA-GDJ150W,1GD,排ｶﾞｽ･騒音,２０２１年１月上旬、８月１０日,エンジン異常警告灯が点灯とともに運転支援装置が無効の表示となり、その後排ガス異常の警告が出る。
206,2021年08月11日,青森,ﾌﾘｰﾀﾞｲｱﾙ,ニッサン,スカイライン,2020年11月,不明,5BA-RV37,VR30,電気装置,２０２１年８月９日,エンジンを始動した瞬間に、Ｐレンジであるはずなのに車が急発進をしようとした。車両は止まったままの状態であったが、駆動輪（後輪）が空転したらしく砂利駐車場の地面を削っていた。
207,2021年08月11日,長野,ＨＰ,ホンダ,Ｎ－ＢＯＸ,2015年06月,"75,324 Km",DBA-JF2,S07A,エンジン,２０２１年４月頃,エンジンスターターを押してもエンジンがかからない。アイドリングストップ状態になった後に再始動せずエンストする。
208,2021年08月11日,千葉,ＨＰ,ヤマハ,ＳＲ４００,不明,不明,RH03J,不明,エンジン,ツーリング時ほぼ毎回,ツーリング時、ニュートラルに入っていようが、クラッチレバーを握っていようが、そのままエンジンが止まることがある。
209,2021年08月11日,埼玉,ﾌﾘｰﾀﾞｲｱﾙ,マツダ,アクセラ,2012年09月,"51,400 Km",DBA-BL5FW,ZY,車枠・車体,不明,ダッシュボードが浮き上がった。
210,2021年08月11日,群馬,ＨＰ,ニッサンＭＴ,マーチ,2013年02月,"65,800 Km",DBA-K13,HR12,エンジン,２０１５年夏,エアコン（クーラー）を使用時、一時停車の後、アクセルを踏み込んでも、数秒間エンジンの回転数が上がらず、そのため速度が上がらない状況が多発する。広い道路を横断する際などにこの現象が生ずると、意図に反し、時間がかかるため、衝突しそうになり、非常に危険なことがある。
211,2021年08月11日,奈良,ＨＰ,ニッサン,セレナ,2013年03月,"99,111 Km",DAA-HFC26,MR20-SM23,電気装置,２０２１年８月１１日,エンジン音にカラカラと大きな音が混じるようになり、ついに信号待ちでアイドリングストップが解除されず動かなくなった。エンジンをかけ直すと車は動く事ができたが、異常音は消える事なくアイドリングストップのランプが点滅した。
212,2021年08月11日,奈良,ＨＰ,ニッサン,セレナ,2013年03月,"88,000 Km",DAA-HFC26,MR20,その他,２０２０年８月９日,ファンモーターの故障により、エアコンが効かなくなった。
213,2021年08月11日,熊本,ＨＰ,トヨタ,ルーミー,2019年06月,"13,000 Km",DBA-M900A,1KR,制動装置,２０２１年８月９日,５０ｋｍ／ｈぐらいで走行中、自動ブレーキがかかる。
214,2021年08月10日,長野,ＨＰ,トヨタ,Ｃ－ＨＲ,2020年03月,不明,3BA-NGX10,8NR,保安灯火,２０２１年２月,ヘッドライト内側に塗られている曇り止めが、乾燥不十分で、熱により液だれしている。
215,2021年08月10日,長野,ＨＰ,トヨタ,パッソ,2018年03月,"20,000 Km",DBA-M700A,1KR,エンジン,２０２１年６月２８日,アクセルを全開にしてもゆっくり動いてその後加速していく。止まってスタートする時は同じ動作をくりかえす。交差点右折時に加速せず、直進車と接触しそうになくらい初速が遅い。
216,2021年08月10日,東京,ﾌﾘｰﾀﾞｲｱﾙ,マツダ,ＲＸ－７,2001年06月,"147,000 Km",GF-FD3S,13B,制動装置,２０２１年８月６日,発進から１０分ほど走行し、途中の赤信号ではきちんと停車できたにもかかわらず、降坂時にブレーキペダルの踏みごたえが固くなり、踏み込めなくなったため、そのまま止まってる車両にぶつかる物損事故になった。
217,2021年08月10日,東京,ﾌﾘｰﾀﾞｲｱﾙ,スバル,レヴォーグ,2021年02月,"4,000 Km",4BA-VN5,CB18,エンジン,２０２１年８月４日,過給器のクランプずれによる圧力不良により。上り坂を走行時に加速不良になった。
218,2021年08月10日,神奈川,ﾌﾘｰﾀﾞｲｱﾙ,ニッサン,ＲＯＯＸ,2021年06月,"1,485 Km",5AA-B44A,BR06-SM21,乗車装置,新車購入当初から,シートベルトの根元の取付角度が悪いため、おなかの上でベルトがねじれる。
219,2021年08月10日,神奈川,ﾌﾘｰﾀﾞｲｱﾙ,ニッサン,ＲＯＯＸ,2021年06月,"1,485 Km",5AA-B44A,BR06-SM21,乗車装置,新車購入当初から,前席ドリンクホルダーから空になったペットボトルが落下する。
220,2021年08月10日,神奈川,ﾌﾘｰﾀﾞｲｱﾙ,スバル,ＷＲＸ,2020年06月,"8,000 Km",DBA-VAG,FA20,保安灯火,不明,前照灯の取付不良でガタついている。
221,2021年08月10日,神奈川,ﾌﾘｰﾀﾞｲｱﾙ,スバル,ＷＲＸ,2020年06月,"8,000 Km",DBA-VAG,FA20,乗車装置,不明,座席取付不良で、座っているとガタガタした。
222,2021年08月10日,埼玉,ﾌﾘｰﾀﾞｲｱﾙ,ＢＭＷ,５２３ｉ　ツーリング,2015年10月,"26,000 Km",DBA-XL20,N20B20B,電気装置,２０２１年７月２０日,駐車中に白煙が上がり、ボンネットを開けると出火した。
223,2021年08月10日,栃木,ＨＰ,スバル,レヴォーグ,2014年06月,"108,000 Km",DBA-VM4,FB16,動力伝達,２０２１年８月頭,ＣＶＴの不具合により、加速時に３０００回転あたりからガガガッと音と振動が起き、加速がギクシャクする。
224,2021年08月10日,福岡,ＨＰ,トヨタ,ヴォクシー,2015年03月,"52,700 Km",DBA-ZRR80W,3ZR,制動装置,２０２１年７月,走行中に普通にフットブレーキを踏むとガクンと振動があり、エンジンブレーキの警告表示ランプがつく、それから消えずにブレーキペダルを踏むとガガガと振動が生じる。
225,2021年08月10日,宮崎,ﾌﾘｰﾀﾞｲｱﾙ,ニッサンＭＴ,マーチ,2013年02月,"100,000 Km",DBA-K13,HR12,エンジン,不明,電動ファンのガタつきにより、異音が発生した。
226,2021年08月09日,宮城,ＨＰ,スバル,フォレスター,2018年10月,"21,000 Km",5AA-SKE,FB20,電動機(モーター),２０２１年８月６日,エンジンを始動したらハイブリッドシステムが異常を示し、エンジンを再始動したら消えた。その後も度々、異常を示すが再始動を繰り返すと消える。
227,2021年08月09日,東京,ＨＰ,トヨタ,プリウス,2009年11月,"123,000 Km",DAA-ZVW30,2ZR-3JM,車枠・車体,２０２１年７月,ボンネット、屋根、ドアの塗装も剥がれ、浮きが発生した。
228,2021年08月09日,東京,ＨＰ,フォルクスワーゲン,パサートヴァリアント,2010年05月,"89,000 Km",ABA-3CCDA,CDA,動力伝達,２０２１年６月,一般道にて赤信号停止後、発進しようとすると空ぶかし状態となり発進できず不動になった。シフトインジケータが点滅し、エンジンチェックランプが点灯した。
229,2021年08月09日,埼玉,ＨＰ,シトロエン,Ｃ４　Ｐｉｃａｓｓｏ,2018年04月,"26,600 Km",LDA-B787AH01,AH01,排ｶﾞｽ･騒音,２０２１年６月１３日,アドブルーポンプの不具合により、走行中アドブルー警告灯が点滅、残り１１００ｋｍでエンジン停止と表示された。走行には影響していない。
230,2021年08月09日,静岡,ＨＰ,ニッサンディーゼル,コンドル,2006年05月,"309,600 Km",ADG-CG4XA,GE13,走行装置,２０２１年８月３日,ホイールナットがサビている。
231,2021年08月09日,静岡,ﾌﾘｰﾀﾞｲｱﾙ,ニッサンディーゼル,コンドル,2007年07月,"748,700 Km",BDG-MK36D,J07E,排ｶﾞｽ･騒音,２０２１年７月１５日,テールパイプが腐食で割れた。
232,2021年08月09日,岐阜,ＨＰ,ＢＭＷ,３２０ｄ,2015年06月,"71,000 Km",LDA-3D20,N47D20C,動力伝達,２０２０年８月ごろ,アイドリングストップからの復帰時に意図なくＤレンジからＰレンジに切り替わり、気づかず、空ぶかしになる。
233,2021年08月09日,岐阜,ＨＰ,ニッサン,リーフ,2021年02月,"11,414 Km",ZAA-ZA1,EM57,その他,２０２１年５月頃から複数回,前方カメラの異常により、走行中にシステムエラーが表示され、プロパイロットや車線逸脱防止警告などの運転支援機能が使用できなくなる。
234,2021年08月09日,兵庫,ＨＰ,ホンダ,フリード,2013年03月,"94,700 Km",DAA-GP3,LEA-MF6,保安灯火,不明,一般道路を走行中、運転席側のパワーウィンドウが閉まらなくなった。
235,2021年08月09日,福岡,ＨＰ,スズキ,スペーシア,2014年01月,"31,000 Km",DBA-MK23S,R06A,かじ取り,２０２１年７月１５日,エンジンを切ってもハンドルロックがかからない。警告灯もついたままになった。
236,2021年08月08日,岩手,ﾌﾘｰﾀﾞｲｱﾙ,スバル,レガシィ,2010年08月,"80,000 Km",DBA-BR9,EJ25,制動装置,２０２０年３月頃,ＶＣＤユニット不良により、メーターパネルにＡＢＳ警告灯、ＶＤＣ警告灯が点灯している。
237,2021年08月08日,東京,ＨＰ,ニッサン,エルグランド,2012年03月,"59,100 Km",DBA-TE52,QR25,かじ取り,２０２０年７月、２０２１年７月,パワーステアリングポンプの不良により、減速時や下り坂など前輪に車重がかかった際にハンドルが回せなくなった。
238,2021年08月08日,神奈川,ＨＰ,フォルクスワーゲン,Ｔ－ｃｒｏｓｓ,2021年03月,"2,500 Km",3BA-C1DKR,DKR,エンジン,２０２１年８月１日,停車するとエンジンが停止して再始動に手間取る。
239,2021年08月08日,神奈川,ＨＰ,マツダ,ＣＸ－３０,2020年03月,不明,3AA-DMFP,HF-MK,乗車装置,２０２０年８月頃,雨の日、スマートキーをポケットに入れ、車に近づくだけでドアが開錠してしまう。
240,2021年08月08日,埼玉,ＨＰ,ＢＭＷ,３２０ｄツーリング,2012年11月,"70,000 Km",LDA-3D20,N47D20C,乗車装置,２０２０年８月,リアハッチゲートが立体駐車場内で勝手に開き、駐車場と車の双方が破損した。
241,2021年08月08日,茨城,ＨＰ,ホンダ,Ｎ－ＢＯＸ,2019年05月,"9,200 Km",DBA-JF3,S07B,エンジン,２０２１年７月２日,発進時、２～３速辺りになると急に加速が遅くなる。赤信号で停止しようとブレーキペダルを踏んで減速するが、いきなり急発進する事が度々ある。
242,2021年08月08日,茨城,ＨＰ,ニッサン,セレナ,2014年08月,"65,000 Km",DAA-HFC26,MR20-SM23,電気装置,２０２１年７月１５日,オルタネーターの不良により、エンジンを始動するとエンジンルームから異音がする。
243,2021年08月08日,岐阜,ＨＰ,スバル,レガシィツーリングワゴン,2011年12月,"78,000 Km",DBA-BR9,EJ25,動力伝達,２０２１年６月２１日,追突と間違える程の強い変速ショックが発生する。
244,2021年08月07日,宮城,ＨＰ,日野,セレガ,2014年02月,"275,000 Km",QRG-RU1ASCA,A09C,動力伝達,２０２０年１２月頃,フィンガーコントロールユニットの不良により、警告灯がつきギアが入らなくなった。
245,2021年08月07日,福井,ＨＰ,スズキ,スイフトスポーツ,2018年05月,"55,000 Km",CBA-ZC33S,K14C,動力伝達,２０２１年７月上旬から,２５００回転以上でパドルシフトのシフトアップが出来ない。（複数回クリックすると出来る）
246,2021年08月07日,大阪,ＨＰ,スズキ,アドレス１２５,不明,"5,900 Km",2BJ-DT11A,不明,エンジン,２０２１年５月中旬以降,一般道走行中、６０ｋｍ／ｈで一定距離を信号にひかかる事なく１０分ほど走行するとエンストする。
247,2021年08月07日,大阪,ＨＰ,アルファロメオ,ジュリアスーパー,2018年01月,"13,514 Km",ABA-95220,55273835,燃料装置,２０２１年７月２０日,燃料ポンプの不良により、走行中エンジンが停止し、再始動不可となった。
248,2021年08月07日,岡山,ＨＰ,マツダ,ＣＸ－３,2016年01月,"48,985 Km",LDA-DK5FW,S5,乗車装置,２０２１年７月１０日,後席左右のシートベルトが２、３回程度しか使用していないにもかかわらず、伸びきったまま戻らなくなった。
249,2021年08月07日,大分,ＨＰ,ニッサン,セレナ,2013年09月,"98,300 Km",DAA-HFC26,MR20-SM23,電気装置,２０２１年８月２日,オルタネーターの不良により、通常走行中エンジンからガラガラ・ゴロゴロ音が発生した。
250,2021年08月06日,富山,ﾌﾘｰﾀﾞｲｱﾙ,ホンダ,Ｎ－ＢＯＸ＋,不明,"55,000 Km",DBA-JF2,S07A,動力伝達,不明,ＣＶＴが故障して走行不能になった。
251,2021年08月06日,神奈川,ＨＰ,三菱,ふそうキャンター,2020年01月,不明,2PG-FBA60,4P10,エンジン,２０２１年７月３０日,高速道路を走行中に先方の走る車を追い越そうと追い越し車線に移り、１２０ｋｍ／ｈくらいに達した時に、突然エンジンの回転数が３０００回転以上になり、スロットルを開けてもスピードが上がらなくなった。４０ｋｍ／ｈくらいで走行したところ、徐々に直ったため、様子を見ながら帰宅した。
