番号,受付日,住所,申告方法,車名,通称名,初度登録年月,総走行距離,型式,原動機型式,不具合装置,発生時期,申告内容の要約
252,2021年08月06日,埼玉,ＨＰ,ホンダ,Ｎ－ＢＯＸカスタム,2017年11月,"55,000 Km",DBA-JF3,S07B,乗車装置,２０１８年２月中旬,自宅及び駐車場にて左側スライドドアが勝手に開きブロックにこすり傷ができた。３年半で１０回発生しており、スイッチ、モーターなど、原因と思われる個所の交換修正をしてもらったが直らない。
253,2021年08月06日,山梨,ﾌﾘｰﾀﾞｲｱﾙ,スズキ,アルトラパン,2011年05月,"103,700 Km",DBA-HE22S,K6A,その他,不明,エバポレーターの故障によりクーラーが効かなくなった。
254,2021年08月06日,愛知,ＨＰ,いすゞ,コモ,2016年06月,"79,907 Km",LDF-JVW2E26,YD25,エンジン,２０２１年７月,高速道路を走行中にエンジンの出力が急に下がり、速度が２０ｋｍ／ｈほどしか出なくなったため路肩に緊急停車したもの
255,2021年08月06日,愛知,ﾌﾘｰﾀﾞｲｱﾙ,ポルシェ,９８１　ケイマンＳ,不明,不明,ABA-981MA123,不明,エンジン,不明,電子制御式ドライブトレインマウント（ＰＡＤＭ）が故障し、警告が出る。交差点の右折待ちなどで、車体が揺れる。
256,2021年08月06日,大阪,ＨＰ,いすゞ,コモ,2016年08月,"116,850 Km",LDF-JVW2E26,YD25,エンジン,２０２１年８月,高速道路を走行中にエンジンの出力が急に下がり、速度が２０ｋｍ／ｈほどしか出なくなったため路肩に緊急停車した。
257,2021年08月06日,高知,ﾌﾘｰﾀﾞｲｱﾙ,カワサキ,ＶＥＲＳＹＳ　１０００　ＳＥ,2021年07月,不明,8BL-LZT00D,ZRT00DE,エンジン,不明,冷却水のリザーバーキャップが取れて冷却水が漏れた。
258,2021年08月06日,福岡,ﾌﾘｰﾀﾞｲｱﾙ,スズキ,エブリイ,2019年08月,不明,不明,不明,エンジン,２０２１年８月１日,走行中に突然エンジンの回転数が上がって暴走をした。ブレーキペダルを踏んだが、ブレーキは効かず、信号待ちの車に衝突した。この際、自動ブレーキは作動しなかった。
259,2021年08月05日,山形,ﾌﾘｰﾀﾞｲｱﾙ,ニッサン,ノート,2014年02月,"86,100 Km",DBA-E12,HR12,エンジン,不明,エンジン、ファンベルトから異音がする。オーバーヒートしやすい気がする。
260,2021年08月05日,東京,ＨＰ,マツダ,ＣＸ－３０,2020年03月,"16,000 Km",3AA-DMFP,HF-MK,制動装置,２０２１年８月４日,ブレーキペダルを踏みエンジンを始動後、シフトレバーをバックに入れたところ、ブレーキペダルからガチガチという音がした。通常と異なりブレーキペダルが踏み込めない状態で、踏んでいるにもかかわらず、クリープで車は動き出した。２、３秒後、ガチガチと言う音は消え、ブレーキペダルが奥に踏み込めるようになり、車が止まったが、この間に約３０ｃｍは動いた。
261,2021年08月05日,東京,ＨＰ,マツダ,ＣＸ－３０,2020年03月,不明,3AA-DMFP,HF-MK,保安灯火,２０２０年４月,フロントガラスの歪みが大きく、フロントガラス越しに見える景気が歪んで見える。
262,2021年08月05日,東京,ＨＰ,マツダ,ＣＸ－３０,2020年03月,不明,3AA-DMFP,HF-MK,動力伝達,２０２０年４月頃,ハンドルにあるパドルシフトレバーにバリがある。
263,2021年08月05日,東京,ＨＰ,マツダ,ＣＸ－３０,2020年03月,不明,3AA-DMFP,HF-MK,その他,２０２０年１２月頃,寒い日に”センシングカメラが視界不良”とメーターに表示される。
264,2021年08月05日,東京,ＨＰ,マツダ,ＣＸ－３０,2020年03月,不明,3AA-DMFP,HF-MK,乗車装置,２０２０年４月,スマートキーを携帯し、ドアノブを触ってもドアロックが解除しないことがたまにある。
265,2021年08月05日,東京,ＨＰ,マツダ,ＣＸ－３０,2020年03月,不明,3AA-DMFP,HF-MK,その他,２０２１年７月８日,走行中に”安全運転支援システム一部作動不可です。周囲の安全を確認して走行してください”と入れ替わりで”超音波センサーが異常です”とメーターに表示された。
266,2021年08月05日,東京,ﾌﾘｰﾀﾞｲｱﾙ,レクサス,ＵＸ２５０ｈ,2021年02月,"5,500 Km",6AA-MZAH10,不明,車枠・車体,不明,車室内でカタカタと異音がする。
267,2021年08月05日,千葉,ＨＰ,アウディ,Ａ４　１．８Ｔ,2020年12月,"89,657 Km",ABA-8KCDH,CDH,エンジン,２０２１年１月以来,エンジンオイル消費が激しく、５００ｋｍ走行前後でオイル補充ランプが点灯した。
268,2021年08月05日,千葉,ﾌﾘｰﾀﾞｲｱﾙ,スバル,プレオ,2001年04月,"46,800 Km",TA-RA2,EN07,エンジン,不明,エンジンのかかりが悪い。何度か鍵を回すとかかる。
269,2021年08月05日,千葉,ﾌﾘｰﾀﾞｲｱﾙ,トヨタ,８６,2017年02月,"37,300 Km",DBA-ZN6,FA20,エンジン,不明,タイミングチェーンカバーに油がにじんでいる。パッキンでは無く鉄の部分からにじんでいる。
270,2021年08月05日,埼玉,ﾌﾘｰﾀﾞｲｱﾙ,トヨタ,プリウス,2010年06月,"108,000 Km",DAA-ZVW30,2ZR-3JM,電動機(モーター),不明,駆動バッテリーが満杯に充電されていてもエンジンが止まらない。燃費が悪くリッター１３ｋｍしか走らない。
271,2021年08月05日,群馬,ＨＰ,トヨタ,プリウス,2016年08月,"31,400 Km",DAA-ZVW51,2ZR-1NM,車枠・車体,３年を経過する前頃から徐々に,ピラーガーニッシュ（Ｃピラー）のクリア塗装が剥げた。
272,2021年08月05日,栃木,ＨＰ,トヨタ,ヴェルファイア,2012年04月,"83,400 Km",DBA-ANH20W,2AZ,エンジン,不明,エンジン残量が少ないランプが点灯した。
273,2021年08月05日,愛知,ＨＰ,スバル,インプレッサ,2015年08月,"54,780 Km",DBA-GP7,FB20,エンジン,２０２１年８月　１年点検時発見,ディーラーでの１年点検時、エンジンのオイルコントロールバルブからのオイル漏れを発見した。
274,2021年08月05日,福岡,ＨＰ,トヨタ,プリウスα,2012年11月,"125,000 Km",DAA-ZVW41W,2ZR-5JM,電動機(モーター),２０２１年８月４日,交差点発進時、アクセルペダルを踏み込むとガクンと異音、振動があり、ハイブリッドチェックランプが点灯して走行不能になった。エンジン再始動にてエンジンは始動でき、ハイブリットシステム不動・チェックランプ点灯は継続していたが、エンジンは動くので自走にて帰宅した。
275,2021年08月05日,福岡,ﾌﾘｰﾀﾞｲｱﾙ,ホンダ,オデッセイ,2003年10月,"135,000 Km",UA-RB1,K24A,燃料装置,不明,給油口パッキンの劣化で燃料が漏れた。
276,2021年08月04日,石川,ＨＰ,ニッサン,マーチ　１４ｅ－ｆｏｕｒ,2003年03月,"185,000 Km",UA-BNK12,CR14,走行装置,不明,走行中にハンドルが傾いていくため、ディーラーで確認したところ、トーションビーム右側において半分くらい亀裂が入っていた。
277,2021年08月04日,東京,ﾌﾘｰﾀﾞｲｱﾙ,三菱,デリカＤ５,2019年04月,不明,3DA-CV1W,4N14,動力伝達,不明,冷機時、下り坂道を走行するとギアがニュートラル状態になり、エンジンブレーキがかからない。暖機された後も、下り坂道を発進するときにアクセルを使わずにブレーキを解放するだけで発進すると、同じようにニュートラル状態のままになってしまう。
278,2021年08月04日,神奈川,ＨＰ,ルノー,メガーヌＲＳ,2019年03月,不明,ABA-BBM5P,M5P,電気装置,購入後半年位から頻繁に,バッテリー電圧が低下しており、長時間の運転をしないとバッテリーがあがったり、ステアリング、ブレーキ、ＥＳＣの警告灯が点灯する。
279,2021年08月04日,千葉,ＨＰ,ニッサン,セレナ,2013年03月,"49,000 Km",DAA-HFC26,MR20-SM23,車枠・車体,２０２１年３月,突然塗装が剥がれはじめてきた。
280,2021年08月04日,千葉,ﾌﾘｰﾀﾞｲｱﾙ,ニッサン,ノートｅ－ＰＯＷＥＲ,2019年03月,不明,DAA-HE12,HR12-EM57,乗車装置,２０２１年８月２日,後席に荷物を載せるためにドアを開閉した際、ドアの端部に手をひっかけてしまったようで、３針縫う負傷をした。
281,2021年08月04日,千葉,ﾌﾘｰﾀﾞｲｱﾙ,ダイハツ,トール,2021年04月,不明,4BA-M900S,1KR,エンジン,購入直後から,エンジン回転を上げると異臭がする。販売店で確認したところ、ガスケットからの臭いと診断された。
282,2021年08月04日,茨城,ﾌﾘｰﾀﾞｲｱﾙ,ルノー,カングー,2004年09月,"106,400 Km",GH-KCK4M,K4M,動力伝達,不明,ギアセレクターレバーからシフトコントロールケーブルが外れ、シフト操作が出来なくなり走行不能になった。
283,2021年08月04日,群馬,電話,メルセデス・ベンツ,Ｅ２５０,2013年03月,"50,000 Km",DBA-207347,271,エンジン,不明,エンジンチェックランプが点灯する。
284,2021年08月04日,山梨,ＨＰ,マツダ,ＣＸ－５,2017年06月,"22,000 Km",DBA-KF5P,PY,その他,半年前くらい,マツダコネクトが触れていないのに勝手に反応し、ナビの位置を移動したり、縮尺を変えたり、音楽を聴いていても全く関係ない設定画面を開いたりする。
285,2021年08月04日,山梨,ﾌﾘｰﾀﾞｲｱﾙ,スバル,プレオ,2003年10月,不明,TA-RA1,EN07,エンジン,５年で十数回,エンジンが吹かしても止まりそうになる。クランクセンサー、カムセンサー等の部品交換や、バルブの清掃なども行ったが直らない。
286,2021年08月04日,愛知,ﾌﾘｰﾀﾞｲｱﾙ,日野,レンジャー,2009年10月,"45,500 Km",BKG-FD7JLYA,J07E,エンジン,これまでに３回発生,ターボが壊れて４０ｋｍ／ｈくらいしか出なくなる。
287,2021年08月04日,岐阜,ＨＰ,ニッサン,エルグランド,2011年03月,"106,000 Km",DBA-PE52,VQ35,動力伝達,２０２１年８月４日,トランスミッションの故障により、高速道路を走行中にエンジン警告灯が点灯するとともに、アクセルペダルを踏んでも、上り坂で失速する。
288,2021年08月04日,大阪,ＨＰ,トヨタ,ハリアー,不明,不明,MXUA80,不明,その他,２０２１年５月,ＩＴＳコネクトの故障表示が毎回出るため運転に支障をきたす。
289,2021年08月04日,滋賀,ﾌﾘｰﾀﾞｲｱﾙ,ジャガー,ＸＪ８　３．５,2004年11月,"70,000 Km",GH-J72RA,RB,制動装置,不明,ＡＢＳ・ＤＳＣ警告灯が点くことがある。
290,2021年08月04日,滋賀,ﾌﾘｰﾀﾞｲｱﾙ,ジャガー,ＸＪ８　３．５,2004年11月,"70,000 Km",GH-J72RA,RB,乗車装置,５年くらい前から,エアバッグ警告灯が点灯した。
291,2021年08月04日,広島,ＨＰ,マツダ,アクセラスポーツ,2013年01月,"54,000 Km",LDA-BM2FS,SH,電気装置,一般道走行中,オルタネーターのプーリーの破損により、充電装置の異常がディスプレイに表示され、安全な場所での停車を指示された。
292,2021年08月04日,長崎,ＨＰ,ニッサン,リーフ,2011年02月,"74,384 Km",ZAA-ZE0,EM61,緩衝装置,２０２１年８月３日　１７：００　帰宅途中,走行中、路面段差を乗り越えた途端「ガキン」という異音発生後常時カタカタ音と共にステアリング操作にも違和感が発生した。整備工場で確認したところ、右フロントサスペンションのアッパーマウントが亀裂により脱落していた。
293,2021年08月04日,熊本,ﾌﾘｰﾀﾞｲｱﾙ,トヨタ,ヴェルファイア,2013年09月,"112,700 Km",DBA-ANH20W,2AZ,エンジン,不明,エンジンオイルの減りが激しく、オイル交換５０００ｋｍで残量が１Ｌになってしまうほど減る。
294,2021年08月03日,山形,ﾌﾘｰﾀﾞｲｱﾙ,マツダ,アテンザ,2015年02月,"110,000 Km",LDA-GJ2AW,SH,エンジン,不明,車検で、排ガスの検査後、エンジンが始動しなくなった。ヘッドを外したところススが溜まっていた。カムシャフトとバルブの頭が磨いたようにピカピカになっていた。
295,2021年08月03日,石川,ＨＰ,スカニア,Ｒ４５０,2019年11月,"208,000 Km",2DG-A4X2ACG,DC13,保安灯火,２０２１年７月１０日くらい,ヘッドライトの上部にあるデイライトの光度が極端に落ちた。
296,2021年08月03日,東京,ＨＰ,トヨタ,ＲＡＶ４　ＨＹＢＲＩＤ　Ｇ,2020年08月,"8,800 Km",6AA-AXAH54,A25A-3NM-4NM,車枠・車体,トヨタ認定中古車で購入納車１ヶ月過ぎ辺り,雨天時にルーフレールクリップ固定箇所、ＢピラーＣピラーから雨漏りし、助手席Ｂピラーのシートベルトから雨水が衣類に染み渡った。
297,2021年08月03日,東京,ﾌﾘｰﾀﾞｲｱﾙ,トヨタ,ライズ,不明,不明,不明,不明,その他,不明,走行中にルーフキャリアーが外れた。
298,2021年08月03日,東京,ﾌﾘｰﾀﾞｲｱﾙ,ポルシェ,カイエン,不明,"80,000 Km",9PAM4851A,不明,動力伝達,不明,プロペラシャフトのセンターベアリングのブラケットが、５０～６０ｋｍ／ｈで暴れて外れそうになる。
299,2021年08月03日,千葉,電話,ＢＭＷ,Ｍ２　Ｃｏｍｐｅｔｉｔｉｏｎ,2018年10月,不明,CBA-2U30,S55B30A,保安灯火,不明,左後方のウィンカーがハイフラッシュになる。
300,2021年08月03日,三重,ﾌﾘｰﾀﾞｲｱﾙ,ヤマハ,ＪＯＧ,2021年07月,不明,2BH-AY01,不明,燃料装置,不明,燃料タンクから燃料が漏れているのを発見した。
301,2021年08月03日,大阪,ＨＰ,ボルボ,Ｖ４０,2018年06月,"25,000 Km",LDA-MD4204T,D4204T,燃料装置,２０２１年８月,エンジンの高圧フューエルポンプの不具合により、走行中にエンジン警告灯が点灯するとともにエンジンが停止し、惰性で路肩に流れ着いた。
302,2021年08月03日,兵庫,ＨＰ,ホンダ,ジョルノ,不明,不明,JBH-AF70,不明,エンジン,２０１１年１２月,減速時、信号停車時、後年は走行中にエンジンが止まり、その後、再始動できなくなる。
303,2021年08月03日,兵庫,ﾌﾘｰﾀﾞｲｱﾙ,ダイハツ,ムーヴ,2007年10月,"118,000 Km",DBA-L175S,KF,エンジン,不明,シートに四角いキーを置いているにも関わらず、ドアのロックが勝手にかかる。また、鍵を回してもエンジン始動しないため、一度降りてまたやり直すとかかるようになる。
304,2021年08月03日,奈良,電話,テスラ,モデルＸ,2019年03月,"15,000 Km",不明,L2S-L2S,乗車装置,２０２１年７月２１日,後方ドアに関し、隣に車があるときにドアを開けると接触防止のため止まるはずが、センサーに不具合があり隣の車に接触した。また、運転席ドアについても数センチ開くがそれ以上開かず、手動で開けなければならないが非常に重い。
305,2021年08月03日,山口,ＨＰ,トヨタ,ハイエースバン,2017年10月,"39,876 Km",QDF-KDH201V,1KD,車枠・車体,自分で気づいたのは、２０２１年６月の初旬,後席、左右のスライドドアに付いている小窓から雨漏りする。
306,2021年08月03日,福岡,ＨＰ,その他,ｇｌａｆｉｔ　ＬＯＭ,2021年04月,60 Km,LOM-01,不明,電動機(モーター),２０２１年８月１日　１７：００頃,走行中に電源が喪失した。
307,2021年08月03日,福岡,ＨＰ,その他,ｇｌａｆｉｔ　ＬＯＭ,2021年04月,60 Km,LOM-01,不明,保安灯火,２０２１年８月１日　１７：００頃,走行中にミラーの位置が頻繁にずれ、後方確認が困難になる。走行中にハンドル＋支柱がきしみ、たわみが発生する。そのためミラーによる後方視認性が良くない。
308,2021年08月03日,長崎,電話,テスラ,モデルＸ,2020年04月,不明,不明,L2S,電動機(モーター),不明,走行中に電源が落ちて走行不能になった。運転席のドア以外開かなくなり、窓ガラスは全て開かなかった。
309,2021年08月03日,熊本,ＨＰ,シトロエン,ＤＳ３,2019年03月,"7,000 Km",ABA-A5CHN05,HN05,燃料装置,２０２１年３月１６日,運転中に異臭が発生したため、停車させボンネットを開くと、燃料が吹き出し続けており、エンジンに降りかかっていた。
310,2021年08月02日,千葉,電話,レクサス,ＬＳ６００ｈ,2013年04月,"160,000 Km",DAA-UVF45,2UR-1KM,エンジン,２０２１年７月３０日,朝、１０分ぐらい走行中にエンジン・ブレーキを整備工場で点検して下さいと表示が出てエンストした。再始動して１ｋｍぐらい走行した後、再びエンストが発生して再始動できなかった。
311,2021年08月02日,千葉,ﾌﾘｰﾀﾞｲｱﾙ,スズキ,クロスビー,2018年05月,"37,300 Km",DAA-MN71S,K10C-WA05A,燃料装置,不明,燃料ポンプのリコール措置を受けた車で、当該部品を燃料タンクに固定するところの不良により、給油時に大量に燃料が漏れた。
312,2021年08月02日,茨城,ＨＰ,ホンダ,ＳＨＵＴＴＬＥハイブリッド,2017年10月,"34,000 Km",DAA-GP7,LEB-H1,その他,２０２１年７月,猛暑の為、エアコンを作動させたら温風が出て来て、窓を開けた方が涼しかった。
313,2021年08月02日,茨城,ﾌﾘｰﾀﾞｲｱﾙ,ニッサン,ノート,2013年02月,"20,000 Km",DBA-E12,HR12,エンジン,不明,スロットル部にあるスワールコントロールバルブ内部の金属部品が割れ、制御不良を起こしたため、エンジン不調が発生し、エンジンチェックランプがついた。
314,2021年08月02日,愛知,電話,ニッサン,デイズ,2015年05月,"40,000 Km",DBA-B21W,3B20,エンジン,２か月ほど前,信号で停止中にエンストした。
315,2021年08月02日,愛知,ＨＰ,マツダ,デミオ,2014年11月,"97,000 Km",LDA-DJ5FS,S5,その他,２０２１年５月,ナビが、触っていないのに勝手に画面右下部を連打したような動きをする。
316,2021年08月02日,愛知,ＨＰ,マツダ,デミオ,2014年11月,"97,000 Km",LDA-DJ5FS,S5,エンジン,２０２１年５月,タイミングチェーンが伸びてメーターパネルに警告表示が出た。
317,2021年08月02日,愛知,ＨＰ,マツダ,デミオ,2014年10月,"98,000 Km",LDA-DJ5FS,S5,保安灯火,２０２１年７月,ウォッシャーポンプからウォッシャー液が漏れた。
318,2021年08月02日,愛知,ﾌﾘｰﾀﾞｲｱﾙ,シトロエン,Ｃ４ピカソ,2016年08月,"34,000 Km",ABA-B7875G01,5G01,かじ取り,不明,ハンドルのメッキ塗装部分が剥がれ、鋭利な状態になっていたため、ハンドル操作時に手を負傷した。
319,2021年08月02日,静岡,ＨＰ,マツダ,ＣＸ－８,2021年05月,"3,000 Km",3DA-KG2P,SH,乗車装置,納車当日より,トランクのドア（パワーリフトゲート）の開閉に支障があり、開かない、もしくは途中で止まる。
320,2021年08月02日,静岡,ＨＰ,マツダ,デミオ,2014年11月,"31,900 Km",LDA-DJ5FS,S5,制動装置,２０２１年８月１日,ＡＢＳ・横滑り・衝突防止の警告灯が点灯し、アイドリングストップの警告灯が点滅した。
321,2021年08月02日,京都,ﾌﾘｰﾀﾞｲｱﾙ,三菱,アイ,2006年06月,"95,000 Km",CBA-HA1W,3B20,動力伝達,１年半～２年前から,自動変速機の不良により、ギアが抜けたり、変速ショックが発生する。
322,2021年08月02日,兵庫,電話,スバル,レヴォーグ,2021年03月,"3,000 Km",4BA-VN5,CB18,かじ取り,２０２１年７月２９日,ハンドルタッチセンサーの異常でエンジンを始動したところ、自動運転機能の不具合が発生しているエラー表示が出ていた。
323,2021年08月02日,滋賀,ﾌﾘｰﾀﾞｲｱﾙ,スズキ,ワゴンＲ,2015年02月,"83,000 Km",DAA-MH44S,R06A-WA04A,動力伝達,不明,ＣＶＴのバルブボディ不良により、しゃくる症状が出たり、加速困難になる。
324,2021年08月02日,奈良,ＨＰ,ルノー,ルーテシアＲＳ,2014年04月,"44,500 Km",ABA-RM5N,M5M,エンジン,２０２１年７月２９日,一般道を走行中に突然エンジンの吹けがおかしくなりオレンジのスパナマークと「Ｃｈｅｃｋ　ｉｎｊｅｃｔｉｏｎ　ｓｙｓｔｅｍ」と言うアラートが表示された。ボンネットを開けたところ、インレットエアホースの接合部分が割れて１ｃｍほど隙間が空いていた。
325,2021年08月02日,岡山,ＨＰ,ニッサン,セレナ,2017年02月,"82,000 Km",DAA-GFC27,MR20-SM24,保安灯火,２０２１年７月１０日,豪雨走行中にワイパーが前ぶれなしで、いきなり不動になったため、走行不能になった。
326,2021年08月02日,岡山,ＨＰ,ホンダ,Ｎ－ＢＯＸ　ターボ,2012年07月,"46,900 Km",DBA-JF1,S07A,エンジン,２０２１年７月車検時に指摘される,タイミングチェーンケースよりオイルが漏れた。高速走行後オイル臭いにおいが以前からしていた。
327,2021年08月01日,神奈川,ＨＰ,フォルクスワーゲン,ゴルフ,2015年03月,不明,DBA-AUCJZ,CJZ,動力伝達,２０２１年７月,走行中、メーターに警告灯が点灯し停車後バックギアに入らないとメッセージが出た。実際にバックに入らず。前進は出来たが２速に入らず。一旦エンジンを止めて掛け直すとギアが入るようになるが、警告灯は消えずしばらくすると同じ症状が出た。
328,2021年08月01日,静岡,ＨＰ,マツダ,デミオ,不明,不明,DJ5FS,不明,制動装置,２０２１年８月１日,ＡＢＳ、Ｉ－ＳＴＯＰ等の４つの警告が点灯し、ナビも使えなくなった。
329,2021年08月01日,大阪,ＨＰ,ＢＭＷ,ＭＩＮＩ　ｃｏｏｐｅｒＤ,2014年12月,"49,000 Km",LDA-XD20F,N47C20A,エンジン,２０２１年７月２２日,走行開始から４０分後、ボンネットより突然白煙が発生した。ボンネットより異臭と異音がし、エアコン系が効かない不具合発生した。ディーラーで確認したところ、バイブレーションダンパーのゴム及びベルトが千切れていた。
330,2021年08月01日,奈良,ＨＰ,ルノー,メガーヌＲＳ,2014年08月,"49,500 Km",ABA-DZF4R,F4R,燃料装置,２０２１年６月３０日,エンジンをスタートさせようとスタートボタンを何度も押したがかからず、ガソリンの強い匂いがし、ボンネットの下がガソリンだらけになった。ボンネットを開けてみるとエンジンに流入するガソリンホースが劣化し抜けていた。
331,2021年08月01日,広島,ＨＰ,その他,Ｇｌａｆｉｔ　ＬＯＭ,2021年07月,35 Km,LOM-01,不明,保安灯火,購入すぐ,ミラー固定不良により、走行振動で後方確認が不能になる。
332,2021年08月01日,島根,ＨＰ,ホンダ,Ｎ－ＢＯＸスラッシュ,2016年04月,"45,000 Km",DBA-JF1,S07A,エンジン,２０２０年１２月,徐行運転や停車中にエンジン回転数が低下し異音、振動が発生した。
